"In a sagging market, the Federal Reserve System ""might flood the market with funds, and that should bring interest rates down,"" says Leonard T. Anctil, vice president of the Bank of New England, Boston.","O-In O-a O-sa X-##gging O-market O-, O-the O-Federal O-Reserve O-System O-"" O-might O-flood O-the O-market O-with O-funds O-, O-and O-that O-should O-bring O-interest O-rates O-down O-, X-"" O-says O-Leonard O-T X-. O-An X-##ct X-##il O-, O-vice O-president O-of O-the O-Bank O-of O-New O-England O-, B-LOC-Boston O-."
"James G. Zafris, president of Danvers Savings Bank, Danvers, Mass., says the market turmoil ""is an absolute non-event for small business.""","O-James O-G X-. O-Z X-##af X-##ris O-, O-president O-of O-Dan X-##vers O-Savings O-Bank O-, B-LOC-Dan X-##vers O-, B-LOC-Mass X-. O-, O-says O-the O-market O-turmoil O-"" O-is O-an O-absolute O-non X-- X-event O-for O-small O-business O-. O-"""
"Peter Drake, biotechnology analyst for Vector Securities International, Chicago, thinks market uncertainty may encourage small companies to form more strategic alliances with big corporations.","O-Peter O-Drake O-, O-bio X-##tech X-##nology O-analyst O-for O-V X-##ector O-Securities O-International O-, B-LOC-Chicago O-, O-thinks O-market O-uncertainty O-may O-encourage O-small O-companies O-to O-form O-more O-strategic O-alliances O-with O-big O-corporations O-."
"Alan Wells, president of Bollinger, Wells, Lett & Co., a New York merger specialist, thinks panicky investors may lose their enthusiasm for leveraged buy-out and giant takeover deals.","O-Alan O-Wells O-, O-president O-of O-Bo X-##lling X-##er O-, O-Wells O-, O-Let X-##t O-& O-Co X-. O-, O-a B-LOC-New I-LOC-York O-merger O-specialist O-, O-thinks O-panic X-##ky O-investors O-may O-lose O-their O-enthusiasm O-for O-leverage X-##d O-buy X-- X-out O-and O-giant O-takeover O-deals O-."
"""Guys were minting money in there today,"" said John Legittino, a futures broker for Elders Futures Inc. in Chicago.","O-"" O-Guys O-were O-mint X-##ing O-money O-in O-there O-today O-, X-"" O-said O-John O-Le X-##git X-##tino O-, O-a O-future X-##s O-broker O-for O-Elders O-Future X-##s O-Inc O-. O-in B-LOC-Chicago O-."
"Many institutions and individual investors have shied away from stock-index futures, blaming them for speeding the stock market crash on Black Monday two years ago.","O-Many O-institutions O-and O-individual O-investors O-have O-s X-##hi X-##ed O-away O-from O-stock X-- X-index O-future X-##s O-, O-b X-##laming O-them O-for O-speeding O-the O-stock O-market O-crash O-on B-LOC-Black I-LOC-Monday O-two O-years O-ago O-."
"Several of Wall Street's largest securities firms, including Salomon Brothers Inc. and PaineWebber Inc., were also large buyers, traders said.","O-Several O-of B-LOC-Wall I-LOC-Street O-' X-s O-largest O-securities O-firms O-, O-including O-Sal X-##omo X-##n O-Brothers O-Inc X-. O-and O-Pain X-##e X-##W X-##eb X-##ber O-Inc X-. O-, O-were O-also O-large O-buyers O-, O-traders O-said O-."
"Closely held Intelligence in Education, of Larchmont, N.Y., is an educational publisher and consultant.","O-Close X-##ly O-held O-Intelligence O-in O-Education O-, O-of B-LOC-La X-##rch X-##mont O-, B-LOC-N X-. X-Y X-. O-, O-is O-an O-educational O-publisher O-and O-consultant O-."
"A battle is raging in Venice over plans to have the 1,200-year-old Italian city be the site for a universal exposition in 2000.","O-A O-battle O-is O-raging O-in B-LOC-Venice O-over O-plans O-to O-have O-the O-1 X-, X-200 X-- X-year X-- X-old O-Italian O-city O-be O-the O-site O-for O-a O-universal O-exposition O-in O-2000 O-."
"""This city already has too many tourists, and it can't hold them all,"" says Pierluigi Beggiato, the president of the Venice hoteliers association.","O-"" O-This O-city O-already O-has O-too O-many O-tourists O-, O-and O-it O-ca O-n X-' X-t O-hold O-them O-all O-, X-"" O-says O-Pier X-##lu X-##igi O-Be X-##gg X-##ia X-##to O-, O-the O-president O-of O-the B-LOC-Venice O-hotel X-##iers O-association O-."
"C. Olivetti & Co., have formed a consortium to lobby for holding the expo in Venice.","O-C X-. O-Olive X-##tti O-& O-Co X-. O-, O-have O-formed O-a O-consortium O-to O-lobby O-for O-holding O-the O-ex X-##po O-in B-LOC-Venice O-."
Three gambling casinos have opened in Poland.,O-Three O-gambling O-casino X-##s O-have O-opened O-in B-LOC-Poland O-.
The three establishments -- two in Warsaw and one in Krakow -- accept only foreign currency and are joint ventures between Polish firms and Western companies.,O-The O-three O-establishments O-- X-- O-two O-in B-LOC-Warsaw O-and O-one O-in B-LOC-K X-##rak X-##ow O-- X-- O-accept O-only O-foreign O-currency O-and O-are O-joint O-ventures O-between O-Polish O-firms O-and O-Western O-companies O-.
"But Bogdan Gumkowski, who runs the casino at Warsaw's Marriott Hotel, said the ventures would help Poland service its $39 billion foreign debt by pouring dollars into the state firms in the joint ventures -- the LOT airline and Orbis tourist organization.","O-But O-Bo X-##g X-##dan O-G X-##um X-##kowski O-, O-who O-runs O-the O-casino O-at B-LOC-Warsaw O-' X-s O-Mar X-##riot X-##t O-Hotel O-, O-said O-the O-ventures O-would O-help B-LOC-Poland O-service O-its O-$ O-39 O-billion O-foreign O-debt O-by O-pouring O-dollars O-into O-the O-state O-firms O-in O-the O-joint O-ventures O-- X-- O-the O-L X-##OT O-airline O-and O-Or X-##bis O-tourist O-organization O-."
Algeria plans to increase natural-gas sales to Europe and the U.S.,B-LOC-Algeria O-plans O-to O-increase O-natural X-- X-gas O-sales O-to B-LOC-Europe O-and O-the B-LOC-U X-. X-S O-.
"According to the Middle East Economic Survey, the North African nation is holding talks with Italy for adding a fourth pipe to a section of the Trans-Mediterranean pipeline, expanding capacity by up to six billion cubic meters a year from 12.5 billion.","O-According O-to O-the O-Middle O-East O-Economic O-Survey O-, O-the O-North O-African O-nation O-is O-holding O-talks O-with B-LOC-Italy O-for O-adding O-a O-fourth O-pipe O-to O-a O-section O-of O-the O-Trans X-- X-Mediterranean O-pipeline O-, O-expanding O-capacity O-by O-up O-to O-six O-billion O-cubic O-meters O-a O-year O-from O-12 X-. X-5 O-billion O-."
"Algeria also wants to build a pipeline through Morocco and across the Strait of Gibraltar to supply Spain, France and West Germany with up to 15 billion cubic meters a year by the late 1990s.","B-LOC-Algeria O-also O-wants O-to O-build O-a O-pipeline O-through B-LOC-Morocco O-and O-across O-the B-LOC-Strait I-LOC-of I-LOC-Gibraltar O-to O-supply B-LOC-Spain O-, B-LOC-France O-and B-LOC-West I-LOC-Germany O-with O-up O-to O-15 O-billion O-cubic O-meters O-a O-year O-by O-the O-late O-1990s O-."
"South Africa's National Union of Mineworkers agreed to suspend the strike by diamond workers and resume negotiations with De Beers Consolidated Mines Ltd. over their wage dispute, De Beers said.","B-LOC-South I-LOC-Africa O-' X-s O-National O-Union O-of O-Mine X-##work X-##ers O-agreed O-to O-su X-##sp X-##end O-the O-strike O-by O-diamond O-workers O-and O-resume O-negotiations O-with O-De O-Beer X-##s O-Consolidated O-Mines O-Ltd O-. O-over O-their O-wage O-dispute O-, O-De O-Beer X-##s O-said O-."
"A 35-nation environmental conference opened in Sofia, Bulgaria.","O-A O-35 X-- X-nation O-environmental O-conference O-opened O-in B-LOC-Sofia O-, B-LOC-Bulgaria O-."
"West German Environment Minister Klaus Toepfer said Bonn is convinced of the need for cooperation, ""especially with our neighbors in the East, because we are directly affected by their ecological progress or lack of it.""","O-West O-German O-Environment O-Minister O-Klaus O-To X-##ep X-##fer O-said B-LOC-Bonn O-is O-convinced O-of O-the O-need O-for O-cooperation O-, O-"" O-especially O-with O-our O-neighbors O-in O-the O-East O-, O-because O-we O-are O-directly O-affected O-by O-their O-ecological O-progress O-or O-lack O-of O-it O-. O-"""
The U.S. and Canada joined every European country except Albania at the meeting.,O-The B-LOC-U X-. X-S X-. O-and B-LOC-Canada O-joined O-every O-European O-country O-except B-LOC-Albania O-at O-the O-meeting O-.
"He said 13,000 more copies were sent to Estonia because of strong sales.","O-He O-said O-13 X-, X-000 O-more O-copies O-were O-sent O-to B-LOC-Estonia O-because O-of O-strong O-sales O-."
"Angel Gurria, Mexico's top debt negotiator, said the country's creditor banks are responding positively to Mexico's debt-reduction package.","O-Angel O-G X-##ur X-##ria O-, B-LOC-Mexico O-' X-s O-top O-debt O-ne X-##got X-##iator O-, O-said O-the O-country O-' X-s O-credit X-##or O-banks O-are O-responding O-positively O-to B-LOC-Mexico O-' X-s O-debt X-- X-reduction O-package O-."
"Mr. Gurria, Mexico's under-secretary of the ministry of finance, met yesterday with European bankers in London, at the half-way point on a so-called road show to market the package around the world.","O-Mr X-. O-G X-##ur X-##ria O-, B-LOC-Mexico O-' X-s O-under X-- X-secretary O-of O-the O-ministry O-of O-finance O-, O-met O-yesterday O-with O-European O-banker X-##s O-in B-LOC-London O-, O-at O-the O-half X-- X-way O-point O-on O-a O-so X-- X-called O-road O-show O-to O-market O-the O-package O-around O-the O-world O-."
"The accord, which covers $52.7 billion of Mexico's medium- and long-term debt, is expected to go into effect in early","O-The O-accord O-, O-which O-covers O-$ O-52 X-. X-7 O-billion O-of B-LOC-Mexico O-' X-s O-medium O-- O-and O-long X-- X-term O-debt O-, O-is O-expected O-to O-go O-into O-effect O-in O-early"
"China's top film actress, Liu Xiaoqing, paid $4,555 in back taxes and fines in Shandong province, the People's Daily reported.","B-LOC-China O-' X-s O-top O-film O-actress O-, O-Liu O-Xiao X-##qing O-, O-paid O-$ O-4 X-, X-55 X-##5 O-in O-back O-taxes O-and O-fines O-in B-LOC-Shan X-##dong O-province O-, O-the O-People O-' X-s O-Daily O-reported O-."
"The amount is equal to about 30 years earnings for the average peasant, who makes $145 a year. . . . China will spend $9.45 million for urgent maintenance on Tibet's Potala Palace, former home of the Dalai Lama, the China News Service said.","O-The O-amount O-is O-equal O-to O-about O-30 O-years O-earnings O-for O-the O-average O-peasant O-, O-who O-makes O-$ O-145 O-a O-year O-. O-. O-. O-. B-LOC-China O-will O-spend O-$ O-9 X-. X-45 O-million O-for O-urgent O-maintenance O-on B-LOC-Tibet O-' X-s B-LOC-Po X-##tal X-##a I-LOC-Palace O-, O-former O-home O-of O-the O-Dal X-##ai O-Lama O-, O-the O-China O-News O-Service O-said O-."
"The Dalai Lama, who was just awarded the Nobel Peace Prize, lives in exile in India.","O-The O-Dal X-##ai O-Lama O-, O-who O-was O-just O-awarded O-the O-Nobel O-Peace O-Prize O-, O-lives O-in O-exile O-in B-LOC-India O-."
"Separately, Purchase, N.Y.-based PepsiCo Inc., as expected, said fiscal third-quarter net rose 11% to $269.3 million, or $1.02 a share, from $241.6 million, or 91 cents a share.","O-Sep X-##arate X-##ly O-, B-LOC-P X-##ur X-##chase O-, B-LOC-N X-. X-Y X-. O-- O-based O-P X-##ep X-##si X-##C X-##o O-Inc X-. O-, O-as O-expected O-, O-said O-fiscal O-third X-- X-quarter O-net O-rose O-11 O-% O-to O-$ O-26 X-##9 X-. X-3 O-million O-, O-or O-$ O-1 X-. X-02 O-a O-share O-, O-from O-$ O-241 X-. X-6 O-million O-, O-or O-91 O-cents O-a O-share O-."
The year-ago quarter's results include an after-tax charge of $5.9 million from the sale of a winery in Spain.,O-The O-year X-- X-ago O-quarter O-' X-s O-results O-include O-an O-after X-- X-tax O-charge O-of O-$ O-5 X-. X-9 O-million O-from O-the O-sale O-of O-a O-wine X-##ry O-in B-LOC-Spain O-.
"Mr. Kossuth, 52 years old, succeeds Ermanno Pascutto, 36, who resigned to join Hong Kong's Securities and Futures Commission.","O-Mr X-. O-Ko X-##ss X-##uth O-, O-52 O-years O-old O-, O-succeeds O-E X-##rman X-##no O-Pa X-##s X-##cut X-##to O-, O-36 O-, O-who O-resigned O-to O-join B-LOC-Hong I-LOC-Kong O-' X-s O-Securities O-and O-Future X-##s O-Commission O-."
"Mr. Kossuth was vice president and director, corporate finance, of Nesbitt Thomson Deacon Inc., a Toronto investment dealer.","O-Mr X-. O-Ko X-##ss X-##uth O-was O-vice O-president O-and O-director O-, O-corporate O-finance O-, O-of O-N X-##es X-##bit X-##t O-Thomson O-Deacon O-Inc X-. O-, O-a B-LOC-Toronto O-investment O-dealer O-."
"Egon Krenz, the man tapped yesterday to become East Germany's new leader, faces the same task that has fallen to neighboring socialist colleagues: reforming a country in crisis.","O-E X-##gon O-K X-##ren X-##z O-, O-the O-man O-tapped O-yesterday O-to O-become B-LOC-East I-LOC-Germany O-' X-s O-new O-leader O-, O-faces O-the O-same O-task O-that O-has O-fallen O-to O-neighboring O-socialist O-colleagues O-: O-reform X-##ing O-a O-country O-in O-crisis O-."
"But unlike the other new leaders in the East Bloc, Mr. Krenz will face an immediate threat to his nation's very existence: German reunification.","O-But O-unlike O-the O-other O-new O-leaders O-in O-the B-LOC-East I-LOC-Bloc O-, O-Mr X-. O-K X-##ren X-##z O-will O-face O-an O-immediate O-threat O-to O-his O-nation O-' X-s O-very O-existence O-: O-German O-re X-##uni X-##fication O-."
"Mr. Krenz, age 52, is known as an old-guard ironfist, one likely to continue the method of running a country that the Berlin Wall made famous.","O-Mr X-. O-K X-##ren X-##z O-, O-age O-52 O-, O-is O-known O-as O-an O-old X-- X-guard O-iron X-##fi X-##st O-, O-one O-likely O-to O-continue O-the O-method O-of O-running O-a O-country O-that O-the B-LOC-Berlin I-LOC-Wall O-made O-famous O-."
"But if East Germany's arthritic Politburo does loosen up enough to permit Mr. Krenz to make serious efforts at reform, he will face a challenge just as fundamental.","O-But O-if B-LOC-East I-LOC-Germany O-' X-s O-art X-##hr X-##itic O-Pol X-##it X-##bur X-##o O-does O-loose X-##n O-up O-enough O-to O-permit O-Mr X-. O-K X-##ren X-##z O-to O-make O-serious O-efforts O-at O-reform O-, O-he O-will O-face O-a O-challenge O-just O-as O-fundamental O-."
"In this scenario it's hard to imagine that a pale imitation of the Federal Republic could avoid being pulled into some kind of tie -- economic, federal or stronger -- with West Germany.","O-In O-this O-scenario O-it O-' X-s O-hard O-to O-imagine O-that O-a O-pale O-imitation O-of O-the B-LOC-Federal I-LOC-Republic O-could O-avoid O-being O-pulled O-into O-some O-kind O-of O-tie O-- X-- O-economic O-, O-federal O-or O-stronger O-- X-- O-with B-LOC-West I-LOC-Germany O-."
"Cartoonists in West Germany have already mocked the exodus by imagining an advertisement placed by Mr. Honecker: ""Wanted: one people.""","O-Cartoon X-##ists O-in B-LOC-West I-LOC-Germany O-have O-already O-mocked O-the O-ex X-##odus O-by O-imagining O-an O-advertisement O-placed O-by O-Mr X-. O-Hon X-##eck X-##er O-: O-"" O-Wanted O-: O-one O-people O-. O-"""
"The West German embassies in Prague, Budapest and Warsaw are continuing to find refugees at their gates.","O-The O-West O-German O-em X-##bas X-##sies O-in B-LOC-Prague O-, B-LOC-Budapest O-and B-LOC-Warsaw O-are O-continuing O-to O-find O-refugees O-at O-their O-gates O-."
"Of course East Germany, true to its tradition, could tighten its borders yet further.","O-Of O-course B-LOC-East I-LOC-Germany O-, O-true O-to O-its O-tradition O-, O-could O-tighten O-its O-borders O-yet O-further O-."
Two of the last gestures of the Honecker regime were to close the border to Czechoslovakia and install halogen lights in some spots along the frontier.,O-Two O-of O-the O-last O-gestures O-of O-the O-Hon X-##eck X-##er O-regime O-were O-to O-close O-the O-border O-to B-LOC-Czechoslovakia O-and O-install O-ha X-##log X-##en O-lights O-in O-some O-spots O-along O-the O-frontier O-.
"But with world-wide opinion -- even, apparently in Moscow -- against East Germany, the country would have to turn itself into an Albania to clamp down further on refugees.","O-But O-with O-world X-- X-wide O-opinion O-- X-- O-even O-, O-apparently O-in B-LOC-Moscow O-- X-- O-against B-LOC-East I-LOC-Germany O-, O-the O-country O-would O-have O-to O-turn O-itself O-into O-an B-LOC-Albania O-to O-c X-##lamp O-down O-further O-on O-refugees O-."
"There have been some reports that Mr. Krenz is moving to ""soften"" his reputation, notably rumors that it was he who kept East Germany's state police off protesters' backs at the country's dismal 40th anniversary celebrations earlier this month.","O-There O-have O-been O-some O-reports O-that O-Mr X-. O-K X-##ren X-##z O-is O-moving O-to O-"" O-soft X-##en O-"" O-his O-reputation O-, O-notably O-rumors O-that O-it O-was O-he O-who O-kept B-LOC-East I-LOC-Germany O-' X-s O-state O-police O-off O-protesters X-' O-backs O-at O-the O-country O-' X-s O-di X-##sma X-##l O-40th O-anniversary O-celebrations O-earlier O-this O-month O-."
"The problem is one that East Germany shares with other half-states, such as North Korea, but one it must shoulder alone in the East Bloc.","O-The O-problem O-is O-one O-that B-LOC-East I-LOC-Germany O-shares O-with O-other O-half X-- X-states O-, O-such O-as B-LOC-North I-LOC-Korea O-, O-but O-one O-it O-must O-shoulder O-alone O-in O-the B-LOC-East I-LOC-Bloc O-."
"When Poland moves to reform, it can at least lean on its past: However flawed and short-lived Joseph Pilsudski's interwar republic, it was a nonsocialist democracy.","O-When B-LOC-Poland O-moves O-to O-reform O-, O-it O-can O-at O-least O-lean O-on O-its O-past O-: O-However O-fl X-##awed O-and O-short X-- X-lived O-Joseph O-Pi X-##ls X-##uds X-##ki O-' X-s O-inter X-##war O-republic O-, O-it O-was O-a O-non X-##so X-##cial X-##ist O-democracy O-."
"Even the Soviet Union has Peter the Great to rediscover, should it choose to.","O-Even O-the B-LOC-Soviet I-LOC-Union O-has O-Peter O-the O-Great O-to O-red X-##isco X-##ver O-, O-should O-it O-choose O-to O-."
"But East Germany is merely ""the land of truly existing socialism.""","O-But B-LOC-East I-LOC-Germany O-is O-merely O-"" O-the O-land O-of O-truly O-existing O-socialism O-. O-"""
"Beyond that, it has to compete with West Germany for a claim to the German identity.","O-Beyond O-that O-, O-it O-has O-to O-compete O-with B-LOC-West I-LOC-Germany O-for O-a O-claim O-to O-the O-German O-identity O-."
"With talk today of a second economic miracle in West Germany, East Germany no longer can content itself with being the economic star in a loser league.","O-With O-talk O-today O-of O-a O-second O-economic O-miracle O-in B-LOC-West I-LOC-Germany O-, B-LOC-East I-LOC-Germany O-no O-longer O-can O-content O-itself O-with O-being O-the O-economic O-star O-in O-a O-loser O-league O-."
"Without Moscow's military and party behind it, East Germany runs the risk of disintegrating.","O-Without B-LOC-Moscow O-' X-s O-military O-and O-party O-behind O-it O-, B-LOC-East I-LOC-Germany O-runs O-the O-risk O-of O-di X-##sin X-##te X-##grating O-."
"If it goes capitalist, and increases trade with West Germany, it will convert itself, willy-nilly, into an economic annex of the Federal Republic.","O-If O-it O-goes O-capitalist O-, O-and O-increases O-trade O-with B-LOC-West I-LOC-Germany O-, O-it O-will O-convert O-itself O-, O-will X-##y X-- X-ni X-##lly O-, O-into O-an O-economic O-an X-##nex O-of O-the B-LOC-Federal I-LOC-Republic O-."
"The protesters who greeted Mikhail Gorbachev at East Berlin's airport earlier this month weren't shouting ""Go U.S.A"" -- they were chanting ""Gorby, Help Us.""","O-The O-protesters O-who O-greeted O-Mikhail O-Go X-##rb X-##ache X-##v O-at B-LOC-East I-LOC-Berlin O-' X-s O-airport O-earlier O-this O-month O-were O-n X-' X-t O-shouting O-"" O-Go O-U X-. X-S X-. X-A O-"" O-- X-- O-they O-were O-chanting O-"" O-Go X-##rby O-, O-Help O-Us O-. O-"""
"Politically, this currently is wisdom -- particularly given a nervous neighboring France.","O-Political X-##ly O-, O-this O-currently O-is O-wisdom O-- X-- O-particularly O-given O-a O-nervous O-neighboring B-LOC-France O-."
"But it would be ironic if Germany's reunification, just like its division, eventually were the result of actions in centers of power other than Bonn and Berlin.","O-But O-it O-would O-be O-ironic O-if B-LOC-Germany O-' X-s O-re X-##uni X-##fication O-, O-just O-like O-its O-division O-, O-eventually O-were O-the O-result O-of O-actions O-in O-centers O-of O-power O-other O-than B-LOC-Bonn O-and B-LOC-Berlin O-."
"In a statement that was as close as East Germany gets to practicing ""glasnost"", Otto Reinhold, an East German party theorist, actually acknowledged the reunification dilemma.","O-In O-a O-statement O-that O-was O-as O-close O-as B-LOC-East I-LOC-Germany O-gets O-to O-practicing O-"" O-g X-##las X-##nos X-##t O-"" O-, O-Otto O-Re X-##in X-##hold O-, O-an O-East O-German O-party O-theorist O-, O-actually O-acknowledged O-the O-re X-##uni X-##fication O-di X-##lemma O-."
"""The main problem,"" Mr. Reinhold said in an East German radio interview monitored by Radio Free Europe in Munich, stems from the fact that ""the GDR is different"" from other East European states.","O-"" O-The O-main O-problem O-, X-"" O-Mr X-. O-Re X-##in X-##hold O-said O-in O-an O-East O-German O-radio O-interview O-monitored O-by O-Radio O-Free O-Europe O-in B-LOC-Munich O-, O-stems O-from O-the O-fact O-that O-"" O-the O-G X-##DR O-is O-different O-"" O-from O-other O-East O-European O-states O-."
"""What kind of right to exist,"" he asked, ""would a capitalist German Democratic Republic have alongside a capitalist Federal Republic?""","O-"" O-What O-kind O-of O-right O-to O-exist O-, X-"" O-he O-asked O-, O-"" O-would O-a O-capitalist B-LOC-German I-LOC-Democratic I-LOC-Republic O-have O-alongside O-a O-capitalist B-LOC-Federal I-LOC-Republic O-? O-"""
"That's a question East Germany can't answer easily, no matter what its new leader does.","O-That O-' X-s O-a O-question B-LOC-East I-LOC-Germany O-ca O-n X-' X-t O-answer O-easily O-, O-no O-matter O-what O-its O-new O-leader O-does O-."
Miss Shlaes is editorial features editor of The Wall Street Journal/Europe.,O-Miss O-S X-##hl X-##ae X-##s O-is O-editorial O-features O-editor O-of O-The O-Wall O-Street O-Journal O-/ B-LOC-Europe O-.
"CACI, based in Arlington, Va., said it hadn't seen the filing by Parsow and Elkhorn and therefore had no comment.","O-CA X-##CI O-, O-based O-in B-LOC-Arlington O-, B-LOC-V X-##a X-. O-, O-said O-it O-had O-n X-' X-t O-seen O-the O-filing O-by O-Pa X-##rs X-##ow O-and O-El X-##kh X-##orn O-and O-therefore O-had O-no O-comment O-."
"According to the filing, Parsow and Elkhorn are based in Elkhorn, Neb., and are controlled by the same general partner, Alan S. Parsow.","O-According O-to O-the O-filing O-, O-Pa X-##rs X-##ow O-and O-El X-##kh X-##orn O-are O-based O-in B-LOC-El X-##kh X-##orn O-, B-LOC-N X-##eb X-. O-, O-and O-are O-controlled O-by O-the O-same O-general O-partner O-, O-Alan O-S X-. O-Pa X-##rs X-##ow O-."
"Shareholders of Central, a bank holding company based in Sterling, Ill., will receive Amcore stock equal to 10 times Central's 1989 earnings, Amcore said.","O-S X-##hare X-##holders O-of O-Central O-, O-a O-bank O-holding O-company O-based O-in B-LOC-Sterling O-, B-LOC-Il X-##l X-. O-, O-will O-receive O-Am X-##core O-stock O-equal O-to O-10 O-times O-Central O-' X-s O-1989 O-earnings O-, O-Am X-##core O-said O-."
"Mr. Boone had been president and chief executive officer of Sunburst Bank, Louisiana, one of the company's two banks.","O-Mr X-. O-Boone O-had O-been O-president O-and O-chief O-executive O-officer O-of O-Sun X-##burst O-Bank O-, B-LOC-Louisiana O-, O-one O-of O-the O-company O-' X-s O-two O-banks O-."
The White House is making sure nobody will accuse it of taking this crisis lightly.,O-The B-LOC-White I-LOC-House O-is O-making O-sure O-nobody O-will O-a X-##cc X-##use O-it O-of O-taking O-this O-crisis O-lightly O-.
"In the aftermath of the California earthquake, President Bush and his aides flew into a whirlwind of earthquake-related activity yesterday morning.","O-In O-the O-aftermath O-of O-the B-LOC-California O-earthquake O-, O-President O-Bush O-and O-his O-aide X-##s O-flew O-into O-a O-w X-##hir X-##l X-##wind O-of O-earthquake X-- X-related O-activity O-yesterday O-morning O-."
"Some of it was necessary to get federal help flowing to victims, but some seemed designed mostly to project an image of a White House in action.","O-Some O-of O-it O-was O-necessary O-to O-get O-federal O-help O-flowing O-to O-victims O-, O-but O-some O-seemed O-designed O-mostly O-to O-project O-an O-image O-of O-a B-LOC-White I-LOC-House O-in O-action O-."
"Mr. Bush and his aides were accused of responding too slowly after the Exxon Valdez oil tanker split open in Alaskan waters and Hurricane Hugo struck the Carolina coast, and they clearly don't want a repeat of those charges now.","O-Mr X-. O-Bush O-and O-his O-aide X-##s O-were O-accused O-of O-responding O-too O-slowly O-after O-the O-Ex X-##xon O-Val X-##dez O-oil O-tanker O-split O-open O-in O-Alaska X-##n O-waters O-and O-Hurricane O-Hugo O-struck O-the B-LOC-Carolina O-coast O-, O-and O-they O-clearly O-do O-n X-' X-t O-want O-a O-repeat O-of O-those O-charges O-now O-."
So the White House announced that Mr. Bush got his first earthquake briefing of the day at 6:30 a.m. from chief of staff John Sununu.,O-So O-the B-LOC-White I-LOC-House O-announced O-that O-Mr X-. O-Bush O-got O-his O-first O-earthquake O-brief X-##ing O-of O-the O-day O-at O-6 X-: X-30 O-a X-. X-m X-. O-from O-chief O-of O-staff O-John O-Sun X-##un X-##u O-.
