"The proposed merger comes as K mart's profit is declining and sales at its core discount stores are rising more slowly than at such competitors as Wal-Mart Stores Inc. K mart, based in Troy, Mich., recently said net income would fall for the third consecutive quarter, after a 16% drop in the first half of its current fiscal year.","O-The O-proposed O-merger O-comes O-as O-K O-ma X-##rt O-' X-s O-profit O-is O-declining O-and O-sales O-at O-its O-core O-discount O-stores O-are O-rising O-more O-slowly O-than O-at O-such O-competitors O-as O-W X-##al X-- X-Mart O-Stores O-Inc O-. O-K O-ma X-##rt O-, O-based O-in B-LOC-Troy O-, B-LOC-Mi X-##ch X-. O-, O-recently O-said O-net O-income O-would O-fall O-for O-the O-third O-consecutive O-quarter O-, O-after O-a O-16 O-% O-drop O-in O-the O-first O-half O-of O-its O-current O-fiscal O-year O-."
"But the Makro chain, which operates as a joint venture between K mart and SHV Holdings N.V. of the Netherlands, has only six stores and annual sales that one analyst estimated at about $300 million.","O-But O-the O-Ma X-##k X-##ro O-chain O-, O-which O-operates O-as O-a O-joint O-venture O-between O-K O-ma X-##rt O-and O-SH X-##V O-Holdings O-N X-. X-V X-. O-of O-the B-LOC-Netherlands O-, O-has O-only O-six O-stores O-and O-annual O-sales O-that O-one O-analyst O-estimated O-at O-about O-$ O-300 O-million O-."
"Six-year-old Pace, based in Aurora, Colo., operates 41 warehouse-club stores.","O-Six X-- X-year X-- X-old O-Pace O-, O-based O-in B-LOC-Aurora O-, B-LOC-Col X-##o X-. O-, O-operates O-41 O-warehouse X-- X-club O-stores O-."
"This Friday brings the ""double witching hour,"" Wall Street's nickname for the monthly simultaneous expiration of a variety of stock index futures, index options and options on individual stocks.","O-This O-Friday O-brings O-the O-"" O-double O-witch X-##ing O-hour O-, X-"" B-LOC-Wall I-LOC-Street O-' X-s O-nickname O-for O-the O-monthly O-simultaneous O-ex X-##piration O-of O-a O-variety O-of O-stock O-index O-future X-##s O-, O-index O-options O-and O-options O-on O-individual O-stocks O-."
"AMR, the parent of American Airlines, continued to retreat in the wake of New York developer Donald Trump's decision to withdraw his $120-a-share takeover bid.","O-AM X-##R O-, O-the O-parent O-of O-American O-Airlines O-, O-continued O-to O-retreat O-in O-the O-wake O-of B-LOC-New I-LOC-York O-developer O-Donald O-Trump O-' X-s O-decision O-to O-withdraw O-his O-$ O-120 X-- X-a X-- X-share O-takeover O-bid O-."
"""The environment is a lot more trading-oriented,"" said Gary Rosenbach, manager of equity trading at the OTC stock firm Needham & Co. in New York.","O-"" O-The O-environment O-is O-a O-lot O-more O-trading X-- X-oriented O-, X-"" O-said O-Gary O-Rosen X-##bach O-, O-manager O-of O-equity O-trading O-at O-the O-O X-##TC O-stock O-firm O-Need X-##ham O-& O-Co X-. O-in B-LOC-New I-LOC-York O-."
"The British company plans to change its name to Manpower, the name of its U.S. unit, and write off part of nearly $1.2 billion in good will as a possible prelude to reincorporating in the U.S.","O-The O-British O-company O-plans O-to O-change O-its O-name O-to O-Man X-##power O-, O-the O-name O-of O-its B-LOC-U X-. X-S X-. O-unit O-, O-and O-write O-off O-part O-of O-nearly O-$ O-1 X-. X-2 O-billion O-in O-good O-will O-as O-a O-possible O-pre X-##lude O-to O-re X-##in X-##cor X-##por X-##ating O-in O-the B-LOC-U X-. X-S O-."
Investment bankers and retailers said the turmoil on Wall Street may benefit managers who plan to bid for U.S. retailing units of the British firm because takeover prices may not be as high as before the recent correction.,O-Investment O-banker X-##s O-and O-retailers O-said O-the O-turmoil O-on B-LOC-Wall I-LOC-Street O-may O-benefit O-managers O-who O-plan O-to O-bid O-for B-LOC-U X-. X-S X-. O-retail X-##ing O-units O-of O-the O-British O-firm O-because O-takeover O-prices O-may O-not O-be O-as O-high O-as O-before O-the O-recent O-correction O-.
Much of the jockeying by OTC traders and investors centered on shares of companies that might be financially affected by damage from the devastating earthquake in northern California.,O-Much O-of O-the O-jockey X-##ing O-by O-O X-##TC O-traders O-and O-investors O-centered O-on O-shares O-of O-companies O-that O-might O-be O-financially O-affected O-by O-damage O-from O-the O-devastating O-earthquake O-in O-northern B-LOC-California O-.
"Heading the list: insurance, construction and technology companies located in the San Francisco Bay Area.","O-Head X-##ing O-the O-list O-: O-insurance O-, O-construction O-and O-technology O-companies O-located O-in O-the B-LOC-San I-LOC-Francisco I-LOC-Bay I-LOC-Area O-."
Traders said property-casualty companies with the heaviest exposure in the San Francisco area include the OTC's Safeco and Ohio Casualty.,O-Trade X-##rs O-said O-property X-- X-casual X-##ty O-companies O-with O-the O-he X-##avi X-##est O-exposure O-in O-the B-LOC-San I-LOC-Francisco O-area O-include O-the O-O X-##TC O-' X-s O-Safe X-##co O-and O-Ohio O-C X-##as X-##ual X-##ty O-.
"Shares of Kasler, a California road and bridge builder, were heavily traded, jumping 2 1/8 to 9 7/8 on 1.3 million shares.","O-S X-##hare X-##s O-of O-Ka X-##sler O-, O-a B-LOC-California O-road O-and O-bridge O-builder O-, O-were O-heavily O-traded O-, O-jumping O-2 O-1 O-/ O-8 O-to O-9 O-7 O-/ O-8 O-on O-1 X-. X-3 O-million O-shares O-."
"The company, based in San Francisco, provides industrial infrastructure engineering and construction services.","O-The O-company O-, O-based O-in B-LOC-San I-LOC-Francisco O-, O-provides O-industrial O-infrastructure O-engineering O-and O-construction O-services O-."
"The stocks of computer-related companies located outside California improved, too.","O-The O-stocks O-of O-computer X-- X-related O-companies O-located O-outside B-LOC-California O-improved O-, O-too O-."
Power couldn't be restored at the company's San Francisco headquarters to allow trading yesterday morning.,O-Power O-could O-n X-' X-t O-be O-restored O-at O-the O-company O-' X-s B-LOC-San I-LOC-Francisco O-headquarters O-to O-allow O-trading O-yesterday O-morning O-.
"In New York, Roger Killion, a Hambrecht executive vice president, said he expects OTC trading at the company to resume this morning, either in New York or in San Francisco.","O-In B-LOC-New I-LOC-York O-, O-Roger O-Kill X-##ion O-, O-a O-Ham X-##brecht O-executive O-vice O-president O-, O-said O-he O-expects O-O X-##TC O-trading O-at O-the O-company O-to O-resume O-this O-morning O-, O-either O-in B-LOC-New I-LOC-York O-or O-in B-LOC-San I-LOC-Francisco O-."
"Analysts in London believe investors, despite their stampede to dump takeover stocks, should hold on tight to their Jaguar shares, this newspaper's Heard on the Street column said yesterday.","O-Ana X-##ly X-##sts O-in B-LOC-London O-believe O-investors O-, O-despite O-their O-stamped X-##e O-to O-dump O-takeover O-stocks O-, O-should O-hold O-on O-tight O-to O-their O-Jaguar O-shares O-, O-this O-newspaper O-' X-s O-Heard O-on O-the O-Street O-column O-said O-yesterday O-."
"HBO has close to 24 million subscribers to its HBO and Cinemax networks, while Showtime and its sister service, The Movie Channel, have only about 10 million, according to Paul Kagan Associates, a Carmel, Calif., research firm.","O-HBO O-has O-close O-to O-24 O-million O-subscribers O-to O-its O-HBO O-and O-Cinema X-##x O-networks O-, O-while O-Showtime O-and O-its O-sister O-service O-, O-The O-Movie O-Channel O-, O-have O-only O-about O-10 O-million O-, O-according O-to O-Paul O-Ka X-##gan O-Associates O-, O-a B-LOC-Carmel O-, B-LOC-Cal X-##if X-. O-, O-research O-firm O-."
Linking up Showtime with the largest cable operator in the U.S. could sharply boost its subscribers.,O-Link X-##ing O-up O-Showtime O-with O-the O-largest O-cable O-operator O-in O-the B-LOC-U X-. X-S X-. O-could O-sharply O-boost O-its O-subscribers O-.
"They were both hired by Sumner Redstone, the Boston billionaire who took control of Viacom three years ago in a leveraged buy-out.","O-They O-were O-both O-hired O-by O-Sumner O-Reds X-##tone O-, O-the B-LOC-Boston O-billionaire O-who O-took O-control O-of O-Via X-##com O-three O-years O-ago O-in O-a O-leverage X-##d O-buy X-- X-out O-."
Analysts said Hachette's earnings in the second half might be boosted by a capital gain from the sale of the Paris headquarters of a newspaper-delivery company that is 49% owned by Hachette.,O-Ana X-##ly X-##sts O-said O-Ha X-##chet X-##te O-' X-s O-earnings O-in O-the O-second O-half O-might O-be O-boost X-##ed O-by O-a O-capital O-gain O-from O-the O-sale O-of O-the B-LOC-Paris O-headquarters O-of O-a O-newspaper X-- X-delivery O-company O-that O-is O-49 O-% O-owned O-by O-Ha X-##chet X-##te O-.
"According to its latest annual report, about a quarter of the company's holdings are in Massachusetts, in the midst of a real-estate slump.","O-According O-to O-its O-latest O-annual O-report O-, O-about O-a O-quarter O-of O-the O-company O-' X-s O-holdings O-are O-in B-LOC-Massachusetts O-, O-in O-the O-midst O-of O-a O-real X-- X-estate O-s X-##lump O-."
The maker of disposable filters said revenue will be reduced about $3 million because of damage done by the hurricane to the company's three plants in Puerto Rico.,O-The O-maker O-of O-di X-##sp X-##osa X-##ble O-filters O-said O-revenue O-will O-be O-reduced O-about O-$ O-3 O-million O-because O-of O-damage O-done O-by O-the O-hurricane O-to O-the O-company O-' X-s O-three O-plants O-in B-LOC-Puerto I-LOC-Rico O-.
"""By encouraging massive, routine, voluntary testing we can enable society to voluntarily segregate itself sexually into two groups: those who carry the virus and those who do not,"" the Indianapolis research organization said in a new report.","O-"" O-By O-encouraging O-massive O-, O-routine O-, O-voluntary O-testing O-we O-can O-enable O-society O-to O-voluntarily O-se X-##g X-##re X-##gate O-itself O-sexually O-into O-two O-groups O-: O-those O-who O-carry O-the O-virus O-and O-those O-who O-do O-not O-, X-"" O-the B-LOC-Indianapolis O-research O-organization O-said O-in O-a O-new O-report O-."
"Stephen N. Wertheimer was named managing director and group head of investment banking in Asia, based in Tokyo.","O-Stephen O-N X-. O-We X-##rth X-##eim X-##er O-was O-named O-managing O-director O-and O-group O-head O-of O-investment O-banking O-in B-LOC-Asia O-, O-based O-in B-LOC-Tokyo O-."
"Sony Corp. won a pretrial order blocking U.S. sales of Justin Products Inc. 's ""My Own"" line of portable audio players for children.","O-Sony O-Corp O-. O-won O-a O-pre X-##tri X-##al O-order O-blocking B-LOC-U X-. X-S X-. O-sales O-of O-Justin O-Products O-Inc O-. O-' O-s O-"" O-My O-Own O-"" O-line O-of O-portable O-audio O-players O-for O-children O-."
"Judge John E. Sprizzo issued the order in Manhattan federal court, where Sony has accused the tiny company of illegally knocking off the ""My First Sony"" line.","O-Judge O-John O-E X-. O-S X-##p X-##riz X-##zo O-issued O-the O-order O-in B-LOC-Manhattan O-federal O-court O-, O-where O-Sony O-has O-accused O-the O-tiny O-company O-of O-illegally O-knocking O-off O-the O-"" O-My O-First O-Sony O-"" O-line O-."
"The judge held that the combination of colors used for the Sony products is distinctive and subject to protection under New York state law, rather than federal law.","O-The O-judge O-held O-that O-the O-combination O-of O-colors O-used O-for O-the O-Sony O-products O-is O-distinctive O-and O-subject O-to O-protection O-under B-LOC-New I-LOC-York O-state O-law O-, O-rather O-than O-federal O-law O-."
"Oncor Inc., Gaithersburg, Md., said it received approval from the U.S. Food and Drug Administration to market a genetic test that will assist in diagnosis and treatment of leukemia and lymph cancer.","O-On X-##cor O-Inc X-. O-, B-LOC-G X-##ait X-##hers X-##burg O-, B-LOC-M X-##d X-. O-, O-said O-it O-received O-approval O-from O-the O-U X-. X-S X-. O-Food O-and O-Drug O-Administration O-to O-market O-a O-genetic O-test O-that O-will O-assist O-in O-diagnosis O-and O-treatment O-of O-le X-##uke X-##mia O-and O-l X-##ymph O-cancer O-."
"As for joint ventures, Mr. Houghton said profit was ""essentially flat"" due primarily to a slow recovery at Samsung-Corning Co. in Korea following a strike at a major customer and the disruption of shipments to China.","O-As O-for O-joint O-ventures O-, O-Mr X-. O-Houghton O-said O-profit O-was O-"" O-essentially O-flat O-"" O-due O-primarily O-to O-a O-slow O-recovery O-at O-Samsung X-- X-Co X-##rn X-##ing O-Co X-. O-in B-LOC-Korea O-following O-a O-strike O-at O-a O-major O-customer O-and O-the O-disruption O-of O-shipment X-##s O-to B-LOC-China O-."
"A., Italy's leading industrial group, is conducting ""concrete"" talks with West Germany's Daimler-Benz AG on a series of projects in the aerospace sector, Fiat officials said.","O-A X-. O-, B-LOC-Italy O-' X-s O-leading O-industrial O-group O-, O-is O-conducting O-"" O-concrete O-"" O-talks O-with B-LOC-West I-LOC-Germany O-' X-s O-Dai X-##mler X-- X-Benz O-AG O-on O-a O-series O-of O-projects O-in O-the O-aerospace O-sector O-, O-Fiat O-officials O-said O-."
Daimler-Benz Chairman Edzard Reuter told Milan's financial daily Il Sole 24 Ore that talks are taking place between both companies' aerospace units.,O-Dai X-##mler X-- X-Benz O-Chairman O-Ed X-##zard O-Re X-##uter O-told B-LOC-Milan O-' X-s O-financial O-daily O-Il O-Sol X-##e O-24 O-Or X-##e O-that O-talks O-are O-taking O-place O-between O-both O-companies X-' O-aerospace O-units O-.
"Roberto Morelli, Italy analyst for County Natwest Securities in London, said that right now ""the market isn't being influenced by that kind of news,"" referring to the conditional nature of the talks mentioned by Mr. Reuter and by the uncertainty surrounding world stock exchanges this week.","O-Roberto O-More X-##lli O-, B-LOC-Italy O-analyst O-for O-County O-Nat X-##wes X-##t O-Securities O-in B-LOC-London O-, O-said O-that O-right O-now O-"" O-the O-market O-is O-n X-' X-t O-being O-influenced O-by O-that O-kind O-of O-news O-, X-"" O-referring O-to O-the O-conditional O-nature O-of O-the O-talks O-mentioned O-by O-Mr X-. O-Re X-##uter O-and O-by O-the O-uncertainty O-surrounding O-world O-stock O-exchanges O-this O-week O-."
"The Hackensack, N.J., company said holders would receive for each $1,000 face amount, $750 face amount of a new issue of secured senior subordinated notes, convertible into common stock at an initial rate of $6.50 a share, and 50 common shares.","O-The B-LOC-Ha X-##cke X-##ns X-##ack O-, B-LOC-N X-. X-J X-. O-, O-company O-said O-holders O-would O-receive O-for O-each O-$ O-1 X-, X-000 O-face O-amount O-, O-$ O-750 O-face O-amount O-of O-a O-new O-issue O-of O-secured O-senior O-subordinate X-##d O-notes O-, O-convertible O-into O-common O-stock O-at O-an O-initial O-rate O-of O-$ O-6 X-. X-50 O-a O-share O-, O-and O-50 O-common O-shares O-."
"""We're trading with a very wary eye on Wall Street,"" said Trevor Woodland, chief corporate trader at Harris Trust & Savings Bank in New York.","O-"" O-We O-' X-re O-trading O-with O-a O-very O-wary O-eye O-on B-LOC-Wall I-LOC-Street O-, X-"" O-said O-Trevor O-Woodland O-, O-chief O-corporate O-trader O-at O-Harris O-Trust O-& O-Savings O-Bank O-in B-LOC-New I-LOC-York O-."
"News of the major earthquake in California Tuesday triggered a round of dollar sales in early Asian trade, but most foreign-exchange dealers said they expect the impact of the quake on financial markets to be short-lived.","O-News O-of O-the O-major O-earthquake O-in B-LOC-California O-Tuesday O-triggered O-a O-round O-of O-dollar O-sales O-in O-early O-Asian O-trade O-, O-but O-most O-foreign X-- X-exchange O-dealers O-said O-they O-expect O-the O-impact O-of O-the O-q X-##ua X-##ke O-on O-financial O-markets O-to O-be O-short X-- X-lived O-."
"Despite the dollar's lackluster performance, some foreign-exchange traders maintain that the U.S. unit remains relatively well bid.","O-Despite O-the O-dollar O-' X-s O-lack X-##luster O-performance O-, O-some O-foreign X-- X-exchange O-traders O-maintain O-that O-the B-LOC-U X-. X-S X-. O-unit O-remains O-relatively O-well O-bid O-."
"Harris Trust's Mr. Woodland noted that the unit continues to show resilience in the face of a barrage of ""headline negatives"" in recent weeks, including rate increases in Europe and Japan, aggressive central bank intervention, a 190-point plunge in New York stock prices, an unexpectedly poor U.S. trade report and action by the Federal Reserve to nudge U.S. rates lower.","O-Harris O-Trust O-' X-s O-Mr X-. O-Woodland O-noted O-that O-the O-unit O-continues O-to O-show O-re X-##si X-##lie X-##nce O-in O-the O-face O-of O-a O-barrage O-of O-"" O-headline O-negative X-##s O-"" O-in O-recent O-weeks O-, O-including O-rate O-increases O-in B-LOC-Europe O-and B-LOC-Japan O-, O-aggressive O-central O-bank O-intervention O-, O-a O-190 X-- X-point O-p X-##lung X-##e O-in B-LOC-New I-LOC-York O-stock O-prices O-, O-an O-unexpectedly O-poor B-LOC-U X-. X-S X-. O-trade O-report O-and O-action O-by O-the O-Federal O-Reserve O-to O-n X-##udge B-LOC-U X-. X-S X-. O-rates O-lower O-."
"While Mr. Woodland doesn't predict a significant climb for the U.S. unit in light of recent moves in interest rates around the world, he noted that ""its downside potential is surprisingly and -- for dollar bulls -- ""impressively"" limited.","O-While O-Mr X-. O-Woodland O-does O-n X-' X-t O-predict O-a O-significant O-climb O-for O-the B-LOC-U X-. X-S X-. O-unit O-in O-light O-of O-recent O-moves O-in O-interest O-rates O-around O-the O-world O-, O-he O-noted O-that O-"" O-its O-down X-##side O-potential O-is O-surprisingly O-and O-- X-- O-for O-dollar O-bull X-##s O-- X-- O-"" O-impressive X-##ly O-"" O-limited O-."
"In late New York trading yesterday, the dollar was quoted at 1.8485 marks, down from 1.8667 marks late Tuesday, and at 141.45 yen, down from 142.75 yen late Tuesday.","O-In O-late B-LOC-New I-LOC-York O-trading O-yesterday O-, O-the O-dollar O-was O-quoted O-at O-1 X-. X-84 X-##8 X-##5 O-marks O-, O-down O-from O-1 X-. X-86 X-##6 X-##7 O-marks O-late O-Tuesday O-, O-and O-at O-141 X-. X-45 O-ye X-##n O-, O-down O-from O-142 X-. X-75 O-ye X-##n O-late O-Tuesday O-."
"In Tokyo Thursday, the U.S. currency opened for trading at 140.97 yen, down from Wednesday's Tokyo close of 142.10 yen.","O-In B-LOC-Tokyo O-Thursday O-, O-the B-LOC-U X-. X-S X-. O-currency O-opened O-for O-trading O-at O-140 X-. X-97 O-ye X-##n O-, O-down O-from O-Wednesday O-' X-s B-LOC-Tokyo O-close O-of O-142 X-. X-10 O-ye X-##n O-."
"Some analysts note that after last week's stock market tailspin and Tuesday's California earthquake, it's hard to gauge where the central bank wants the key federal funds rate.","O-Some O-analysts O-note O-that O-after O-last O-week O-' X-s O-stock O-market O-tails X-##pin O-and O-Tuesday O-' X-s B-LOC-California O-earthquake O-, O-it O-' X-s O-hard O-to O-gauge O-where O-the O-central O-bank O-wants O-the O-key O-federal O-funds O-rate O-."
"For now, traders say the foreign exchange market is scrutinizing both federal funds and events on Wall Street.","O-For O-now O-, O-traders O-say O-the O-foreign O-exchange O-market O-is O-s X-##c X-##ru X-##tin X-##izing O-both O-federal O-funds O-and O-events O-on B-LOC-Wall I-LOC-Street O-."
"Indeed, the U.S. unit edged lower as the Dow Jones Industrial Average dropped about 13 points in early trading.","O-Indeed O-, O-the B-LOC-U X-. X-S X-. O-unit O-edged O-lower O-as O-the O-Dow O-Jones O-Industrial O-Average O-dropped O-about O-13 O-points O-in O-early O-trading O-."
Some dealers noted that nervousness over the recent sharp dive in stock prices could intensify following suggestions by Bank of Japan Governor Satoshi Sumita that appeared to advise Japanese investors to be very careful in investing in U.S. leveraged buy-outs.,O-Some O-dealers O-noted O-that O-nervous X-##ness O-over O-the O-recent O-sharp O-dive O-in O-stock O-prices O-could O-in X-##tens X-##ify O-following O-suggestions O-by O-Bank O-of O-Japan O-Governor O-Sato X-##shi O-Su X-##mit X-##a O-that O-appeared O-to O-advise O-Japanese O-investors O-to O-be O-very O-careful O-in O-investing O-in B-LOC-U X-. X-S X-. O-leverage X-##d O-buy X-- X-outs O-.
Dealers suggest that the only positive news on the horizon that could detract attention from equities transactions is September's U.S. consumer price data.,O-Deal X-##ers O-suggest O-that O-the O-only O-positive O-news O-on O-the O-horizon O-that O-could O-de X-##tract O-attention O-from O-e X-##quities O-transactions O-is O-September O-' X-s B-LOC-U X-. X-S X-. O-consumer O-price O-data O-.
"On the Commodity Exchange in New York, gold for current delivery rose $1.30 to $368.70 an ounce in moderate trading.","O-On O-the O-Co X-##mm X-##od X-##ity O-Exchange O-in B-LOC-New I-LOC-York O-, O-gold O-for O-current O-delivery O-rose O-$ O-1 X-. X-30 O-to O-$ O-36 X-##8 X-. X-70 O-an O-ounce O-in O-moderate O-trading O-."
"In early trading in Hong Kong Thursday, gold was at $368.15 an ounce.","O-In O-early O-trading O-in B-LOC-Hong I-LOC-Kong O-Thursday O-, O-gold O-was O-at O-$ O-36 X-##8 X-. X-15 O-an O-ounce O-."
"General Dynamics Services Co., a unit of General Dynamics Corp., won a $48.2 million Army contract to establish maintenance facilities for tracked vehicles in Pakistan.","O-General O-Dynamics O-Services O-Co X-. O-, O-a O-unit O-of O-General O-Dynamics O-Corp X-. O-, O-won O-a O-$ O-48 X-. X-2 O-million O-Army O-contract O-to O-establish O-maintenance O-facilities O-for O-tracked O-vehicles O-in B-LOC-Pakistan O-."
"The broadcasting and newspaper concern, based in Chicago, said net was $62.7 million, or 77 cents a primary share, up from $51.6 million, or 69 cents a share.","O-The O-broadcasting O-and O-newspaper O-concern O-, O-based O-in B-LOC-Chicago O-, O-said O-net O-was O-$ O-62 X-. X-7 O-million O-, O-or O-77 O-cents O-a O-primary O-share O-, O-up O-from O-$ O-51 X-. X-6 O-million O-, O-or O-69 O-cents O-a O-share O-."
"IBM, Armonk, N.Y., remained upbeat.","O-IBM O-, B-LOC-Arm X-##on X-##k O-, B-LOC-N X-. X-Y X-. O-, O-remained O-up X-##beat O-."
"The computer giant, whose U.S. results have been dismal for years, noted that revenue rose again in the U.S. in the third quarter, following an increase in the second period.","O-The O-computer O-giant O-, O-whose B-LOC-U X-. X-S X-. O-results O-have O-been O-di X-##sma X-##l O-for O-years O-, O-noted O-that O-revenue O-rose O-again O-in O-the B-LOC-U X-. X-S X-. O-in O-the O-third O-quarter O-, O-following O-an O-increase O-in O-the O-second O-period O-."
"CHICAGO - Options traders were among the big victims of Friday's plunging stock market, including one small firm that required an emergency $50 million bailout.","B-LOC-CH X-##IC X-##AG X-##O O-- O-Op X-##tions O-traders O-were O-among O-the O-big O-victims O-of O-Friday O-' X-s O-p X-##lung X-##ing O-stock O-market O-, O-including O-one O-small O-firm O-that O-required O-an O-emergency O-$ O-50 O-million O-bail X-##out O-."
"While Monday's rebounding markets helped other investors recoup losses, many options customers and professional traders in stock-index options and the options on takeover stocks were left with multimillion-dollar losses, traders here and in New York said.","O-While O-Monday O-' X-s O-re X-##bound X-##ing O-markets O-helped O-other O-investors O-re X-##co X-##up O-losses O-, O-many O-options O-customers O-and O-professional O-traders O-in O-stock X-- X-index O-options O-and O-the O-options O-on O-takeover O-stocks O-were O-left O-with O-multi X-##mill X-##ion X-- X-dollar O-losses O-, O-traders O-here O-and O-in B-LOC-New I-LOC-York O-said O-."
"Thus, options traders Friday were stuck with losses that also were several times larger than those suffered by many stock traders in New York.","O-Thus O-, O-options O-traders O-Friday O-were O-stuck O-with O-losses O-that O-also O-were O-several O-times O-larger O-than O-those O-suffered O-by O-many O-stock O-traders O-in B-LOC-New I-LOC-York O-."
"Officials at Options Clearing Corp., which processes all options trades for U.S. exchanges, said that the $50 million guarantee was unprecedented, but was necessary to help insure the integrity of the options markets.","O-Official X-##s O-at O-Op X-##tions O-Clear X-##ing O-Corp X-. O-, O-which O-processes O-all O-options O-trades O-for B-LOC-U X-. X-S X-. O-exchanges O-, O-said O-that O-the O-$ O-50 O-million O-guarantee O-was O-unprecedented O-, O-but O-was O-necessary O-to O-help O-ins X-##ure O-the O-integrity O-of O-the O-options O-markets O-."
That was the question structural engineers and California transportation officials were asking themselves yesterday as rescue workers began the gruesome task of trying to extract as many as 250 victims from beneath the concrete slabs of the double-deck Nimitz Freeway in Oakland that caved in during Tuesday's temblor.,O-That O-was O-the O-question O-structural O-engineers O-and B-LOC-California O-transportation O-officials O-were O-asking O-themselves O-yesterday O-as O-rescue O-workers O-began O-the O-g X-##rue X-##some O-task O-of O-trying O-to O-extract O-as O-many O-as O-250 O-victims O-from O-beneath O-the O-concrete O-slab X-##s O-of O-the O-double X-- X-deck B-LOC-Ni X-##mit X-##z I-LOC-Freeway O-in B-LOC-Oakland O-that O-cave X-##d O-in O-during O-Tuesday O-' X-s O-te X-##mb X-##lor O-.
"After touring the area, California Gov.","O-After O-touring O-the O-area O-, B-LOC-California O-Go X-##v O-."
