"Besides that, some of the paintings that were to grace the walls of CenTrust actually ended up hanging in the chairman's estate on La Gorce Isle off Miami Beach.","O-Besides O-that O-, O-some O-of O-the O-paintings O-that O-were O-to O-grace O-the O-walls O-of O-Ce X-##n X-##T X-##rust O-actually O-ended O-up O-hanging O-in O-the O-chairman O-' X-s O-estate O-on B-LOC-La I-LOC-Go X-##rc X-##e I-LOC-Isle O-off B-LOC-Miami I-LOC-Beach O-."
"""It's not like selling Chevrolets,"" Mr. Paul says, as he takes a drag on a goldbanded St. Moritz cigarette.","O-"" O-It O-' X-s O-not O-like O-selling O-Chevrolet X-##s O-, X-"" O-Mr X-. O-Paul O-says O-, O-as O-he O-takes O-a O-drag O-on O-a O-gold X-##band X-##ed B-LOC-St X-. I-LOC-Mo X-##ritz O-cigarette O-."
"Despite Mr. Paul's characteristic hauteur, the 50-year-old, chain-smoking dynamo is finding that getting CenTrust -- Florida's largest thrift institution -- out of its riskiest investments is much tougher than getting into them had been.","O-Despite O-Mr X-. O-Paul O-' X-s O-characteristic O-ha X-##ute X-##ur O-, O-the O-50 X-- X-year X-- X-old O-, O-chain X-- X-smoking O-d X-##yna X-##mo O-is O-finding O-that O-getting O-Ce X-##n X-##T X-##rust O-- X-- B-LOC-Florida O-' X-s O-largest O-th X-##rift O-institution O-- X-- O-out O-of O-its O-risk X-##iest O-investments O-is O-much O-tough X-##er O-than O-getting O-into O-them O-had O-been O-."
"Collectors don't say ""It's a van Gogh"" anymore, laments Harry Brooks, the president of Wildenstein & Co., a New York gallery.","O-Collector X-##s O-do O-n X-' X-t O-say O-"" O-It O-' X-s O-a O-van O-Go X-##gh O-"" O-anymore O-, O-lame X-##nts O-Harry O-Brooks O-, O-the O-president O-of O-Wilde X-##nstein O-& O-Co X-. O-, O-a B-LOC-New I-LOC-York O-gallery O-."
He established his reputation as a freespender in January last year at Sotheby's auction of the Linda and Gerald Guterman collection in New York.,O-He O-established O-his O-reputation O-as O-a O-free X-##sp X-##ender O-in O-January O-last O-year O-at O-So X-##the X-##by O-' X-s O-auction O-of O-the O-Linda O-and O-Gerald O-G X-##uter X-##man O-collection O-in B-LOC-New I-LOC-York O-.
"Afterward, Mr. Paul is said by Mr. Guterman to have phoned Mr. Guterman, the New York developer selling the collection, and gloated.","O-Afterward O-, O-Mr X-. O-Paul O-is O-said O-by O-Mr X-. O-G X-##uter X-##man O-to O-have O-phone X-##d O-Mr X-. O-G X-##uter X-##man O-, O-the B-LOC-New I-LOC-York O-developer O-selling O-the O-collection O-, O-and O-g X-##loat X-##ed O-."
"""And he tells me, `If you want to see your paintings, you'll have to come to my house in Florida. '""","O-"" O-And O-he O-tells O-me O-, O-` O-If O-you O-want O-to O-see O-your O-paintings O-, O-you O-' X-ll O-have O-to O-come O-to O-my O-house O-in B-LOC-Florida O-. O-' X-"""
"Mr. Wachter, who became his principal adviser, searched galleries in London, Paris and Monaco.","O-Mr X-. O-W X-##ach X-##ter O-, O-who O-became O-his O-principal O-adviser O-, O-searched O-galleries O-in B-LOC-London O-, B-LOC-Paris O-and B-LOC-Monaco O-."
"Nicholas Hall, the president of the Colnaghi U.S.A. Ltd. gallery in New York, sold Mr. Paul ""Abraham and Sarah in the Wilderness"" by Giovanni Battista Tiepolo.","O-Nicholas O-Hall O-, O-the O-president O-of O-the O-Col X-##na X-##gh X-##i O-U X-. X-S X-. X-A O-. O-Ltd O-. O-gallery O-in B-LOC-New I-LOC-York O-, O-sold O-Mr X-. O-Paul O-"" O-Abraham O-and O-Sarah O-in O-the O-Wilderness O-"" O-by O-Giovanni O-Bat X-##tista O-T X-##ie X-##pol X-##o O-."
"Sotheby's, the auction house founded in London 1744 and now under the umbrella of Sotheby's Holdings Inc., was hoping to stir up interest in old masters as it strove to build its U.S. business.","O-So X-##the X-##by O-' X-s O-, O-the O-auction O-house O-founded O-in B-LOC-London O-174 X-##4 O-and O-now O-under O-the O-umbrella O-of O-So X-##the X-##by O-' X-s O-Holdings O-Inc X-. O-, O-was O-hoping O-to O-stir O-up O-interest O-in O-old O-masters O-as O-it O-s X-##tro X-##ve O-to O-build O-its B-LOC-U X-. X-S X-. O-business O-."
"European dealers continued to dominate the action in old masters, which Sotheby's North America had lately been touting in this country.","O-European O-dealers O-continued O-to O-dominate O-the O-action O-in O-old O-masters O-, O-which O-So X-##the X-##by O-' X-s B-LOC-North I-LOC-America O-had O-lately O-been O-to X-##uti X-##ng O-in O-this O-country O-."
"In March 1989, just 15 months into his campaign, Mr. Paul was named by Art & Antiques magazine as one of the top 100 individual collectors in the U.S. ""An unknown quantity to most of the art world, Paul is no stranger to lavish spending,"" the magazine said, noting that he doesn't stop at paint on canvas but also spends big on art you can eat.","O-In O-March O-1989 O-, O-just O-15 O-months O-into O-his O-campaign O-, O-Mr X-. O-Paul O-was O-named O-by O-Art O-& O-Anti X-##ques O-magazine O-as O-one O-of O-the O-top O-100 O-individual O-collectors O-in O-the B-LOC-U X-. X-S X-. O-"" O-An O-unknown O-quantity O-to O-most O-of O-the O-art O-world O-, O-Paul O-is O-no O-stranger O-to O-lavish O-spending O-, X-"" O-the O-magazine O-said O-, O-noting O-that O-he O-does O-n X-' X-t O-stop O-at O-paint O-on O-canvas O-but O-also O-spends O-big O-on O-art O-you O-can O-eat O-."
"""He recently bid $30,000 at a Paris charity auction for a dinner cooked by six of the world's great chefs, but the final party cost closer to $100,000.""","O-"" O-He O-recently O-bid O-$ O-30 X-, X-000 O-at O-a B-LOC-Paris O-charity O-auction O-for O-a O-dinner O-cooked O-by O-six O-of O-the O-world O-' X-s O-great O-chef X-##s O-, O-but O-the O-final O-party O-cost O-closer O-to O-$ O-100 X-, X-000 O-. O-"""
The art collection might have come to rival the Medicis' had the Florida comptroller's office not got wind of Mr. Paul's aesthetic adventure.,O-The O-art O-collection O-might O-have O-come O-to O-rival O-the O-Medici X-##s X-' O-had O-the B-LOC-Florida O-com X-##pt X-##roll X-##er O-' X-s O-office O-not O-got O-wind O-of O-Mr X-. O-Paul O-' X-s O-aesthetic O-adventure O-.
"David Tunick, the president of David Tunick Inc., a New York gallery, says scholars question the authenticity of the Rubens.","O-David O-Tu X-##nick O-, O-the O-president O-of O-David O-Tu X-##nick O-Inc X-. O-, O-a B-LOC-New I-LOC-York O-gallery O-, O-says O-scholars O-question O-the O-authenticity O-of O-the O-R X-##uben X-##s O-."
"Mr. Hall of the Colnaghi gallery says $1.15 million ""would have been an impossible price for anyone to ask for a Preti four years ago.""","O-Mr X-. O-Hall O-of O-the B-LOC-Col X-##na X-##gh X-##i O-gallery O-says O-$ O-1 X-. X-15 O-million O-"" O-would O-have O-been O-an O-impossible O-price O-for O-anyone O-to O-ask O-for O-a O-Pre X-##ti O-four O-years O-ago O-. O-"""
"Naomi Bernhard Levinson, a fine-arts appraiser at Bernhard Associates in San Francisco, considers it ""definite conflict of interest for an auction house to both advise a client on purchases and to set price estimates on the paintings to be purchased.""","O-Naomi O-Bernhard O-Levin X-##son O-, O-a O-fine X-- X-arts O-app X-##raiser O-at O-Bernhard O-Associates O-in B-LOC-San I-LOC-Francisco O-, O-considers O-it O-"" O-definite O-conflict O-of O-interest O-for O-an O-auction O-house O-to O-both O-advise O-a O-client O-on O-purchases O-and O-to O-set O-price O-estimates O-on O-the O-paintings O-to O-be O-purchased O-. O-"""
Mr. Paul says that he has feelers out over much of the globe and that potential buyers from as far away as Japan and Italy have examined the collection.,O-Mr X-. O-Paul O-says O-that O-he O-has O-feel X-##ers O-out O-over O-much O-of O-the O-globe O-and O-that O-potential O-buyers O-from O-as O-far O-away O-as B-LOC-Japan O-and B-LOC-Italy O-have O-examined O-the O-collection O-.
"One dealer, Martin Zimet of French & Co. in New York, says he ""would have loved to buy"" a Jan Davids de Heem painting from the bank.","O-One O-dealer O-, O-Martin O-Z X-##ime X-##t O-of O-French O-& O-Co X-. O-in B-LOC-New I-LOC-York O-, O-says O-he O-"" O-would O-have O-loved O-to O-buy O-"" O-a O-Jan O-David X-##s O-de O-He X-##em O-painting O-from O-the O-bank O-."
"The Galileo worm apparently was hatched on a computer in France hooked up to NASA's Space Physics Analysis Network, Mr. Redmond said.","O-The O-Galileo O-worm O-apparently O-was O-hatch X-##ed O-on O-a O-computer O-in B-LOC-France O-hooked O-up O-to O-NASA O-' X-s O-Space O-Physics O-Analysis O-Network O-, O-Mr X-. O-Red X-##mond O-said O-."
Anti-nuclear activists have protested the launch of the Galileo space probe to Jupiter because it uses plutonium to generate the electricity needed to run the craft.,O-Anti X-- X-nuclear O-activists O-have O-protested O-the O-launch O-of O-the O-Galileo O-space O-probe O-to B-LOC-Jupiter O-because O-it O-uses O-p X-##lut X-##onium O-to O-generate O-the O-electricity O-needed O-to O-run O-the O-craft O-.
"Activists fear that if the shuttle carrying Galileo into orbit should explode, or if Galileo itself crashes into the Earth during the two times it flies close to the planet, fatal levels of plutonium would be released into the atmosphere.","O-Act X-##ivist X-##s O-fear O-that O-if O-the O-shuttle O-carrying O-Galileo O-into O-orbit O-should O-explode O-, O-or O-if O-Galileo O-itself O-crashes O-into O-the B-LOC-Earth O-during O-the O-two O-times O-it O-flies O-close O-to O-the O-planet O-, O-fatal O-levels O-of O-p X-##lut X-##onium O-would O-be O-released O-into O-the O-atmosphere O-."
"He said the Chaos Computer Club, of West Germany, once managed to invade SPAN and do such things as change the value of pi, messing up some calculations.","O-He O-said O-the O-Chaos O-Computer O-Club O-, O-of B-LOC-West I-LOC-Germany O-, O-once O-managed O-to O-invade O-SP X-##AN O-and O-do O-such O-things O-as O-change O-the O-value O-of O-p X-##i O-, O-messing O-up O-some O-calculations O-."
CALIFORNIA STRUGGLED with the aftermath of a Bay area earthquake.,B-LOC-CA X-##L X-##IF X-##OR X-##NI X-##A O-ST X-##R X-##U X-##G X-##G X-##LE X-##D O-with O-the O-aftermath O-of O-a B-LOC-Bay O-area O-earthquake O-.
"As aftershocks shook the San Francisco Bay area, rescuers searched through rubble for survivors of Tuesday's temblor, and residents picked their way through glass-strewn streets.","O-As O-after X-##sh X-##ocks O-shook O-the B-LOC-San I-LOC-Francisco I-LOC-Bay O-area O-, O-rescue X-##rs O-searched O-through O-rubble O-for O-survivors O-of O-Tuesday O-' X-s O-te X-##mb X-##lor O-, O-and O-residents O-picked O-their O-way O-through O-glass X-- X-s X-##tre X-##wn O-streets O-."
"In Oakland, hopes faded for finding any more survivors within the concrete and steel from the collapse of an interstate highway.","O-In B-LOC-Oakland O-, O-hopes O-faded O-for O-finding O-any O-more O-survivors O-within O-the O-concrete O-and O-steel O-from O-the O-collapse O-of O-an O-interstate O-highway O-."
"At least 270 people were reported killed and 1,400 injured in the rush-hour tremor that caused billions of dollars of damage along 100 miles of the San Andreas fault.","O-At O-least O-270 O-people O-were O-reported O-killed O-and O-1 X-, X-400 O-injured O-in O-the O-rush X-- X-hour O-t X-##rem X-##or O-that O-caused O-billion X-##s O-of O-dollars O-of O-damage O-along O-100 O-miles O-of O-the B-LOC-San I-LOC-Andreas O-fault O-."
The baseball commissioner said the third game of the World Series between the Giants and the Athletics would be played Tuesday in Candlestick Park.,O-The O-baseball O-commissioner O-said O-the O-third O-game O-of O-the O-World O-Series O-between O-the O-Giants O-and O-the O-Athletics O-would O-be O-played O-Tuesday O-in B-LOC-Can X-##dles X-##tick I-LOC-Park O-.
HONECKER WAS OUSTED as leader of East Germany amid growing unrest.,O-H X-##ON X-##EC X-##KE X-##R O-WA X-##S O-O X-##US X-##TE X-##D O-as O-leader O-of B-LOC-East I-LOC-Germany O-amid O-growing O-unrest O-.
"The 77-year-old official, who oversaw the building of the Berlin Wall, was removed during a meeting of the 163-member Communist Party Central Committee in East Berlin.","O-The O-77 X-- X-year X-- X-old O-official O-, O-who O-oversaw O-the O-building O-of O-the B-LOC-Berlin I-LOC-Wall O-, O-was O-removed O-during O-a O-meeting O-of O-the O-163 X-- X-member O-Communist O-Party O-Central O-Committee O-in B-LOC-East I-LOC-Berlin O-."
HUNGARY ADOPTED constitutional changes to form a democratic system.,B-LOC-H X-##UN X-##GA X-##R X-##Y O-AD X-##OP X-##TE X-##D O-constitutional O-changes O-to O-form O-a O-democratic O-system O-.
"At a nationally televised legislative session in Budapest, the Parliament overwhelmingly approved changes formally ending one-party domination in the country, regulating free elections by next summer and establishing the office of state president to replace a 21-member council.","O-At O-a O-nationally O-televised O-legislative O-session O-in B-LOC-Budapest O-, O-the O-Parliament O-overwhelming X-##ly O-approved O-changes O-formally O-ending O-one X-- X-party O-domination O-in O-the O-country O-, O-regulating O-free O-elections O-by O-next O-summer O-and O-establishing O-the O-office O-of O-state O-president O-to O-replace O-a O-21 X-- X-member O-council O-."
The country was renamed the Republic of Hungary.,O-The O-country O-was O-renamed O-the B-LOC-Republic I-LOC-of I-LOC-Hungary O-.
The voting for new laws followed dissolution of Hungary's Communist Party this month and its replacement by a Western-style Socialist Party.,O-The O-voting O-for O-new O-laws O-followed O-dissolution O-of B-LOC-Hungary O-' X-s O-Communist O-Party O-this O-month O-and O-its O-replacement O-by O-a O-Western X-- X-style O-Socialist O-Party O-.
"The space shuttle Atlantis blasted into orbit from Cape Canaveral, Fla., and its crew of five astronauts launched the nuclear-powered Galileo space probe on a flight to the planet Jupiter.","O-The O-space O-shuttle O-Atlantis O-blasted O-into O-orbit O-from B-LOC-Cape I-LOC-Can X-##aver X-##al O-, B-LOC-F X-##la X-. O-, O-and O-its O-crew O-of O-five O-astronaut X-##s O-launched O-the O-nuclear X-- X-powered O-Galileo O-space O-probe O-on O-a O-flight O-to O-the O-planet B-LOC-Jupiter O-."
The shuttle is slated to return Monday to California.,O-The O-shuttle O-is O-slated O-to O-return O-Monday O-to B-LOC-California O-.
"South Korea's President Roh addressed a joint House-Senate meeting and urged patience over U.S. demands for the opening of Seoul's markets to more American goods, saying trade issues would be ""resolved to mutual satisfaction.""","B-LOC-South I-LOC-Korea O-' X-s O-President O-R X-##oh O-addressed O-a O-joint O-House X-- X-Senate O-meeting O-and O-urged O-patience O-over B-LOC-U X-. X-S X-. O-demands O-for O-the O-opening O-of B-LOC-Seoul O-' X-s O-markets O-to O-more O-American O-goods O-, O-saying O-trade O-issues O-would O-be O-"" O-resolved O-to O-mutual O-satisfaction O-. O-"""
"He also said tragic results could follow any ""hint of weakening"" of the U.S. defense commitment to Seoul.","O-He O-also O-said O-tragic O-results O-could O-follow O-any O-"" O-hint O-of O-weakening O-"" O-of O-the B-LOC-U X-. X-S X-. O-defense O-commitment O-to B-LOC-Seoul O-."
"The Census Bureau reported that 13.1% of the U.S. population, or 31.9 million people, were living in poverty in 1988.","O-The O-Census O-Bureau O-reported O-that O-13 X-. X-1 O-% O-of O-the B-LOC-U X-. X-S X-. O-population O-, O-or O-31 X-. X-9 O-million O-people O-, O-were O-living O-in O-poverty O-in O-1988 O-."
"The Bush administration accused Israeli Prime Minister Shamir of hindering peace efforts in the Mideast with ""unhelpful"" and disappointing statements.","O-The O-Bush O-administration O-accused O-Israeli O-Prime O-Minister O-S X-##ham X-##ir O-of O-hind X-##ering O-peace O-efforts O-in O-the B-LOC-Mid X-##eas X-##t O-with O-"" O-un X-##hel X-##pf X-##ul O-"" O-and O-disappointing O-statements O-."
"Shamir said Tuesday that he was prepared to risk a policy conflict with the U.S. over an Egyptian plan to hold direct Israeli-Palestinian talks, which the premier's Likud bloc opposes.","O-S X-##ham X-##ir O-said O-Tuesday O-that O-he O-was O-prepared O-to O-risk O-a O-policy O-conflict O-with O-the B-LOC-U X-. X-S X-. O-over O-an O-Egyptian O-plan O-to O-hold O-direct O-Israeli X-- X-Palestinian O-talks O-, O-which O-the O-premier O-' X-s O-Li X-##ku X-##d O-b X-##loc O-oppose X-##s O-."
Cuba was elected to the U.N. Security Council for the first time since its Castro-led revolution 30 years ago.,B-LOC-Cuba O-was O-elected O-to O-the O-U X-. X-N O-. O-Security O-Council O-for O-the O-first O-time O-since O-its O-Castro X-- X-led O-revolution O-30 O-years O-ago O-.
The U.S. didn't openly oppose Cuba's seating as the Latin American council delegate.,O-The B-LOC-U X-. X-S X-. O-did O-n X-' X-t O-openly O-oppose B-LOC-Cuba O-' X-s O-seating O-as O-the O-Latin O-American O-council O-delegate O-.
"Britain's Prime Minister Thatcher told a Commonwealth summit in Kuala Lumpur, Malaysia, that sanctions against South Africa were ""utterly irresponsible,"" officials said.","B-LOC-Britain O-' X-s O-Prime O-Minister O-Thatcher O-told O-a O-Commonwealth O-summit O-in B-LOC-Kuala I-LOC-Lumpur O-, B-LOC-Malaysia O-, O-that O-sanctions O-against B-LOC-South I-LOC-Africa O-were O-"" O-utterly O-i X-##rre X-##sponsible O-, X-"" O-officials O-said O-."
But other nations at the opening of the 49-nation meeting of Britain and its former colonies pressed for continued or stronger embargoes in an effort to end apartheid.,O-But O-other O-nations O-at O-the O-opening O-of O-the O-49 X-- X-nation O-meeting O-of B-LOC-Britain O-and O-its O-former O-colonies O-pressed O-for O-continued O-or O-stronger O-em X-##bar X-##go X-##es O-in O-an O-effort O-to O-end O-apartheid O-.
Arab officials in Saudi Arabia said three-week-old talks by Lebanese lawmakers aimed at ending Lebanon's civil war appeared about to collapse.,O-Arab O-officials O-in B-LOC-Saudi I-LOC-Arabia O-said O-three X-- X-week X-- X-old O-talks O-by O-Lebanese O-law X-##makers O-aimed O-at O-ending B-LOC-Lebanon O-' X-s O-civil O-war O-appeared O-about O-to O-collapse O-.
Christian legislators are insisting on a Syrian troop pullout from Lebanon before agreeing to political changes giving the nation's Moslems a greater role in Beirut's government.,O-Christian O-legislators O-are O-insisting O-on O-a O-Syrian O-troop O-pull X-##out O-from B-LOC-Lebanon O-before O-agreeing O-to O-political O-changes O-giving O-the O-nation O-' X-s O-Mo X-##sle X-##ms O-a O-greater O-role O-in B-LOC-Beirut O-' X-s O-government O-.
Colombia's judges launched a 72-hour strike to press security demands following Tuesday's murder of a High Court justice in Medellin.,B-LOC-Colombia O-' X-s O-judges O-launched O-a O-72 X-- X-hour O-strike O-to O-press O-security O-demands O-following O-Tuesday O-' X-s O-murder O-of O-a O-High O-Court O-justice O-in B-LOC-Me X-##dell X-##in O-.
Some people on Wall Street -- and even some in the Bush administration -- think that Transportation Secretary Samuel Skinner may have played a second-hand role in the stock slide.,O-Some O-people O-on B-LOC-Wall I-LOC-Street O-- X-- O-and O-even O-some O-in O-the O-Bush O-administration O-- X-- O-think O-that O-Transportation O-Secretary O-Samuel O-Skinner O-may O-have O-played O-a O-second X-- X-hand O-role O-in O-the O-stock O-slide O-.
"Mr. Skinner's LBO comments ""probably helped discourage some of the banks from participating"" in the UAL deal, says Louis Marckesano, airline analyst for Janney Montgomery Scott Inc., a Philadelphia brokerage house.","O-Mr X-. O-Skinner O-' X-s O-L X-##BO O-comments O-"" O-probably O-helped O-disco X-##urage O-some O-of O-the O-banks O-from O-participating O-"" O-in O-the O-U X-##AL O-deal O-, O-says O-Louis O-Marc X-##kes X-##ano O-, O-airline O-analyst O-for O-Jan X-##ney O-Montgomery O-Scott O-Inc X-. O-, O-a B-LOC-Philadelphia O-broker X-##age O-house O-."
"But whether he single-handedly sparked the crash or had nothing to do with it, one thing is clear in the aftermath of the price slide: Sam Skinner, by his repeated jawboning on the buy-out issue, has irritated some in the Bush administration, so much so that some White House officials want to rein him in.","O-But O-whether O-he O-single X-- X-handed X-##ly O-sparked O-the O-crash O-or O-had O-nothing O-to O-do O-with O-it O-, O-one O-thing O-is O-clear O-in O-the O-aftermath O-of O-the O-price O-slide O-: O-Sam O-Skinner O-, O-by O-his O-repeated O-jaw X-##bon X-##ing O-on O-the O-buy X-- X-out O-issue O-, O-has O-irritated O-some O-in O-the O-Bush O-administration O-, O-so O-much O-so O-that O-some B-LOC-White I-LOC-House O-officials O-want O-to O-re X-##in O-him O-in O-."
"Moreover, administration officials say that Office of Management and Budget Director Richard Darman, Treasury Secretary Nicholas Brady, Council of Economic Advisers Michael Boskin and U.S. Trade Representative Carla Hills all have had problems with Mr. Skinner's jawboning.","O-Moreover O-, O-administration O-officials O-say O-that O-Office O-of O-Management O-and O-Budget O-Director O-Richard O-Dar X-##man O-, O-Treasury O-Secretary O-Nicholas O-Brady O-, O-Council O-of O-Economic O-Ad X-##vise X-##rs O-Michael O-Bo X-##skin O-and B-LOC-U X-. X-S X-. O-Trade O-Representative O-Carla O-Hills O-all O-have O-had O-problems O-with O-Mr X-. O-Skinner O-' X-s O-jaw X-##bon X-##ing O-."
"""The banks in this country and in Japan couldn't put the financing together on the terms offered,"" he said in a telephone interview from Detroit, where he was speaking to the Economic Club of Detroit.","O-"" O-The O-banks O-in O-this O-country O-and O-in B-LOC-Japan O-could O-n X-' X-t O-put O-the O-financing O-together O-on O-the O-terms O-offered O-, X-"" O-he O-said O-in O-a O-telephone O-interview O-from B-LOC-Detroit O-, O-where O-he O-was O-speaking O-to O-the O-Economic O-Club O-of O-Detroit O-."
"At the very least, the administration has been sending mixed signals about leveraged buy-outs and foreign ownership of U.S. airlines.","O-At O-the O-very O-least O-, O-the O-administration O-has O-been O-sending O-mixed O-signals O-about O-leverage X-##d O-buy X-- X-outs O-and O-foreign O-ownership O-of B-LOC-U X-. X-S X-. O-airlines O-."
"Last month, Mr. Skinner forced Northwest Airlines to reduce a stake held by KLM Royal Dutch Airlines to ensure, he said, that the foreign airline wouldn't illegally control Northwest.","O-Last O-month O-, O-Mr X-. O-Skinner O-forced O-Northwest O-Airlines O-to O-reduce O-a O-stake O-held O-by O-K X-##LM O-Royal O-Dutch O-Airlines O-to O-ensure O-, O-he O-said O-, O-that O-the O-foreign O-airline O-would O-n X-' X-t O-illegally O-control B-LOC-Northwest O-."
Mr. Skinner says he hasn't spelled out a policy for leveraged buy-outs because Wall Street bankers and lawyers would simply find ways to circumvent it.,O-Mr X-. O-Skinner O-says O-he O-has O-n X-' X-t O-spelled O-out O-a O-policy O-for O-leverage X-##d O-buy X-- X-outs O-because B-LOC-Wall I-LOC-Street O-banker X-##s O-and O-lawyers O-would O-simply O-find O-ways O-to O-c X-##ir X-##cum X-##vent O-it O-.
"Foreign companies are barred by law from holding more than 25% voting stock, or exerting actual control, over U.S. airlines.","O-Foreign O-companies O-are O-barred O-by O-law O-from O-holding O-more O-than O-25 O-% O-voting O-stock O-, O-or O-ex X-##ert X-##ing O-actual O-control O-, O-over B-LOC-U X-. X-S X-. O-airlines O-."
It appears that some leading administration officials believe the Northwest decision leaves the U.S. open to charges of protectionism and could undermine the U.S. position in international trade talks.,O-It O-appears O-that O-some O-leading O-administration O-officials O-believe O-the B-LOC-Northwest O-decision O-leaves O-the B-LOC-U X-. X-S X-. O-open O-to O-charges O-of O-protection X-##ism O-and O-could O-under X-##mine O-the B-LOC-U X-. X-S X-. O-position O-in O-international O-trade O-talks O-.
"He and other department officials argue that it would be foolish to open U.S. markets to foreign carriers through investments, when other countries are blocking expanded service by American carriers overseas.","O-He O-and O-other O-department O-officials O-argue O-that O-it O-would O-be O-foolish O-to O-open B-LOC-U X-. X-S X-. O-markets O-to O-foreign O-carriers O-through O-investments O-, O-when O-other O-countries O-are O-blocking O-expanded O-service O-by O-American O-carriers O-overseas O-."
"Mr. Skinner satisfied his safety concerns on the Northwest deal by requiring the airline to file certain financial information that could affect safety, including maintenance expenditures.","O-Mr X-. O-Skinner O-satisfied O-his O-safety O-concerns O-on O-the B-LOC-Northwest O-deal O-by O-requiring O-the O-airline O-to O-file O-certain O-financial O-information O-that O-could O-affect O-safety O-, O-including O-maintenance O-expenditure X-##s O-."
"That, says House Aviation Subcommittee Chairman James Oberstar, a Minnesota Democrat, is like ""using a howitzer to go deer hunting.""","O-That O-, O-says O-House O-Aviation O-Subcommittee O-Chairman O-James O-O X-##bers X-##tar O-, O-a B-LOC-Minnesota O-Democrat O-, O-is O-like O-"" O-using O-a O-how X-##itzer O-to O-go O-deer O-hunting O-. O-"""
"Despite continuing troubles with problem properties and nonperforming loans, the Dallas trust said it has rebuilt reserves, abandoned properties with little potential and experienced improved operating results from joint ventures.","O-Despite O-continuing O-troubles O-with O-problem O-properties O-and O-non X-##per X-##form X-##ing O-loans O-, O-the B-LOC-Dallas O-trust O-said O-it O-has O-rebuilt O-reserves O-, O-abandoned O-properties O-with O-little O-potential O-and O-experienced O-improved O-operating O-results O-from O-joint O-ventures O-."
