"It was down more than 40 points a half-hour before the close, marking a 61.5-point turnaround from its high, reached in the first 15 minutes of trading.","O-It O-was O-down O-more O-than O-40 O-points O-a O-half X-- X-hour O-before O-the O-close O-, O-marking O-a O-61 X-. X-5 X-- X-point O-turn X-##around O-from B-PRP$-its O-high O-, O-reached O-in O-the O-first O-15 O-minutes O-of O-trading O-."
"On the corporate front, Ford Motor announced that it raised its stake in U.K. luxury car maker Jaguar to 10.4% from 5%.","O-On O-the O-corporate O-front O-, O-Ford O-Motor O-announced O-that O-it O-raised B-PRP$-its O-stake O-in O-U X-. X-K X-. O-luxury O-car O-maker O-Jaguar O-to O-10 X-. X-4 O-% O-from O-5 O-% O-."
"Brewery stocks were firm to higher on talk of early bargain-hunting, but most ended below their peaks.","O-Brewery O-stocks O-were O-firm O-to O-higher O-on O-talk O-of O-early O-bargain X-- X-hunting O-, O-but O-most O-ended O-below B-PRP$-their O-peaks O-."
"1 domestic aluminum producer, Aluminum Co. of America, Friday said its earnings fell 3.2% to $219 million, or $2.46 a share.","O-1 O-domestic O-aluminum O-producer O-, O-Al X-##umi X-##num O-Co X-. O-of O-America O-, O-Friday O-said B-PRP$-its O-earnings O-fell O-3 X-. X-2 O-% O-to O-$ O-219 O-million O-, O-or O-$ O-2 X-. X-46 O-a O-share O-."
"(During its centennial year, The Wall Street Journal will report events of the past century that stand as milestones of American business history.)","O-( O-During B-PRP$-its O-cent X-##ennial O-year O-, O-The O-Wall O-Street O-Journal O-will O-report O-events O-of O-the O-past O-century O-that O-stand O-as O-milestone X-##s O-of O-American O-business O-history O-. O-)"
"Japan and Europe, far more dependent on Mideast oil than the U.S., wouldn't offend the Arabs or trade off their precious supplies.","O-Japan O-and O-Europe O-, O-far O-more O-dependent O-on O-Mid X-##eas X-##t O-oil O-than O-the O-U X-. X-S X-. O-, O-would O-n X-' X-t O-off X-##end O-the O-Arabs O-or O-trade O-off B-PRP$-their O-precious O-supplies O-."
"The U.S. did manage to supply the Dutch with oil by relabeling supplies; once oil is shipped, no one can tell its source.","O-The O-U X-. X-S X-. O-did O-manage O-to O-supply O-the O-Dutch O-with O-oil O-by O-re X-##la X-##bel X-##ing O-supplies O-; O-once O-oil O-is O-shipped O-, O-no O-one O-can O-tell B-PRP$-its O-source O-."
The issue brings Fannie Mae's 1989 Remic issuance to $30.2 billion and its total volume to $42.3 billion since the program began in April 1987.,O-The O-issue O-brings O-Fan X-##nie O-Mae O-' X-s O-1989 O-Re X-##mic O-is X-##su X-##ance O-to O-$ O-30 X-. X-2 O-billion O-and B-PRP$-its O-total O-volume O-to O-$ O-42 X-. X-3 O-billion O-since O-the O-program O-began O-in O-April O-1987 O-.
"As part of his plea agreement with the government, the 44-year-old Mr. Craig faces a maximum of three years in prison.","O-As O-part O-of B-PRP$-his O-plea O-agreement O-with O-the O-government O-, O-the O-44 X-- X-year X-- X-old O-Mr X-. O-Craig O-faces O-a O-maximum O-of O-three O-years O-in O-prison O-."
"The National Broadcasting Co., a unit of General Electric Co., had its record-breaking 68-week reign as the prime-time ratings leader snapped yesterday by ABC-TV, a subsidiary of Capital Cities/ABC Inc.","O-The O-National O-Broadcasting O-Co X-. O-, O-a O-unit O-of O-General O-Electric O-Co X-. O-, O-had B-PRP$-its O-record X-- X-breaking O-68 X-- X-week O-reign O-as O-the O-prime X-- X-time O-ratings O-leader O-snapped O-yesterday O-by O-ABC X-- X-TV O-, O-a O-subsidiary O-of O-Capital O-Cities O-/ O-ABC O-Inc O-."
"Debora Foster takes off her necklace, settles herself on a padded chair and gently leans forward.","O-De X-##bor X-##a O-Foster O-takes O-off B-PRP$-her O-necklace O-, O-settle X-##s O-herself O-on O-a O-padded O-chair O-and O-gently O-leans O-forward O-."
"O'Reilly, the company's chairman, swears by her firm touch, saying regular massages are a balm for his old football injuries.","O-O X-' X-Reilly O-, O-the O-company O-' X-s O-chairman O-, O-swear X-##s O-by B-PRP$-her O-firm O-touch O-, O-saying O-regular O-massage X-##s O-are O-a O-b X-##al X-##m O-for B-PRP$-his O-old O-football O-injuries O-."
"""The blood flows to your head, you feel lightheaded and you don't feel tension around the head or neck,"" says Minnie Morey, an operations supervisor at the Social Security office in Grand Rapids, Mich., where massages began last month.","O-"" O-The O-blood O-flows O-to B-PRP$-your O-head O-, O-you O-feel O-light X-##headed O-and O-you O-do O-n X-' X-t O-feel O-tension O-around O-the O-head O-or O-neck O-, X-"" O-says O-Min X-##nie O-More X-##y O-, O-an O-operations O-supervisor O-at O-the O-Social O-Security O-office O-in O-Grand O-Rapids O-, O-Mi X-##ch X-. O-, O-where O-massage X-##s O-began O-last O-month O-."
"""When you leave the room after your massage, people say you look like you're glowing.""","O-"" O-When O-you O-leave O-the O-room O-after B-PRP$-your O-massage O-, O-people O-say O-you O-look O-like O-you O-' X-re O-glowing O-. O-"""
"Adds Candice Ohlman, the 35-year-old masseuse who plies her trade in the Grand Rapids office, ""They fall in love with my hands.""","O-Ad X-##ds O-Can X-##dice O-Oh X-##lman O-, O-the O-35 X-- X-year X-- X-old O-mass X-##eus X-##e O-who O-p X-##lies B-PRP$-her O-trade O-in O-the O-Grand O-Rapids O-office O-, O-"" O-They O-fall O-in O-love O-with B-PRP$-my O-hands O-. O-"""
"Three years ago, the Internal Revenue Service's office in San Jose, Calif., opened its doors to on-site massage.","O-Three O-years O-ago O-, O-the O-Internal O-Revenue O-Service O-' X-s O-office O-in O-San O-Jose O-, O-Cal X-##if X-. O-, O-opened B-PRP$-its O-doors O-to O-on X-- X-site O-massage O-."
"Some masseurs have tried to get around this by calling themselves ""bodyworkers"" and describing their office visits as ""reinvigoration breaks.""","O-Some O-mass X-##eur X-##s O-have O-tried O-to O-get O-around O-this O-by O-calling O-themselves O-"" O-body X-##work X-##ers O-"" O-and O-describing B-PRP$-their O-office O-visits O-as O-"" O-re X-##in X-##vi X-##gor X-##ation O-breaks O-. O-"""
"Last year, the research and development division of Weyerhaeuser Co., the large wood-products concern, invited a masseuse to its Tacoma, Wash., offices.","O-Last O-year O-, O-the O-research O-and O-development O-division O-of O-We X-##yer X-##ha X-##eus X-##er O-Co X-. O-, O-the O-large O-wood X-- X-products O-concern O-, O-invited O-a O-mass X-##eus X-##e O-to B-PRP$-its O-Tacoma O-, O-Was X-##h X-. O-, O-offices O-."
Mr. Soule says his only beef was that the massages were being given in a company conference room; the department's supervised health facility would have been fine.,O-Mr X-. O-Soul X-##e O-says B-PRP$-his O-only O-beef O-was O-that O-the O-massage X-##s O-were O-being O-given O-in O-a O-company O-conference O-room O-; O-the O-department O-' X-s O-supervised O-health O-facility O-would O-have O-been O-fine O-.
"""In my view, {massages} should be managed with an appropriate mixture of males and females around,"" he says.","O-"" O-In B-PRP$-my O-view O-, O-{ O-massage X-##s O-} O-should O-be O-managed O-with O-an O-appropriate O-mixture O-of O-males O-and O-females O-around O-, X-"" O-he O-says O-."
"Given such attitudes, some corporate masseurs prefer to go about their business quietly.","O-Given O-such O-attitudes O-, O-some O-corporate O-mass X-##eur X-##s O-prefer O-to O-go O-about B-PRP$-their O-business O-quietly O-."
"His massage chair is kept in a closet, and a secretary escorts him past security.","B-PRP$-His O-massage O-chair O-is O-kept O-in O-a O-closet O-, O-and O-a O-secretary O-escort X-##s O-him O-past O-security O-."
"""This is common with a lot of large companies,"" says Mr. Borner, who worked for American Telephone & Telegraph Co. for 23 years before choosing his current trade.","O-"" O-This O-is O-common O-with O-a O-lot O-of O-large O-companies O-, X-"" O-says O-Mr X-. O-Born X-##er O-, O-who O-worked O-for O-American O-Telephone O-& O-Telegraph O-Co X-. O-for O-23 O-years O-before O-choosing B-PRP$-his O-current O-trade O-."
"Managers, he contends, ""are afraid how they're going to look in the eyes of their peers.","O-Manager X-##s O-, O-he O-con X-##tend X-##s O-, O-"" O-are O-afraid O-how O-they O-' X-re O-going O-to O-look O-in O-the O-eyes O-of B-PRP$-their O-peers O-."
My vision is to change human consciousness towards touch.,B-PRP$-My O-vision O-is O-to O-change O-human O-consciousness O-towards O-touch O-.
"My attitude is: Let's come out of the closet.""","B-PRP$-My O-attitude O-is O-: O-Let O-' X-s O-come O-out O-of O-the O-closet O-. O-"""
She notes that she also stresses professionalism during her weekly visits.,O-She O-notes O-that O-she O-also O-stresses O-professional X-##ism O-during B-PRP$-her O-weekly O-visits O-.
"""I pull my hair back, wear a little makeup and look corporate,"" says Ms. Byler, who has been visiting Emerson since January.","O-"" O-I O-pull B-PRP$-my O-hair O-back O-, O-wear O-a O-little O-makeup O-and O-look O-corporate O-, X-"" O-says O-Ms O-. O-By X-##ler O-, O-who O-has O-been O-visiting O-Emerson O-since O-January O-."
"""The culture is not ready to take off its clothes, lie down and be touched for an hour for $45,"" he says.","O-"" O-The O-culture O-is O-not O-ready O-to O-take O-off B-PRP$-its O-clothes O-, O-lie O-down O-and O-be O-touched O-for O-an O-hour O-for O-$ O-45 O-, X-"" O-he O-says O-."
"Customers lean forward, rest their knees on side supports and bury their face in padding on the back of the chair.","O-Custom X-##ers O-lean O-forward O-, O-rest B-PRP$-their O-knees O-on O-side O-supports O-and O-bury B-PRP$-their O-face O-in O-pad X-##ding O-on O-the O-back O-of O-the O-chair O-."
"""It was a powerful point in my career,"" says the 31-year-old Mr. MacInnis, who has since taken out a $1 million liability policy for his business.","O-"" O-It O-was O-a O-powerful O-point O-in B-PRP$-my O-career O-, X-"" O-says O-the O-31 X-- X-year X-- X-old O-Mr X-. O-Mac X-##I X-##nn X-##is O-, O-who O-has O-since O-taken O-out O-a O-$ O-1 O-million O-liability O-policy O-for B-PRP$-his O-business O-."
"""Whole areas of their bodies are neglected,"" she says, adding that clothes ruin the experience.","O-"" O-Whole O-areas O-of B-PRP$-their O-bodies O-are O-neglected O-, X-"" O-she O-says O-, O-adding O-that O-clothes O-ruin O-the O-experience O-."
Loral will provide to Turkey an electronic countermeasures system for its fleet of F-16 aircraft.,O-Lo X-##ral O-will O-provide O-to O-Turkey O-an O-electronic O-counter X-##me X-##asures O-system O-for B-PRP$-its O-fleet O-of O-F X-- X-16 O-aircraft O-.
"Mr. Craven is widely credited with refocusing Morgan Grenfell's energies on its core corporate finance, fund management and banking activities over the past year.","O-Mr X-. O-Craven O-is O-widely O-credited O-with O-re X-##fo X-##cus X-##ing O-Morgan O-G X-##ren X-##fell O-' X-s O-energies O-on B-PRP$-its O-core O-corporate O-finance O-, O-fund O-management O-and O-banking O-activities O-over O-the O-past O-year O-."
"Last year, Morgan Grenfell shut down its ailing U.K. securities operations.","O-Last O-year O-, O-Morgan O-G X-##ren X-##fell O-shut O-down B-PRP$-its O-a X-##iling O-U X-. X-K X-. O-securities O-operations O-."
"Mr. Craven said his move to the chairmanship means he will take a less active role in the day-to-day management of the group, but he added that the merchant bank's strategic focus remains unchanged.","O-Mr X-. O-Craven O-said B-PRP$-his O-move O-to O-the O-chairman X-##ship O-means O-he O-will O-take O-a O-less O-active O-role O-in O-the O-day X-- X-to X-- X-day O-management O-of O-the O-group O-, O-but O-he O-added O-that O-the O-merchant O-bank O-' X-s O-strategic O-focus O-remains O-unchanged O-."
"His duties will be taken over by Anthony Richmond-Watson, who has been elected deputy chairman.","B-PRP$-His O-duties O-will O-be O-taken O-over O-by O-Anthony O-Richmond X-- X-Watson O-, O-who O-has O-been O-elected O-deputy O-chairman O-."
"Last month, Morgan Grenfell announced its pretax profit rose 49.6% to #32.8 million in the first half, boosted by a healthy growth in its domestic and international corporate finance business.","O-Last O-month O-, O-Morgan O-G X-##ren X-##fell O-announced B-PRP$-its O-pre X-##ta X-##x O-profit O-rose O-49 X-. X-6 O-% O-to O-# O-32 X-. X-8 O-million O-in O-the O-first O-half O-, O-boost X-##ed O-by O-a O-healthy O-growth O-in B-PRP$-its O-domestic O-and O-international O-corporate O-finance O-business O-."
"Integrated Resources Inc., the troubled financial-services company that has been trying to sell its core companies to restructure debt, said talks with a potential buyer ended.","O-Integrated O-Resources O-Inc X-. O-, O-the O-troubled O-financial X-- X-services O-company O-that O-has O-been O-trying O-to O-sell B-PRP$-its O-core O-companies O-to O-rest X-##ru X-##cture O-debt O-, O-said O-talks O-with O-a O-potential O-buyer O-ended O-."
"The company didn't disclose the new estimate but said the change was related to Integrated's failure to sell its core businesses, as well as ""other events,"" which it didn't detail, that occurred after its announcement last week that it was in talks with the unidentified prospective buyer.","O-The O-company O-did O-n X-' X-t O-disc X-##lose O-the O-new O-estimate O-but O-said O-the O-change O-was O-related O-to O-Integrated O-' X-s O-failure O-to O-sell B-PRP$-its O-core O-businesses O-, O-as O-well O-as O-"" O-other O-events O-, X-"" O-which O-it O-did O-n X-' X-t O-detail O-, O-that O-occurred O-after B-PRP$-its O-announcement O-last O-week O-that O-it O-was O-in O-talks O-with O-the O-unidentified O-prospective O-buyer O-."
"Meanwhile, a number of top sales producers from Integrated Resources Equity will meet this afternoon in Chicago to discuss their options.","O-Meanwhile O-, O-a O-number O-of O-top O-sales O-producers O-from O-Integrated O-Resources O-Equity O-will O-meet O-this O-afternoon O-in O-Chicago O-to O-discuss B-PRP$-their O-options O-."
The sales force is viewed as a critical asset in Integrated's attempt to sell its core companies.,O-The O-sales O-force O-is O-viewed O-as O-a O-critical O-asset O-in O-Integrated O-' X-s O-attempt O-to O-sell B-PRP$-its O-core O-companies O-.
Whitehall cited concerns about how long Integrated would be able to hold together the sales force as one reason its talks with Integrated failed.,O-White X-##hall O-cited O-concerns O-about O-how O-long O-Integrated O-would O-be O-able O-to O-hold O-together O-the O-sales O-force O-as O-one O-reason B-PRP$-its O-talks O-with O-Integrated O-failed O-.
"ONE LIBERTY PROPERTIES Inc. declared a dividend of 40 cents a share on its $16.50 cumulative convertible preferred stock, payable Jan. 2 to stock of record Dec. 8.","O-ONE O-L X-##IB X-##ER X-##TY O-PR X-##OP X-##ER X-##TI X-##ES O-Inc O-. O-declared O-a O-divide X-##nd O-of O-40 O-cents O-a O-share O-on B-PRP$-its O-$ O-16 X-. X-50 O-cumulative O-convertible O-preferred O-stock O-, O-pay X-##able O-Jan X-. O-2 O-to O-stock O-of O-record O-Dec X-. O-8 O-."
"According to a spokesman, One Liberty will have paid out as dividends the required amount of its taxable income to maintain its legal status as a real estate investment trust.","O-According O-to O-a O-spokesman O-, O-One O-Liberty O-will O-have O-paid O-out O-as O-divide X-##nds O-the O-required O-amount O-of B-PRP$-its O-taxa X-##ble O-income O-to O-maintain B-PRP$-its O-legal O-status O-as O-a O-real O-estate O-investment O-trust O-."
"But stocks later recovered, erasing most of their early declines.","O-But O-stocks O-later O-recovered O-, O-era X-##sing O-most O-of B-PRP$-their O-early O-decline X-##s O-."
Federal Reserve officials sent another signal of their determination to shore up investor confidence.,O-Federal O-Reserve O-officials O-sent O-another O-signal O-of B-PRP$-their O-determination O-to O-shore O-up O-investor O-confidence O-.
"Fed officials appear reluctant to ease their credit grip any further because a bold move doesn't appear necessary, several investment managers said.","O-Fed O-officials O-appear O-reluctant O-to O-ease B-PRP$-their O-credit O-grip O-any O-further O-because O-a O-bold O-move O-does O-n X-' X-t O-appear O-necessary O-, O-several O-investment O-managers O-said O-."
"Some of the decline at the Big Three is production shifted to the ""transplants"": Diamond-Star Motors Corp. builds cars sold by Chrysler as well as Mitsubishi Motors Corp. Mazda Motor Corp. 's U.S. plant builds cars for its own and Ford dealers.","O-Some O-of O-the O-decline O-at O-the O-Big O-Three O-is O-production O-shifted O-to O-the O-"" O-transplant X-##s O-"" O-: O-Diamond X-- X-Star O-Motors O-Corp O-. O-builds O-cars O-sold O-by O-Chrysler O-as O-well O-as O-Mitsubishi O-Motors O-Corp O-. O-Ma X-##zda O-Motor O-Corp O-. O-' O-s O-U X-. X-S X-. O-plant O-builds O-cars O-for B-PRP$-its O-own O-and O-Ford O-dealers O-."
"Mazda also is adding the Mazda 626 car at its Flat Rock, Mich., plant, slowing output.","O-Ma X-##zda O-also O-is O-adding O-the O-Ma X-##zda O-62 X-##6 O-car O-at B-PRP$-its O-Flat O-Rock O-, O-Mi X-##ch X-. O-, O-plant O-, O-slowing O-output O-."
"Honda is accelerating production after retooling its Marysville, Ohio, plant to build the redesigned Accord.","O-Honda O-is O-a X-##cc X-##ele X-##rating O-production O-after O-re X-##to X-##olin X-##g B-PRP$-its O-Mary X-##sville O-, O-Ohio O-, O-plant O-to O-build O-the O-redesigned O-A X-##cco X-##rd O-."
"More than half the decline in Ford's expected car output comes from closing its Escort plant in Wayne, Mich., as of Nov. 22 to prepare for production of the next generation of the popular subcompact.","O-More O-than O-half O-the O-decline O-in O-Ford O-' X-s O-expected O-car O-output O-comes O-from O-closing B-PRP$-its O-E X-##sco X-##rt O-plant O-in O-Wayne O-, O-Mi X-##ch X-. O-, O-as O-of O-Nov X-. O-22 O-to O-prepare O-for O-production O-of O-the O-next O-generation O-of O-the O-popular O-sub X-##com X-##pa X-##ct O-."
The lower output will likely mean the subcompacts will lose for the first time since the 1985 model year their distinction as the best-selling car in the U.S.,O-The O-lower O-output O-will O-likely O-mean O-the O-sub X-##com X-##pa X-##cts O-will O-lose O-for O-the O-first O-time O-since O-the O-1985 O-model O-year B-PRP$-their O-distinction O-as O-the O-best X-- X-selling O-car O-in O-the O-U X-. X-S O-.
Your James P. Sterba thought that our James P. Sterba was an impostor?,B-PRP$-Your O-James O-P X-. O-St X-##er X-##ba O-thought O-that B-PRP$-our O-James O-P X-. O-St X-##er X-##ba O-was O-an O-imp X-##ost X-##or O-?
I always thought your Sterba was the charlatan.,O-I O-always O-thought B-PRP$-your O-St X-##er X-##ba O-was O-the O-ch X-##ar X-##lat X-##an O-.
Control Data said it expects its first RISC-based mainframe machine to be introduced next year.,O-Control O-Data O-said O-it O-expects B-PRP$-its O-first O-R X-##IS X-##C X-- X-based O-main X-##frame O-machine O-to O-be O-introduced O-next O-year O-.
"The accord with MIPS calls for Control Data to share its expertise in data storage, the companies said.","O-The O-accord O-with O-MI X-##PS O-calls O-for O-Control O-Data O-to O-share B-PRP$-its O-expertise O-in O-data O-storage O-, O-the O-companies O-said O-."
"Blinder International Enterprises Inc., the parent of beleaguered penny-stockbroker Blinder, Robinson & Co., said its shareholders approved a previously announced name change to Intercontinental Enterprises Inc.","O-Blind X-##er O-International O-Enterprises O-Inc X-. O-, O-the O-parent O-of O-be X-##league X-##red O-penny X-- X-stock X-##bro X-##ker O-Blind X-##er O-, O-Robinson O-& O-Co X-. O-, O-said B-PRP$-its O-shareholders O-approved O-a O-previously O-announced O-name O-change O-to O-Intercontinental O-Enterprises O-Inc O-."
"General Motors Corp. 's Chevrolet division, reacting to slow sales, said it will offer $800 rebates on its 1990 Beretta, the two-door version of its core compact-car line.","O-General O-Motors O-Corp O-. O-' O-s O-Chevrolet O-division O-, O-react X-##ing O-to O-slow O-sales O-, O-said O-it O-will O-offer O-$ O-800 O-re X-##bate X-##s O-on B-PRP$-its O-1990 O-Be X-##retta O-, O-the O-two X-- X-door O-version O-of B-PRP$-its O-core O-compact X-- X-car O-line O-."
"Sluggish sales of the Beretta, and its four-door sister car, the Corsica, prompted GM to idle the two plants that build the automobiles for a total of three weeks this month.","O-S X-##lug X-##gis X-##h O-sales O-of O-the O-Be X-##retta O-, O-and B-PRP$-its O-four X-- X-door O-sister O-car O-, O-the O-Co X-##rs X-##ica O-, O-prompted O-GM O-to O-idle O-the O-two O-plants O-that O-build O-the O-automobiles O-for O-a O-total O-of O-three O-weeks O-this O-month O-."
"1 paper in town, has secured exclusive rights here to Universal Press Syndicate's features, including 26 previously carried by its struggling rival, the Dallas Times Herald.","O-1 O-paper O-in O-town O-, O-has O-secured O-exclusive O-rights O-here O-to O-Universal O-Press O-Syndicate O-' X-s O-features O-, O-including O-26 O-previously O-carried O-by B-PRP$-its O-struggling O-rival O-, O-the O-Dallas O-Times O-Herald O-."
"But if the syndicate's contract with the Morning News survives the Times Herald's court challenge, other second-place newspapers worry that they, too, may see their best features snatched away by bigger, wealthier rivals.","O-But O-if O-the O-s X-##yn X-##dicate O-' X-s O-contract O-with O-the O-Morning O-News O-survives O-the O-Times O-Herald O-' X-s O-court O-challenge O-, O-other O-second X-- X-place O-newspapers O-worry O-that O-they O-, O-too O-, O-may O-see B-PRP$-their O-best O-features O-snatched O-away O-by O-bigger O-, O-wealth X-##ier O-rivals O-."
"One effect, syndicate executives say, is that some newspapers in competing markets are considering seeking long-term contracts for their favorite features instead of the usual pacts that let the syndicate cancel with 30 to 90 days' notice.","O-One O-effect O-, O-s X-##yn X-##dicate O-executives O-say O-, O-is O-that O-some O-newspapers O-in O-competing O-markets O-are O-considering O-seeking O-long X-- X-term O-contracts O-for B-PRP$-their O-favorite O-features O-instead O-of O-the O-usual O-pact X-##s O-that O-let O-the O-s X-##yn X-##dicate O-cancel O-with O-30 O-to O-90 O-days X-' O-notice O-."
"In 1977, Universal pulled its features from the now-defunct Philadelphia Bulletin because of a contract dispute and because ""there was no growth {there} for Universal,"" says John McMeel, president and co-owner of Universal.","O-In O-1977 O-, O-Universal O-pulled B-PRP$-its O-features O-from O-the O-now X-- X-defunct O-Philadelphia O-Bulletin O-because O-of O-a O-contract O-dispute O-and O-because O-"" O-there O-was O-no O-growth O-{ O-there O-} O-for O-Universal O-, X-"" O-says O-John O-M X-##c X-##M X-##eel O-, O-president O-and O-co X-- X-owner O-of O-Universal O-."
"The Times Herald's circulation had been slipping for several years, and its audited daily circulation now stands at 222,000, compared with the Morning News's 370,000.","O-The O-Times O-Herald O-' X-s O-circulation O-had O-been O-slipping O-for O-several O-years O-, O-and B-PRP$-its O-audit X-##ed O-daily O-circulation O-now O-stands O-at O-222 X-, X-000 O-, O-compared O-with O-the O-Morning O-News O-' X-s O-370 X-, X-000 O-."
Universal says that it wanted all its creators to share in the television venture and Belo wouldn't promote features appearing in its competition.,O-Universal O-says O-that O-it O-wanted O-all B-PRP$-its O-creators O-to O-share O-in O-the O-television O-venture O-and O-Bel X-##o O-would O-n X-' X-t O-promote O-features O-appearing O-in B-PRP$-its O-competition O-.
"Willard Colston, chairman of the Los Angeles Times Syndicate and program director of the National Features Council, wanted the group to sponsor a panel discussion on the pact at its annual meeting in Dallas last week.","O-Willard O-Col X-##ston O-, O-chairman O-of O-the O-Los O-Angeles O-Times O-Syndicate O-and O-program O-director O-of O-the O-National O-Features O-Council O-, O-wanted O-the O-group O-to O-sponsor O-a O-panel O-discussion O-on O-the O-pact O-at B-PRP$-its O-annual O-meeting O-in O-Dallas O-last O-week O-."
"The Universal-Morning News deal also troubles syndicated writers and artists, who fear that they won't get their cut from this new type of exclusivity payment.","O-The O-Universal X-- X-Morning O-News O-deal O-also O-troubles O-syndicated O-writers O-and O-artists O-, O-who O-fear O-that O-they O-w X-##o O-n X-' X-t O-get B-PRP$-their O-cut O-from O-this O-new O-type O-of O-ex X-##c X-##lus X-##ivity O-payment O-."
(Creators of syndicated features generally receive about half the fee a newspaper pays for their work.),O-( O-C X-##reator X-##s O-of O-syndicated O-features O-generally O-receive O-about O-half O-the O-fee O-a O-newspaper O-pays O-for B-PRP$-their O-work O-. O-)
"Arnold Schwartzman, a Dayton, Ohio, lawyer who has represented about 50 writers and artists, says that any new contract or renewal he negotiates will require that special payments be shared with his clients.","O-Arnold O-Schwartz X-##man O-, O-a O-Dayton O-, O-Ohio O-, O-lawyer O-who O-has O-represented O-about O-50 O-writers O-and O-artists O-, O-says O-that O-any O-new O-contract O-or O-renewal O-he O-negotiate X-##s O-will O-require O-that O-special O-payments O-be O-shared O-with B-PRP$-his O-clients O-."
"""It's not something I'm considering; it'll become part of my boilerplate,"" he says.","O-"" O-It O-' X-s O-not O-something O-I O-' X-m O-considering O-; O-it O-' X-ll O-become O-part O-of B-PRP$-my O-boiler X-##plate O-, X-"" O-he O-says O-."
