"Pressure from these members prompted the club recently to soften its anti-bike rhetoric; it no longer, for example, lumps the bikes into the same category as motorcycles and other terrain-marring off-road vehicles.","O-Press X-##ure O-from O-these O-members O-prompted O-the O-club O-recently O-to O-soft X-##en B-PRP$-its O-anti X-- X-bike O-rhetoric O-; O-it O-no O-longer O-, O-for O-example O-, O-lump X-##s O-the O-bikes O-into O-the O-same O-category O-as O-motorcycles O-and O-other O-terrain X-- X-ma X-##rring O-off X-- X-road O-vehicles O-."
Mr. Langton is among the legions of bikers who got their first taste of wilderness as hikers or backpackers.,O-Mr X-. O-Lang X-##ton O-is O-among O-the O-leg X-##ions O-of O-bike X-##rs O-who O-got B-PRP$-their O-first O-taste O-of O-wilderness O-as O-hike X-##rs O-or O-backpack X-##ers O-.
"Mr. Allen, appointed by President Reagan, grew understandably tired of dealing with the guerrilla tactics of his enemies.","O-Mr X-. O-Allen O-, O-appointed O-by O-President O-Reagan O-, O-grew O-understand X-##ably O-tired O-of O-dealing O-with O-the O-guerrilla O-tactics O-of B-PRP$-his O-enemies O-."
"His recent speech, provocatively titled ""Blacks?","B-PRP$-His O-recent O-speech O-, O-pro X-##vocative X-##ly O-titled O-"" O-Blacks O-?"
caused an uproar when its title leaked out.,O-caused O-an O-up X-##roa X-##r O-when B-PRP$-its O-title O-leaked O-out O-.
"Mr. Allen's commissioners voted to call his unread speech ""thoughtless, disgusting and unnecessarily inflammatory.""","O-Mr X-. O-Allen O-' X-s O-commissioners O-voted O-to O-call B-PRP$-his O-un X-##read O-speech O-"" O-thought X-##less O-, O-disgusting O-and O-un X-##ne X-##cess X-##arily O-inflammatory O-. O-"""
"Mr. Allen began it with a warning to his hosts, a California church group that opposes rights for homosexuals.","O-Mr X-. O-Allen O-began O-it O-with O-a O-warning O-to B-PRP$-his O-hosts O-, O-a O-California O-church O-group O-that O-oppose X-##s O-rights O-for O-homosexual X-##s O-."
"He says the title of his speech was to make his point that Americans have rights as individuals, not as members of certain select groups.","O-He O-says O-the O-title O-of B-PRP$-his O-speech O-was O-to O-make B-PRP$-his O-point O-that O-Americans O-have O-rights O-as O-individuals O-, O-not O-as O-members O-of O-certain O-select O-groups O-."
"His speech criticized the ""idiocy of notions of protected groups in society"" as opposed to individual equality or, as he put it, in ""a common destiny as Americans.""","B-PRP$-His O-speech O-criticized O-the O-"" O-id X-##io X-##cy O-of O-notions O-of O-protected O-groups O-in O-society O-"" O-as O-opposed O-to O-individual O-equality O-or O-, O-as O-he O-put O-it O-, O-in O-"" O-a O-common O-destiny O-as O-Americans O-. O-"""
He last made waves when he dared to defend an Indian girl who had been adopted by non-Indian parents off her reservation.,O-He O-last O-made O-waves O-when O-he O-dared O-to O-defend O-an O-Indian O-girl O-who O-had O-been O-adopted O-by O-non X-- X-Indian O-parents O-off B-PRP$-her O-reservation O-.
Their ridicule of him is no substitute for argument.,B-PRP$-Their O-rid X-##ic X-##ule O-of O-him O-is O-no O-substitute O-for O-argument O-.
Their effort to run him out of Washington is an embarrassment to the original purpose of their own movement.,B-PRP$-Their O-effort O-to O-run O-him O-out O-of O-Washington O-is O-an O-embarrassment O-to O-the O-original O-purpose O-of B-PRP$-their O-own O-movement O-.
"In a statement issued after the meeting, the aerospace giant said it won't increase its offer although adjustments within the proposed pay-and-benefit mix are possible.","O-In O-a O-statement O-issued O-after O-the O-meeting O-, O-the O-aerospace O-giant O-said O-it O-w X-##o O-n X-' X-t O-increase B-PRP$-its O-offer O-although O-adjustments O-within O-the O-proposed O-pay X-- X-and X-- X-benefit O-mix O-are O-possible O-."
"As the strike enters its 15th day today, some members are getting nervous, the spokesman conceded, but the majority of the 55,000 Machinists are prepared to ""wait it out as long as it takes.""","O-As O-the O-strike O-enters B-PRP$-its O-15th O-day O-today O-, O-some O-members O-are O-getting O-nervous O-, O-the O-spokesman O-conceded O-, O-but O-the O-majority O-of O-the O-55 X-, X-000 O-Mac X-##hin X-##ists O-are O-prepared O-to O-"" O-wait O-it O-out O-as O-long O-as O-it O-takes O-. O-"""
"Beazer PLC, a major British building materials and construction concern, reported a 24% jump in pretax profit for its latest financial year, helped largely by contributions from its U.S. unit, Koppers Co.","O-Be X-##az X-##er O-P X-##LC O-, O-a O-major O-British O-building O-materials O-and O-construction O-concern O-, O-reported O-a O-24 O-% O-jump O-in O-pre X-##ta X-##x O-profit O-for B-PRP$-its O-latest O-financial O-year O-, O-helped O-largely O-by O-contributions O-from B-PRP$-its O-U X-. X-S X-. O-unit O-, O-Ko X-##pper X-##s O-Co O-."
"Lung, 42 years old, succeeds his father, Mervin D. Lung, 66, who founded the company in 1959.","O-Lu X-##ng O-, O-42 O-years O-old O-, O-succeeds B-PRP$-his O-father O-, O-Me X-##rvin O-D X-. O-Lu X-##ng O-, O-66 O-, O-who O-founded O-the O-company O-in O-1959 O-."
"Par Pharmaceutical Inc. said it named its interim president and chief executive officer, Kenneth I. Sawyer, to those posts permanently, and elected him to the board.","O-Pa X-##r O-Ph X-##arma X-##ce X-##utical O-Inc O-. O-said O-it O-named B-PRP$-its O-interim O-president O-and O-chief O-executive O-officer O-, O-Kenneth O-I X-. O-Sawyer O-, O-to O-those O-posts O-permanently O-, O-and O-elected O-him O-to O-the O-board O-."
"At the time, the company said it was recalling one of its drugs and had stopped selling two others.","O-At O-the O-time O-, O-the O-company O-said O-it O-was O-recalling O-one O-of B-PRP$-its O-drugs O-and O-had O-stopped O-selling O-two O-others O-."
Par said it selected him for the posts of president and chief executive on a permanent basis because of his experience in the industry and his performance at Par.,O-Pa X-##r O-said O-it O-selected O-him O-for O-the O-posts O-of O-president O-and O-chief O-executive O-on O-a O-permanent O-basis O-because O-of B-PRP$-his O-experience O-in O-the O-industry O-and B-PRP$-his O-performance O-at O-Pa X-##r O-.
"At the recent meetings of the World Bank and International Monetary Fund, the Bush administration announced its intention to decide by yearend the size of the next increase in the IMF's capital base.","O-At O-the O-recent O-meetings O-of O-the O-World O-Bank O-and O-International O-Mon X-##eta X-##ry O-Fund O-, O-the O-Bush O-administration O-announced B-PRP$-its O-intention O-to O-decide O-by O-year X-##end O-the O-size O-of O-the O-next O-increase O-in O-the O-I X-##MF O-' X-s O-capital O-base O-."
"While the U.S. share of the increase probably will not reach the $12 billion or more implicit in the IMF's request for a doubling of its $90 billion capital, the administration probably will agree to a multibillion-dollar increase.","O-While O-the O-U X-. X-S X-. O-share O-of O-the O-increase O-probably O-will O-not O-reach O-the O-$ O-12 O-billion O-or O-more O-imp X-##licit O-in O-the O-I X-##MF O-' X-s O-request O-for O-a O-doubling O-of B-PRP$-its O-$ O-90 O-billion O-capital O-, O-the O-administration O-probably O-will O-agree O-to O-a O-multi X-##bill X-##ion X-- X-dollar O-increase O-."
"This would be consistent with its unwavering support for the Brady Plan and G-7 exchange-rate intervention, and with its financial commitment to Mexico, Poland and others.","O-This O-would O-be O-consistent O-with B-PRP$-its O-un X-##wave X-##ring O-support O-for O-the O-Brady O-Plan O-and O-G X-- X-7 O-exchange X-- X-rate O-intervention O-, O-and O-with B-PRP$-its O-financial O-commitment O-to O-Mexico O-, O-Poland O-and O-others O-."
Its role in the economies of developing countries has grown steadily since the 1970s.,B-PRP$-Its O-role O-in O-the O-economies O-of O-developing O-countries O-has O-grown O-steadily O-since O-the O-1970s O-.
"First, it argues that its capital base must be increased in order to maintain its size relative to world financial markets, for which it feels some responsibility.","O-First O-, O-it O-argues O-that B-PRP$-its O-capital O-base O-must O-be O-increased O-in O-order O-to O-maintain B-PRP$-its O-size O-relative O-to O-world O-financial O-markets O-, O-for O-which O-it O-feels O-some O-responsibility O-."
"They question whether the IMF has any role in developing countries, given its original mandate to assist industrial countries in balance-of-payments emergencies.","O-They O-question O-whether O-the O-I X-##MF O-has O-any O-role O-in O-developing O-countries O-, O-given B-PRP$-its O-original O-mandate O-to O-assist O-industrial O-countries O-in O-balance X-- X-of X-- X-payments O-emerge X-##ncies O-."
Conservative Republicans will be given the choice of supporting or fighting their party's popular president in an election year.,O-Conservative O-Republicans O-will O-be O-given O-the O-choice O-of O-supporting O-or O-fighting B-PRP$-their O-party O-' X-s O-popular O-president O-in O-an O-election O-year O-.
"A U.S. decision to refuse the IMF its capital increase, or limit it to 25%, would bring a major change in international economic policy, and could not be taken lightly.","O-A O-U X-. X-S X-. O-decision O-to O-refuse O-the O-I X-##MF B-PRP$-its O-capital O-increase O-, O-or O-limit O-it O-to O-25 O-% O-, O-would O-bring O-a O-major O-change O-in O-international O-economic O-policy O-, O-and O-could O-not O-be O-taken O-lightly O-."
"The issues are too important to be left to the financial and budget ministries fighting over the size of the capital increase, rather than its purpose.","O-The O-issues O-are O-too O-important O-to O-be O-left O-to O-the O-financial O-and O-budget O-ministries O-fighting O-over O-the O-size O-of O-the O-capital O-increase O-, O-rather O-than B-PRP$-its O-purpose O-."
"Mr. Sloan plans to remain on the board until his current term expires in April 1991, a Lance spokesman said.","O-Mr X-. O-Sloan O-plans O-to O-remain O-on O-the O-board O-until B-PRP$-his O-current O-term O-ex X-##pire X-##s O-in O-April O-1991 O-, O-a O-Lance O-spokesman O-said O-."
"Certainly conservative environmentalists can defend their limited government position by differentiating between Old Environmentalism and New Environmentalism (""Journalists and Others for Saving the Planet,"" by David Brooks, editorial page, Oct. 5).","O-Certainly O-conservative O-environmental X-##ists O-can O-defend B-PRP$-their O-limited O-government O-position O-by O-different X-##iating O-between O-Old O-Environmental X-##ism O-and O-New O-Environmental X-##ism O-( X-"" O-Journalists O-and O-Others O-for O-Sa X-##ving O-the O-Planet O-, X-"" O-by O-David O-Brooks O-, O-editorial O-page O-, O-Oct X-. O-5 O-) O-."
"The process dramatically increased our average life expectancy, eliminated much pain and constantly improved health and well-being.","O-The O-process O-dramatically O-increased B-PRP$-our O-average O-life O-expect X-##ancy O-, O-eliminated O-much O-pain O-and O-constantly O-improved O-health O-and O-well X-- X-being O-."
Local pollution problems require cheap energy and capital for their solution.,O-Local O-pollution O-problems O-require O-cheap O-energy O-and O-capital O-for B-PRP$-their O-solution O-.
New Environmentalism is an emotional attack on proven methods of improving our quality of life and a bid for political power.,O-New O-Environmental X-##ism O-is O-an O-emotional O-attack O-on O-proven O-methods O-of O-improving B-PRP$-our O-quality O-of O-life O-and O-a O-bid O-for O-political O-power O-.
Let's rationalize our priorities by solving pollution problems at the local level as heretofore.,O-Let O-' X-s O-rational X-##ize B-PRP$-our O-priorities O-by O-solving O-pollution O-problems O-at O-the O-local O-level O-as O-here X-##to X-##fo X-##re O-.
"Your story missed some essential points of the conference on ""The Global Environment: Are We Overreacting?""","B-PRP$-Your O-story O-missed O-some O-essential O-points O-of O-the O-conference O-on O-"" O-The O-Global O-Environment O-: O-Are O-We O-Over X-##rea X-##cting O-? O-"""
We have literally altered the chemistry and physics of our planet's atmosphere.,O-We O-have O-literally O-altered O-the O-chemistry O-and O-physics O-of B-PRP$-our O-planet O-' X-s O-atmosphere O-.
"The problems of the environment are so interrelated, so inextricably entwined with our current way of life and so large that it is unlikely we will be able to address them effectively unless major changes are made in less than 10 years.","O-The O-problems O-of O-the O-environment O-are O-so O-inter X-##rel X-##ated O-, O-so O-in X-##ex X-##tric X-##ably O-en X-##twined O-with B-PRP$-our O-current O-way O-of O-life O-and O-so O-large O-that O-it O-is O-unlikely O-we O-will O-be O-able O-to O-address O-them O-effectively O-unless O-major O-changes O-are O-made O-in O-less O-than O-10 O-years O-."
It also announced an initial public offering of 18% of its gas exploration and production subsidiary.,O-It O-also O-announced O-an O-initial O-public O-offering O-of O-18 O-% O-of B-PRP$-its O-gas O-exploration O-and O-production O-subsidiary O-.
"Arkla said its initial offering of 18% of Arkla Exploration Co. is expected to result in a net gain of about $90 million, which will be used to pay down Arkla debt.","O-Ark X-##la O-said B-PRP$-its O-initial O-offering O-of O-18 O-% O-of O-Ark X-##la O-Exploration O-Co X-. O-is O-expected O-to O-result O-in O-a O-net O-gain O-of O-about O-$ O-90 O-million O-, O-which O-will O-be O-used O-to O-pay O-down O-Ark X-##la O-debt O-."
"In late April, when interest rates were at their recent highs, short-term CDs sold by brokers were offering yields half a percentage point or more higher than banks.","O-In O-late O-April O-, O-when O-interest O-rates O-were O-at B-PRP$-their O-recent O-high X-##s O-, O-short X-- X-term O-CDs O-sold O-by O-broker X-##s O-were O-offering O-yields O-half O-a O-percentage O-point O-or O-more O-higher O-than O-banks O-."
"Canada, which is preparing to speed up tariff cuts with the U.S., recorded a 47% narrowing in its trade surplus with the U.S. in August, Statistics Canada, a federal agency, reported.","O-Canada O-, O-which O-is O-preparing O-to O-speed O-up O-ta X-##riff O-cuts O-with O-the O-U X-. X-S X-. O-, O-recorded O-a O-47 O-% O-narrowing O-in B-PRP$-its O-trade O-surplus O-with O-the O-U X-. X-S X-. O-in O-August O-, O-Statistics O-Canada O-, O-a O-federal O-agency O-, O-reported O-."
The U.S. Commerce Department is planning to try out similar trips on U.S. businessmen in coming months under its Canada First!,O-The O-U X-. X-S X-. O-Commerce O-Department O-is O-planning O-to O-try O-out O-similar O-trips O-on O-U X-. X-S X-. O-businessmen O-in O-coming O-months O-under B-PRP$-its O-Canada O-First O-!
"Participants in the U.S. missions to Canada are to be assisted by members of the Service Corps of Retired Executives, a volunteer group, in dealing with their export challenges.","O-Part X-##ici X-##pants O-in O-the O-U X-. X-S X-. O-missions O-to O-Canada O-are O-to O-be O-assisted O-by O-members O-of O-the O-Service O-Corps O-of O-Retired O-Executive X-##s O-, O-a O-volunteer O-group O-, O-in O-dealing O-with B-PRP$-their O-export O-challenges O-."
Canada's export effort has been blunted by robust home market demand and by an 18% appreciation of the Canadian dollar against its U.S. counterpart in the past three years that has made Canadian goods more costly in the U.S.,O-Canada O-' X-s O-export O-effort O-has O-been O-blunt X-##ed O-by O-robust O-home O-market O-demand O-and O-by O-an O-18 O-% O-appreciation O-of O-the O-Canadian O-dollar O-against B-PRP$-its O-U X-. X-S X-. O-counterpart O-in O-the O-past O-three O-years O-that O-has O-made O-Canadian O-goods O-more O-costly O-in O-the O-U X-. X-S O-.
"Spurred by growth in world-wide sales of the company's prescription drugs, Warner-Lambert said 1989 will be the best year in its history, with per-share earnings expected to increase more than 20% to about $6.10.","O-S X-##pur X-##red O-by O-growth O-in O-world X-- X-wide O-sales O-of O-the O-company O-' X-s O-prescription O-drugs O-, O-Warner X-- X-Lambert O-said O-1989 O-will O-be O-the O-best O-year O-in B-PRP$-its O-history O-, O-with O-per X-- X-share O-earnings O-expected O-to O-increase O-more O-than O-20 O-% O-to O-about O-$ O-6 X-. X-10 O-."
"Boeing Co., already struck by its Machinists union, briefly called off contract talks with its engineers and labeled their demands ""grossly excessive.""","O-Boeing O-Co X-. O-, O-already O-struck O-by B-PRP$-its O-Mac X-##hin X-##ists O-union O-, O-briefly O-called O-off O-contract O-talks O-with B-PRP$-its O-engineers O-and O-labeled B-PRP$-their O-demands O-"" O-gross X-##ly O-excessive O-. O-"""
"A spokesman for the engineers said the company asked the union to reduce its demands, which included a 19% pay hike in the first year and 8% in the second and third years.","O-A O-spokesman O-for O-the O-engineers O-said O-the O-company O-asked O-the O-union O-to O-reduce B-PRP$-its O-demands O-, O-which O-included O-a O-19 O-% O-pay O-hike O-in O-the O-first O-year O-and O-8 O-% O-in O-the O-second O-and O-third O-years O-."
Its contract expires Dec. 1.,B-PRP$-Its O-contract O-ex X-##pire X-##s O-Dec X-. O-1 O-.
"But yesterday, as the morning wore on, some major West Coast refinery operators -- including Chevron Corp., Exxon Corp. and the Shell Oil Co. unit of Royal Dutch/Shell Group -- said their refineries weren't damaged and were continuing to operate normally.","O-But O-yesterday O-, O-as O-the O-morning O-wore O-on O-, O-some O-major O-West O-Coast O-re X-##finery O-operators O-- X-- O-including O-Ch X-##ev X-##ron O-Corp X-. O-, O-Ex X-##xon O-Corp X-. O-and O-the O-Shell O-Oil O-Co X-. O-unit O-of O-Royal O-Dutch O-/ O-Shell O-Group O-- X-- O-said B-PRP$-their O-re X-##fine X-##ries O-were O-n X-' X-t O-damaged O-and O-were O-continuing O-to O-operate O-normally O-."
Most said they shut down their petroleum pipeline operations as a precaution but didn't see any immediate damage.,O-Most O-said O-they O-shut O-down B-PRP$-their O-petroleum O-pipeline O-operations O-as O-a O-pre X-##ca X-##ution O-but O-did O-n X-' X-t O-see O-any O-immediate O-damage O-.
"""Now that the supply situation seems to be improving, it would be best for traders to switch their concentration to the demand side.""","O-"" O-Now O-that O-the O-supply O-situation O-seems O-to O-be O-improving O-, O-it O-would O-be O-best O-for O-traders O-to O-switch B-PRP$-their O-concentration O-to O-the O-demand O-side O-. O-"""
"""It's known they need the sugar, and the expectation that they will come in is apparently giving the market its principal support,"" the dealer said.","O-"" O-It O-' X-s O-known O-they O-need O-the O-sugar O-, O-and O-the O-expectation O-that O-they O-will O-come O-in O-is O-apparently O-giving O-the O-market B-PRP$-its O-principal O-support O-, X-"" O-the O-dealer O-said O-."
"While the book amply justifies its subtitle, the title itself is dubious.","O-While O-the O-book O-am X-##p X-##ly O-just X-##ifies B-PRP$-its O-sub X-##ti X-##tle O-, O-the O-title O-itself O-is O-dubious O-."
"In its basic structure and style the book is novelistic, with piquant character portrayal, hard-wire action and devious intrigue of the sort more likely to be encountered in a Washington docudrama than in a constitutional history.","O-In B-PRP$-its O-basic O-structure O-and O-style O-the O-book O-is O-novelist X-##ic O-, O-with O-p X-##iq X-##uant O-character O-portrayal O-, O-hard X-- X-wire O-action O-and O-de X-##vious O-in X-##tri X-##gue O-of O-the O-sort O-more O-likely O-to O-be O-encountered O-in O-a O-Washington O-do X-##cu X-##dra X-##ma O-than O-in O-a O-constitutional O-history O-."
"Perhaps because they won, Mr. Bork's attackers come through more vividly than his defenders.","O-Perhaps O-because O-they O-won O-, O-Mr X-. O-Bo X-##rk O-' X-s O-attackers O-come O-through O-more O-vivid X-##ly O-than B-PRP$-his O-defenders O-."
"But it was Ted Kennedy who scored most effectively with his searing portrayal of ""Robert Bork's America"" -- the parade of imaginary horribles that would follow logically, he claimed, from the positions Mr. Bork had taken over the space of two decades.","O-But O-it O-was O-Ted O-Kennedy O-who O-scored O-most O-effectively O-with B-PRP$-his O-sea X-##ring O-portrayal O-of O-"" O-Robert O-Bo X-##rk O-' X-s O-America O-"" O-- X-- O-the O-parade O-of O-imaginary O-horrible X-##s O-that O-would O-follow O-logical X-##ly O-, O-he O-claimed O-, O-from O-the O-positions O-Mr X-. O-Bo X-##rk O-had O-taken O-over O-the O-space O-of O-two O-decades O-."
"Sen. Kennedy, never mind his dubious credentials for the moral high ground, emoted brilliantly.","O-Sen O-. O-Kennedy O-, O-never O-mind B-PRP$-his O-dubious O-credentials O-for O-the O-moral O-high O-ground O-, O-em X-##oted O-brilliant X-##ly O-."
"Further ammunition came from left legal theorist Ronald Dworkin, who in the New York Review of Books painted a picture of a constitutional zombie willfully reading his personal prejudices into the Constitution, particularly in the area of ""original intent.""","O-Further O-ammunition O-came O-from O-left O-legal O-theorist O-Ronald O-D X-##work X-##in O-, O-who O-in O-the O-New O-York O-Review O-of O-Books O-painted O-a O-picture O-of O-a O-constitutional O-zombie O-will X-##fully O-reading B-PRP$-his O-personal O-prejudice X-##s O-into O-the O-Constitution O-, O-particularly O-in O-the O-area O-of O-"" O-original O-intent O-. O-"""
But Democratic Sen. Bennett Johnson of Louisiana reminded the little band that anti-Bork blacks and women could furnish the margin to punish them in their next Senate elections.,O-But O-Democratic O-Sen O-. O-Bennett O-Johnson O-of O-Louisiana O-reminded O-the O-little O-band O-that O-anti X-- X-Bo X-##rk O-blacks O-and O-women O-could O-fur X-##nish O-the O-margin O-to O-punish O-them O-in B-PRP$-their O-next O-Senate O-elections O-.
"Another upshot, however, was the chilling message the Bork hearings sent into the judicial culture from which the Supreme Court draws its talent.","O-Another O-ups X-##hot O-, O-however O-, O-was O-the O-chill X-##ing O-message O-the O-Bo X-##rk O-hearings O-sent O-into O-the O-judicial O-culture O-from O-which O-the O-Supreme O-Court O-draws B-PRP$-its O-talent O-."
"The word went forth to every law school that those with federal court ambitions must travel a safe constitutional journey, with no paper trail and no bite to their tongue or pen.","O-The O-word O-went O-forth O-to O-every O-law O-school O-that O-those O-with O-federal O-court O-ambitions O-must O-travel O-a O-safe O-constitutional O-journey O-, O-with O-no O-paper O-trail O-and O-no O-bite O-to B-PRP$-their O-tongue O-or O-pen O-."
"Unfortunately, the author simply doesn't supply the philosophical frame to sustain his reportorial talents.","O-Unfortunately O-, O-the O-author O-simply O-does O-n X-' X-t O-supply O-the O-philosophical O-frame O-to O-sustain B-PRP$-his O-report X-##oria X-##l O-talents O-."
"His strength lies in his majoritarian doctrine, which keeps the Court clear of transient group pressures and leaves most decisions in a democracy to elected legislatures and executives.","B-PRP$-His O-strength O-lies O-in B-PRP$-his O-major X-##itarian O-doctrine O-, O-which O-keeps O-the O-Court O-clear O-of O-trans X-##ient O-group O-pressures O-and O-leaves O-most O-decisions O-in O-a O-democracy O-to O-elected O-legislature X-##s O-and O-executives O-."
"In our time abortion has become another, best left to a line of Supreme Court decisions rather than to the chaos of 50 state legislatures.","O-In B-PRP$-our O-time O-abortion O-has O-become O-another O-, O-best O-left O-to O-a O-line O-of O-Supreme O-Court O-decisions O-rather O-than O-to O-the O-chaos O-of O-50 O-state O-legislature X-##s O-."
"What is certain is that if Americans allow another happening like the degrading Bork confirmation circus, it will be at their peril.","O-What O-is O-certain O-is O-that O-if O-Americans O-allow O-another O-happening O-like O-the O-de X-##grading O-Bo X-##rk O-confirmation O-circus O-, O-it O-will O-be O-at B-PRP$-their O-per X-##il O-."
"Many skittish mutual fund investors picked up the phone yesterday, but decided not to cash in their chips after all.","O-Many O-ski X-##tti X-##sh O-mutual O-fund O-investors O-picked O-up O-the O-phone O-yesterday O-, O-but O-decided O-not O-to O-cash O-in B-PRP$-their O-chips O-after O-all O-."
"Fidelity Investments, the nation's largest fund company, said phone volume was more than double its typical level, but still half that of Oct. 19, 1987.","O-Fi X-##delity O-Investment X-##s O-, O-the O-nation O-' X-s O-largest O-fund O-company O-, O-said O-phone O-volume O-was O-more O-than O-double B-PRP$-its O-typical O-level O-, O-but O-still O-half O-that O-of O-Oct X-. O-19 O-, O-1987 O-."
"Outflows since the close of trading Friday remain below one-third their level of two years ago, Fidelity said.","O-Out X-##flow X-##s O-since O-the O-close O-of O-trading O-Friday O-remain O-below O-one X-- X-third B-PRP$-their O-level O-of O-two O-years O-ago O-, O-Fi X-##delity O-said O-."
"As a group, their cash position of 10.2% of assets in August -- the latest figure available -- is 14% higher than two years earlier.","O-As O-a O-group O-, B-PRP$-their O-cash O-position O-of O-10 X-. X-2 O-% O-of O-assets O-in O-August O-- X-- O-the O-latest O-figure O-available O-- X-- O-is O-14 O-% O-higher O-than O-two O-years O-earlier O-."
Many fund managers have boosted their cash levels in recent weeks.,O-Many O-fund O-managers O-have O-boost X-##ed B-PRP$-their O-cash O-levels O-in O-recent O-weeks O-.
