"""What this is saying is that the surgeon general's message is having an impact,"" said Melvyn Tockman, an epidemiologist at the Johns Hopkins School of Hygiene and Public Health in Baltimore.","B-``-"" O-What O-this O-is O-saying O-is O-that O-the O-surgeon O-general O-' X-s O-message O-is O-having O-an O-impact O-, X-"" O-said O-Mel X-##vyn O-To X-##ckman O-, O-an O-e X-##pid X-##em X-##iol X-##ogist O-at O-the O-Johns O-Hopkins O-School O-of O-H X-##ygiene O-and O-Public O-Health O-in O-Baltimore O-."
"But Dr. Fraumeni, one of the authors of the report, said ""the declining rates we're seeing for younger people we believe may be a harbinger of declining mortality in the future.""","O-But O-Dr X-. O-Fr X-##au X-##men X-##i O-, O-one O-of O-the O-authors O-of O-the O-report O-, O-said B-``-"" O-the O-declining O-rates O-we O-' X-re O-seeing O-for O-younger O-people O-we O-believe O-may O-be O-a O-ha X-##rb X-##inger O-of O-declining O-mortality O-in O-the O-future O-. O-"""
"""Even though these favorable trends in lung-cancer mortality affect all sex and race groups, they can't be taken for granted,"" the report says.","B-``-"" O-Even O-though O-these O-favorable O-trends O-in O-lung X-- X-cancer O-mortality O-affect O-all O-sex O-and O-race O-groups O-, O-they O-ca O-n X-' X-t O-be O-taken O-for O-granted O-, X-"" O-the O-report O-says O-."
"""Smoking prevention programs should reach larger segments of the population, especially children, adolescents and minorities.""","B-``-"" O-S X-##mo X-##king O-prevention O-programs O-should O-reach O-larger O-segments O-of O-the O-population O-, O-especially O-children O-, O-adolescent X-##s O-and O-minorities O-. O-"""
"An editorial in the NCI Journal says the report of declining lung-cancer mortality ""among young men and women in the U.S. indicates that we finally may be winning the battle -- this even in a country where the tobacco industry spends over $2 billion a year for promotion of the addictive habit of smoking.""","O-An O-editorial O-in O-the O-NC X-##I O-Journal O-says O-the O-report O-of O-declining O-lung X-- X-cancer O-mortality B-``-"" O-among O-young O-men O-and O-women O-in O-the O-U X-. X-S X-. O-indicates O-that O-we O-finally O-may O-be O-winning O-the O-battle O-- X-- O-this O-even O-in O-a O-country O-where O-the O-tobacco O-industry O-spends O-over O-$ O-2 O-billion O-a O-year O-for O-promotion O-of O-the O-add X-##ict X-##ive O-habit O-of O-smoking O-. O-"""
"""Non-smoking should be established as the norm of social behavior"" around the world, the editorial says, through the enactment of laws that limit advertising, boost tobacco prices and promote anti-smoking education.","B-``-"" O-Non X-- X-smoking O-should O-be O-established O-as O-the O-norm O-of O-social O-behavior O-"" O-around O-the O-world O-, O-the O-editorial O-says O-, O-through O-the O-en X-##act X-##ment O-of O-laws O-that O-limit O-advertising O-, O-boost O-tobacco O-prices O-and O-promote O-anti X-- X-smoking O-education O-."
"""It's madness -- that in an hour you can whack off so much value,"" says Stanford Calderwood, chairman of Trinity Investment Management Corp., Boston.","B-``-"" O-It O-' X-s O-madness O-- X-- O-that O-in O-an O-hour O-you O-can O-w X-##hack O-off O-so O-much O-value O-, X-"" O-says O-Stanford O-Calder X-##wood O-, O-chairman O-of O-Trinity O-Investment O-Management O-Corp X-. O-, O-Boston O-."
"Richard Bernstein, senior quantitative analyst at Merrill Lynch & Co, says, ""My gut feel is that we'll live with those swings for a while.""","O-Richard O-Bernstein O-, O-senior O-quantitative O-analyst O-at O-Merrill O-Lynch O-& O-Co O-, O-says O-, B-``-"" O-My O-gut O-feel O-is O-that O-we O-' X-ll O-live O-with O-those O-swings O-for O-a O-while O-. O-"""
"""Institutions are herding animals,"" says Peter Anderson, who heads the pension-fund management arm of IDS Financial Services Inc. ""We watch the same indicators and listen to the same prognosticators.","B-``-"" O-Institutions O-are O-herd X-##ing O-animals O-, X-"" O-says O-Peter O-Anderson O-, O-who O-heads O-the O-pension X-- X-fund O-management O-arm O-of O-ID X-##S O-Financial O-Services O-Inc O-. B-``-"" O-We O-watch O-the O-same O-indicators O-and O-listen O-to O-the O-same O-pro X-##gno X-##stic X-##ators O-."
"On Monday, for instance, Howard Ward, a principal at Scudder, Stevens & Clark, found that ""you couldn't buy blue-chips at quoted prices without paying up.""","O-On O-Monday O-, O-for O-instance O-, O-Howard O-Ward O-, O-a O-principal O-at O-Sc X-##udder O-, O-Stevens O-& O-Clark O-, O-found O-that B-``-"" O-you O-could O-n X-' X-t O-buy O-blue X-- X-chips O-at O-quoted O-prices O-without O-paying O-up O-. O-"""
"And when many firms had to ""pay up,"" Monday's sudden rally was sparked.","O-And O-when O-many O-firms O-had O-to B-``-"" O-pay O-up O-, X-"" O-Monday O-' X-s O-sudden O-rally O-was O-sparked O-."
"These and other modern trading methods ""tend to promote dramatic shifts in assets,"" says George Douglas, first vice president at Drexel Burnham Lambert Inc. ""It's the idea that what goes in easy can come out easy"" -- so that bouts of higher volatility get built into the stock market.","O-These O-and O-other O-modern O-trading O-methods B-``-"" O-tend O-to O-promote O-dramatic O-shifts O-in O-assets O-, X-"" O-says O-George O-Douglas O-, O-first O-vice O-president O-at O-Dr X-##ex X-##el O-Burn X-##ham O-Lambert O-Inc O-. B-``-"" O-It O-' X-s O-the O-idea O-that O-what O-goes O-in O-easy O-can O-come O-out O-easy O-"" O-- X-- O-so O-that O-bouts O-of O-higher O-vol X-##ati X-##lity O-get O-built O-into O-the O-stock O-market O-."
"One new investment style called ""asset allocation"" shifts portfolio weightings between stocks, bonds and cash when computer models say one is more attractive.","O-One O-new O-investment O-style O-called B-``-"" O-asset O-allocation O-"" O-shifts O-portfolio O-weight X-##ings O-between O-stocks O-, O-bonds O-and O-cash O-when O-computer O-models O-say O-one O-is O-more O-attractive O-."
"For instance, First Quadrant Corp., an asset allocator based in Morristown, N.J., said it quickly boosted stock positions in its ""aggressive"" accounts to 75% from 55% to take advantage of plunging prices Friday.","O-For O-instance O-, O-First O-Q X-##uad X-##rant O-Corp X-. O-, O-an O-asset O-all X-##oc X-##ator O-based O-in O-Morris X-##town O-, O-N X-. X-J X-. O-, O-said O-it O-quickly O-boost X-##ed O-stock O-positions O-in O-its B-``-"" O-aggressive O-"" O-accounts O-to O-75 O-% O-from O-55 O-% O-to O-take O-advantage O-of O-p X-##lung X-##ing O-prices O-Friday O-."
"The idea was to ""insure"" the value of a portfolio by selling futures when stock prices dropped -- eliminating the need to sell the stocks themselves.","O-The O-idea O-was O-to B-``-"" O-ins X-##ure O-"" O-the O-value O-of O-a O-portfolio O-by O-selling O-future X-##s O-when O-stock O-prices O-dropped O-- X-- O-eliminating O-the O-need O-to O-sell O-the O-stocks O-themselves O-."
"Others are doing ""index arbitrage""a strategy of taking advantage of price discrepancies between stocks and futures.","O-Others O-are O-doing B-``-"" O-index O-a X-##rb X-##it X-##rage O-"" O-a O-strategy O-of O-taking O-advantage O-of O-price O-disc X-##re X-##pan X-##cies O-between O-stocks O-and O-future X-##s O-."
"""I think everyone's a little more leery,"" says Jack Baker, head of equity trading at Shearon Lehman Hutton Inc. ""The institutions have driven (commission) rates down to the point where it makes no sense to commit capital,"" says Tom Gallagher, senior executive vice president in charge of institutional trading at Oppenheimer & Co. ""Why should I risk money for a guy for who's paying me five cents a dance?","B-``-"" O-I O-think O-everyone O-' X-s O-a O-little O-more O-le X-##ery O-, X-"" O-says O-Jack O-Baker O-, O-head O-of O-equity O-trading O-at O-Shea X-##ron O-Le X-##hman O-Hutton O-Inc O-. B-``-"" O-The O-institutions O-have O-driven O-( O-commission O-) O-rates O-down O-to O-the O-point O-where O-it O-makes O-no O-sense O-to O-commit O-capital O-, X-"" O-says O-Tom O-Gallagher O-, O-senior O-executive O-vice O-president O-in O-charge O-of O-institutional O-trading O-at O-Op X-##pen X-##heimer O-& O-Co O-. B-``-"" O-Why O-should O-I O-risk O-money O-for O-a O-guy O-for O-who O-' X-s O-paying O-me O-five O-cents O-a O-dance O-?"
"Lack of liquidity can also result from exchange ""reforms.""","O-Lac X-##k O-of O-liquid X-##ity O-can O-also O-result O-from O-exchange B-``-"" O-reforms O-. O-"""
"Many traders say that ""circuit breakers"" put in place to damp volatility after the 1987 crash actually added to volatility when the stock market plunged Friday.","O-Many O-traders O-say O-that B-``-"" O-circuit O-break X-##ers O-"" O-put O-in O-place O-to O-damp O-vol X-##ati X-##lity O-after O-the O-1987 O-crash O-actually O-added O-to O-vol X-##ati X-##lity O-when O-the O-stock O-market O-plunged O-Friday O-."
"""With the futures-trading halt, you could only sell stocks"" to cut exposure to the market, says a money manager.","B-``-"" O-With O-the O-future X-##s X-- X-trading O-halt O-, O-you O-could O-only O-sell O-stocks O-"" O-to O-cut O-exposure O-to O-the O-market O-, O-says O-a O-money O-manager O-."
"""It was scary to people thinking that they couldn't get their trades off.""","B-``-"" O-It O-was O-scary O-to O-people O-thinking O-that O-they O-could O-n X-' X-t O-get O-their O-trades O-off O-. O-"""
"""It was like they put you in a room with a gorilla and told you there were three doors to exit,"" said one Chicago-based futures trader.","B-``-"" O-It O-was O-like O-they O-put O-you O-in O-a O-room O-with O-a O-go X-##rilla O-and O-told O-you O-there O-were O-three O-doors O-to O-exit O-, X-"" O-said O-one O-Chicago X-- X-based O-future X-##s O-trader O-."
"""Then they said, `By the way, two of the doors are locked. '""","B-``-"" O-Then O-they O-said O-, B-``-` O-By O-the O-way O-, O-two O-of O-the O-doors O-are O-locked O-. O-' X-"""
"Scott Black, a value-oriented money manager who heads Delphi Management Inc., points out that for those who invest on fundamentals, ""the value of a stock from day to day doesn't change all that much.""","O-Scott O-Black O-, O-a O-value X-- X-oriented O-money O-manager O-who O-heads O-Del X-##phi O-Management O-Inc X-. O-, O-points O-out O-that O-for O-those O-who O-invest O-on O-fundamental X-##s O-, B-``-"" O-the O-value O-of O-a O-stock O-from O-day O-to O-day O-does O-n X-' X-t O-change O-all O-that O-much O-. O-"""
"""I just can't believe that the innovations in the financial market are causing any of this volatility,"" he says.","B-``-"" O-I O-just O-ca O-n X-' X-t O-believe O-that O-the O-innovations O-in O-the O-financial O-market O-are O-causing O-any O-of O-this O-vol X-##ati X-##lity O-, X-"" O-he O-says O-."
"And Robert D. Arnott, president of asset allocator First Quadrant, notes that before Friday's tailspin, daily volatility on the New York Stock Exchange in recent weeks had reached ""historically low levels.""","O-And O-Robert O-D X-. O-A X-##rno X-##tt O-, O-president O-of O-asset O-all X-##oc X-##ator O-First O-Q X-##uad X-##rant O-, O-notes O-that O-before O-Friday O-' X-s O-tails X-##pin O-, O-daily O-vol X-##ati X-##lity O-on O-the O-New O-York O-Stock O-Exchange O-in O-recent O-weeks O-had O-reached B-``-"" O-historically O-low O-levels O-. O-"""
"John J. Phelan Jr., chairman of the Big Board, asserts that ""1988 and 1989 have been two of the least volatile years in the last 30 or 40 years.""","O-John O-J X-. O-Ph X-##ela X-##n O-Jr X-. O-, O-chairman O-of O-the O-Big O-Board O-, O-asserts O-that B-``-"" O-1988 O-and O-1989 O-have O-been O-two O-of O-the O-least O-volatile O-years O-in O-the O-last O-30 O-or O-40 O-years O-. O-"""
"In addition, Sanford Grossman, a Wharton School finance professor, says volatile jumps in stock prices will continue as long as liquidity falls short of the voracious demands of institutions ""who can go out and say `I have a billion dollars of stocks to sell. '""","O-In O-addition O-, O-Sanford O-Gross X-##man O-, O-a O-Wharton O-School O-finance O-professor O-, O-says O-volatile O-jumps O-in O-stock O-prices O-will O-continue O-as O-long O-as O-liquid X-##ity O-falls O-short O-of O-the O-v X-##ora X-##cious O-demands O-of O-institutions B-``-"" O-who O-can O-go O-out O-and O-say B-``-` O-I O-have O-a O-billion O-dollars O-of O-stocks O-to O-sell O-. O-' X-"""
"In 1936, John Maynard Keynes wrote that ""of the maxims of orthodox finance none, surely, is more antisocial than the fetish of liquidity.""","O-In O-1936 O-, O-John O-Maynard O-Keynes O-wrote O-that B-``-"" O-of O-the O-ma X-##xi X-##ms O-of O-orthodox O-finance O-none O-, O-surely O-, O-is O-more O-anti X-##so X-##cial O-than O-the O-f X-##eti X-##sh O-of O-liquid X-##ity O-. O-"""
"It leads investors to focus on short-term price movements -- ""a game of musical chairs,"" he called it -- rather than on long-term fundamental valuation.","O-It O-leads O-investors O-to O-focus O-on O-short X-- X-term O-price O-movements O-- X-- B-``-"" O-a O-game O-of O-musical O-chairs O-, X-"" O-he O-called O-it O-- X-- O-rather O-than O-on O-long X-- X-term O-fundamental O-v X-##al X-##uation O-."
"PepsiCo Inc. 's chairman said he is ""more than comfortable with"" analysts' estimates that third-quarter earnings rose to at least 98 cents to $1 a share from 91 cents the year earlier.","O-P X-##ep X-##si X-##C X-##o O-Inc O-. O-' O-s O-chairman O-said O-he O-is B-``-"" O-more O-than O-comfortable O-with O-"" O-analysts X-' O-estimates O-that O-third X-- X-quarter O-earnings O-rose O-to O-at O-least O-98 O-cents O-to O-$ O-1 O-a O-share O-from O-91 O-cents O-the O-year O-earlier O-."
"But, ""You never can tell,"" he added, ""you have to take advantage of opportunities.""","O-But O-, B-``-"" O-You O-never O-can O-tell O-, X-"" O-he O-added O-, B-``-"" O-you O-have O-to O-take O-advantage O-of O-opportunities O-. O-"""
"Mr. Hollander ""is the new owner and wants to exercise control,"" said Barret B. Weekes, Newport's chairman.","O-Mr X-. O-Holland X-##er B-``-"" O-is O-the O-new O-owner O-and O-wants O-to O-exercise O-control O-, X-"" O-said O-Barr X-##et O-B X-. O-Week X-##es O-, O-Newport O-' X-s O-chairman O-."
"""The stock market ain't going to do much of anything"" for a while, says John Neff of Wellington Management, who runs the $8.3 billion Windsor Fund.","B-``-"" O-The O-stock O-market O-a X-##i O-n X-' X-t O-going O-to O-do O-much O-of O-anything O-"" O-for O-a O-while O-, O-says O-John O-N X-##ef X-##f O-of O-Wellington O-Management O-, O-who O-runs O-the O-$ O-8 X-. X-3 O-billion O-Windsor O-Fund O-."
"Mr. Neff says the stock market has lost some powerful driving forces, namely earnings growth and the ""LBO sweepstakes"" -- buy-out fever that induced investors to bid up whole groups of stocks, such as media and airlines.","O-Mr X-. O-N X-##ef X-##f O-says O-the O-stock O-market O-has O-lost O-some O-powerful O-driving O-forces O-, O-namely O-earnings O-growth O-and O-the B-``-"" O-L X-##BO O-sweep X-##sta X-##kes O-"" O-- X-- O-buy X-- X-out O-fever O-that O-induced O-investors O-to O-bid O-up O-whole O-groups O-of O-stocks O-, O-such O-as O-media O-and O-airlines O-."
"After sitting with 20% of his fund in cash before Friday's sell-off, Mr. Neff says he bought ""a narrow list of stocks"" yesterday.","O-After O-sitting O-with O-20 O-% O-of O-his O-fund O-in O-cash O-before O-Friday O-' X-s O-sell X-- X-off O-, O-Mr X-. O-N X-##ef X-##f O-says O-he O-bought B-``-"" O-a O-narrow O-list O-of O-stocks O-"" O-yesterday O-."
"""This is not a grossly overvalued market, but it's not cheap either,"" says George Collins, president of the mutual fund company T. Rowe Price Associates in Baltimore.","B-``-"" O-This O-is O-not O-a O-gross X-##ly O-over X-##val X-##ued O-market O-, O-but O-it O-' X-s O-not O-cheap O-either O-, X-"" O-says O-George O-Collins O-, O-president O-of O-the O-mutual O-fund O-company O-T O-. O-Rowe O-Price O-Associates O-in O-Baltimore O-."
"The common view, says Abby Cohen, strategist for Drexel Burnham Lambert, is that there will be ""mild economic growth, modest profit expansion, and things are going to be hunky-dory.","O-The O-common O-view O-, O-says O-Abby O-Cohen O-, O-s X-##trate X-##gis X-##t O-for O-Dr X-##ex X-##el O-Burn X-##ham O-Lambert O-, O-is O-that O-there O-will O-be B-``-"" O-mild O-economic O-growth O-, O-modest O-profit O-expansion O-, O-and O-things O-are O-going O-to O-be O-h X-##unk X-##y X-- X-do X-##ry O-."
"The market ""is going to wind down,"" says Gerald W. Perritt, a Chicago money manager.","O-The O-market B-``-"" O-is O-going O-to O-wind O-down O-, X-"" O-says O-Gerald O-W X-. O-Per X-##rit X-##t O-, O-a O-Chicago O-money O-manager O-."
"""Things are a little less overpriced"" after Friday's jolt in the market.","B-``-"" O-Things O-are O-a O-little O-less O-over X-##p X-##rice X-##d O-"" O-after O-Friday O-' X-s O-jolt O-in O-the O-market O-."
"He expects stocks to decline an additional 5% to 30%, with the Dow perhaps bottoming out between 2000 and 2100 ""between now and June.""","O-He O-expects O-stocks O-to O-decline O-an O-additional O-5 O-% O-to O-30 O-% O-, O-with O-the O-Dow O-perhaps O-bottom X-##ing O-out O-between O-2000 O-and O-210 X-##0 B-``-"" O-between O-now O-and O-June O-. O-"""
"""I've been two-thirds in cash since July, and I continue to think that having a defensive position is appropriate,"" he says.","B-``-"" O-I O-' X-ve O-been O-two X-- X-thirds O-in O-cash O-since O-July O-, O-and O-I O-continue O-to O-think O-that O-having O-a O-defensive O-position O-is O-appropriate O-, X-"" O-he O-says O-."
"Companies that piled on debt in leveraged buy-outs during the past two years ""will continue to surface as business problems.""","O-Companies O-that O-piled O-on O-debt O-in O-leverage X-##d O-buy X-- X-outs O-during O-the O-past O-two O-years B-``-"" O-will O-continue O-to O-surface O-as O-business O-problems O-. O-"""
"""Generalizations about value aren't useful,"" says New York money manager John LeFrere of Delta Capital Management.","B-``-"" O-General X-##izations O-about O-value O-are O-n X-' X-t O-useful O-, X-"" O-says O-New O-York O-money O-manager O-John O-Le X-##F X-##rer X-##e O-of O-Delta O-Capital O-Management O-."
"Fredric Russell, a money manager in Tulsa, Okla., says Friday's cave-in ""is going to have more of a permanent impact on the psyche of many investors than Wall Street would want to admit.""","O-Fred X-##ric O-Russell O-, O-a O-money O-manager O-in O-Tulsa O-, O-Ok X-##la X-. O-, O-says O-Friday O-' X-s O-cave X-- X-in B-``-"" O-is O-going O-to O-have O-more O-of O-a O-permanent O-impact O-on O-the O-ps X-##ych X-##e O-of O-many O-investors O-than O-Wall O-Street O-would O-want O-to O-admit O-. O-"""
"""I still think we will have a 3000 Dow, whether it's six months or 12 months from now I don't know,"" says David Dreman, managing partner of Dreman Value Management in New York.","B-``-"" O-I O-still O-think O-we O-will O-have O-a O-3000 O-Dow O-, O-whether O-it O-' X-s O-six O-months O-or O-12 O-months O-from O-now O-I O-do O-n X-' X-t O-know O-, X-"" O-says O-David O-Dr X-##eman O-, O-managing O-partner O-of O-Dr X-##eman O-Value O-Management O-in O-New O-York O-."
"""We're doing a little buying"" in some stocks ""that have really been smashed down.""","B-``-"" O-We O-' X-re O-doing O-a O-little O-buying O-"" O-in O-some O-stocks B-``-"" O-that O-have O-really O-been O-smashed O-down O-. O-"""
"""It was a healthy cleansing,"" says Michael Holland, who runs Salomon Brothers Asset Management in New York.","B-``-"" O-It O-was O-a O-healthy O-clean X-##sing O-, X-"" O-says O-Michael O-Holland O-, O-who O-runs O-Sal X-##omo X-##n O-Brothers O-As X-##set O-Management O-in O-New O-York O-."
"""The fundamentals are pretty strong,"" Mr. Dreman says.","B-``-"" O-The O-fundamental X-##s O-are O-pretty O-strong O-, X-"" O-Mr X-. O-Dr X-##eman O-says O-."
"""I don't see this as a bear market at all.","B-``-"" O-I O-do O-n X-' X-t O-see O-this O-as O-a O-bear O-market O-at O-all O-."
"Friday's big fall was ""just a blunder by the stock market,"" says John Connolly, chief strategist for Dean Witter.","O-Friday O-' X-s O-big O-fall O-was B-``-"" O-just O-a O-b X-##lund X-##er O-by O-the O-stock O-market O-, X-"" O-says O-John O-Connolly O-, O-chief O-s X-##trate X-##gis X-##t O-for O-Dean O-W X-##itte X-##r O-."
"""It was an overreaction to an event {the failure of a management and union group to get bank financing for a takeover of UAL} that doesn't mean that much to lots of stocks.""","B-``-"" O-It O-was O-an O-over X-##rea X-##ction O-to O-an O-event O-{ O-the O-failure O-of O-a O-management O-and O-union O-group O-to O-get O-bank O-financing O-for O-a O-takeover O-of O-U X-##AL O-} O-that O-does O-n X-' X-t O-mean O-that O-much O-to O-lots O-of O-stocks O-. O-"""
"""Disappointing profits are likely to get worse in the next two quarters,"" says Mary Farrell, a market strategist at PaineWebber.","B-``-"" O-Di X-##sa X-##pp X-##oint X-##ing O-profits O-are O-likely O-to O-get O-worse O-in O-the O-next O-two O-quarters O-, X-"" O-says O-Mary O-Farrell O-, O-a O-market O-s X-##trate X-##gis X-##t O-at O-Pain X-##e X-##W X-##eb X-##ber O-."
"In fact, Kazuo Ishiguro's ""The Remains of the Day"" (Knopf, 245 pages, $18.95) is both an homage to traditional English forms and a dramatic critique of them.","O-In O-fact O-, O-Ka X-##zu X-##o O-Is X-##hi X-##gu X-##ro O-' X-s B-``-"" O-The O-Re X-##ma X-##ins O-of O-the O-Day O-"" O-( O-K X-##no X-##pf O-, O-245 O-pages O-, O-$ O-18 X-. X-95 O-) O-is O-both O-an O-homage O-to O-traditional O-English O-forms O-and O-a O-dramatic O-critique O-of O-them O-."
"As the narrator Stevens, the solitary butler of Darlington Hall, mulls over such hallowed terms as ""greatness,"" ""dignity,"" ""service"" and ""loyalty,"" we see how pious cant subverts the soul.","O-As O-the O-narrator O-Stevens O-, O-the O-solitary O-butler O-of O-Darlington O-Hall O-, O-m X-##ull X-##s O-over O-such O-hall X-##owed O-terms O-as B-``-"" O-great X-##ness O-, X-"" B-``-"" O-dignity O-, X-"" B-``-"" O-service O-"" O-and B-``-"" O-loyalty O-, X-"" O-we O-see O-how O-p X-##ious O-can X-##t O-sub X-##vert X-##s O-the O-soul O-."
"""We call this land of ours Great Britain, and there may be those who believe this a somewhat immodest practice.","B-``-"" O-We O-call O-this O-land O-of O-ours O-Great O-Britain O-, O-and O-there O-may O-be O-those O-who O-believe O-this O-a O-somewhat O-im X-##mo X-##des X-##t O-practice O-."
"But let Stevens continue in his unwitting comic manner (his conscious efforts at ""banter"" always fail -- most comically): ""This whole question is very akin to the question that has caused much debate in our profession over the years: what is a `great' butler?""","O-But O-let O-Stevens O-continue O-in O-his O-un X-##wi X-##tting O-comic O-manner O-( O-his O-conscious O-efforts O-at B-``-"" O-ban X-##ter O-"" O-always O-fail O-- X-- O-most O-comic X-##ally O-) O-: B-``-"" O-This O-whole O-question O-is O-very O-akin O-to O-the O-question O-that O-has O-caused O-much O-debate O-in O-our O-profession O-over O-the O-years O-: O-what O-is O-a B-``-` O-great O-' O-butler O-? O-"""
"His answer is one ""possessed of a dignity in keeping with his position.""","O-His O-answer O-is O-one B-``-"" O-possessed O-of O-a O-dignity O-in O-keeping O-with O-his O-position O-. O-"""
"Such dignity ""has to do crucially with a butler's ability not to abandon the professional being he inhabits.""","O-Such O-dignity B-``-"" O-has O-to O-do O-crucial X-##ly O-with O-a O-butler O-' X-s O-ability O-not O-to O-abandon O-the O-professional O-being O-he O-inhabit X-##s O-. O-"""
"He ""will not be shaken out by external events, however surprising, alarming or vexing. . . . Continentals are unable to be butlers because they are as a breed incapable of the emotional restraint which only the English race are capable of.""","O-He B-``-"" O-will O-not O-be O-shaken O-out O-by O-external O-events O-, O-however O-surprising O-, O-alarm X-##ing O-or O-ve X-##xing O-. O-. O-. O-. O-Continental X-##s O-are O-unable O-to O-be O-butler X-##s O-because O-they O-are O-as O-a O-breed O-incapable O-of O-the O-emotional O-restraint O-which O-only O-the O-English O-race O-are O-capable O-of O-. O-"""
"Despite his racial advantage, to be a great butler is a heroic calling; one's pantry is ""not unlike general's headquarters during a battle.""","O-Despite O-his O-racial O-advantage O-, O-to O-be O-a O-great O-butler O-is O-a O-heroic O-calling O-; O-one O-' X-s O-pan X-##try O-is B-``-"" O-not O-unlike O-general O-' X-s O-headquarters O-during O-a O-battle O-. O-"""
"If, for example, in the midst of a great social occasion (such as an international conference on revising the Versailles Treaty in 1923), one's 72-yearold father, himself a great butler once, should happen to die of a stroke, one must continue to serve the port: ""Please don't think me unduly improper in not ascending to see my father in his deceased condition just at this moment.","O-If O-, O-for O-example O-, O-in O-the O-midst O-of O-a O-great O-social O-occasion O-( O-such O-as O-an O-international O-conference O-on O-re X-##vis X-##ing O-the O-Versailles O-Treaty O-in O-1923 O-) O-, O-one O-' X-s O-72 X-- X-year X-##old O-father O-, O-himself O-a O-great O-butler O-once O-, O-should O-happen O-to O-die O-of O-a O-stroke O-, O-one O-must O-continue O-to O-serve O-the O-port O-: B-``-"" O-Please O-do O-n X-' X-t O-think O-me O-und X-##ul X-##y O-imp X-##roper O-in O-not O-ascending O-to O-see O-my O-father O-in O-his O-deceased O-condition O-just O-at O-this O-moment O-."
