"The protesters who greeted Mikhail Gorbachev at East Berlin's airport earlier this month weren't shouting ""Go U.S.A"" -- they were chanting ""Gorby, Help Us.""","O-The O-protesters O-who O-greeted O-Mikhail O-Go X-##rb X-##ache X-##v O-at O-East O-Berlin O-' X-s O-airport O-earlier O-this O-month O-were O-n X-' X-t O-shouting B-``-"" O-Go O-U X-. X-S X-. X-A O-"" O-- X-- O-they O-were O-chanting B-``-"" O-Go X-##rby O-, O-Help O-Us O-. O-"""
"In a statement that was as close as East Germany gets to practicing ""glasnost"", Otto Reinhold, an East German party theorist, actually acknowledged the reunification dilemma.","O-In O-a O-statement O-that O-was O-as O-close O-as O-East O-Germany O-gets O-to O-practicing B-``-"" O-g X-##las X-##nos X-##t O-"" O-, O-Otto O-Re X-##in X-##hold O-, O-an O-East O-German O-party O-theorist O-, O-actually O-acknowledged O-the O-re X-##uni X-##fication O-di X-##lemma O-."
"""The main problem,"" Mr. Reinhold said in an East German radio interview monitored by Radio Free Europe in Munich, stems from the fact that ""the GDR is different"" from other East European states.","B-``-"" O-The O-main O-problem O-, X-"" O-Mr X-. O-Re X-##in X-##hold O-said O-in O-an O-East O-German O-radio O-interview O-monitored O-by O-Radio O-Free O-Europe O-in O-Munich O-, O-stems O-from O-the O-fact O-that B-``-"" O-the O-G X-##DR O-is O-different O-"" O-from O-other O-East O-European O-states O-."
"""What kind of right to exist,"" he asked, ""would a capitalist German Democratic Republic have alongside a capitalist Federal Republic?""","B-``-"" O-What O-kind O-of O-right O-to O-exist O-, X-"" O-he O-asked O-, B-``-"" O-would O-a O-capitalist O-German O-Democratic O-Republic O-have O-alongside O-a O-capitalist O-Federal O-Republic O-? O-"""
"On his FEMA visit, Mr. Bush said that he hoped there would be ""less carping"" about the emergency office's performance this time, adding that the agency ""took a hit"" for its reaction to Hurricane Hugo.","O-On O-his O-F X-##EM X-##A O-visit O-, O-Mr X-. O-Bush O-said O-that O-he O-hoped O-there O-would O-be B-``-"" O-less O-car X-##ping O-"" O-about O-the O-emergency O-office O-' X-s O-performance O-this O-time O-, O-adding O-that O-the O-agency B-``-"" O-took O-a O-hit O-"" O-for O-its O-reaction O-to O-Hurricane O-Hugo O-."
"He said the company was ""encouraged by feedback"" it received from selected customers now testing Version 1.1.","O-He O-said O-the O-company O-was B-``-"" O-encouraged O-by O-feedback O-"" O-it O-received O-from O-selected O-customers O-now O-testing O-Version O-1 X-. X-1 O-."
"""The loss is in line with our expectations,"" said John C. Maxwell III, an analyst with Dillon, Read & Co. in New York.","B-``-"" O-The O-loss O-is O-in O-line O-with O-our O-expectations O-, X-"" O-said O-John O-C X-. O-Maxwell O-III O-, O-an O-analyst O-with O-Dillon O-, O-Read O-& O-Co X-. O-in O-New O-York O-."
"He added gross margins and operating profit ""eroded quite dramatically"" from the prior quarter, along with sales of existing software product lines like Multimate and Framework.","O-He O-added O-gross O-margins O-and O-operating O-profit B-``-"" O-eroded O-quite O-dramatically O-"" O-from O-the O-prior O-quarter O-, O-along O-with O-sales O-of O-existing O-software O-product O-lines O-like O-Multi X-##mate O-and O-Framework O-."
"""The success of a new product in the database line is needed.","B-``-"" O-The O-success O-of O-a O-new O-product O-in O-the O-database O-line O-is O-needed O-."
"The company said in a statement that it expects to ship new products ""during the next two quarters.""","O-The O-company O-said O-in O-a O-statement O-that O-it O-expects O-to O-ship O-new O-products B-``-"" O-during O-the O-next O-two O-quarters O-. O-"""
"""It now looks like database IV Version 1.1 isn't going to be {widely} available until the first quarter of 1990,"" said David Bayer, an analyst with Montgomery Securities in San Francisco.","B-``-"" O-It O-now O-looks O-like O-database O-IV O-Version O-1 X-. X-1 O-is O-n X-' X-t O-going O-to O-be O-{ O-widely O-} O-available O-until O-the O-first O-quarter O-of O-1990 O-, X-"" O-said O-David O-Bay X-##er O-, O-an O-analyst O-with O-Montgomery O-Securities O-in O-San O-Francisco O-."
"""This is the second delay now in getting the product out the door.","B-``-"" O-This O-is O-the O-second O-delay O-now O-in O-getting O-the O-product O-out O-the O-door O-."
"Mr. Maxwell said unless the company can start shipments of the new product sometime this quarter, the fourth-quarter loss is likely to be ""comparable to the third quarter's.""","O-Mr X-. O-Maxwell O-said O-unless O-the O-company O-can O-start O-shipment X-##s O-of O-the O-new O-product O-sometime O-this O-quarter O-, O-the O-fourth X-- X-quarter O-loss O-is O-likely O-to O-be B-``-"" O-comparable O-to O-the O-third O-quarter O-' X-s O-. O-"""
"Yesterday a spokeswoman said the company was ""pleased with our progress"" in that regard and ""hopes to provide additional details soon.""","O-Yesterday O-a O-spoke X-##s X-##woman O-said O-the O-company O-was B-``-"" O-pleased O-with O-our O-progress O-"" O-in O-that O-regard O-and B-``-"" O-hopes O-to O-provide O-additional O-details O-soon O-. O-"""
"Then suddenly Ike's ghost came to visit and said, ""What the hell are you doing planning for a land war in Asia 12,000 miles away?","O-Then O-suddenly O-I X-##ke O-' X-s O-ghost O-came O-to O-visit O-and O-said O-, B-``-"" O-What O-the O-hell O-are O-you O-doing O-planning O-for O-a O-land O-war O-in O-Asia O-12 X-, X-000 O-miles O-away O-?"
"Predictably, some Navy guys said: ""Do we still need to keep all 18 Army divisions on active duty and all those extra land-based aircraft without bases and all those Army guys playing admiral in Tampa?","O-Pre X-##dict X-##ably O-, O-some O-Navy O-guys O-said O-: B-``-"" O-Do O-we O-still O-need O-to O-keep O-all O-18 O-Army O-divisions O-on O-active O-duty O-and O-all O-those O-extra O-land X-- X-based O-aircraft O-without O-bases O-and O-all O-those O-Army O-guys O-playing O-admiral O-in O-Tampa O-?"
"Earlier this week, Mr. Simmons objected to published reports quoting him as saying he planned to sell his Lockheed stake because ""the defense industry seems to be getting more uncertain.""","O-Earlier O-this O-week O-, O-Mr X-. O-Simmons O-objected O-to O-published O-reports O-q X-##uo X-##ting O-him O-as O-saying O-he O-planned O-to O-sell O-his O-Lockheed O-stake O-because B-``-"" O-the O-defense O-industry O-seems O-to O-be O-getting O-more O-uncertain O-. O-"""
"Louisiana-Pacific said fourth-quarter performance is usually hampered by weather-related construction slowdowns, but that ""many positive factors"" should help the period's results.","O-Louisiana X-- X-Pacific O-said O-fourth X-- X-quarter O-performance O-is O-usually O-hampered O-by O-weather X-- X-related O-construction O-slow X-##down X-##s O-, O-but O-that B-``-"" O-many O-positive O-factors O-"" O-should O-help O-the O-period O-' X-s O-results O-."
"Mr. Lang admits that Ms. is ""in dire straits"" and that Sassy needs big promotional dollars to keep it alive.","O-Mr X-. O-Lang O-admits O-that O-Ms X-. O-is B-``-"" O-in O-dire O-s X-##tra X-##its O-"" O-and O-that O-Sa X-##ssy O-needs O-big O-promotional O-dollars O-to O-keep O-it O-alive O-."
"""Any fool can publish a money-losing magazine.","B-``-"" O-Any O-fool O-can O-publish O-a O-money X-- X-losing O-magazine O-."
"""For Ms., it's time to publish for the reader, not the advertiser.""","B-``-"" O-For O-Ms X-. O-, O-it O-' X-s O-time O-to O-publish O-for O-the O-reader O-, O-not O-the O-ad X-##vert X-##iser O-. O-"""
"Mr. Lang said the former Australian owners of Sassy were ""blind-sided by the Moral Majority. . . . Their reaction was to do nothing and ride it out.""","O-Mr X-. O-Lang O-said O-the O-former O-Australian O-owners O-of O-Sa X-##ssy O-were B-``-"" O-blind X-- X-sided O-by O-the O-Mo X-##ral O-Majority O-. O-. O-. O-. O-Their O-reaction O-was O-to O-do O-nothing O-and O-ride O-it O-out O-. O-"""
"He said Sassy will keep its irreverent tone, but added, ""We will keep a close watch on the editorial content of the magazine.""","O-He O-said O-Sa X-##ssy O-will O-keep O-its O-i X-##rre X-##vere X-##nt O-tone O-, O-but O-added O-, B-``-"" O-We O-will O-keep O-a O-close O-watch O-on O-the O-editorial O-content O-of O-the O-magazine O-. O-"""
"""Seventeen is written more for mothers, not their daughters,"" said Mr. Lang.","B-``-"" O-Seven X-##teen O-is O-written O-more O-for O-mothers O-, O-not O-their O-daughters O-, X-"" O-said O-Mr X-. O-Lang O-."
"""But Sassy has a different spirit.","B-``-"" O-But O-Sa X-##ssy O-has O-a O-different O-spirit O-."
"Industry observers have congratulated Mr. Lang on what some call his ""courageous"" handling of Ms., but his track record in magazine publishing in general has gotten mixed reviews.","O-Industry O-observers O-have O-con X-##gra X-##tu X-##lated O-Mr X-. O-Lang O-on O-what O-some O-call O-his B-``-"" O-courage X-##ous O-"" O-handling O-of O-Ms X-. O-, O-but O-his O-track O-record O-in O-magazine O-publishing O-in O-general O-has O-gotten O-mixed O-reviews O-."
"Time executives complained about the shoddy editorial quality, and in the end, one Time executive who asked not to be identified said, ""Frankly, McCall's and the joint venture were an embarrassment.""","O-Time O-executives O-complained O-about O-the O-s X-##ho X-##ddy O-editorial O-quality O-, O-and O-in O-the O-end O-, O-one O-Time O-executive O-who O-asked O-not O-to O-be O-identified O-said O-, B-``-"" O-Frank X-##ly O-, O-M X-##c X-##C X-##all O-' X-s O-and O-the O-joint O-venture O-were O-an O-embarrassment O-. O-"""
"""Their management changed right after {the venture was formed}, and I don't think they were comfortable getting into the competitive wars of women's service magazines.""","B-``-"" O-Their O-management O-changed O-right O-after O-{ O-the O-venture O-was O-formed O-} O-, O-and O-I O-do O-n X-' X-t O-think O-they O-were O-comfortable O-getting O-into O-the O-competitive O-wars O-of O-women O-' X-s O-service O-magazines O-. O-"""
"""We write straight for women on their level,"" he said.","B-``-"" O-We O-write O-straight O-for O-women O-on O-their O-level O-, X-"" O-he O-said O-."
"""We don't have passive readers.""","B-``-"" O-We O-do O-n X-' X-t O-have O-passive O-readers O-. O-"""
"""We would have to go outside to banks to get the money and I am not ready to do that,"" he said.","B-``-"" O-We O-would O-have O-to O-go O-outside O-to O-banks O-to O-get O-the O-money O-and O-I O-am O-not O-ready O-to O-do O-that O-, X-"" O-he O-said O-."
"""Besides, we have enough on our plate.","B-``-"" O-Besides O-, O-we O-have O-enough O-on O-our O-plate O-."
"""This,"" says Ms. Peterson, ""is what it's all about.""","B-``-"" O-This O-, X-"" O-says O-Ms O-. O-Peterson O-, B-``-"" O-is O-what O-it O-' X-s O-all O-about O-. O-"""
"""We were being overrun,"" says Steve Fiala, trails coordinator of the East Bay Regional Park District.","B-``-"" O-We O-were O-being O-overrun O-, X-"" O-says O-Steve O-Fi X-##ala O-, O-trails O-coordinator O-of O-the O-East O-Bay O-Regional O-Park O-District O-."
"Even the U.S. Forest Service, whose lenient ""multiple-use"" philosophy permits motorized vehicles on thousands of miles of its trails across the U.S., has begun to close some lands to the bikes, including major portions of the popular Pacific Crest Trail, which stretches from California to Canada.","O-Even O-the O-U X-. X-S X-. O-Forest O-Service O-, O-whose O-le X-##nie X-##nt B-``-"" O-multiple X-- X-use O-"" O-philosophy O-permits O-motor X-##ized O-vehicles O-on O-thousands O-of O-miles O-of O-its O-trails O-across O-the O-U X-. X-S X-. O-, O-has O-begun O-to O-close O-some O-lands O-to O-the O-bikes O-, O-including O-major O-portions O-of O-the O-popular O-Pacific O-C X-##rest O-Trail O-, O-which O-stretches O-from O-California O-to O-Canada O-."
"""I have a mountain bike, yet as a hiker I've been run off the road by kids careening down a fire trail on them,"" says Gene Coan, an official at Sierra's headquarters in San Francisco, echoing the concerns of many members.","B-``-"" O-I O-have O-a O-mountain O-bike O-, O-yet O-as O-a O-hike X-##r O-I O-' X-ve O-been O-run O-off O-the O-road O-by O-kids O-care X-##ening O-down O-a O-fire O-trail O-on O-them O-, X-"" O-says O-Gene O-Co X-##an O-, O-an O-official O-at O-Sierra O-' X-s O-headquarters O-in O-San O-Francisco O-, O-echoing O-the O-concerns O-of O-many O-members O-."
"""People who feel that cyclists should be banned from an area aren't looking at the whole picture,"" complains Mark Langton, associate editor of Mountain and City Biking magazine in Canoga Park, Calif.","B-``-"" O-People O-who O-feel O-that O-cyclists O-should O-be O-banned O-from O-an O-area O-are O-n X-' X-t O-looking O-at O-the O-whole O-picture O-, X-"" O-complain X-##s O-Mark O-Lang X-##ton O-, O-associate O-editor O-of O-Mountain O-and O-City O-B X-##iki X-##ng O-magazine O-in O-Can X-##oga O-Park O-, O-Cal X-##if O-."
"While some are renegade riders who simply scorn regulations, much bad riding simply reflects ignorance that can be corrected through ""education and peer pressure,"" says Jim Hasenauer, a director of the International Mountain Biking Association.","O-While O-some O-are O-re X-##ne X-##gade O-riders O-who O-simply O-s X-##corn O-regulations O-, O-much O-bad O-riding O-simply O-reflects O-ignorance O-that O-can O-be O-corrected O-through B-``-"" O-education O-and O-peer O-pressure O-, X-"" O-says O-Jim O-Has X-##ena X-##uer O-, O-a O-director O-of O-the O-International O-Mountain O-B X-##iki X-##ng O-Association O-."
"""I think we're making progress.""","B-``-"" O-I O-think O-we O-' X-re O-making O-progress O-. O-"""
"""The mountain bike feels as comfortable as the `paperboy' bike you had as a kid, but it can do so much more,"" he says.","B-``-"" O-The O-mountain O-bike O-feels O-as O-comfortable O-as O-the B-``-` O-paper X-##boy O-' O-bike O-you O-had O-as O-a O-kid O-, O-but O-it O-can O-do O-so O-much O-more O-, X-"" O-he O-says O-."
"His recent speech, provocatively titled ""Blacks?","O-His O-recent O-speech O-, O-pro X-##vocative X-##ly O-titled B-``-"" O-Blacks O-?"
"Mr. Allen's commissioners voted to call his unread speech ""thoughtless, disgusting and unnecessarily inflammatory.""","O-Mr X-. O-Allen O-' X-s O-commissioners O-voted O-to O-call O-his O-un X-##read O-speech B-``-"" O-thought X-##less O-, O-disgusting O-and O-un X-##ne X-##cess X-##arily O-inflammatory O-. O-"""
"Commissioner Mary Francis Berry said it was ""another sad episode in the saga of the unguided missile who is chairman.""","O-Commissioner O-Mary O-Francis O-Berry O-said O-it O-was B-``-"" O-another O-sad O-episode O-in O-the O-saga O-of O-the O-un X-##gu X-##ided O-missile O-who O-is O-chairman O-. O-"""
"Rep. Don Edwards, the California Democrat, warned Mr. Allen that the speech would be ""outside the scope of the commission's jurisdiction.""","O-Rep O-. O-Don O-Edwards O-, O-the O-California O-Democrat O-, O-warned O-Mr X-. O-Allen O-that O-the O-speech O-would O-be B-``-"" O-outside O-the O-scope O-of O-the O-commission O-' X-s O-jurisdiction O-. O-"""
"Thomas Stoddard, head of the Lambda Legal Defense Fund, called the prospect of the speech ""frankly shocking.""","O-Thomas O-St X-##od X-##dar X-##d O-, O-head O-of O-the O-Lamb X-##da O-Legal O-Defense O-Fund O-, O-called O-the O-prospect O-of O-the O-speech B-``-"" O-frankly O-shocking O-. O-"""
"He said that other participants in the conference ""do not believe that the rights of Americans should be guaranteed to citizens who are homosexual,"" but that ""I mean to persuade you to the opposite view.""","O-He O-said O-that O-other O-participants O-in O-the O-conference B-``-"" O-do O-not O-believe O-that O-the O-rights O-of O-Americans O-should O-be O-guaranteed O-to O-citizens O-who O-are O-homosexual O-, X-"" O-but O-that B-``-"" O-I O-mean O-to O-persuade O-you O-to O-the O-opposite O-view O-. O-"""
"He recalled to the audience a ""strange, infelicitous"" analogy he once heard arguing ""now that we have finally recognized that American blacks have rights, we need to do the same for animals.""","O-He O-recalled O-to O-the O-audience O-a B-``-"" O-strange O-, O-in X-##fe X-##licit X-##ous O-"" O-analogy O-he O-once O-heard O-arguing B-``-"" O-now O-that O-we O-have O-finally O-recognized O-that O-American O-blacks O-have O-rights O-, O-we O-need O-to O-do O-the O-same O-for O-animals O-. O-"""
"Mr. Allen objected to this analogy because it seems to ""assimilate the status of blacks to that of animals -- as a mere project of charity, of humaneness.""","O-Mr X-. O-Allen O-objected O-to O-this O-analogy O-because O-it O-seems O-to B-``-"" O-ass X-##im X-##ila X-##te O-the O-status O-of O-blacks O-to O-that O-of O-animals O-- X-- O-as O-a O-mere O-project O-of O-charity O-, O-of O-human X-##ene X-##ss O-. O-"""
"Rights on such a basis, whether for blacks or homosexuals, are ""mere indulgences,"" he said, subject to being taken back.","O-Rights O-on O-such O-a O-basis O-, O-whether O-for O-blacks O-or O-homosexual X-##s O-, O-are B-``-"" O-mere O-in X-##du X-##lge X-##nces O-, X-"" O-he O-said O-, O-subject O-to O-being O-taken O-back O-."
"His speech criticized the ""idiocy of notions of protected groups in society"" as opposed to individual equality or, as he put it, in ""a common destiny as Americans.""","O-His O-speech O-criticized O-the B-``-"" O-id X-##io X-##cy O-of O-notions O-of O-protected O-groups O-in O-society O-"" O-as O-opposed O-to O-individual O-equality O-or O-, O-as O-he O-put O-it O-, O-in B-``-"" O-a O-common O-destiny O-as O-Americans O-. O-"""
"Instead of lobbying for special treatment, Mr. Allen said that homosexuals and others should try to ensure equal treatment under the law and not aim for special privileges that would risk ""invidious retrenchment with government complicity.""","O-Instead O-of O-lobbying O-for O-special O-treatment O-, O-Mr X-. O-Allen O-said O-that O-homosexual X-##s O-and O-others O-should O-try O-to O-ensure O-equal O-treatment O-under O-the O-law O-and O-not O-aim O-for O-special O-privileges O-that O-would O-risk B-``-"" O-in X-##vid X-##ious O-re X-##tre X-##nch X-##ment O-with O-government O-com X-##p X-##licity O-. O-"""
"Mr. Allen quickly ran up against the liberal establishment again, which somehow elevated the vague concept of ""Indian rights"" above the rights of individual Indians.","O-Mr X-. O-Allen O-quickly O-ran O-up O-against O-the O-liberal O-establishment O-again O-, O-which O-somehow O-elevated O-the O-vague O-concept O-of B-``-"" O-Indian O-rights O-"" O-above O-the O-rights O-of O-individual O-Indians O-."
"""The company will not budge on anything,"" said a spokesman for the union.","B-``-"" O-The O-company O-will O-not O-b X-##udge O-on O-anything O-, X-"" O-said O-a O-spokesman O-for O-the O-union O-."
"As the strike enters its 15th day today, some members are getting nervous, the spokesman conceded, but the majority of the 55,000 Machinists are prepared to ""wait it out as long as it takes.""","O-As O-the O-strike O-enters O-its O-15th O-day O-today O-, O-some O-members O-are O-getting O-nervous O-, O-the O-spokesman O-conceded O-, O-but O-the O-majority O-of O-the O-55 X-, X-000 O-Mac X-##hin X-##ists O-are O-prepared O-to B-``-"" O-wait O-it O-out O-as O-long O-as O-it O-takes O-. O-"""
"The spokesman said he also understood that the inquiry related to the existence of an ""off-the-record"" production book.","O-The O-spokesman O-said O-he O-also O-understood O-that O-the O-inquiry O-related O-to O-the O-existence O-of O-an B-``-"" O-off X-- X-the X-- X-record O-"" O-production O-book O-."
"Perry Levine, chairman, said Mr. Sawyer had ""taken significant steps"" to restore the company's credibility and sense of professionalism and integrity.","O-Perry O-Levine O-, O-chairman O-, O-said O-Mr X-. O-Sawyer O-had B-``-"" O-taken O-significant O-steps O-"" O-to O-restore O-the O-company O-' X-s O-credibility O-and O-sense O-of O-professional X-##ism O-and O-integrity O-."
"Banc One said ""it is contemplated"" that John B. McCoy, chairman and chief executive officer, will assume the additional position of president upon Mr. McKinney's retirement.","O-Ban X-##c O-One O-said B-``-"" O-it O-is O-contemplated O-"" O-that O-John O-B O-. O-McCoy O-, O-chairman O-and O-chief O-executive O-officer O-, O-will O-assume O-the O-additional O-position O-of O-president O-upon O-Mr X-. O-M X-##c X-##K X-##inn X-##ey O-' X-s O-retirement O-."
"The company said Mr. McKinney plans to retire because the process of affiliating American Fletcher into Banc One ""is considered completed.""","O-The O-company O-said O-Mr X-. O-M X-##c X-##K X-##inn X-##ey O-plans O-to O-retire O-because O-the O-process O-of O-a X-##ff X-##ilia X-##ting O-American O-Fletcher O-into O-Ban X-##c O-One B-``-"" O-is O-considered O-completed O-. O-"""
"New Environmentalism probably started in 1962 with the publication of Rachel Carson's book ""Silent Spring.""","O-New O-Environmental X-##ism O-probably O-started O-in O-1962 O-with O-the O-publication O-of O-Rachel O-Carson O-' X-s O-book B-``-"" O-Silent O-Spring O-. O-"""
"Your story missed some essential points of the conference on ""The Global Environment: Are We Overreacting?""","O-Your O-story O-missed O-some O-essential O-points O-of O-the O-conference O-on B-``-"" O-The O-Global O-Environment O-: O-Are O-We O-Over X-##rea X-##cting O-? O-"""
"""Banks want to remain competitive,"" said Norberto Mehl, chairman of Banxquote.","B-``-"" O-Banks O-want O-to O-remain O-competitive O-, X-"" O-said O-Nor X-##berto O-Me X-##hl O-, O-chairman O-of O-Ban X-##x X-##q X-##uo X-##te O-."
"""October is a big rollover month and perhaps they anticipate greater demand .","B-``-"" O-October O-is O-a O-big O-roll X-##over O-month O-and O-perhaps O-they O-anti X-##ci X-##pate O-greater O-demand O-."
"""Reports from branches are that there has been greater interest in the last day or so,"" said Steven Braitman, a vice president at Chemical Bank in New York.","B-``-"" O-Reports O-from O-branches O-are O-that O-there O-has O-been O-greater O-interest O-in O-the O-last O-day O-or O-so O-, X-"" O-said O-Steven O-B X-##rai X-##tman O-, O-a O-vice O-president O-at O-Chemical O-Bank O-in O-New O-York O-."
"""This is no time to be playing in the street .","B-``-"" O-This O-is O-no O-time O-to O-be O-playing O-in O-the O-street O-."
"Harold Jones, Lincoln's chief retail banking officer, said there hasn't yet been ""a discernible response,"" although the ad included a coupon that could arrive later in the week.","O-Harold O-Jones O-, O-Lincoln O-' X-s O-chief O-retail O-banking O-officer O-, O-said O-there O-has O-n X-' X-t O-yet O-been B-``-"" O-a O-disc X-##ern X-##ible O-response O-, X-"" O-although O-the O-ad O-included O-a O-coup X-##on O-that O-could O-arrive O-later O-in O-the O-week O-."
"""What happened in the stock market and the bigger trade deficit"" reported yesterday ""make it unlikely that short-term interest rates will rise"" any time soon, said Mr. Mehl of Banxquote.","B-``-"" O-What O-happened O-in O-the O-stock O-market O-and O-the O-bigger O-trade O-deficit O-"" O-reported O-yesterday B-``-"" O-make O-it O-unlikely O-that O-short X-- X-term O-interest O-rates O-will O-rise O-"" O-any O-time O-soon O-, O-said O-Mr X-. O-Me X-##hl O-of O-Ban X-##x X-##q X-##uo X-##te O-."
"""Even before the market drop, rates were down about half a percentage point,"" said Robert J. Hutchinson, senior vice president for retail marketing at Manufacturers Hanover Trust Co. in New York.","B-``-"" O-Even O-before O-the O-market O-drop O-, O-rates O-were O-down O-about O-half O-a O-percentage O-point O-, X-"" O-said O-Robert O-J X-. O-Hutchinson O-, O-senior O-vice O-president O-for O-retail O-marketing O-at O-Man X-##uf X-##act X-##urers O-Hanover O-Trust O-Co X-. O-in O-New O-York O-."
"""That puts pressure on CD rates.""","B-``-"" O-That O-puts O-pressure O-on O-CD O-rates O-. O-"""
"Boeing Co., already struck by its Machinists union, briefly called off contract talks with its engineers and labeled their demands ""grossly excessive.""","O-Boeing O-Co X-. O-, O-already O-struck O-by O-its O-Mac X-##hin X-##ists O-union O-, O-briefly O-called O-off O-contract O-talks O-with O-its O-engineers O-and O-labeled O-their O-demands B-``-"" O-gross X-##ly O-excessive O-. O-"""
"""It will take several meetings to resolve this,"" said a spokesman for the Machinists union.","B-``-"" O-It O-will O-take O-several O-meetings O-to O-resolve O-this O-, X-"" O-said O-a O-spokesman O-for O-the O-Mac X-##hin X-##ists O-union O-."
"""We don't want to bring back something the members will reject.""","B-``-"" O-We O-do O-n X-' X-t O-want O-to O-bring O-back O-something O-the O-members O-will O-reject O-. O-"""
"""It's hard to imagine how the markets were speculating, given that nobody could get through to San Francisco,"" said one amazed oil company executive.","B-``-"" O-It O-' X-s O-hard O-to O-imagine O-how O-the O-markets O-were O-s X-##pec X-##ulating O-, O-given O-that O-nobody O-could O-get O-through O-to O-San O-Francisco O-, X-"" O-said O-one O-amazed O-oil O-company O-executive O-."
"""The market was basically acting on two contradictory forces,"" said Nauman Barakat of Shearson Lehman Hutton Inc. ""One is the panic, the earthquake in San Francisco, which is positive.""","B-``-"" O-The O-market O-was O-basically O-acting O-on O-two O-con X-##tra X-##dict X-##ory O-forces O-, X-"" O-said O-Na X-##uman O-Bar X-##aka X-##t O-of O-Shea X-##rson O-Le X-##hman O-Hutton O-Inc O-. B-``-"" O-One O-is O-the O-panic O-, O-the O-earthquake O-in O-San O-Francisco O-, O-which O-is O-positive O-. O-"""
