"But they said the C$30-a-share bid, which was due to expire Monday, may still be extended or varied.","O-But O-they O-said O-the O-C O-$ O-30 X-- X-a X-- X-share O-bid O-, O-which O-was O-due O-to O-ex X-##pire O-Monday O-, O-may O-still O-be B-VBN-extended O-or B-VBN-varied O-."
"Merieux, a vaccine manufacturer based in Lyon, France, is 51%-held by French state-owned Rhone-Poulenc S.A. Ciba-Geigy is a major pharmaceutical concern based in Basel, Switzerland.","O-Me X-##rie X-##ux O-, O-a O-vaccine O-manufacturer B-VBN-based O-in O-Lyon O-, O-France O-, O-is O-51 O-% X-- B-VBN-held O-by O-French O-state X-- X-owned O-R X-##hone X-- X-Po X-##ule X-##nc O-S X-. X-A O-. O-C X-##iba X-- X-G X-##ei X-##gy O-is O-a O-major O-pharmaceutical O-concern B-VBN-based O-in O-Basel O-, O-Switzerland O-."
"Chiron, another pharmaceutical concern, is based in Emeryville, Calif.","O-Chi X-##ron O-, O-another O-pharmaceutical O-concern O-, O-is B-VBN-based O-in O-Emery X-##ville O-, O-Cal X-##if O-."
"Institut Merieux's bid for Toronto-based Connaught has run into problems with the Canadian government, which told Merieux last week that it wasn't convinced that the proposed acquisition would be of ""net benefit"" to Canada.","O-Institut O-Me X-##rie X-##ux O-' X-s O-bid O-for O-Toronto X-- X-based O-Con X-##na X-##ught O-has B-VBN-run O-into O-problems O-with O-the O-Canadian O-government O-, O-which O-told O-Me X-##rie X-##ux O-last O-week O-that O-it O-was O-n X-' X-t B-VBN-convinced O-that O-the B-VBN-proposed O-acquisition O-would O-be O-of O-"" O-net O-benefit O-"" O-to O-Canada O-."
Merieux officials are expected to meet with federal officials in Ottawa today to discuss the decision.,O-Me X-##rie X-##ux O-officials O-are B-VBN-expected O-to O-meet O-with O-federal O-officials O-in O-Ottawa O-today O-to O-discuss O-the O-decision O-.
"Prospect Group Inc., whose recent hostile tender offer for Recognition Equipment Inc. failed for lack of financing, apparently has gained a measure of control over the troubled company anyway.","O-Prospect O-Group O-Inc X-. O-, O-whose O-recent O-hostile O-tender O-offer O-for O-Re X-##cognition O-Equipment O-Inc O-. O-failed O-for O-lack O-of O-financing O-, O-apparently O-has B-VBN-gained O-a O-measure O-of O-control O-over O-the O-troubled O-company O-anyway O-."
"Thomas M. Hurley and Robert A. Vanourek, who had been designated to take over Recognition's top spots had Prospect's tender offer succeeded, were named co-chief executives and directors.","O-Thomas O-M X-. O-Hu X-##rley O-and O-Robert O-A X-. O-Van X-##our X-##ek O-, O-who O-had B-VBN-been B-VBN-designated O-to O-take O-over O-Re X-##cognition O-' X-s O-top O-spots O-had O-Prospect O-' X-s O-tender O-offer B-VBN-succeeded O-, O-were B-VBN-named O-co X-- X-chief O-executives O-and O-directors O-."
"In addition, the agreement calls for Gilbert H. Lamphere, chairman of Prospect Group's executive committee, to be named chairman of a restructured board that will include four new independent directors.","O-In O-addition O-, O-the O-agreement O-calls O-for O-Gilbert O-H X-. O-Lam X-##phere O-, O-chairman O-of O-Prospect O-Group O-' X-s O-executive O-committee O-, O-to O-be B-VBN-named O-chairman O-of O-a B-VBN-rest X-##ru X-##cture X-##d O-board O-that O-will O-include O-four O-new O-independent O-directors O-."
Also named to the revised board was Thomas A.,O-Also B-VBN-named O-to O-the O-revised O-board O-was O-Thomas O-A O-.
"Prospect, a New York-based leveraged buy-out firm, also agreed to invest $15 million in Recognition, which in turn agreed to repurchase as much as $20 million of its stock.","O-Prospect O-, O-a O-New O-York X-- X-based O-leverage X-##d O-buy X-- X-out O-firm O-, O-also O-agreed O-to O-invest O-$ O-15 O-million O-in O-Re X-##cognition O-, O-which O-in O-turn O-agreed O-to B-VBN-re X-##pur X-##chase O-as O-much O-as O-$ O-20 O-million O-of O-its O-stock O-."
That would increase Prospect's ownership of the company's fully-diluted shares outstanding to 20% from 14.1%.,O-That O-would O-increase O-Prospect O-' X-s O-ownership O-of O-the O-company O-' X-s B-VBN-fully X-- X-di X-##lut X-##ed O-shares O-outstanding O-to O-20 O-% O-from O-14 X-. X-1 O-% O-.
"Under the agreement, Prospect is permitted to increase its stake in Recognition to 30%.","O-Under O-the O-agreement O-, O-Prospect O-is B-VBN-permitted O-to O-increase O-its O-stake O-in O-Re X-##cognition O-to O-30 O-% O-."
"Recognition also said it obtained a commitment from Chemical Bank and Bank of Boston to convert an estimated $18 million in bank debt to a new, 24-month secured term loan to be repaid through the sale of certain assets.","O-Re X-##cognition O-also O-said O-it O-obtained O-a O-commitment O-from O-Chemical O-Bank O-and O-Bank O-of O-Boston O-to O-convert O-an O-estimated O-$ O-18 O-million O-in O-bank O-debt O-to O-a O-new O-, O-24 X-- X-month O-secured O-term O-loan O-to O-be B-VBN-re X-##pa X-##id O-through O-the O-sale O-of O-certain O-assets O-."
"In August, Recognition said it was in violation of certain terms of its debt agreements with bank lenders because of a $3.9 million loss for the third quarter ended July 31.","O-In O-August O-, O-Re X-##cognition O-said O-it O-was O-in O-violation O-of O-certain O-terms O-of O-its O-debt O-agreements O-with O-bank O-lend X-##ers O-because O-of O-a O-$ O-3 X-. X-9 O-million O-loss O-for O-the O-third O-quarter B-VBN-ended O-July O-31 O-."
"The former executives were indicted last October on charges of fraud, theft and conspiracy related to efforts by the company to win $400 million in Postal Service contracts.","O-The O-former O-executives O-were B-VBN-indicted O-last O-October O-on O-charges O-of O-fraud O-, O-theft O-and O-conspiracy B-VBN-related O-to O-efforts O-by O-the O-company O-to O-win O-$ O-400 O-million O-in O-Postal O-Service O-contracts O-."
"In Louisville, Ky., for example, David Peterson has built a Lexus dealership with the showroom on the second floor.","O-In O-Louisville O-, O-K X-##y X-. O-, O-for O-example O-, O-David O-Peterson O-has B-VBN-built O-a O-Lex X-##us O-dealers X-##hip O-with O-the O-show X-##room O-on O-the O-second O-floor O-."
Yet some dealers have turned down Infiniti or Lexus franchises because they were unwilling or unable to meet the design requirements.,O-Yet O-some O-dealers O-have B-VBN-turned O-down O-In X-##fin X-##iti O-or O-Lex X-##us O-franchises O-because O-they O-were O-unwilling O-or O-unable O-to O-meet O-the O-design O-requirements O-.
That's the lesson offered through one case study featured in a design exhibit.,O-That O-' X-s O-the O-lesson B-VBN-offered O-through O-one O-case O-study B-VBN-featured O-in O-a O-design O-exhibit O-.
"Dictaphone Corp. was caught off guard in 1974 when its main competitor, Lanier Office Products of Japan, introduced a microcassette dictation recorder half the size of standard cassette devices.","O-Di X-##ct X-##aph X-##one O-Corp X-. O-was B-VBN-caught O-off O-guard O-in O-1974 O-when O-its O-main O-competitor O-, O-La X-##nier O-Office O-Products O-of O-Japan O-, O-introduced O-a O-micro X-##cas X-##sett X-##e O-di X-##ct X-##ation O-recorder O-half O-the O-size O-of O-standard O-cassette O-devices O-."
"Blocked by patent protection from following suit, Dictaphone decided to go a step further and cut the cassette in half again -- down to the length of a paperclip.","B-VBN-Block X-##ed O-by O-patent O-protection O-from O-following O-suit O-, O-Di X-##ct X-##aph X-##one O-decided O-to O-go O-a O-step O-further O-and O-cut O-the O-cassette O-in O-half O-again O-- X-- O-down O-to O-the O-length O-of O-a O-paper X-##c X-##lip O-."
"By 1979, designers and engineers at Dictaphone, a Pitney Bowes subsidiary, had produced a working model of a ""picocassette"" recorder.","O-By O-1979 O-, O-designers O-and O-engineers O-at O-Di X-##ct X-##aph X-##one O-, O-a O-Pit X-##ney O-Bow X-##es O-subsidiary O-, O-had B-VBN-produced O-a O-working O-model O-of O-a O-"" O-p X-##ico X-##cas X-##sett X-##e O-"" O-recorder O-."
"By 1982, however, the patent status of the Lanier microcassette had changed, permitting Dictaphone to develop its own competitive micro system, which it did.","O-By O-1982 O-, O-however O-, O-the O-patent O-status O-of O-the O-La X-##nier O-micro X-##cas X-##sett X-##e O-had B-VBN-changed O-, O-permitting O-Di X-##ct X-##aph X-##one O-to O-develop O-its O-own O-competitive O-micro O-system O-, O-which O-it O-did O-."
"Dictaphone went ahead and introduced the pico in 1985, but it hasn't sold well.","O-Di X-##ct X-##aph X-##one O-went O-ahead O-and O-introduced O-the O-p X-##ico O-in O-1985 O-, O-but O-it O-has O-n X-' X-t B-VBN-sold O-well O-."
"To date, says Emil Jachmann, a Dictaphone vice president, it has ""broken even or shown a small loss.""","O-To O-date O-, O-says O-Emil O-J X-##ach X-##mann O-, O-a O-Di X-##ct X-##aph X-##one O-vice O-president O-, O-it O-has O-"" B-VBN-broken O-even O-or B-VBN-shown O-a O-small O-loss O-. O-"""
"Nevertheless, the device has been successful in other ways.","O-Nevertheless O-, O-the O-device O-has B-VBN-been O-successful O-in O-other O-ways O-."
"Dictaphone's picocassette recorder is one of 13 case studies in the TRIAD Design Project, sponsored by the Design Management Institute of Boston and Harvard Business School.","O-Di X-##ct X-##aph X-##one O-' X-s O-p X-##ico X-##cas X-##sett X-##e O-recorder O-is O-one O-of O-13 O-case O-studies O-in O-the O-T X-##RI X-##AD O-Design O-Project O-, B-VBN-sponsored O-by O-the O-Design O-Management O-Institute O-of O-Boston O-and O-Harvard O-Business O-School O-."
"Now incorporated into a polypropylene rake, the four-inch prongs, or ""wonderbars,"" also are supposed to aid in picking up leaves.","O-Now B-VBN-incorporated O-into O-a O-p X-##oly X-##p X-##rop X-##yle X-##ne O-r X-##ake O-, O-the O-four X-- X-inch O-pro X-##ng X-##s O-, O-or O-"" O-wonder X-##bar X-##s O-, X-"" O-also O-are B-VBN-supposed O-to O-aid O-in O-picking O-up O-leaves O-."
"Odds and Ends NO MORE STUBBED toes or bruised shins, promises Geste Corp. of Goshen, Ind., the designer of a bed support to replace traditional frames.","O-Odd X-##s O-and O-End X-##s O-NO O-M X-##OR X-##E B-VBN-ST X-##U X-##BB X-##ED O-toes O-or O-bruised O-s X-##hin X-##s O-, O-promises O-G X-##este O-Corp X-. O-of O-Go X-##she X-##n O-, O-In X-##d X-. O-, O-the O-designer O-of O-a O-bed O-support O-to O-replace O-traditional O-frames O-."
"Four tubular steel ""Bedfellows,"" each roughly in the shape of a ""W,"" are attached to the bottom of the box spring in a recessed position. . . . Nearly half of U.S. consumers say they'll pay up to 5% more for packaging that can be recycled or is biodegradable, according to a survey commissioned by the Michael Peters Group, a design consultant.","O-Four O-tub X-##ular O-steel O-"" O-Bed X-##fell X-##ows O-, X-"" O-each O-roughly O-in O-the O-shape O-of O-a O-"" O-W O-, X-"" O-are B-VBN-attached O-to O-the O-bottom O-of O-the O-box O-spring O-in O-a O-re X-##cess X-##ed O-position O-. O-. O-. O-. O-Nearly O-half O-of O-U X-. X-S X-. O-consumers O-say O-they O-' X-ll O-pay O-up O-to O-5 O-% O-more O-for O-packaging O-that O-can O-be B-VBN-recycled O-or O-is O-bio X-##de X-##grad X-##able O-, O-according O-to O-a O-survey B-VBN-commissioned O-by O-the O-Michael O-Peters O-Group O-, O-a O-design O-consultant O-."
"And while the U.S. currency recovered much of the lost ground from its collapse on Friday, several dealers contend that its potential to climb further could be limited.","O-And O-while O-the O-U X-. X-S X-. O-currency O-recovered O-much O-of O-the B-VBN-lost O-ground O-from O-its O-collapse O-on O-Friday O-, O-several O-dealers O-con X-##tend O-that O-its O-potential O-to O-climb O-further O-could O-be O-limited O-."
"In late New York trading, the dollar stood at 1.8685 West German marks and 141.80 yen, compared with 1.8655 marks and 141.50 yen late Friday.","O-In O-late O-New O-York O-trading O-, O-the O-dollar O-stood O-at O-1 X-. X-86 X-##8 X-##5 O-West O-German O-marks O-and O-141 X-. X-80 O-ye X-##n O-, B-VBN-compared O-with O-1 X-. X-86 X-##55 O-marks O-and O-141 X-. X-50 O-ye X-##n O-late O-Friday O-."
"Moreover, forecasters predict that the trade deficit for August, to be released today, will worsen to more than $9 billion from $7.6 billion the previous month.","O-Moreover O-, O-forecast X-##ers O-predict O-that O-the O-trade O-deficit O-for O-August O-, O-to O-be B-VBN-released O-today O-, O-will O-worse X-##n O-to O-more O-than O-$ O-9 O-billion O-from O-$ O-7 X-. X-6 O-billion O-the O-previous O-month O-."
"By the end of trading in Tokyo, the dollar was quoted at 1.8470 and 140.73 yen.","O-By O-the O-end O-of O-trading O-in O-Tokyo O-, O-the O-dollar O-was B-VBN-quoted O-at O-1 X-. X-84 X-##70 O-and O-140 X-. X-73 O-ye X-##n O-."
But the real fireworks began in European and early New York activity where traders were whipsawed by an inaccurate report of the stock market's opening and a statement by Federal Reserve Board Chairman Alan Greenspan.,O-But O-the O-real O-fireworks O-began O-in O-European O-and O-early O-New O-York O-activity O-where O-traders O-were B-VBN-whip X-##sa X-##wed O-by O-an O-in X-##ac X-##curate O-report O-of O-the O-stock O-market O-' X-s O-opening O-and O-a O-statement O-by O-Federal O-Reserve O-Board O-Chairman O-Alan O-Greens X-##pan O-.
The mistake was quickly corrected.,O-The O-mistake O-was O-quickly B-VBN-corrected O-.
A spokesman for Reuters in New York confirmed there was an error and that it was quickly corrected.,O-A O-spokesman O-for O-Re X-##uters O-in O-New O-York O-confirmed O-there O-was O-an O-error O-and O-that O-it O-was O-quickly B-VBN-corrected O-.
"Later, news wires reported that Mr. Greenspan said a speech he delivered last week in Moscow had been misinterpreted.","O-Later O-, O-news O-wires O-reported O-that O-Mr X-. O-Greens X-##pan O-said O-a O-speech O-he O-delivered O-last O-week O-in O-Moscow O-had B-VBN-been B-VBN-mi X-##sin X-##ter X-##p X-##ret X-##ed O-."
"""Investors who had been in dollars for a long time got out.","O-"" O-In X-##ves X-##tors O-who O-had B-VBN-been O-in O-dollars O-for O-a O-long O-time O-got O-out O-."
"Yet Heiko Thieme, an investment strategist for Deutsche Bank in New York, contended that Europeans hadn't purchased many American shares this year.","O-Yet O-He X-##iko O-T X-##hi X-##em X-##e O-, O-an O-investment O-s X-##trate X-##gis X-##t O-for O-Deutsche O-Bank O-in O-New O-York O-, O-con X-##tended O-that O-Europeans O-had O-n X-' X-t B-VBN-purchased O-many O-American O-shares O-this O-year O-."
"In early trading in Hong Kong Tuesday, gold was quoted at about $366.27 an ounce, down $2 an ounce from Monday.","O-In O-early O-trading O-in O-Hong O-Kong O-Tuesday O-, O-gold O-was B-VBN-quoted O-at O-about O-$ O-36 X-##6 X-. X-27 O-an O-ounce O-, O-down O-$ O-2 O-an O-ounce O-from O-Monday O-."
"Moody's Investors Service Inc. said it lowered ratings on about $650 million of Beatrice Co. debt, citing the closely held Chicago food concern's proposed recapitalization.","O-Moody O-' X-s O-In X-##ves X-##tors O-Service O-Inc O-. O-said O-it O-lowered O-ratings O-on O-about O-$ O-650 O-million O-of O-Beatrice O-Co X-. O-debt O-, O-citing O-the O-closely B-VBN-held O-Chicago O-food O-concern O-' X-s B-VBN-proposed O-re X-##cap X-##ital X-##ization O-."
"Moody's said the proposed recaptilization may ""limit the company's ability to realize its profit potential"" and that paying dividends from a new series of preferred could squeeze ""basic business operations.""","O-Moody O-' X-s O-said O-the B-VBN-proposed O-re X-##cap X-##til X-##ization O-may O-"" O-limit O-the O-company O-' X-s O-ability O-to O-realize O-its O-profit O-potential O-"" O-and O-that O-paying O-divide X-##nds O-from O-a O-new O-series O-of B-VBN-preferred O-could O-squeeze O-"" O-basic O-business O-operations O-. O-"""
Steven F. Kaplan was named a senior vice president of this graphics equipment company.,O-Steven O-F X-. O-Kaplan O-was B-VBN-named O-a O-senior O-vice O-president O-of O-this O-graphics O-equipment O-company O-.
"FEDERAL FUNDS: 8 11/16% high, 8 5/8% low, 8 5/8% near closing bid, 8 11/16% offered.","O-F X-##ED X-##ER X-##AL O-F X-##UN X-##DS O-: O-8 O-11 O-/ O-16 O-% O-high O-, O-8 O-5 O-/ O-8 O-% O-low O-, O-8 O-5 O-/ O-8 O-% O-near O-closing B-VBN-bid O-, O-8 O-11 O-/ O-16 O-% B-VBN-offered O-."
Reserves traded among commercial banks for overnight use in amounts of $1 million or more.,O-Reserves B-VBN-traded O-among O-commercial O-banks O-for O-overnight O-use O-in O-amounts O-of O-$ O-1 O-million O-or O-more O-.
COMMERCIAL PAPER placed directly by General Motors Acceptance Corp.: 8.40% 30 to 44 days; 8.325% 45 to 59 days; 8.10% 60 to 89 days; 8% 90 to 119 days; 7.85% 120 to 149 days; 7.70% 150 to 179 days; 7.375% 180 to 270 days.,O-CO X-##MM X-##ER X-##CI X-##AL O-PA X-##P X-##ER B-VBN-placed O-directly O-by O-General O-Motors O-A X-##cc X-##ept X-##ance O-Corp X-. O-: O-8 X-. X-40 O-% O-30 O-to O-44 O-days O-; O-8 X-. X-325 O-% O-45 O-to O-59 O-days O-; O-8 X-. X-10 O-% O-60 O-to O-89 O-days O-; O-8 O-% O-90 O-to O-119 O-days O-; O-7 X-. X-85 O-% O-120 O-to O-149 O-days O-; O-7 X-. X-70 O-% O-150 O-to O-179 O-days O-; O-7 X-. X-375 O-% O-180 O-to O-270 O-days O-.
"COMMERCIAL PAPER: High-grade unsecured notes sold through dealers by major corporations in multiples of $1,000: 8.50% 30 days; 8.40% 60 days; 8.375% 90 days.","O-CO X-##MM X-##ER X-##CI X-##AL O-PA X-##P X-##ER O-: O-High X-- X-grade O-un X-##se X-##cure X-##d O-notes B-VBN-sold O-through O-dealers O-by O-major O-corporations O-in O-multiple X-##s O-of O-$ O-1 X-, X-000 O-: O-8 X-. X-50 O-% O-30 O-days O-; O-8 X-. X-40 O-% O-60 O-days O-; O-8 X-. X-375 O-% O-90 O-days O-."
"Average of top rates paid by major New York banks on primary new issues of negotiable C.D.s, usually on amounts of $1 million and more.","O-Average O-of O-top O-rates B-VBN-paid O-by O-major O-New O-York O-banks O-on O-primary O-new O-issues O-of O-ne X-##got X-##iable O-C X-. X-D X-. X-s O-, O-usually O-on O-amounts O-of O-$ O-1 O-million O-and O-more O-."
LONDON INTERBANK OFFERED RATES (LIBOR): 8 5/8% one month; 8 9/16% three months; 8 7/16% six months; 8 7/16% one year.,O-L X-##ON X-##D X-##ON O-IN X-##TE X-##RB X-##AN X-##K B-VBN-OF X-##F X-##ER X-##ED O-RA X-##TE X-##S O-( O-L X-##IB X-##OR O-) O-: O-8 O-5 O-/ O-8 O-% O-one O-month O-; O-8 O-9 O-/ O-16 O-% O-three O-months O-; O-8 O-7 O-/ O-16 O-% O-six O-months O-; O-8 O-7 O-/ O-16 O-% O-one O-year O-.
The average of interbank offered rates for dollar deposits in the London market based on quotations at five major banks.,O-The O-average O-of O-inter X-##bank O-offered O-rates O-for O-dollar O-deposits O-in O-the O-London O-market B-VBN-based O-on O-quota X-##tions O-at O-five O-major O-banks O-.
"TREASURY BILLS: Results of the Monday, October 16, 1989, auction of short-term U.S. government bills, sold at a discount from face value in units of $10,000 to $1 million: 7.37% 13 weeks; 7.42% 26 weeks.","O-T X-##RE X-##AS X-##UR X-##Y O-B X-##IL X-##LS O-: O-Results O-of O-the O-Monday O-, O-October O-16 O-, O-1989 O-, O-auction O-of O-short X-- X-term O-U X-. X-S X-. O-government O-bills O-, B-VBN-sold O-at O-a O-discount O-from O-face O-value O-in O-units O-of O-$ O-10 X-, X-000 O-to O-$ O-1 O-million O-: O-7 X-. X-37 O-% O-13 O-weeks O-; O-7 X-. X-42 O-% O-26 O-weeks O-."
FEDERAL HOME LOAN MORTGAGE CORP. (Freddie Mac): Posted yields on 30-year mortgage commitments for delivery within 30 days.,O-F X-##ED X-##ER X-##AL O-H X-##OM X-##E O-L X-##OA X-##N O-M X-##OR X-##T X-##GA X-##GE O-CO X-##RP O-. O-( O-Freddie O-Mac O-) O-: B-VBN-Post X-##ed O-yields O-on O-30 X-- X-year O-mortgage O-commitments O-for O-delivery O-within O-30 O-days O-.
"9.88%, standard conventional fixed-rate mortgages; 7.875%, 2% rate capped one-year adjustable rate mortgages.","O-9 X-. X-88 O-% O-, O-standard O-conventional O-fixed X-- X-rate O-mortgage X-##s O-; O-7 X-. X-87 X-##5 O-% O-, O-2 O-% O-rate B-VBN-capped O-one X-- X-year O-adjust X-##able O-rate O-mortgage X-##s O-."
"FEDERAL NATIONAL MORTGAGE ASSOCIATION (Fannie Mae): Posted yields on 30 year mortgage commitments for delivery within 30 days (priced at par) 9.80%, standard conventional fixed-rate mortgages; 8.70%, 6/2 rate capped one-year adjustable rate mortgages.","O-F X-##ED X-##ER X-##AL O-N X-##AT X-##ION X-##AL O-M X-##OR X-##T X-##GA X-##GE O-AS X-##SO X-##CI X-##AT X-##ION O-( O-Fan X-##nie O-Mae O-) O-: B-VBN-Post X-##ed O-yields O-on O-30 O-year O-mortgage O-commitments O-for O-delivery O-within O-30 O-days O-( B-VBN-priced O-at O-par O-) O-9 X-. X-80 O-% O-, O-standard O-conventional O-fixed X-- X-rate O-mortgage X-##s O-; O-8 X-. X-70 O-% O-, O-6 O-/ O-2 O-rate B-VBN-capped O-one X-- X-year O-adjust X-##able O-rate O-mortgage X-##s O-."
"Michael A. Gaskin, 55 years old, was named president and chief executive officer of this manufacturer of industrial robots, succeeding Walter K. Weisel.","O-Michael O-A X-. O-Gas X-##kin O-, O-55 O-years O-old O-, O-was B-VBN-named O-president O-and O-chief O-executive O-officer O-of O-this O-manufacturer O-of O-industrial O-robots O-, O-succeeding O-Walter O-K X-. O-Wei X-##sel O-."
Inventories had been running at about this level -- one that economists regard as manageable -- for much of the year before they jumped to 1.54 months in July.,O-In X-##vent X-##ories O-had B-VBN-been O-running O-at O-about O-this O-level O-- X-- O-one O-that O-economists O-regard O-as O-manage X-##able O-- X-- O-for O-much O-of O-the O-year O-before O-they O-jumped O-to O-1 X-. X-54 O-months O-in O-July O-.
"In July, business inventories had climbed 0.9%, a number the department revised from its initial report of 0.6%.","O-In O-July O-, O-business O-inventor X-##ies O-had B-VBN-climbed O-0 X-. X-9 O-% O-, O-a O-number O-the O-department O-revised O-from O-its O-initial O-report O-of O-0 X-. X-6 O-% O-."
"The figures are in billions of dollars, seasonally adjusted:","O-The O-figures O-are O-in O-billion X-##s O-of O-dollars O-, O-seasonal X-##ly B-VBN-adjusted O-:"
"The IRS also said that it would create the position of chief financial officer, who will be hired from within the agency.","O-The O-I X-##RS O-also O-said O-that O-it O-would O-create O-the O-position O-of O-chief O-financial O-officer O-, O-who O-will O-be B-VBN-hired O-from O-within O-the O-agency O-."
"Mr. Goldberg, who took over as head of the IRS in July, has been disturbed by what he considers the inefficiency, waste and lack of coordination among the branches of the vast federal agency.","O-Mr X-. O-Goldberg O-, O-who O-took O-over O-as O-head O-of O-the O-I X-##RS O-in O-July O-, O-has B-VBN-been B-VBN-disturbed O-by O-what O-he O-considers O-the O-in X-##ef X-##ficiency O-, O-waste O-and O-lack O-of O-coordination O-among O-the O-branches O-of O-the O-vast O-federal O-agency O-."
"The IRS operates on a computer system designed in 1961, which it has been trying to modernize for years.","O-The O-I X-##RS O-operates O-on O-a O-computer O-system B-VBN-designed O-in O-1961 O-, O-which O-it O-has B-VBN-been O-trying O-to O-modern X-##ize O-for O-years O-."
"And the agency, which operated throughout fiscal 1989 with a $360 million budget shortfall, has been under a hiring freeze since last fall.","O-And O-the O-agency O-, O-which O-operated O-throughout O-fiscal O-1989 O-with O-a O-$ O-360 O-million O-budget O-short X-##fall O-, O-has B-VBN-been O-under O-a O-hiring O-freeze O-since O-last O-fall O-."
"""Capital spending and exports, which have been the driving force in this expansion, are showing clear signs of having the steam taken out of them,"" said Robert Dederick, economist for Northern Trust Co. in Chicago.","O-"" O-Capital O-spending O-and O-exports O-, O-which O-have B-VBN-been O-the O-driving O-force O-in O-this O-expansion O-, O-are O-showing O-clear O-signs O-of O-having O-the O-steam B-VBN-taken O-out O-of O-them O-, X-"" O-said O-Robert O-De X-##der X-##ick O-, O-economist O-for O-Northern O-Trust O-Co X-. O-in O-Chicago O-."
"The new reports of sluggishness, which were foreshadowed by an earlier Labor Department report that manufacturing payrolls dropped by 105,000 in September, give the Fed another reason to further ease its grip on credit and lower interest rates.","O-The O-new O-reports O-of O-s X-##lug X-##gis X-##hn X-##ess O-, O-which O-were B-VBN-fore X-##sha X-##do X-##wed O-by O-an O-earlier O-Labor O-Department O-report O-that O-manufacturing O-pay X-##rolls O-dropped O-by O-105 X-, X-000 O-in O-September O-, O-give O-the O-Fed O-another O-reason O-to O-further O-ease O-its O-grip O-on O-credit O-and O-lower O-interest O-rates O-."
"Factory output dropped 0.2%, its first decline since February, after having been unchanged in October.","O-Factory O-output O-dropped O-0 X-. X-2 O-% O-, O-its O-first O-decline O-since O-February O-, O-after O-having B-VBN-been O-unchanged O-in O-October O-."
"The declines mainly reflected widespread weakness in durable goods, those intended to last more than three years.","O-The O-decline X-##s O-mainly O-reflected O-widespread O-weakness O-in O-du X-##rable O-goods O-, O-those B-VBN-intended O-to O-last O-more O-than O-three O-years O-."
"The biggest drop was recorded by primary metals producers, a category that includes the steel industry.","O-The O-biggest O-drop O-was B-VBN-recorded O-by O-primary O-metals O-producers O-, O-a O-category O-that O-includes O-the O-steel O-industry O-."
"""You haven't seen the full effect of that yet.""","O-"" O-You O-have O-n X-' X-t B-VBN-seen O-the O-full O-effect O-of O-that O-yet O-. O-"""
Analysts don't expect the September surge in auto production to be repeated in the coming months.,O-Ana X-##ly X-##sts O-do O-n X-' X-t O-expect O-the O-September O-surge O-in O-auto O-production O-to O-be B-VBN-repeated O-in O-the O-coming O-months O-.
