Foreign investors reportedly started off selling but later joined in the buying.,O-Foreign O-investors O-reportedly O-started B-RP-off O-selling O-but O-later O-joined O-in O-the O-buying O-.
"In particular, Japanese investors will be keeping a wary eye on Wall Street to see whether Monday's 88.12-point rally holds up as fresh U.S. economic data are released.","O-In O-particular O-, O-Japanese O-investors O-will O-be O-keeping O-a O-wary O-eye O-on O-Wall O-Street O-to O-see O-whether O-Monday O-' X-s O-88 X-. X-12 X-- X-point O-rally O-holds B-RP-up O-as O-fresh O-U X-. X-S X-. O-economic O-data O-are O-released O-."
But the advance faltered as index-options traders and investors jittery about the U.K. economic outlook took over.,O-But O-the O-advance O-f X-##altered O-as O-index X-- X-options O-traders O-and O-investors O-ji X-##tter X-##y O-about O-the O-U X-. X-K X-. O-economic O-outlook O-took B-RP-over O-.
"Bass ended up 3 higher at 966, Guinness closed at 589, down 7, and Scottish & Newcastle dropped 11 to 359, but Whitbread Class A shares rose 17 to 363.","O-Bass O-ended B-RP-up O-3 O-higher O-at O-96 X-##6 O-, O-Guinness O-closed O-at O-58 X-##9 O-, O-down O-7 O-, O-and O-Scottish O-& O-Newcastle O-dropped O-11 O-to O-35 X-##9 O-, O-but O-W X-##hit X-##bre X-##ad O-Class O-A O-shares O-rose O-17 O-to O-36 X-##3 O-."
"But William O. Bourke, chairman and chief executive officer, said the ingot price ""appears to have bottomed out.""","O-But O-William O-O X-. O-Bo X-##ur X-##ke O-, O-chairman O-and O-chief O-executive O-officer O-, O-said O-the O-ing X-##ot O-price O-"" O-appears O-to O-have O-bottom X-##ed B-RP-out O-. O-"""
"Early in October, six Arab nations in the Persian Gulf jacked up prices sharply.","O-Early O-in O-October O-, O-six O-Arab O-nations O-in O-the O-Persian O-Gulf O-jack X-##ed B-RP-up O-prices O-sharply O-."
"In 1956, when Britain, France and Israel invaded Egypt to seize the Suez Canal, Arab producers cut off supplies to Europe.","O-In O-1956 O-, O-when O-Britain O-, O-France O-and O-Israel O-invaded O-Egypt O-to O-seize O-the O-Suez O-Canal O-, O-Arab O-producers O-cut B-RP-off O-supplies O-to O-Europe O-."
"By 1973, the U.S. was bringing in two million barrels of Arab oil a day, more than 10% of the 17.3 million barrels consumed daily.","O-By O-1973 O-, O-the O-U X-. X-S X-. O-was O-bringing B-RP-in O-two O-million O-barrels O-of O-Arab O-oil O-a O-day O-, O-more O-than O-10 O-% O-of O-the O-17 X-. X-3 O-million O-barrels O-consumed O-daily O-."
"Japan and Europe, far more dependent on Mideast oil than the U.S., wouldn't offend the Arabs or trade off their precious supplies.","O-Japan O-and O-Europe O-, O-far O-more O-dependent O-on O-Mid X-##eas X-##t O-oil O-than O-the O-U X-. X-S X-. O-, O-would O-n X-' X-t O-off X-##end O-the O-Arabs O-or O-trade B-RP-off O-their O-precious O-supplies O-."
"The spot dislocations that showed up were largely the result of confusion (much of it in Washington), though that was cold comfort for drivers waiting in mile-long lines at the gas pumps.","O-The O-spot O-di X-##s X-##location X-##s O-that O-showed B-RP-up O-were O-largely O-the O-result O-of O-confusion O-( O-much O-of O-it O-in O-Washington O-) O-, O-though O-that O-was O-cold O-comfort O-for O-drivers O-waiting O-in O-mile X-- X-long O-lines O-at O-the O-gas O-pumps O-."
"Debora Foster takes off her necklace, settles herself on a padded chair and gently leans forward.","O-De X-##bor X-##a O-Foster O-takes B-RP-off O-her O-necklace O-, O-settle X-##s O-herself O-on O-a O-padded O-chair O-and O-gently O-leans O-forward O-."
"""On days that I'm really busy,"" says Ms. Foster, who works in public relations for the company, ""it seems decadent to take time off for a massage.""","O-"" O-On O-days O-that O-I O-' X-m O-really O-busy O-, X-"" O-says O-Ms O-. O-Foster O-, O-who O-works O-in O-public O-relations O-for O-the O-company O-, O-"" O-it O-seems O-decade X-##nt O-to O-take O-time B-RP-off O-for O-a O-massage O-. O-"""
"""You build up a lot of tension working at a terminal all day,"" he says.","O-"" O-You O-build B-RP-up O-a O-lot O-of O-tension O-working O-at O-a O-terminal O-all O-day O-, X-"" O-he O-says O-."
"Elisa Byler, a St. Louis masseuse, won over officials at Emerson Electric Co., a maker of electrical and electronic equipment, by providing documents and other articles trumpeting the therapeutic benefits of massage.","O-Eli X-##sa O-By X-##ler O-, O-a O-St X-. O-Louis O-mass X-##eus X-##e O-, O-won B-RP-over O-officials O-at O-Emerson O-Electric O-Co X-. O-, O-a O-maker O-of O-electrical O-and O-electronic O-equipment O-, O-by O-providing O-documents O-and O-other O-articles O-trumpet X-##ing O-the O-therapeutic O-benefits O-of O-massage O-."
"""The culture is not ready to take off its clothes, lie down and be touched for an hour for $45,"" he says.","O-"" O-The O-culture O-is O-not O-ready O-to O-take B-RP-off O-its O-clothes O-, O-lie B-RP-down O-and O-be O-touched O-for O-an O-hour O-for O-$ O-45 O-, X-"" O-he O-says O-."
"""The idea is to keep the clothes on and to keep people seated.","O-"" O-The O-idea O-is O-to O-keep O-the O-clothes B-RP-on O-and O-to O-keep O-people O-seated O-."
"Three minutes into the massage, the man curled up, began shaking and turned red.","O-Three O-minutes O-into O-the O-massage O-, O-the O-man O-curled B-RP-up O-, O-began O-shaking O-and O-turned O-red O-."
"""It was a powerful point in my career,"" says the 31-year-old Mr. MacInnis, who has since taken out a $1 million liability policy for his business.","O-"" O-It O-was O-a O-powerful O-point O-in O-my O-career O-, X-"" O-says O-the O-31 X-- X-year X-- X-old O-Mr X-. O-Mac X-##I X-##nn X-##is O-, O-who O-has O-since O-taken B-RP-out O-a O-$ O-1 O-million O-liability O-policy O-for O-his O-business O-."
"Despite the number of fans that office massage has won, some purists look down on it, arguing that naked, full-body rubs are the only way to go.","O-Despite O-the O-number O-of O-fans O-that O-office O-massage O-has O-won O-, O-some O-pu X-##rist X-##s O-look B-RP-down O-on O-it O-, O-arguing O-that O-naked O-, O-full X-- X-body O-rub X-##s O-are O-the O-only O-way O-to O-go O-."
"Morgan Grenfell Group PLC said John Craven, group chief executive officer, is taking over the chairmanship of the merchant banking group from Sir Peter Carey, who is retiring.","O-Morgan O-G X-##ren X-##fell O-Group O-P X-##LC O-said O-John O-Craven O-, O-group O-chief O-executive O-officer O-, O-is O-taking B-RP-over O-the O-chairman X-##ship O-of O-the O-merchant O-banking O-group O-from O-Sir O-Peter O-Carey O-, O-who O-is O-retiring O-."
"Last year, Morgan Grenfell shut down its ailing U.K. securities operations.","O-Last O-year O-, O-Morgan O-G X-##ren X-##fell O-shut B-RP-down O-its O-a X-##iling O-U X-. X-K X-. O-securities O-operations O-."
"His duties will be taken over by Anthony Richmond-Watson, who has been elected deputy chairman.","O-His O-duties O-will O-be O-taken B-RP-over O-by O-Anthony O-Richmond X-- X-Watson O-, O-who O-has O-been O-elected O-deputy O-chairman O-."
"According to a spokesman, One Liberty will have paid out as dividends the required amount of its taxable income to maintain its legal status as a real estate investment trust.","O-According O-to O-a O-spokesman O-, O-One O-Liberty O-will O-have O-paid B-RP-out O-as O-divide X-##nds O-the O-required O-amount O-of O-its O-taxa X-##ble O-income O-to O-maintain O-its O-legal O-status O-as O-a O-real O-estate O-investment O-trust O-."
Federal Reserve officials sent another signal of their determination to shore up investor confidence.,O-Federal O-Reserve O-officials O-sent O-another O-signal O-of O-their O-determination O-to O-shore B-RP-up O-investor O-confidence O-.
"Much of the difference in Chrysler's car output compared with a year ago comes from having two fewer plants; Chrysler's now-shuttered facilities in Kenosha, Wis., turned out 51,000 subcompacts and mid-size cars in the 1988 fourth-quarter before it closed in December.","O-Much O-of O-the O-difference O-in O-Chrysler O-' X-s O-car O-output O-compared O-with O-a O-year O-ago O-comes O-from O-having O-two O-fewer O-plants O-; O-Chrysler O-' X-s O-now X-- X-shut X-##tered O-facilities O-in O-Ken X-##osh X-##a O-, O-W X-##is X-. O-, O-turned B-RP-out O-51 X-, X-000 O-sub X-##com X-##pa X-##cts O-and O-mid X-- X-size O-cars O-in O-the O-1988 O-fourth X-- X-quarter O-before O-it O-closed O-in O-December O-."
"(""Will the Real Jim Please Stand Up?""","O-( X-"" O-Will O-the O-Real O-Jim O-Please O-Stand B-RP-Up O-? O-"""
"The Corsica and Beretta make up the highest-volume car line at Chevrolet, but sales of the vehicles are off 9.6% for the year, and fell a steep 34% during early October.","O-The O-Co X-##rs X-##ica O-and O-Be X-##retta O-make B-RP-up O-the O-highest X-- X-volume O-car O-line O-at O-Chevrolet O-, O-but O-sales O-of O-the O-vehicles O-are O-off O-9 X-. X-6 O-% O-for O-the O-year O-, O-and O-fell O-a O-steep O-34 O-% O-during O-early O-October O-."
"Syndicates have traditionally turned down fatter fees from competitors, switching only when a newspaper dropped a feature or some unusual ownership change occurred.","O-Syndicate X-##s O-have O-traditionally O-turned B-RP-down O-fat X-##ter O-fees O-from O-competitors O-, O-switching O-only O-when O-a O-newspaper O-dropped O-a O-feature O-or O-some O-unusual O-ownership O-change O-occurred O-."
"Initially a majority of the directors, made up of syndicate executives, editors, cartoonists and columnists, supported the idea.","O-Initially O-a O-majority O-of O-the O-directors O-, O-made B-RP-up O-of O-s X-##yn X-##dicate O-executives O-, O-editors O-, O-cartoonist X-##s O-and O-columnist X-##s O-, O-supported O-the O-idea O-."
"But Universal's Mr. McMeel, the council's president, asked directors to reconsider, and they voted down the discussion 13-12, Mr. Colston says.","O-But O-Universal O-' X-s O-Mr X-. O-M X-##c X-##M X-##eel O-, O-the O-council O-' X-s O-president O-, O-asked O-directors O-to O-re X-##con X-##side X-##r O-, O-and O-they O-voted B-RP-down O-the O-discussion O-13 X-- X-12 O-, O-Mr X-. O-Col X-##ston O-says O-."
"In a sign of its continuing problems in the U.S. auto market, General Motors Corp. acknowledged that a key midsized-car plant will shut down for two weeks to cut bulging inventories of Pontiac Grand Prix models.","O-In O-a O-sign O-of O-its O-continuing O-problems O-in O-the O-U X-. X-S X-. O-auto O-market O-, O-General O-Motors O-Corp O-. O-acknowledged O-that O-a O-key O-mid X-##si X-##zed X-- X-car O-plant O-will O-shut B-RP-down O-for O-two O-weeks O-to O-cut O-b X-##ul X-##ging O-inventor X-##ies O-of O-Pontiac O-Grand O-Prix O-models O-."
"A federal appeals court struck down a natural-gas regulation that had prevented pipeline companies from passing to customers part of $1 billion in costs from controversial ""take-or-pay"" contracts.","O-A O-federal O-appeals O-court O-struck B-RP-down O-a O-natural X-- X-gas O-regulation O-that O-had O-prevented O-pipeline O-companies O-from O-passing O-to O-customers O-part O-of O-$ O-1 O-billion O-in O-costs O-from O-controversial O-"" O-take X-- X-or X-- X-pay O-"" O-contracts O-."
"The court, in a 3-0 ruling, threw out a deadline set by the Federal Energy Regulatory Commission for settling old contract disputes over gas that the pipeline companies reserved but didn't use.","O-The O-court O-, O-in O-a O-3 X-- X-0 O-ruling O-, O-threw B-RP-out O-a O-deadline O-set O-by O-the O-Federal O-Energy O-Reg X-##ulatory O-Commission O-for O-settling O-old O-contract O-disputes O-over O-gas O-that O-the O-pipeline O-companies O-reserved O-but O-did O-n X-' X-t O-use O-."
"FERC's regulation had given pipelines until March 31, 1989, to pass on to customers as much as 50% of the costs of buying out their broken contracts, which were made with producers when gas prices were high and supplies short.","O-F X-##ER X-##C O-' X-s O-regulation O-had O-given O-pipeline X-##s O-until O-March O-31 O-, O-1989 O-, O-to O-pass B-RP-on O-to O-customers O-as O-much O-as O-50 O-% O-of O-the O-costs O-of O-buying B-RP-out O-their O-broken O-contracts O-, O-which O-were O-made O-with O-producers O-when O-gas O-prices O-were O-high O-and O-supplies O-short O-."
"Robert I. Toussie, general partner of the investment group, said the Lionel response reflected management's entrenched position, saying officials had failed to come up with a better alternative to his group's offer.","O-Robert O-I X-. O-To X-##uss X-##ie O-, O-general O-partner O-of O-the O-investment O-group O-, O-said O-the O-Lionel O-response O-reflected O-management O-' X-s O-en X-##tre X-##nched O-position O-, O-saying O-officials O-had O-failed O-to O-come B-RP-up O-with O-a O-better O-alternative O-to O-his O-group O-' X-s O-offer O-."
They are enjoying domestic sales that are more than making up for lost overseas sales.,O-They O-are O-enjoying O-domestic O-sales O-that O-are O-more O-than O-making B-RP-up O-for O-lost O-overseas O-sales O-.
"In fact, some auto executives suggest that slackened demand for their cars in the U.S. and Canada is a blessing; otherwise they wouldn't be able to keep up with demand in the more profitable local market.","O-In O-fact O-, O-some O-auto O-executives O-suggest O-that O-slack X-##ened O-demand O-for O-their O-cars O-in O-the O-U X-. X-S X-. O-and O-Canada O-is O-a O-blessing O-; O-otherwise O-they O-would O-n X-' X-t O-be O-able O-to O-keep B-RP-up O-with O-demand O-in O-the O-more O-profitable O-local O-market O-."
"At that point domestic sales will slow down,"" says Kim Yoon Kwon, director of marketing for Daewoo Motor.","O-At O-that O-point O-domestic O-sales O-will O-slow B-RP-down O-, X-"" O-says O-Kim O-Yo X-##on O-K X-##won O-, O-director O-of O-marketing O-for O-Da X-##ew X-##oo O-Motor O-."
"A part of the construction-oriented conglomerate SsangYong Group, it took over the dying Dong-A Motor Co. in 1986.","O-A O-part O-of O-the O-construction X-- X-oriented O-conglomerate O-S X-##sang X-##Y X-##ong O-Group O-, O-it O-took B-RP-over O-the O-dying O-Dong X-- X-A O-Motor O-Co X-. O-in O-1986 O-."
"The quake, which also caused damage in San Jose and Berkeley, knocked out electricity and telephones, cracked roadways and disrupted subway service in the Bay Area.","O-The O-q X-##ua X-##ke O-, O-which O-also O-caused O-damage O-in O-San O-Jose O-and O-Berkeley O-, O-knocked B-RP-out O-electricity O-and O-telephone X-##s O-, O-cracked O-roadway X-##s O-and O-disrupted O-subway O-service O-in O-the O-Bay O-Area O-."
The amendment is aimed at skirting a Supreme Court ruling that threw out the conviction of a Texas flag-burner on grounds that his freedom of speech was violated.,O-The O-amendment O-is O-aimed O-at O-skirt X-##ing O-a O-Supreme O-Court O-ruling O-that O-threw B-RP-out O-the O-conviction O-of O-a O-Texas O-flag X-- X-burn X-##er O-on O-grounds O-that O-his O-freedom O-of O-speech O-was O-violated O-.
The report by the Defense Ministry also rejected allegations that Britain covered up evidence of Waldheim's activities as a German army officer.,O-The O-report O-by O-the O-Defense O-Ministry O-also O-rejected O-allegations O-that O-Britain O-covered B-RP-up O-evidence O-of O-W X-##ald X-##heim O-' X-s O-activities O-as O-a O-German O-army O-officer O-.
"The bank syndicate is made up mostly of European banks, but it includes China's state-owned Citic Industrial Bank.","O-The O-bank O-s X-##yn X-##dicate O-is O-made B-RP-up O-mostly O-of O-European O-banks O-, O-but O-it O-includes O-China O-' X-s O-state X-- X-owned O-C X-##itic O-Industrial O-Bank O-."
The 11 banks in the syndicate sustained no monetary losses because none of the credit facility had been drawn down.,O-The O-11 O-banks O-in O-the O-s X-##yn X-##dicate O-sustained O-no O-monetary O-losses O-because O-none O-of O-the O-credit O-facility O-had O-been O-drawn B-RP-down O-.
He also held out little hope of restitution for purchasers of $225 million in American Continental subordinated debt.,O-He O-also O-held B-RP-out O-little O-hope O-of O-rest X-##itution O-for O-purchase X-##rs O-of O-$ O-225 O-million O-in O-American O-Continental O-subordinate X-##d O-debt O-.
"""We have no plans at this time to pay off those notes,"" he said.","O-"" O-We O-have O-no O-plans O-at O-this O-time O-to O-pay B-RP-off O-those O-notes O-, X-"" O-he O-said O-."
His early promises to make India a modern nation remain bogged down in bloated bureaucracy.,O-His O-early O-promises O-to O-make O-India O-a O-modern O-nation O-remain O-b X-##ogged B-RP-down O-in O-b X-##loat X-##ed O-bureau X-##cracy O-.
"His pledge to clean up local administration and Indian politics, including his own party, went unfulfilled.","O-His O-pledge O-to O-clean B-RP-up O-local O-administration O-and O-Indian O-politics O-, O-including O-his O-own O-party O-, O-went O-un X-##ful X-##fill X-##ed O-."
"Even if the Congress (I) retains control of the government, Mr. Gandhi's ability to push through major initiatives might be hobbled by a thinner majority.","O-Even O-if O-the O-Congress O-( O-I O-) O-retains O-control O-of O-the O-government O-, O-Mr X-. O-Gandhi O-' X-s O-ability O-to O-push B-RP-through O-major O-initiatives O-might O-be O-ho X-##bbled O-by O-a O-thinner O-majority O-."
"His term has produced no spectacular failures in politics, in the economy or on the military front, and has chalked up some successes.","O-His O-term O-has O-produced O-no O-spectacular O-failures O-in O-politics O-, O-in O-the O-economy O-or O-on O-the O-military O-front O-, O-and O-has O-chalk X-##ed B-RP-up O-some O-successes O-."
"Before American foreign policy set out to destroy Noriega, it helped create him out of the crucible of Panama's long history of conspirators and pirates.","O-Before O-American O-foreign O-policy O-set B-RP-out O-to O-destroy O-Nor X-##ie X-##ga O-, O-it O-helped O-create O-him O-out O-of O-the O-c X-##ru X-##cible O-of O-Panama O-' X-s O-long O-history O-of O-con X-##sp X-##ira X-##tors O-and O-pirates O-."
"In keeping with America's long history of propping up Mr. Noriega, recent U.S. actions have extended rather than shortened his survival.","O-In O-keeping O-with O-America O-' X-s O-long O-history O-of O-prop X-##ping B-RP-up O-Mr X-. O-Nor X-##ie X-##ga O-, O-recent O-U X-. X-S X-. O-actions O-have O-extended O-rather O-than O-shortened O-his O-survival O-."
"He signed up for intelligence and counter-intelligence training under American officers at Fort Gulick in Panama in July 1967, according to a copy of a 1983 resume with details Mr. Noriega has since classified as secret.","O-He O-signed B-RP-up O-for O-intelligence O-and O-counter X-- X-intelligence O-training O-under O-American O-officers O-at O-Fort O-G X-##uli X-##ck O-in O-Panama O-in O-July O-1967 O-, O-according O-to O-a O-copy O-of O-a O-1983 O-resume O-with O-details O-Mr X-. O-Nor X-##ie X-##ga O-has O-since O-classified O-as O-secret O-."
"One DEA agent drew up a list of five options for dealing with Col. Noriega, one of which was assassination.","O-One O-DE X-##A O-agent O-drew B-RP-up O-a O-list O-of O-five O-options O-for O-dealing O-with O-Col X-. O-Nor X-##ie X-##ga O-, O-one O-of O-which O-was O-assassination O-."
"The question is how much you get tied in with seedy characters so they can extort you.""","O-The O-question O-is O-how O-much O-you O-get O-tied B-RP-in O-with O-seed X-##y O-characters O-so O-they O-can O-ex X-##tor X-##t O-you O-. O-"""
And the investigators were quickly closing in on Mr. Noriega himself.,O-And O-the O-investigators O-were O-quickly O-closing B-RP-in O-on O-Mr X-. O-Nor X-##ie X-##ga O-himself O-.
"In August 1983, Mr. Noriega took over as General and de-facto dictator of Panama, having maneuvered his way to the top only two years after the mysterious death in a plane crash of his old boss Omar Torrijos.","O-In O-August O-1983 O-, O-Mr X-. O-Nor X-##ie X-##ga O-took B-RP-over O-as O-General O-and O-de X-- X-facto O-dictator O-of O-Panama O-, O-having O-maneuver X-##ed O-his O-way O-to O-the O-top O-only O-two O-years O-after O-the O-mysterious O-death O-in O-a O-plane O-crash O-of O-his O-old O-boss O-Omar O-Tor X-##ri X-##jos O-."
Mr. Blandon says the general allowed the Contras to set up a secret training center in Panama.,O-Mr X-. O-B X-##land X-##on O-says O-the O-general O-allowed O-the O-Con X-##tras O-to O-set B-RP-up O-a O-secret O-training O-center O-in O-Panama O-.
"He says Mr. Briggs told him he was being set up for a ""honey trap,"" in which Mr. Noriega would try to involve him in an orgy and then record the event ""with sound and video.""","O-He O-says O-Mr X-. O-Briggs O-told O-him O-he O-was O-being O-set B-RP-up O-for O-a O-"" O-honey O-trap O-, X-"" O-in O-which O-Mr X-. O-Nor X-##ie X-##ga O-would O-try O-to O-involve O-him O-in O-an O-org X-##y O-and O-then O-record O-the O-event O-"" O-with O-sound O-and O-video O-. O-"""
"As recounted in a stipulation that summarized government documents released for the North trial, Mr. Noriega offered to assassinate the Sandinista leadership in exchange ""for a promise to help clean up Noriega's image and a commitment to lift the {U.S.} ban on military sales to the Panamanian Defense Forces.""","O-As O-recounted O-in O-a O-s X-##tip X-##ulation O-that O-summarized O-government O-documents O-released O-for O-the O-North O-trial O-, O-Mr X-. O-Nor X-##ie X-##ga O-offered O-to O-assassin X-##ate O-the O-Sand X-##ini X-##sta O-leadership O-in O-exchange O-"" O-for O-a O-promise O-to O-help O-clean B-RP-up O-Nor X-##ie X-##ga O-' X-s O-image O-and O-a O-commitment O-to O-lift O-the O-{ O-U X-. X-S X-. O-} O-ban O-on O-military O-sales O-to O-the O-Panama X-##nian O-Defense O-Forces O-. O-"""
"The representative responded that Noriega had numerous assets in place in Nicaragua and could accomplish many essential things, just as Noriega had helped {the U.S.} the previous year in blowing up a Sandinista arsenal.""","O-The O-representative O-responded O-that O-Nor X-##ie X-##ga O-had O-numerous O-assets O-in O-place O-in O-Nicaragua O-and O-could O-accomplish O-many O-essential O-things O-, O-just O-as O-Nor X-##ie X-##ga O-had O-helped O-{ O-the O-U X-. X-S X-. O-} O-the O-previous O-year O-in O-blowing B-RP-up O-a O-Sand X-##ini X-##sta O-a X-##rsen X-##al O-. O-"""
"""For short-term gains, people were willing to put up with him.","O-"" O-For O-short X-- X-term O-gains O-, O-people O-were O-willing O-to O-put B-RP-up O-with O-him O-."
"Including Monday's plunge, that has given the two executives paper losses of $49.5 million, based on what they would have realized had the pilots and management-led buy-out of UAL gone through at $300 a share.","O-Including O-Monday O-' X-s O-p X-##lung X-##e O-, O-that O-has O-given O-the O-two O-executives O-paper O-losses O-of O-$ O-49 X-. X-5 O-million O-, O-based O-on O-what O-they O-would O-have O-realized O-had O-the O-pilots O-and O-management X-- X-led O-buy X-- X-out O-of O-U X-##AL O-gone B-RP-through O-at O-$ O-300 O-a O-share O-."
"Conceivably, in a scaled-back buy-out, they could be bumped back to coach seats for life.","O-Con X-##ce X-##iva X-##bly O-, O-in O-a O-scaled X-- X-back O-buy X-- X-out O-, O-they O-could O-be O-bumped B-RP-back O-to O-coach O-seats O-for O-life O-."
"""December delivery gold is trading in a range of $365 to $375 {an ounce} and is having difficulty breaking out above that,"" Mr. Savaiko said.","O-"" O-December O-delivery O-gold O-is O-trading O-in O-a O-range O-of O-$ O-365 O-to O-$ O-375 O-{ O-an O-ounce O-} O-and O-is O-having O-difficulty O-breaking B-RP-out O-above O-that O-, X-"" O-Mr X-. O-Sa X-##va X-##iko O-said O-."
"""They still bear the memory of October 1987, when they bought gold after the stock market crashed and ended up losing money because gold prices subsequently fell,"" Mr. Nichols said.","O-"" O-They O-still O-bear O-the O-memory O-of O-October O-1987 O-, O-when O-they O-bought O-gold O-after O-the O-stock O-market O-crashed O-and O-ended B-RP-up O-losing O-money O-because O-gold O-prices O-subsequently O-fell O-, X-"" O-Mr X-. O-Nichols O-said O-."
"Previously, he noted, gold producers tended to back off from a rising gold market, letting prices rise as much as possible before selling.","O-Previously O-, O-he O-noted O-, O-gold O-producers O-tended O-to O-back B-RP-off O-from O-a O-rising O-gold O-market O-, O-letting O-prices O-rise O-as O-much O-as O-possible O-before O-selling O-."
"LIVESTOCK AND MEATS: The prices of cattle, hogs and pork belly futures contracts rebounded as livestock traders shook off fears that the Friday stock market plunge would chill consumer spending, which in turn would hurt retail sales of beef and pork.","O-L X-##IVE X-##ST X-##OC X-##K O-AND O-ME X-##AT X-##S O-: O-The O-prices O-of O-cattle O-, O-ho X-##gs O-and O-pork O-belly O-future X-##s O-contracts O-re X-##bound X-##ed O-as O-livestock O-traders O-shook B-RP-off O-fears O-that O-the O-Friday O-stock O-market O-p X-##lung X-##e O-would O-chill O-consumer O-spending O-, O-which O-in O-turn O-would O-hurt O-retail O-sales O-of O-beef O-and O-pork O-."
An analyst called it one of the worst trade reports since the dollar bottomed out in,O-An O-analyst O-called O-it O-one O-of O-the O-worst O-trade O-reports O-since O-the O-dollar O-bottom X-##ed B-RP-out O-in
Bank of New England plans to sell some operations and lay off 4% of its work force after a year of weak earnings and mounting loan problems.,O-Bank O-of O-New O-England O-plans O-to O-sell O-some O-operations O-and O-lay B-RP-off O-4 O-% O-of O-its O-work O-force O-after O-a O-year O-of O-weak O-earnings O-and O-mounting O-loan O-problems O-.
