"Thus, in an unprecedented arrangement underscoring the seriousness of the transfer, the CBOE, the American Stock Exchange and the Options Clearing Corp., as well as the firm's owner, Stephen Fossett, put up a total of $50 million to guarantee the customer positions being transferred to the bank holding company subsidiary in case the market plunged again yesterday.","O-Thus O-, O-in O-an O-unprecedented O-arrangement O-under X-##sco X-##ring O-the O-serious X-##ness O-of O-the O-transfer O-, O-the O-CB X-##OE O-, O-the O-American O-Stock O-Exchange O-and O-the O-Op X-##tions O-Clear X-##ing O-Corp X-. O-, O-as O-well O-as O-the O-firm O-' X-s O-owner O-, O-Stephen O-F X-##oss X-##ett O-, O-put O-up O-a O-total O-of O-$ O-50 O-million O-to O-guarantee O-the O-customer O-positions O-being B-VBN-transferred O-to O-the O-bank O-holding O-company O-subsidiary O-in O-case O-the O-market O-plunged O-again O-yesterday O-."
"S. Waite Rawls III, vice chairman of Continental Bank, First Options' parent company, said the firm took on about 160 accounts formerly held by Fossett, almost all of them belonging to professional floor traders.","O-S X-. O-Wait X-##e O-Raw X-##ls O-III O-, O-vice O-chairman O-of O-Continental O-Bank O-, O-First O-Op X-##tions X-' O-parent O-company O-, O-said O-the O-firm O-took O-on O-about O-160 O-accounts O-formerly B-VBN-held O-by O-F X-##oss X-##ett O-, O-almost O-all O-of O-them O-belonging O-to O-professional O-floor O-traders O-."
"""A package of credit support was put together -- including the assets of Steve and his firm.""","O-"" O-A O-package O-of O-credit O-support O-was B-VBN-put O-together O-- X-- O-including O-the O-assets O-of O-Steve O-and O-his O-firm O-. O-"""
"The bailout was cobbled together over the weekend, with officials from the Federal Reserve Board, Securities and Exchange Commission, Comptroller of the Currency and Treasury as well as the options exchanges.","O-The O-bail X-##out O-was B-VBN-co X-##bbled O-together O-over O-the O-weekend O-, O-with O-officials O-from O-the O-Federal O-Reserve O-Board O-, O-Securities O-and O-Exchange O-Commission O-, O-Co X-##mpt X-##roll X-##er O-of O-the O-C X-##ur X-##ren X-##cy O-and O-Treasury O-as O-well O-as O-the O-options O-exchanges O-."
"Yesterday's rally in the stock, futures and options markets led CBOE and Amex officials to conclude that the $50 million in guarantees almost certainly won't need to be tapped by First Options.","O-Yesterday O-' X-s O-rally O-in O-the O-stock O-, O-future X-##s O-and O-options O-markets O-led O-CB X-##OE O-and O-Am X-##ex O-officials O-to O-conclude O-that O-the O-$ O-50 O-million O-in O-guarantees O-almost O-certainly O-w X-##o O-n X-' X-t O-need O-to O-be B-VBN-tapped O-by O-First O-Op X-##tions O-."
"A federal official said that Continental Bank worked with securities and banking regulators over the weekend to fashion the Fossett bailout, but that conditions weren't dictated by those agencies.","O-A O-federal O-official O-said O-that O-Continental O-Bank O-worked O-with O-securities O-and O-banking O-regulator X-##s O-over O-the O-weekend O-to O-fashion O-the O-F X-##oss X-##ett O-bail X-##out O-, O-but O-that O-conditions O-were O-n X-' X-t B-VBN-dictated O-by O-those O-agencies O-."
Mr. Fossett couldn't be reached to comment.,O-Mr X-. O-F X-##oss X-##ett O-could O-n X-' X-t O-be B-VBN-reached O-to O-comment O-.
Could the collapse of I-880 have been prevented?,O-Could O-the O-collapse O-of O-I X-- X-88 X-##0 O-have B-VBN-been B-VBN-prevented O-?
The impact of the destruction of this 2.5-mile stretch of highway was tragically measured in lost lives.,O-The O-impact O-of O-the O-destruction O-of O-this O-2 X-. X-5 X-- X-mile O-stretch O-of O-highway O-was O-tragic X-##ally B-VBN-measured O-in B-VBN-lost O-lives O-.
"It could easily be two years before the well-traveled artery that helps connect Oakland with San Francisco is reopened, and the cost to build a new stretch of highway could soar to more than $250 million, said Charles J. O'Connell, deputy district director in Los Angeles of the California Department of Transportation, nicknamed Caltrans.","O-It O-could O-easily O-be O-two O-years O-before O-the O-well X-- X-traveled O-artery O-that O-helps O-connect O-Oakland O-with O-San O-Francisco O-is B-VBN-reopened O-, O-and O-the O-cost O-to O-build O-a O-new O-stretch O-of O-highway O-could O-so X-##ar O-to O-more O-than O-$ O-250 O-million O-, O-said O-Charles O-J O-. O-O X-' X-Connell O-, O-deputy O-district O-director O-in O-Los O-Angeles O-of O-the O-California O-Department O-of O-Transportation O-, B-VBN-nicknamed O-Cal X-##tra X-##ns O-."
Caltrans in Sacramento said total damage from the collapsed highway is estimated at around $500 million.,O-Cal X-##tra X-##ns O-in O-Sacramento O-said O-total O-damage O-from O-the B-VBN-collapsed O-highway O-is B-VBN-estimated O-at O-around O-$ O-500 O-million O-.
"""We've run out of places to build freeways in L.A., and the only place to go is up,"" Mr. O'Connell said, although he acknowledges there are many obstacles, including cost.","O-"" O-We O-' X-ve B-VBN-run O-out O-of O-places O-to O-build O-freeway X-##s O-in O-L X-. X-A X-. O-, O-and O-the O-only O-place O-to O-go O-is O-up O-, X-"" O-Mr X-. O-O X-' X-Connell O-said O-, O-although O-he O-acknowledge X-##s O-there O-are O-many O-obstacles O-, O-including O-cost O-."
"But as for safety, he says double-deck freeways built today with the heavily reinforced concrete and thicker columns required after the Sylmar quake should withstand a calamitous temblor of 7.5 to 8 on the Richter scale.","O-But O-as O-for O-safety O-, O-he O-says O-double X-- X-deck O-freeway X-##s B-VBN-built O-today O-with O-the O-heavily B-VBN-reinforced O-concrete O-and O-thicker O-columns B-VBN-required O-after O-the O-S X-##yl X-##mar O-q X-##ua X-##ke O-should O-withstand O-a O-ca X-##lam X-##ito X-##us O-te X-##mb X-##lor O-of O-7 X-. X-5 O-to O-8 O-on O-the O-Richter O-scale O-."
"The two-story roadway, designed in the mid-1940s and completed in 1957, was supported by columns that apparently lacked the kind of steel reinforcement used in highways today.","O-The O-two X-- X-story O-roadway O-, B-VBN-designed O-in O-the O-mid X-- X-1940s O-and B-VBN-completed O-in O-1957 O-, O-was B-VBN-supported O-by O-columns O-that O-apparently O-lacked O-the O-kind O-of O-steel O-reinforce X-##ment B-VBN-used O-in O-highways O-today O-."
"But in the case of the Nimitz Freeway, the lack of such support caused the core of the columns to crumble and buckle under the weight of the second deck, crushing motorists who were lined up in bumper-to-bumper rush-hour traffic on the lower deck nearly 15 feet below.","O-But O-in O-the O-case O-of O-the O-Ni X-##mit X-##z O-Freeway O-, O-the O-lack O-of O-such O-support O-caused O-the O-core O-of O-the O-columns O-to O-c X-##rum X-##ble O-and O-b X-##uckle O-under O-the O-weight O-of O-the O-second O-deck O-, O-crushing O-motor X-##ists O-who O-were B-VBN-lined O-up O-in O-bumper X-- X-to X-- X-bumper O-rush X-- X-hour O-traffic O-on O-the O-lower O-deck O-nearly O-15 O-feet O-below O-."
The firm brought in to strengthen the structure could be liable as well.,O-The O-firm B-VBN-brought O-in O-to O-strengthen O-the O-structure O-could O-be O-liable O-as O-well O-.
"The results of the quake certainly raise questions about whether reasonable care was taken, Mr. Messina says.","O-The O-results O-of O-the O-q X-##ua X-##ke O-certainly O-raise O-questions O-about O-whether O-reasonable O-care O-was B-VBN-taken O-, O-Mr X-. O-Me X-##ssin X-##a O-says O-."
"Given the seismic history of the Bay Area, ""it seems to me that a 6.9 earthquake is a foreseeable event.""","B-VBN-Given O-the O-se X-##ismic O-history O-of O-the O-Bay O-Area O-, O-"" O-it O-seems O-to O-me O-that O-a O-6 X-. X-9 O-earthquake O-is O-a O-fore X-##see X-##able O-event O-. O-"""
"""The work was done properly,"" he said.","O-"" O-The O-work O-was B-VBN-done O-properly O-, X-"" O-he O-said O-."
"But only bridges supported with single rows of columns were top priority, and the Nimitz Freeway, supported by double rows, was left out, Mr. Drago explained.","O-But O-only O-bridges B-VBN-supported O-with O-single O-rows O-of O-columns O-were O-top O-priority O-, O-and O-the O-Ni X-##mit X-##z O-Freeway O-, B-VBN-supported O-by O-double O-rows O-, O-was B-VBN-left O-out O-, O-Mr X-. O-Dr X-##ago O-explained O-."
"The Boston Globe says its newly redesigned pages have a ""crisper"" look with revamped fixtures aimed at making the paper ""more consistent"" and ""easier to read.""","O-The O-Boston O-Globe O-says O-its O-newly B-VBN-redesigned O-pages O-have O-a O-"" O-crisp X-##er O-"" O-look O-with B-VBN-re X-##va X-##mp X-##ed O-fixtures B-VBN-aimed O-at O-making O-the O-paper O-"" O-more O-consistent O-"" O-and O-"" O-easier O-to O-read O-. O-"""
"Ray"" Berry, yesterday poured ridicule on new drawings of Globe columnists that replaced old photos in the revamped pages this week.","O-Ray O-"" O-Berry O-, O-yesterday O-poured O-rid X-##ic X-##ule O-on O-new O-drawings O-of O-Globe O-columnist X-##s O-that O-replaced O-old O-photos O-in O-the B-VBN-re X-##va X-##mp X-##ed O-pages O-this O-week O-."
Mr. Barnicle reminded readers that he still hasn't forgiven Globe management for questioning a $20 expense chit he submitted for parking his car while chasing a story.,O-Mr X-. O-Bar X-##nic X-##le O-reminded O-readers O-that O-he O-still O-has O-n X-' X-t B-VBN-forgive X-##n O-Globe O-management O-for O-questioning O-a O-$ O-20 O-expense O-ch X-##it O-he O-submitted O-for O-parking O-his O-car O-while O-chasing O-a O-story O-.
". . or a guy who boasted he'd been Charles Manson's roommate for the last 19 years,"" he said.","O-. O-. O-or O-a O-guy O-who O-boasted O-he O-' X-d B-VBN-been O-Charles O-Manson O-' X-s O-roommate O-for O-the O-last O-19 O-years O-, X-"" O-he O-said O-."
"Rival Boston Herald columnist Howie Carr, who usually rails at Statehouse ""hacks"" and nepotism, argued that the new drawings were designed to hide Mr. Madden's ""rapidly growing forehead"" and the facial defects of ""chinless"" Dan Shaughnessy, a Globe sports columnist.","O-R X-##ival O-Boston O-Herald O-columnist O-How X-##ie O-Carr O-, O-who O-usually O-rails O-at O-State X-##house O-"" O-ha X-##cks O-"" O-and O-ne X-##pot X-##ism O-, O-argued O-that O-the O-new O-drawings O-were B-VBN-designed O-to O-hide O-Mr X-. O-Mad X-##den O-' X-s O-"" O-rapidly O-growing O-forehead O-"" O-and O-the O-facial O-defects O-of O-"" O-chin X-##less O-"" O-Dan O-S X-##ha X-##ugh X-##ness X-##y O-, O-a O-Globe O-sports O-columnist O-."
"The Financial Services division has guaranteed the Dorrance family that it will receive a minimum of $100 million for the collection, regardless of what the bids for the art works total, people close to the transaction say.","O-The O-Financial O-Services O-division O-has B-VBN-guaranteed O-the O-Do X-##rra X-##nce O-family O-that O-it O-will O-receive O-a O-minimum O-of O-$ O-100 O-million O-for O-the O-collection O-, O-regardless O-of O-what O-the O-bids O-for O-the O-art O-works O-total O-, O-people O-close O-to O-the O-transaction O-say O-."
"Normally, Sotheby's would have earned 20% of the total in commissions.","O-Normally O-, O-So X-##the X-##by O-' X-s O-would O-have B-VBN-earned O-20 O-% O-of O-the O-total O-in O-commissions O-."
"Buried in the glossy hardbound catalog for the sale, however, appears the statement, ""Sotheby's has an interest in the property in this catalog.""","B-VBN-B X-##uri X-##ed O-in O-the O-glossy O-hard X-##bound O-catalog O-for O-the O-sale O-, O-however O-, O-appears O-the O-statement O-, O-"" O-So X-##the X-##by O-' X-s O-has O-an O-interest O-in O-the O-property O-in O-this O-catalog O-. O-"""
"Sotheby's made the $100 million guarantee to keep the Dorrance collection away from its archrival, auction house Christie's International PLC; Christie's has handled smaller sales for the Dorrance family over the years.","O-So X-##the X-##by O-' X-s O-made O-the O-$ O-100 O-million O-guarantee O-to O-keep O-the O-Do X-##rra X-##nce O-collection O-away O-from O-its O-arch X-##ri X-##val O-, O-auction O-house O-Christie O-' X-s O-International O-P X-##LC O-; O-Christie O-' X-s O-has B-VBN-handled O-smaller O-sales O-for O-the O-Do X-##rra X-##nce O-family O-over O-the O-years O-."
"When Christie's officials asked why the firm wasn't picked to sell the Dorrance collection, representatives of the Dorrance family ""told us it was a question of financial considerations,"" said Michael Findlay, Christie's head of impressionist and modern paintings.","O-When O-Christie O-' X-s O-officials O-asked O-why O-the O-firm O-was O-n X-' X-t B-VBN-picked O-to O-sell O-the O-Do X-##rra X-##nce O-collection O-, O-representatives O-of O-the O-Do X-##rra X-##nce O-family O-"" O-told O-us O-it O-was O-a O-question O-of O-financial O-considerations O-, X-"" O-said O-Michael O-Find X-##lay O-, O-Christie O-' X-s O-head O-of O-impression X-##ist O-and O-modern O-paintings O-."
"Collectors who have made their money on Wall Street have become an increasingly important part of the art business and their money has helped fuel the art boom, but recently it appears Sotheby's has been returning the compliment.","O-Collector X-##s O-who O-have B-VBN-made O-their O-money O-on O-Wall O-Street O-have B-VBN-become O-an O-increasingly O-important O-part O-of O-the O-art O-business O-and O-their O-money O-has B-VBN-helped O-fuel O-the O-art O-boom O-, O-but O-recently O-it O-appears O-So X-##the X-##by O-' X-s O-has B-VBN-been O-returning O-the O-compliment O-."
"But two weeks ago, Sotheby's said that it has the painting under lock and key because the loan had not been fully repaid.","O-But O-two O-weeks O-ago O-, O-So X-##the X-##by O-' X-s O-said O-that O-it O-has O-the O-painting O-under O-lock O-and O-key O-because O-the O-loan O-had O-not B-VBN-been O-fully B-VBN-re X-##pa X-##id O-."
"But it's likely that Sotheby's will take a higher than usual commission, called an override, on the amount exceeding the guarantee.","O-But O-it O-' X-s O-likely O-that O-So X-##the X-##by O-' X-s O-will O-take O-a O-higher O-than O-usual O-commission O-, B-VBN-called O-an O-over X-##ride O-, O-on O-the O-amount O-exceeding O-the O-guarantee O-."
Sotheby's has been aggressively promoting the Dorrance sale.,O-So X-##the X-##by O-' X-s O-has B-VBN-been O-aggressively O-promoting O-the O-Do X-##rra X-##nce O-sale O-.
"More recently, Sotheby's has predicted the collection will fetch $140 million.","O-More O-recently O-, O-So X-##the X-##by O-' X-s O-has B-VBN-predicted O-the O-collection O-will O-fetch O-$ O-140 O-million O-."
"The decision to put the entire collection on the block stunned many, since Mr. Dorrance had served as chairman of the Philadelphia Museum of Art, and it had been assumed many of the works would be donated to the institution.","O-The O-decision O-to O-put O-the O-entire O-collection O-on O-the O-block O-stunned O-many O-, O-since O-Mr X-. O-Do X-##rra X-##nce O-had B-VBN-served O-as O-chairman O-of O-the O-Philadelphia O-Museum O-of O-Art O-, O-and O-it O-had B-VBN-been B-VBN-assumed O-many O-of O-the O-works O-would O-be B-VBN-donated O-to O-the O-institution O-."
"At last night's sale, 13 of 44 works that sold were purchased by Aska International Gallery, the art-acquisition unit of Aichi Financial, a Japanese conglomerate that owns 7.5% of Christie's.","O-At O-last O-night O-' X-s O-sale O-, O-13 O-of O-44 O-works O-that O-sold O-were B-VBN-purchased O-by O-Ask X-##a O-International O-Gallery O-, O-the O-art X-- X-acquisition O-unit O-of O-Ai X-##chi O-Financial O-, O-a O-Japanese O-conglomerate O-that O-owns O-7 X-. X-5 O-% O-of O-Christie O-' X-s O-."
"While he adds that he has no problem with auction houses who sell works in which they have a financial interest, ""It ought not to be hidden in some small print.""","O-While O-he O-adds O-that O-he O-has O-no O-problem O-with O-auction O-houses O-who O-sell O-works O-in O-which O-they O-have O-a O-financial O-interest O-, O-"" O-It O-ought O-not O-to O-be B-VBN-hidden O-in O-some O-small O-print O-. O-"""
"For example, an auction house's comments on the condition of a work of art that is up for sale should be looked at with ""very open eyes,"" he says.","O-For O-example O-, O-an O-auction O-house O-' X-s O-comments O-on O-the O-condition O-of O-a O-work O-of O-art O-that O-is O-up O-for O-sale O-should O-be B-VBN-looked O-at O-with O-"" O-very O-open O-eyes O-, X-"" O-he O-says O-."
"In January, two small New York galleries, the Coe Kerr Gallery and Beadleston Fine Arts, snatched a major art collection owned by the Askin family away from rival auction-house bidders with an up-front payment of about $25 million.","O-In O-January O-, O-two O-small O-New O-York O-galleries O-, O-the O-Co X-##e O-Kerr O-Gallery O-and O-Be X-##ad X-##les X-##ton O-Fine O-Arts O-, O-snatched O-a O-major O-art O-collection B-VBN-owned O-by O-the O-Ask X-##in O-family O-away O-from O-rival O-auction X-- X-house O-bid X-##ders O-with O-an O-up X-- X-front O-payment O-of O-about O-$ O-25 O-million O-."
"The dividend represents the balance of its regular quarterly payout of 10 cents a share, of which half was paid July 17 in a final distribution prior to its merger with B.B.","O-The O-divide X-##nd O-represents O-the O-balance O-of O-its O-regular O-quarterly O-pay X-##out O-of O-10 O-cents O-a O-share O-, O-of O-which O-half O-was B-VBN-paid O-July O-17 O-in O-a O-final O-distribution O-prior O-to O-its O-merger O-with O-B X-. X-B O-."
It attracts people with funny hair (or with no hair -- in front of me a girl with spiked locks sat beside a boy who had shaved his).,O-It O-attracts O-people O-with O-funny O-hair O-( O-or O-with O-no O-hair O-- X-- O-in O-front O-of O-me O-a O-girl O-with B-VBN-spike X-##d O-locks B-VBN-sat O-beside O-a O-boy O-who O-had B-VBN-shaved O-his O-) O-.
"Whoever constitute the local Left Bank come out in force, dressed in black, along with a smattering of yuppies who want to be on the cutting edge.","O-Whoever O-constitute O-the O-local O-Left O-Bank O-come O-out O-in O-force O-, B-VBN-dressed O-in O-black O-, O-along O-with O-a O-s X-##mat X-##tering O-of O-y X-##up X-##pies O-who O-want O-to O-be O-on O-the O-cutting O-edge O-."
"And, if still conscious at the evening's end, you notice something else: The audience, at first entranced and hypnotized by the music, releases its pent-up feelings in collective gratitude.","O-And O-, O-if O-still O-conscious O-at O-the O-evening O-' X-s O-end O-, O-you O-notice O-something O-else O-: O-The O-audience O-, O-at O-first B-VBN-entrance X-##d O-and B-VBN-h X-##y X-##p X-##not X-##ized O-by O-the O-music O-, O-releases O-its O-pen X-##t X-- X-up O-feelings O-in O-collective O-gratitude O-."
"Currently in the middle of a four-week, 20-city tour as a solo pianist, Mr. Glass has left behind his synthesizers, equipment and collaborators in favor of going it alone.","O-Currently O-in O-the O-middle O-of O-a O-four X-- X-week O-, O-20 X-- X-city O-tour O-as O-a O-solo O-pianist O-, O-Mr X-. O-Glass O-has B-VBN-left O-behind O-his O-synthesizers O-, O-equipment O-and O-collaborators O-in O-favor O-of O-going O-it O-alone O-."
"The typical Glass audience, which is more likely to be composed of music students than their teachers, certainly does.","O-The O-typical O-Glass O-audience O-, O-which O-is O-more O-likely O-to O-be B-VBN-composed O-of O-music O-students O-than O-their O-teachers O-, O-certainly O-does O-."
"The piano compositions, which have been labeled variously as minimalist, Oriental, repetitive, cyclical, monophonic and hypnotic, are relentlessly tonal (therefore unthreatening), unvaryingly rhythmic (therefore soporific), and unflaggingly harmonious but unmelodic (therefore both pretty and unconventional).","O-The O-piano O-compositions O-, O-which O-have B-VBN-been B-VBN-labeled O-variously O-as O-minimal X-##ist O-, O-Oriental O-, O-repetitive O-, O-c X-##yclic X-##al O-, O-mon X-##op X-##hon X-##ic O-and O-h X-##y X-##p X-##not X-##ic O-, O-are O-relentless X-##ly O-ton X-##al O-( O-therefore O-un X-##th X-##reate X-##ning O-) O-, O-un X-##vary X-##ingly O-rhythmic O-( O-therefore O-so X-##por X-##ific O-) O-, O-and O-un X-##f X-##lag X-##ging X-##ly O-harm X-##oni X-##ous O-but O-un X-##mel X-##od X-##ic O-( O-therefore O-both O-pretty O-and O-unconventional O-) O-."
"Mr. Glass has inverted the famous modernist dictum ""less is more.""","O-Mr X-. O-Glass O-has B-VBN-inverted O-the O-famous O-modernist O-di X-##ct X-##um O-"" O-less O-is O-more O-. O-"""
"Far from being minimalist, the music unabatingly torments us with apparent novelties not so cleverly disguised in the simplicities of 4/4 time, octave intervals, and ragtime or gospel chord progressions.","O-Far O-from O-being O-minimal X-##ist O-, O-the O-music O-un X-##aba X-##ting X-##ly O-torment X-##s O-us O-with O-apparent O-novel X-##ties O-not O-so O-clever X-##ly B-VBN-disguised O-in O-the O-si X-##mp X-##licit X-##ies O-of O-4 O-/ O-4 O-time O-, O-o X-##ct X-##ave O-intervals O-, O-and O-rag X-##time O-or O-gospel O-chord O-progression X-##s O-."
"But the music has its charm, and Mr. Glass has constructed his solo program around a move from the simple to the relatively complex.","O-But O-the O-music O-has O-its O-charm O-, O-and O-Mr X-. O-Glass O-has B-VBN-constructed O-his O-solo O-program O-around O-a O-move O-from O-the O-simple O-to O-the O-relatively O-complex O-."
"Not only is the typical Glasswork open-ended, it is also often multiple in its context(s).","O-Not O-only O-is O-the O-typical O-Glass X-##work B-VBN-open X-- X-ended O-, O-it O-is O-also O-often O-multiple O-in O-its O-context O-( O-s O-) O-."
"Later it was performed on Radio Bremen in Germany, and then Lucinda Childs took it for one of her dance pieces.","O-Later O-it O-was B-VBN-performed O-on O-Radio O-Bremen O-in O-Germany O-, O-and O-then O-Luc X-##inda O-Child X-##s O-took O-it O-for O-one O-of O-her O-dance O-pieces O-."
The point is that any piece can be used as background music for virtually anything.,O-The O-point O-is O-that O-any O-piece O-can O-be B-VBN-used O-as O-background O-music O-for O-virtually O-anything O-.
"When used as background in this way, the music has an appropriate eeriness, as when a two-note phrase, a descending minor third, accompanies the seemingly endless litany of reports, interviews and confessions of witnesses in the Morris film.","O-When B-VBN-used O-as O-background O-in O-this O-way O-, O-the O-music O-has O-an O-appropriate O-e X-##eri X-##ness O-, O-as O-when O-a O-two X-- X-note O-phrase O-, O-a O-descending O-minor O-third O-, O-a X-##cco X-##mp X-##ani X-##es O-the O-seemingly O-endless O-lit X-##any O-of O-reports O-, O-interviews O-and O-confession X-##s O-of O-witnesses O-in O-the O-Morris O-film O-."
"Served up as a solo, however, the music lacks the resonance provided by a context within another medium.","B-VBN-Ser X-##ved O-up O-as O-a O-solo O-, O-however O-, O-the O-music O-lacks O-the O-resonance B-VBN-provided O-by O-a O-context O-within O-another O-medium O-."
"The offering will be divided evenly between 13-week and 26-week bills maturing on Jan. 25, 1990, and April 26, 1990, respectively.","O-The O-offering O-will O-be B-VBN-divided O-evenly O-between O-13 X-- X-week O-and O-26 X-- X-week O-bills O-mat X-##uring O-on O-Jan X-. O-25 O-, O-1990 O-, O-and O-April O-26 O-, O-1990 O-, O-respectively O-."
"Tenders for the bills, available in minimum $10,000 denominations, must be received by 1 p.m. EDT Monday at the Treasury or at Federal Reserve banks or branches.","O-Ten X-##ders O-for O-the O-bills O-, O-available O-in O-minimum O-$ O-10 X-, X-000 O-denominations O-, O-must O-be B-VBN-received O-by O-1 O-p X-. X-m O-. O-E X-##D X-##T O-Monday O-at O-the O-Treasury O-or O-at O-Federal O-Reserve O-banks O-or O-branches O-."
House leaders had hoped to follow the Senate's lead by getting an agreement from House committee chairmen under which they would drop items that wouldn't reduce the fiscal 1990 budget deficit from the House-passed bill before the negotiations with the Senate began.,O-House O-leaders O-had B-VBN-hoped O-to O-follow O-the O-Senate O-' X-s O-lead O-by O-getting O-an O-agreement O-from O-House O-committee O-chair X-##men O-under O-which O-they O-would O-drop O-items O-that O-would O-n X-' X-t O-reduce O-the O-fiscal O-1990 O-budget O-deficit O-from O-the O-House X-- X-passed O-bill O-before O-the O-negotiations O-with O-the O-Senate O-began O-.
"But the effort became snagged on the question of what would become of other issues, ranging from cutting the capital-gains tax to child care to repeal of catastrophic-illness insurance.","O-But O-the O-effort O-became B-VBN-s X-##na X-##gged O-on O-the O-question O-of O-what O-would O-become O-of O-other O-issues O-, O-ranging O-from O-cutting O-the O-capital X-- X-gains O-tax O-to O-child O-care O-to O-repeal O-of O-catastrophic X-- X-illness O-insurance O-."
"""Many members feel there are important features of the House bill that should be enacted,"" Speaker Thomas Foley (D., Wash.) said.","O-"" O-Many O-members O-feel O-there O-are O-important O-features O-of O-the O-House O-bill O-that O-should O-be B-VBN-enacted O-, X-"" O-Speaker O-Thomas O-Foley O-( O-D X-. O-, O-Was X-##h X-. O-) O-said O-."
"""If there is any support for reducing the bill, it is conditioned on their desire to see them passed in another form.""","O-"" O-If O-there O-is O-any O-support O-for O-reducing O-the O-bill O-, O-it O-is B-VBN-conditioned O-on O-their O-desire O-to O-see O-them B-VBN-passed O-in O-another O-form O-. O-"""
