"On Dec. 13, 1973, it issued its first rule; it required companies to disclose foreign currency translations in U.S. dollars.","O-On O-Dec X-. O-13 O-, O-1973 O-, O-it O-issued B-PRP$-its O-first O-rule O-; O-it O-required O-companies O-to O-disc X-##lose O-foreign O-currency O-translations O-in O-U X-. X-S X-. O-dollars O-."
Olin Corp. said third-quarter net income rose 26% on the strength of its chemical business.,O-O X-##lin O-Corp O-. O-said O-third X-- X-quarter O-net O-income O-rose O-26 O-% O-on O-the O-strength O-of B-PRP$-its O-chemical O-business O-.
"Olin said its chemical segment had profit of $22 million, up from $15 million a year ago, largely because of gains in electrochemicals such as caustic soda.","O-O X-##lin O-said B-PRP$-its O-chemical O-segment O-had O-profit O-of O-$ O-22 O-million O-, O-up O-from O-$ O-15 O-million O-a O-year O-ago O-, O-largely O-because O-of O-gains O-in O-electro X-##chemical X-##s O-such O-as O-ca X-##ustic O-soda O-."
"Cross & Trecker Corp. said it reached an agreement to sell its Wiedemann division to recently created Murata Wiedemann Inc., a U.S. affiliate of Murata Machinery Ltd. of Kyoto, Japan.","O-Cross O-& O-T X-##reck X-##er O-Corp O-. O-said O-it O-reached O-an O-agreement O-to O-sell B-PRP$-its O-W X-##ied X-##emann O-division O-to O-recently O-created O-Mu X-##rata O-W X-##ied X-##emann O-Inc X-. O-, O-a O-U X-. X-S X-. O-affiliate O-of O-Mu X-##rata O-Machine X-##ry O-Ltd X-. O-of O-Kyoto O-, O-Japan O-."
"Cross & Trecker is also selling its equity interest in a Japanese joint venture, Murata Warner Swasey, to Murata Machinery.","O-Cross O-& O-T X-##reck X-##er O-is O-also O-selling B-PRP$-its O-equity O-interest O-in O-a O-Japanese O-joint O-venture O-, O-Mu X-##rata O-Warner O-S X-##was X-##ey O-, O-to O-Mu X-##rata O-Machine X-##ry O-."
"Foley and Michel had agreed to streamline the deficit-reduction bill before the House even took it up, but Mr. Darman and White House Chief of Staff John Sununu had torpedoed that plan in order to press their fight for a cut in capital-gains taxes.","O-Foley O-and O-Michel O-had O-agreed O-to O-stream X-##line O-the O-deficit X-- X-reduction O-bill O-before O-the O-House O-even O-took O-it O-up O-, O-but O-Mr X-. O-Dar X-##man O-and O-White O-House O-Chief O-of O-Staff O-John O-Sun X-##un X-##u O-had O-torpedo X-##ed O-that O-plan O-in O-order O-to O-press B-PRP$-their O-fight O-for O-a O-cut O-in O-capital X-- X-gains O-taxes O-."
Congressional leaders rejected suggestions that their attempts to speed the deficit-reduction bill had anything to do with Friday's stock market decline.,O-Congressional O-leaders O-rejected O-suggestions O-that B-PRP$-their O-attempts O-to O-speed O-the O-deficit X-- X-reduction O-bill O-had O-anything O-to O-do O-with O-Friday O-' X-s O-stock O-market O-decline O-.
"""We are responding to our responsibility under the budget act,"" Rep. Foley said.","O-"" O-We O-are O-responding O-to B-PRP$-our O-responsibility O-under O-the O-budget O-act O-, X-"" O-Rep O-. O-Foley O-said O-."
"Taking a tough bargaining position, Mr. Darman said he opposes restoring the funds when Congress finally wraps up its work on 1990 spending.","O-Taking O-a O-tough O-bargaining O-position O-, O-Mr X-. O-Dar X-##man O-said O-he O-oppose X-##s O-restoring O-the O-funds O-when O-Congress O-finally O-wraps O-up B-PRP$-its O-work O-on O-1990 O-spending O-."
"First to suffer from the spending cuts will be programs that spend most of their money on personnel, Mr. Darman said.","O-First O-to O-suffer O-from O-the O-spending O-cuts O-will O-be O-programs O-that O-spend O-most O-of B-PRP$-their O-money O-on O-personnel O-, O-Mr X-. O-Dar X-##man O-said O-."
"In addition to his previous real-estate investment and asset-management duties, Mr. Meador takes responsibility for development and property management.","O-In O-addition O-to B-PRP$-his O-previous O-real X-- X-estate O-investment O-and O-asset X-- X-management O-duties O-, O-Mr X-. O-Mead X-##or O-takes O-responsibility O-for O-development O-and O-property O-management O-."
"Procter & Gamble Co., Cincinnati, expanding its presence in the food service market, said it acquired Maryland Club Foods, a coffee supplier, from an investor group led by F. Philip Handy of Winter Park, Fla.","O-Pro X-##cter O-& O-G X-##amble O-Co X-. O-, O-Cincinnati O-, O-expanding B-PRP$-its O-presence O-in O-the O-food O-service O-market O-, O-said O-it O-acquired O-Maryland O-Club O-Foods O-, O-a O-coffee O-supplier O-, O-from O-an O-investor O-group O-led O-by O-F X-. O-Philip O-Hand X-##y O-of O-Winter O-Park O-, O-F X-##la O-."
"P&G already sells its Folgers ground roast coffee to food service concerns, but not to as many markets as Maryland Club.","O-P O-& O-G O-already O-sells B-PRP$-its O-F X-##ol X-##gers O-ground O-r X-##oast O-coffee O-to O-food O-service O-concerns O-, O-but O-not O-to O-as O-many O-markets O-as O-Maryland O-Club O-."
"Philadelphia Museum head Anne d'Harnoncourt insists that even though John Dorrance may have been the chairman of her Board of Trustees, ""We weren't expecting the pictures we didn't get.""","O-Philadelphia O-Museum O-head O-Anne O-d X-' X-Ha X-##rno X-##nco X-##urt O-insists O-that O-even O-though O-John O-Do X-##rra X-##nce O-may O-have O-been O-the O-chairman O-of B-PRP$-her O-Board O-of O-Trustees O-, O-"" O-We O-were O-n X-' X-t O-expecting O-the O-pictures O-we O-did O-n X-' X-t O-get O-. O-"""
Their sales have turned into theater for a world audience.,B-PRP$-Their O-sales O-have O-turned O-into O-theater O-for O-a O-world O-audience O-.
"The weak dollar makes our market a playground for foreign bidders, and our sorry balance of trade has given them plenty of dollars to play with.","O-The O-weak O-dollar O-makes B-PRP$-our O-market O-a O-playground O-for O-foreign O-bid X-##ders O-, O-and B-PRP$-our O-sorry O-balance O-of O-trade O-has O-given O-them O-plenty O-of O-dollars O-to O-play O-with O-."
But the stakes are now very high and for your $40 million you can buy only the best of what is available -- which may not be the best there is.,O-But O-the O-stakes O-are O-now O-very O-high O-and O-for B-PRP$-your O-$ O-40 O-million O-you O-can O-buy O-only O-the O-best O-of O-what O-is O-available O-- X-- O-which O-may O-not O-be O-the O-best O-there O-is O-.
Big-bucks buyers trust that the market will continue its strong surge.,O-Big X-- X-bucks O-buyers O-trust O-that O-the O-market O-will O-continue B-PRP$-its O-strong O-surge O-.
"SEC decision, which found that liability depended on whether the tipper had breached his fiduciary duty to the corporation in order to obtain ""some personal gain"" and whether the tippee knew or recklessly disregarded this fact.","O-SEC O-decision O-, O-which O-found O-that O-liability O-depended O-on O-whether O-the O-tip X-##per O-had O-breach X-##ed B-PRP$-his O-fi X-##du X-##cia X-##ry O-duty O-to O-the O-corporation O-in O-order O-to O-obtain O-"" O-some O-personal O-gain O-"" O-and O-whether O-the O-tip X-##pe X-##e O-knew O-or O-reckless X-##ly O-di X-##s X-##regard X-##ed O-this O-fact O-."
"Gradually, however, lower courts and prosecutors have pushed this definition to its breaking point.","O-G X-##rad X-##ually O-, O-however O-, O-lower O-courts O-and O-prosecutors O-have O-pushed O-this O-definition O-to B-PRP$-its O-breaking O-point O-."
"Prior to a tender offer by A&P for Waldbaum Inc. in 1986, the founder of the Waldbaum's supermarket chain called an elderly relative to tell her to assemble her stock certificates for delivery.","O-Prior O-to O-a O-tender O-offer O-by O-A O-& O-P O-for O-W X-##ald X-##baum O-Inc O-. O-in O-1986 O-, O-the O-founder O-of O-the O-W X-##ald X-##baum O-' X-s O-supermarket O-chain O-called O-an O-elderly O-relative O-to O-tell O-her O-to O-assemble B-PRP$-her O-stock O-certificates O-for O-delivery O-."
"She called her daughter to take her to the bank, who, in turn, persuaded her husband, a Mr. Loeb, to run this errand.","O-She O-called B-PRP$-her O-daughter O-to O-take O-her O-to O-the O-bank O-, O-who O-, O-in O-turn O-, O-persuaded B-PRP$-her O-husband O-, O-a O-Mr X-. O-Lo X-##eb O-, O-to O-run O-this O-er X-##rand O-."
"Hearing of this information, the husband discussed it with his broker, Mr. Chestman, and Mr. Chestman then bought for his own account and other clients.","O-Hearing O-of O-this O-information O-, O-the O-husband O-discussed O-it O-with B-PRP$-his O-broker O-, O-Mr X-. O-Ch X-##est X-##man O-, O-and O-Mr X-. O-Ch X-##est X-##man O-then O-bought O-for B-PRP$-his O-own O-account O-and O-other O-clients O-."
"Did Mr. Loeb, his tipper, breach a fiduciary duty (and, if so, to whom)?","O-Did O-Mr X-. O-Lo X-##eb O-, B-PRP$-his O-tip X-##per O-, O-breach O-a O-fi X-##du X-##cia X-##ry O-duty O-( O-and O-, O-if O-so O-, O-to O-whom O-) O-?"
"Mr. Siegel asked Mr. Freeman who his source was and, on hearing that it was Bunny Lasker, responded: ""Well, your bunny has a good nose.""","O-Mr X-. O-Siege X-##l O-asked O-Mr X-. O-Freeman O-who B-PRP$-his O-source O-was O-and O-, O-on O-hearing O-that O-it O-was O-Bunny O-Las X-##ker O-, O-responded O-: O-"" O-Well O-, B-PRP$-your O-b X-##un X-##ny O-has O-a O-good O-nose O-. O-"""
It is not my contention that either Mr. Chestman or Mr. Freeman was an innocent victim of prosecutorial overzealousness.,O-It O-is O-not B-PRP$-my O-contention O-that O-either O-Mr X-. O-Ch X-##est X-##man O-or O-Mr X-. O-Freeman O-was O-an O-innocent O-victim O-of O-prosecutor X-##ial O-over X-##ze X-##alo X-##us X-##ness O-.
"Arguably, both were on notice that their behavior was at least risky.","O-A X-##rg X-##ua X-##bly O-, O-both O-were O-on O-notice O-that B-PRP$-their O-behavior O-was O-at O-least O-risky O-."
"In this light, the comparative advantages of legislative law-making become clear: (1) Before it acts, the legislature typically will hear the views of representatives of all those affected by its decision, not just the immediate parties before the court; and (2) the legislature can frame ""bright line"" standards that create less uncertainty than the fact-bound decisions of courts.","O-In O-this O-light O-, O-the O-comparative O-advantages O-of O-legislative O-law X-- X-making O-become O-clear O-: O-( O-1 O-) O-Before O-it O-acts O-, O-the O-legislature O-typically O-will O-hear O-the O-views O-of O-representatives O-of O-all O-those O-affected O-by B-PRP$-its O-decision O-, O-not O-just O-the O-immediate O-parties O-before O-the O-court O-; O-and O-( O-2 O-) O-the O-legislature O-can O-frame O-"" O-bright O-line O-"" O-standards O-that O-create O-less O-uncertainty O-than O-the O-fact X-- X-bound O-decisions O-of O-courts O-."
"Such a statute illustrates the fundamental problem: Congress finds it is easier to pass sweepingly moralistic prohibitions, which the courts must thereafter interpret, than to engage in the difficult line-drawing distinctions that are inherently its responsibility.","O-Such O-a O-statute O-illustrate X-##s O-the O-fundamental O-problem O-: O-Congress O-finds O-it O-is O-easier O-to O-pass O-sweeping X-##ly O-moral X-##istic O-prohibition X-##s O-, O-which O-the O-courts O-must O-thereafter O-interpret O-, O-than O-to O-engage O-in O-the O-difficult O-line X-- X-drawing O-distinction X-##s O-that O-are O-inherent X-##ly B-PRP$-its O-responsibility O-."
"Unilab said its wholly owned MetWest Inc. unit paid $25 million in cash, provided $30 million in notes and $30 million in preferred stock to acquire Central's labs in the Western U.S.","O-Un X-##ila X-##b O-said B-PRP$-its O-wholly O-owned O-Met X-##W X-##est O-Inc O-. O-unit O-paid O-$ O-25 O-million O-in O-cash O-, O-provided O-$ O-30 O-million O-in O-notes O-and O-$ O-30 O-million O-in O-preferred O-stock O-to O-acquire O-Central O-' X-s O-labs O-in O-the O-Western O-U X-. X-S O-."
"Acting more than a year after Ms. Bertussi filed a complaint, the panel issued a ""letter of reproval"" saying Rep. Bates had admitted conduct that violated a House rule forbidding discrimination against employees on account of their sex.","O-Acting O-more O-than O-a O-year O-after O-Ms O-. O-Bert X-##uss X-##i O-filed O-a O-complaint O-, O-the O-panel O-issued O-a O-"" O-letter O-of O-re X-##p X-##rov X-##al O-"" O-saying O-Rep O-. O-Bates O-had O-admitted O-conduct O-that O-violated O-a O-House O-rule O-for X-##bid X-##ding O-discrimination O-against O-employees O-on O-account O-of B-PRP$-their O-sex O-."
"But Ms. Bertussi asked, ""Who in their right mind is going to file another complaint with the Ethics Committee?""","O-But O-Ms O-. O-Bert X-##uss X-##i O-asked O-, O-"" O-Who O-in B-PRP$-their O-right O-mind O-is O-going O-to O-file O-another O-complaint O-with O-the O-Ethics O-Committee O-? O-"""
"Ciba-Geigy Ltd. and Chiron Corp. said they extended their offer for Connaught BioSciences Inc., valued at 866 million Canadian dollars (US$736 million) to Oct. 27.","O-C X-##iba X-- X-G X-##ei X-##gy O-Ltd X-. O-and O-Chi X-##ron O-Corp O-. O-said O-they O-extended B-PRP$-their O-offer O-for O-Con X-##na X-##ught O-B X-##io X-##S X-##cie X-##nces O-Inc X-. O-, O-valued O-at O-86 X-##6 O-million O-Canadian O-dollars O-( O-US O-$ O-73 X-##6 O-million O-) O-to O-Oct X-. O-27 O-."
"The companies earlier said they didn't want to raise their offer to match a rival bid by Institut Merieux S.A. of C$37 a share, or C$942 million.","O-The O-companies O-earlier O-said O-they O-did O-n X-' X-t O-want O-to O-raise B-PRP$-their O-offer O-to O-match O-a O-rival O-bid O-by O-Institut O-Me X-##rie X-##ux O-S X-. X-A X-. O-of O-C O-$ O-37 O-a O-share O-, O-or O-C O-$ O-94 X-##2 O-million O-."
"Prospect, a New York-based leveraged buy-out firm, also agreed to invest $15 million in Recognition, which in turn agreed to repurchase as much as $20 million of its stock.","O-Prospect O-, O-a O-New O-York X-- X-based O-leverage X-##d O-buy X-- X-out O-firm O-, O-also O-agreed O-to O-invest O-$ O-15 O-million O-in O-Re X-##cognition O-, O-which O-in O-turn O-agreed O-to O-re X-##pur X-##chase O-as O-much O-as O-$ O-20 O-million O-of B-PRP$-its O-stock O-."
"Under the agreement, Prospect is permitted to increase its stake in Recognition to 30%.","O-Under O-the O-agreement O-, O-Prospect O-is O-permitted O-to O-increase B-PRP$-its O-stake O-in O-Re X-##cognition O-to O-30 O-% O-."
"In August, Recognition said it was in violation of certain terms of its debt agreements with bank lenders because of a $3.9 million loss for the third quarter ended July 31.","O-In O-August O-, O-Re X-##cognition O-said O-it O-was O-in O-violation O-of O-certain O-terms O-of B-PRP$-its O-debt O-agreements O-with O-bank O-lend X-##ers O-because O-of O-a O-$ O-3 X-. X-9 O-million O-loss O-for O-the O-third O-quarter O-ended O-July O-31 O-."
Recognition Equipment said it expected to put the agreement with Prospect to a vote of its stockholders at a special meeting in January.,O-Re X-##cognition O-Equipment O-said O-it O-expected O-to O-put O-the O-agreement O-with O-Prospect O-to O-a O-vote O-of B-PRP$-its O-stock X-##holders O-at O-a O-special O-meeting O-in O-January O-.
JAPANESE luxury-car makers are trying to set strict design standards for their dealerships.,O-J X-##AP X-##AN X-##ES X-##E O-luxury X-- X-car O-makers O-are O-trying O-to O-set O-strict O-design O-standards O-for B-PRP$-their O-dealers X-##hips O-.
Some are even coming up with their own novel designs.,O-Some O-are O-even O-coming O-up O-with B-PRP$-their O-own O-novel O-designs O-.
"Dictaphone Corp. was caught off guard in 1974 when its main competitor, Lanier Office Products of Japan, introduced a microcassette dictation recorder half the size of standard cassette devices.","O-Di X-##ct X-##aph X-##one O-Corp X-. O-was O-caught O-off O-guard O-in O-1974 O-when B-PRP$-its O-main O-competitor O-, O-La X-##nier O-Office O-Products O-of O-Japan O-, O-introduced O-a O-micro X-##cas X-##sett X-##e O-di X-##ct X-##ation O-recorder O-half O-the O-size O-of O-standard O-cassette O-devices O-."
"By 1982, however, the patent status of the Lanier microcassette had changed, permitting Dictaphone to develop its own competitive micro system, which it did.","O-By O-1982 O-, O-however O-, O-the O-patent O-status O-of O-the O-La X-##nier O-micro X-##cas X-##sett X-##e O-had O-changed O-, O-permitting O-Di X-##ct X-##aph X-##one O-to O-develop B-PRP$-its O-own O-competitive O-micro O-system O-, O-which O-it O-did O-."
"""It gave me great pride to see the inventor of the microcassette in Japan look at the pico and shake his head and say `unbelievable, '"" says Mr. Jachmann.","O-"" O-It O-gave O-me O-great O-pride O-to O-see O-the O-inventor O-of O-the O-micro X-##cas X-##sett X-##e O-in O-Japan O-look O-at O-the O-p X-##ico O-and O-shake B-PRP$-his O-head O-and O-say O-` O-un X-##believable O-, O-' X-"" O-says O-Mr X-. O-J X-##ach X-##mann O-."
"The harder he tried to push them into large piles, the closer he came to breaking the rake and straining his back.","O-The O-harder O-he O-tried O-to O-push O-them O-into O-large O-piles O-, O-the O-closer O-he O-came O-to O-breaking O-the O-r X-##ake O-and O-straining B-PRP$-his O-back O-."
"His crude device worked: The lower teeth gathered the leaves into a pile, while the higher, harder teeth moved the top of the pile.","B-PRP$-His O-crude O-device O-worked O-: O-The O-lower O-teeth O-gathered O-the O-leaves O-into O-a O-pile O-, O-while O-the O-higher O-, O-harder O-teeth O-moved O-the O-top O-of O-the O-pile O-."
"One customer, Donald Blaggs of Mobile, says the Barrett Rake allowed him to do his lawn in 2 1/2 hours, two hours less than usual.","O-One O-customer O-, O-Donald O-B X-##lag X-##gs O-of O-Mobile O-, O-says O-the O-Barrett O-Ra X-##ke O-allowed O-him O-to O-do B-PRP$-his O-lawn O-in O-2 O-1 O-/ O-2 O-hours O-, O-two O-hours O-less O-than O-usual O-."
But other rake makers have their doubts.,O-But O-other O-r X-##ake O-makers O-have B-PRP$-their O-doubts O-.
"And while the U.S. currency recovered much of the lost ground from its collapse on Friday, several dealers contend that its potential to climb further could be limited.","O-And O-while O-the O-U X-. X-S X-. O-currency O-recovered O-much O-of O-the O-lost O-ground O-from B-PRP$-its O-collapse O-on O-Friday O-, O-several O-dealers O-con X-##tend O-that B-PRP$-its O-potential O-to O-climb O-further O-could O-be O-limited O-."
"On its rebound, the dollar soared from about 1.8480 marks to 1.8735, or 1.4%, within two-and-a-half minutes.","O-On B-PRP$-its O-re X-##bound O-, O-the O-dollar O-so X-##ared O-from O-about O-1 X-. X-84 X-##80 O-marks O-to O-1 X-. X-87 X-##35 O-, O-or O-1 X-. X-4 O-% O-, O-within O-two X-- X-and X-- X-a X-- X-half O-minutes O-."
"At the time, many traders took it to be a signal that the Fed wouldn't lower interest rates to weaken the dollar, and that the U.S. was at odds with its major trading partners in seeking to stabilize a high-flying U.S. currency at a lower level.","O-At O-the O-time O-, O-many O-traders O-took O-it O-to O-be O-a O-signal O-that O-the O-Fed O-would O-n X-' X-t O-lower O-interest O-rates O-to O-weaken O-the O-dollar O-, O-and O-that O-the O-U X-. X-S X-. O-was O-at O-odds O-with B-PRP$-its O-major O-trading O-partners O-in O-seeking O-to O-stab X-##ilize O-a O-high X-- X-flying O-U X-. X-S X-. O-currency O-at O-a O-lower O-level O-."
"Indeed, the dollar dropped 4.4% against the mark from its highs on Friday to its Sunday night lows only to shoot back up 2.4% to its high point yesterday.","O-Indeed O-, O-the O-dollar O-dropped O-4 X-. X-4 O-% O-against O-the O-mark O-from B-PRP$-its O-high X-##s O-on O-Friday O-to B-PRP$-its O-Sunday O-night O-low X-##s O-only O-to O-shoot O-back O-up O-2 X-. X-4 O-% O-to B-PRP$-its O-high O-point O-yesterday O-."
"During the hectic activity, traders said the Danish and Italian central banks intervened to defend their respective currencies against the strengthening mark.","O-During O-the O-he X-##ctic O-activity O-, O-traders O-said O-the O-Danish O-and O-Italian O-central O-banks O-intervened O-to O-defend B-PRP$-their O-respective O-cu X-##rre X-##ncies O-against O-the O-strengthening O-mark O-."
"""In my view, the dollar isn't vulnerable at all.","O-"" O-In B-PRP$-my O-view O-, O-the O-dollar O-is O-n X-' X-t O-vulnerable O-at O-all O-."
"""My clients lost a lot of money in the 1970s because of the dollar, so I can afford not to gain"" from U.S. equities.","O-"" B-PRP$-My O-clients O-lost O-a O-lot O-of O-money O-in O-the O-1970s O-because O-of O-the O-dollar O-, O-so O-I O-can O-afford O-not O-to O-gain O-"" O-from O-U X-. X-S X-. O-e X-##quities O-."
"Moody's said the proposed recaptilization may ""limit the company's ability to realize its profit potential"" and that paying dividends from a new series of preferred could squeeze ""basic business operations.""","O-Moody O-' X-s O-said O-the O-proposed O-re X-##cap X-##til X-##ization O-may O-"" O-limit O-the O-company O-' X-s O-ability O-to O-realize B-PRP$-its O-profit O-potential O-"" O-and O-that O-paying O-divide X-##nds O-from O-a O-new O-series O-of O-preferred O-could O-squeeze O-"" O-basic O-business O-operations O-. O-"""
He retains his current positions as chief strategic officer of AM International and president of AM Ventures.,O-He O-retains B-PRP$-his O-current O-positions O-as O-chief O-strategic O-officer O-of O-AM O-International O-and O-president O-of O-AM O-Ventures O-.
"Flowers Industries Inc. said it will report a charge of eight cents to 10 cents a share for its fiscal first quarter, ended Sept. 23, from the sale of two bakeries, in High Point, N.C., and Gadsden, Ala.","O-Flowers O-Industries O-Inc O-. O-said O-it O-will O-report O-a O-charge O-of O-eight O-cents O-to O-10 O-cents O-a O-share O-for B-PRP$-its O-fiscal O-first O-quarter O-, O-ended O-Sept X-. O-23 O-, O-from O-the O-sale O-of O-two O-b X-##aker X-##ies O-, O-in O-High O-Point O-, O-N X-. X-C X-. O-, O-and O-G X-##ads X-##den O-, O-Al X-##a O-."
"In July, business inventories had climbed 0.9%, a number the department revised from its initial report of 0.6%.","O-In O-July O-, O-business O-inventor X-##ies O-had O-climbed O-0 X-. X-9 O-% O-, O-a O-number O-the O-department O-revised O-from B-PRP$-its O-initial O-report O-of O-0 X-. X-6 O-% O-."
"Manufacturers showed the biggest sales gains; their sales rose 5.6%, while factory inventories only grew 0.3%.","O-Man X-##uf X-##act X-##urers O-showed O-the O-biggest O-sales O-gains O-; B-PRP$-their O-sales O-rose O-5 X-. X-6 O-% O-, O-while O-factory O-inventor X-##ies O-only O-grew O-0 X-. X-3 O-% O-."
"Retailers' sales increased 0.7%, as did their inventories.","O-Re X-##tail X-##ers X-' O-sales O-increased O-0 X-. X-7 O-% O-, O-as O-did B-PRP$-their O-inventor X-##ies O-."
"Wholesalers' sales climbed 1.5%, while their inventories dropped 0.1%.","O-Whole X-##sal X-##ers X-' O-sales O-climbed O-1 X-. X-5 O-% O-, O-while B-PRP$-their O-inventor X-##ies O-dropped O-0 X-. X-1 O-% O-."
"""My assessment and everyone's assessment is that we do not have the kinds of information that let us responsibly and effectively formulate and execute our budget,"" Mr. Goldberg said.","O-"" B-PRP$-My O-assessment O-and O-everyone O-' X-s O-assessment O-is O-that O-we O-do O-not O-have O-the O-kinds O-of O-information O-that O-let O-us O-re X-##sp X-##ons X-##ibly O-and O-effectively O-formula X-##te O-and O-execute B-PRP$-our O-budget O-, X-"" O-Mr X-. O-Goldberg O-said O-."
The new commissioner says that closer scrutiny of how the agency uses its resources will go a long way toward enhancing its ability to collect more tax revenue.,O-The O-new O-commissioner O-says O-that O-closer O-scrutiny O-of O-how O-the O-agency O-uses B-PRP$-its O-resources O-will O-go O-a O-long O-way O-toward O-enhancing B-PRP$-its O-ability O-to O-collect O-more O-tax O-revenue O-.
"""You're telling someone they can spend the next three or four or five or six years of their life bringing about the most difficult and costly modernization of an information system on the civil side ever,"" Mr. Goldberg said.","O-"" O-You O-' X-re O-telling O-someone O-they O-can O-spend O-the O-next O-three O-or O-four O-or O-five O-or O-six O-years O-of B-PRP$-their O-life O-bringing O-about O-the O-most O-difficult O-and O-costly O-modernization O-of O-an O-information O-system O-on O-the O-civil O-side O-ever O-, X-"" O-Mr X-. O-Goldberg O-said O-."
"Industrial production declined 0.1% in September, reinforcing other signs that the manufacturing sector continues its slowing trend.","O-Industrial O-production O-declined O-0 X-. X-1 O-% O-in O-September O-, O-re X-##in X-##forcing O-other O-signs O-that O-the O-manufacturing O-sector O-continues B-PRP$-its O-slowing O-trend O-."
"The new reports of sluggishness, which were foreshadowed by an earlier Labor Department report that manufacturing payrolls dropped by 105,000 in September, give the Fed another reason to further ease its grip on credit and lower interest rates.","O-The O-new O-reports O-of O-s X-##lug X-##gis X-##hn X-##ess O-, O-which O-were O-fore X-##sha X-##do X-##wed O-by O-an O-earlier O-Labor O-Department O-report O-that O-manufacturing O-pay X-##rolls O-dropped O-by O-105 X-, X-000 O-in O-September O-, O-give O-the O-Fed O-another O-reason O-to O-further O-ease B-PRP$-its O-grip O-on O-credit O-and O-lower O-interest O-rates O-."
"Factory output dropped 0.2%, its first decline since February, after having been unchanged in October.","O-Factory O-output O-dropped O-0 X-. X-2 O-% O-, B-PRP$-its O-first O-decline O-since O-February O-, O-after O-having O-been O-unchanged O-in O-October O-."
