"When Congress increased federal deposit insurance to $100,000 from $40,000, it seemed like a good idea.","B-WRB-When O-Congress O-increased O-federal O-deposit O-insurance O-to O-$ O-100 X-, X-000 O-from O-$ O-40 X-, X-000 O-, O-it O-seemed O-like O-a O-good O-idea O-."
"To confuse matters further, when UAL Corp. stock finally opened on the New York Stock Exchange at 11:08 a.m., the price was listed at $324.75 a share, up about $45 from Friday; in fact, its true price was $224.75, down $55.","O-To O-con X-##fuse O-matters O-further O-, B-WRB-when O-U X-##AL O-Corp O-. O-stock O-finally O-opened O-on O-the O-New O-York O-Stock O-Exchange O-at O-11 X-: X-08 O-a X-. X-m X-. O-, O-the O-price O-was O-listed O-at O-$ O-32 X-##4 X-. X-75 O-a O-share O-, O-up O-about O-$ O-45 O-from O-Friday O-; O-in O-fact O-, O-its O-true O-price O-was O-$ O-224 X-. X-75 O-, O-down O-$ O-55 O-."
"When the market opened at 9:30 a.m. EST, a reporter for the Reuters newswire miscalculated the industrial average's drop as a 4% decline when it really was down 0.7%.","B-WRB-When O-the O-market O-opened O-at O-9 X-: X-30 O-a X-. X-m O-. O-E X-##ST O-, O-a O-reporter O-for O-the O-Re X-##uters O-news X-##wire O-mi X-##sca X-##l X-##culate X-##d O-the O-industrial O-average O-' X-s O-drop O-as O-a O-4 O-% O-decline B-WRB-when O-it O-really O-was O-down O-0 X-. X-7 O-% O-."
"""What we're trying to explore now is how to protect these other issues,"" said House Budget Committee Chairman Leon Panetta (D., Calif.).","O-"" O-What O-we O-' X-re O-trying O-to O-explore O-now O-is B-WRB-how O-to O-protect O-these O-other O-issues O-, X-"" O-said O-House O-Budget O-Committee O-Chairman O-Leon O-Pan X-##etta O-( O-D X-. O-, O-Cal X-##if X-. O-) O-."
"When the fiscal year began on Oct. 1, the Office of Management and Budget began withholding 4.3% of the Pentagon's money and 5.3% of other agencies' money, as the Gramm-Rudman law requires.","B-WRB-When O-the O-fiscal O-year O-began O-on O-Oct X-. O-1 O-, O-the O-Office O-of O-Management O-and O-Budget O-began O-with X-##holding O-4 X-. X-3 O-% O-of O-the O-Pentagon O-' X-s O-money O-and O-5 X-. X-3 O-% O-of O-other O-agencies X-' O-money O-, O-as O-the O-Gram X-##m X-- X-R X-##ud X-##man O-law O-requires O-."
"Those cuts, known as a ""sequester"" in budget jargon, became permanent yesterday, although Congress could cancel or rescind them whenever it wants to.","O-Those O-cuts O-, O-known O-as O-a O-"" O-se X-##quest X-##er O-"" O-in O-budget O-jar X-##gon O-, O-became O-permanent O-yesterday O-, O-although O-Congress O-could O-cancel O-or O-re X-##s X-##cin X-##d O-them B-WRB-whenever O-it O-wants O-to O-."
"Taking a tough bargaining position, Mr. Darman said he opposes restoring the funds when Congress finally wraps up its work on 1990 spending.","O-Taking O-a O-tough O-bargaining O-position O-, O-Mr X-. O-Dar X-##man O-said O-he O-oppose X-##s O-restoring O-the O-funds B-WRB-when O-Congress O-finally O-wraps O-up O-its O-work O-on O-1990 O-spending O-."
"The Gramm-Rudman penalty won't be taken seriously if agencies merely ""figure out how to juggle the accounts, trusting that Congress is going to restore all the money a little bit later,"" he said.","O-The O-Gram X-##m X-- X-R X-##ud X-##man O-penalty O-w X-##o O-n X-' X-t O-be O-taken O-seriously O-if O-agencies O-merely O-"" O-figure O-out B-WRB-how O-to O-j X-##ug X-##gle O-the O-accounts O-, O-trusting O-that O-Congress O-is O-going O-to O-restore O-all O-the O-money O-a O-little O-bit O-later O-, X-"" O-he O-said O-."
"He wouldn't predict how long it would be before the first layoffs, if any, occur.","O-He O-would O-n X-' X-t O-predict B-WRB-how O-long O-it O-would O-be O-before O-the O-first O-lay X-##offs O-, O-if O-any O-, O-occur O-."
"But since the 1986 tax laws drastically reduced deductions for the donation of appreciated property and reduced overall tax rates (thereby making deductions less significant), charitable donations to museums, when anyone makes them, are very charitable indeed.","O-But O-since O-the O-1986 O-tax O-laws O-drastically O-reduced O-de X-##duction X-##s O-for O-the O-donation O-of O-appreciated O-property O-and O-reduced O-overall O-tax O-rates O-( O-thereby O-making O-de X-##duction X-##s O-less O-significant O-) O-, O-charitable O-donations O-to O-museums O-, B-WRB-when O-anyone O-makes O-them O-, O-are O-very O-charitable O-indeed O-."
But why art?,O-But B-WRB-why O-art O-?
It is now a commonplace that prosecutors are bringing criminal indictments in cases where until a few years ago only a civil action at most would have been brought.,O-It O-is O-now O-a O-common X-##place O-that O-prosecutors O-are O-bringing O-criminal O-indictment X-##s O-in O-cases B-WRB-where O-until O-a O-few O-years O-ago O-only O-a O-civil O-action O-at O-most O-would O-have O-been O-brought O-.
"Did Mr. Loeb seek personal gain (and if so, how)?","O-Did O-Mr X-. O-Lo X-##eb O-seek O-personal O-gain O-( O-and O-if O-so O-, B-WRB-how O-) O-?"
"Essentially, Mr. Freeman had invested heavily in the Beatrice leveraged buy-out, when he was told by another prominent trader, Bernard ""Bunny"" Lasker, that the deal was in trouble.","O-Essential X-##ly O-, O-Mr X-. O-Freeman O-had O-invested O-heavily O-in O-the O-Beatrice O-leverage X-##d O-buy X-- X-out O-, B-WRB-when O-he O-was O-told O-by O-another O-prominent O-trader O-, O-Bernard O-"" O-Bunny O-"" O-Las X-##ker O-, O-that O-the O-deal O-was O-in O-trouble O-."
"When only civil liability is involved, this method has the undeniable strengths of factual specificity and avoidance of overgeneralization.","B-WRB-When O-only O-civil O-liability O-is O-involved O-, O-this O-method O-has O-the O-und X-##enia X-##ble O-strengths O-of O-fact X-##ual O-specific X-##ity O-and O-avoid X-##ance O-of O-over X-##gene X-##ral X-##ization O-."
"When a court decides that a particular actor's conduct was culpable and so extends the definition of insider trading to reach this conduct, it does not see the potentially enormous number of other cases that will be covered by the expanded rule.","B-WRB-When O-a O-court O-decides O-that O-a O-particular O-actor O-' X-s O-conduct O-was O-cu X-##l X-##pable O-and O-so O-extends O-the O-definition O-of O-inside X-##r O-trading O-to O-reach O-this O-conduct O-, O-it O-does O-not O-see O-the O-potentially O-enormous O-number O-of O-other O-cases O-that O-will O-be O-covered O-by O-the O-expanded O-rule O-."
"Although legislative lines can result in under-inclusion (which explains why the SEC has long resisted a legislative definition of insider trading), judicial lawmaking inevitably creates uncertainty because of the shadowy outer edges and implications of most judicial decisions.","O-Although O-legislative O-lines O-can O-result O-in O-under X-- X-inclusion O-( O-which O-explains B-WRB-why O-the O-SEC O-has O-long O-resisted O-a O-legislative O-definition O-of O-inside X-##r O-trading O-) O-, O-judicial O-law X-##making O-inevitably O-creates O-uncertainty O-because O-of O-the O-shadowy O-outer O-edges O-and O-implications O-of O-most O-judicial O-decisions O-."
"At least when the stakes are high, uncertainty in turn results in overinclusion, as individuals do not dare to approach an uncertain line closely.","O-At O-least B-WRB-when O-the O-stakes O-are O-high O-, O-uncertainty O-in O-turn O-results O-in O-over X-##in X-##c X-##lusion O-, O-as O-individuals O-do O-not O-dare O-to O-approach O-an O-uncertain O-line O-closely O-."
"Predictably, when confronted with morally dubious behavior, prosecutors will exploit the latitude such openended statutes give them.","O-Pre X-##dict X-##ably O-, B-WRB-when O-confronted O-with O-moral X-##ly O-dubious O-behavior O-, O-prosecutors O-will O-exploit O-the O-latitude O-such O-open X-##ended O-statutes O-give O-them O-."
"Dictaphone Corp. was caught off guard in 1974 when its main competitor, Lanier Office Products of Japan, introduced a microcassette dictation recorder half the size of standard cassette devices.","O-Di X-##ct X-##aph X-##one O-Corp X-. O-was O-caught O-off O-guard O-in O-1974 B-WRB-when O-its O-main O-competitor O-, O-La X-##nier O-Office O-Products O-of O-Japan O-, O-introduced O-a O-micro X-##cas X-##sett X-##e O-di X-##ct X-##ation O-recorder O-half O-the O-size O-of O-standard O-cassette O-devices O-."
The dollar's bumpy journey began late Sunday night in Far Eastern trading where panic selling in a thin market initially pushed it as low as 1.8305 marks and 139.10 yen.,O-The O-dollar O-' X-s O-bump X-##y O-journey O-began O-late O-Sunday O-night O-in O-Far O-Eastern O-trading B-WRB-where O-panic O-selling O-in O-a O-thin O-market O-initially O-pushed O-it O-as O-low O-as O-1 X-. X-83 X-##0 X-##5 O-marks O-and O-139 X-. X-10 O-ye X-##n O-.
But the real fireworks began in European and early New York activity where traders were whipsawed by an inaccurate report of the stock market's opening and a statement by Federal Reserve Board Chairman Alan Greenspan.,O-But O-the O-real O-fireworks O-began O-in O-European O-and O-early O-New O-York O-activity B-WRB-where O-traders O-were O-whip X-##sa X-##wed O-by O-an O-in X-##ac X-##curate O-report O-of O-the O-stock O-market O-' X-s O-opening O-and O-a O-statement O-by O-Federal O-Reserve O-Board O-Chairman O-Alan O-Greens X-##pan O-.
The new commissioner says that closer scrutiny of how the agency uses its resources will go a long way toward enhancing its ability to collect more tax revenue.,O-The O-new O-commissioner O-says O-that O-closer O-scrutiny O-of B-WRB-how O-the O-agency O-uses O-its O-resources O-will O-go O-a O-long O-way O-toward O-enhancing O-its O-ability O-to O-collect O-more O-tax O-revenue O-.
"""Whenever corporate profits are weak that means capital spending is going to soften subsequently,"" Mr. Harris said.","O-"" B-WRB-Whenever O-corporate O-profits O-are O-weak O-that O-means O-capital O-spending O-is O-going O-to O-soft X-##en O-subsequently O-, X-"" O-Mr X-. O-Harris O-said O-."
A formal blessing of sorts was bestowed on this friendship in April when Mikhail and Raisa Gorbachev stopped here for talks with Irish Prime Minister Charles Haughey.,O-A O-formal O-blessing O-of O-sorts O-was O-bestowed O-on O-this O-friendship O-in O-April B-WRB-when O-Mikhail O-and O-Rai X-##sa O-Go X-##rb X-##ache X-##v O-stopped O-here O-for O-talks O-with O-Irish O-Prime O-Minister O-Charles O-Ha X-##ugh X-##ey O-.
"When it opened in 1939, Shannon was the first landfall in Europe for thirsty airplanes flying from North America.","B-WRB-When O-it O-opened O-in O-1939 O-, O-Shannon O-was O-the O-first O-landfall O-in O-Europe O-for O-thirst X-##y O-airplane X-##s O-flying O-from O-North O-America O-."
"In fact, Aer Lingus started ferrying Russians from Shannon to New York when Washington stripped Aeroflot of its U.S. landing rights.","O-In O-fact O-, O-A X-##er O-Ling X-##us O-started O-ferry X-##ing O-Russians O-from O-Shannon O-to O-New O-York B-WRB-when O-Washington O-stripped O-Aero X-##f X-##lot O-of O-its O-U X-. X-S X-. O-landing O-rights O-."
"An editorial in the NCI Journal says the report of declining lung-cancer mortality ""among young men and women in the U.S. indicates that we finally may be winning the battle -- this even in a country where the tobacco industry spends over $2 billion a year for promotion of the addictive habit of smoking.""","O-An O-editorial O-in O-the O-NC X-##I O-Journal O-says O-the O-report O-of O-declining O-lung X-- X-cancer O-mortality O-"" O-among O-young O-men O-and O-women O-in O-the O-U X-. X-S X-. O-indicates O-that O-we O-finally O-may O-be O-winning O-the O-battle O-- X-- O-this O-even O-in O-a O-country B-WRB-where O-the O-tobacco O-industry O-spends O-over O-$ O-2 O-billion O-a O-year O-for O-promotion O-of O-the O-add X-##ict X-##ive O-habit O-of O-smoking O-. O-"""
Why is the stock market suddenly so volatile?,B-WRB-Why O-is O-the O-stock O-market O-suddenly O-so O-volatile O-?
But when they discover that markets aren't always as liquid as they supposed -- markets jump.,O-But B-WRB-when O-they O-discover O-that O-markets O-are O-n X-' X-t O-always O-as O-liquid O-as O-they O-supposed O-- X-- O-markets O-jump O-.
"And when many firms had to ""pay up,"" Monday's sudden rally was sparked.","O-And B-WRB-when O-many O-firms O-had O-to O-"" O-pay O-up O-, X-"" O-Monday O-' X-s O-sudden O-rally O-was O-sparked O-."
"Investors believe they can can rely on such derivative securities to get in and out of the stock market without actually selling any stocks; that is, a way of staying liquid even when they own stocks.","O-In X-##ves X-##tors O-believe O-they O-can O-can O-rely O-on O-such O-derivative O-securities O-to O-get O-in O-and O-out O-of O-the O-stock O-market O-without O-actually O-selling O-any O-stocks O-; O-that O-is O-, O-a O-way O-of O-staying O-liquid O-even B-WRB-when O-they O-own O-stocks O-."
"One new investment style called ""asset allocation"" shifts portfolio weightings between stocks, bonds and cash when computer models say one is more attractive.","O-One O-new O-investment O-style O-called O-"" O-asset O-allocation O-"" O-shifts O-portfolio O-weight X-##ings O-between O-stocks O-, O-bonds O-and O-cash B-WRB-when O-computer O-models O-say O-one O-is O-more O-attractive O-."
"When they did, the firm reduced those stock holdings to about 70%.","B-WRB-When O-they O-did O-, O-the O-firm O-reduced O-those O-stock O-holdings O-to O-about O-70 O-% O-."
"The idea was to ""insure"" the value of a portfolio by selling futures when stock prices dropped -- eliminating the need to sell the stocks themselves.","O-The O-idea O-was O-to O-"" O-ins X-##ure O-"" O-the O-value O-of O-a O-portfolio O-by O-selling O-future X-##s B-WRB-when O-stock O-prices O-dropped O-- X-- O-eliminating O-the O-need O-to O-sell O-the O-stocks O-themselves O-."
"But in October 1987, when portfolio insurers rushed to sell at the same time, they overwhelmed both the stock and futures markets.","O-But O-in O-October O-1987 O-, B-WRB-when O-portfolio O-ins X-##urers O-rushed O-to O-sell O-at O-the O-same O-time O-, O-they O-overwhelmed O-both O-the O-stock O-and O-future X-##s O-markets O-."
"""I think everyone's a little more leery,"" says Jack Baker, head of equity trading at Shearon Lehman Hutton Inc. ""The institutions have driven (commission) rates down to the point where it makes no sense to commit capital,"" says Tom Gallagher, senior executive vice president in charge of institutional trading at Oppenheimer & Co. ""Why should I risk money for a guy for who's paying me five cents a dance?","O-"" O-I O-think O-everyone O-' X-s O-a O-little O-more O-le X-##ery O-, X-"" O-says O-Jack O-Baker O-, O-head O-of O-equity O-trading O-at O-Shea X-##ron O-Le X-##hman O-Hutton O-Inc O-. O-"" O-The O-institutions O-have O-driven O-( O-commission O-) O-rates O-down O-to O-the O-point B-WRB-where O-it O-makes O-no O-sense O-to O-commit O-capital O-, X-"" O-says O-Tom O-Gallagher O-, O-senior O-executive O-vice O-president O-in O-charge O-of O-institutional O-trading O-at O-Op X-##pen X-##heimer O-& O-Co O-. O-"" B-WRB-Why O-should O-I O-risk O-money O-for O-a O-guy O-for O-who O-' X-s O-paying O-me O-five O-cents O-a O-dance O-?"
"Many traders say that ""circuit breakers"" put in place to damp volatility after the 1987 crash actually added to volatility when the stock market plunged Friday.","O-Many O-traders O-say O-that O-"" O-circuit O-break X-##ers O-"" O-put O-in O-place O-to O-damp O-vol X-##ati X-##lity O-after O-the O-1987 O-crash O-actually O-added O-to O-vol X-##ati X-##lity B-WRB-when O-the O-stock O-market O-plunged O-Friday O-."
"When the deal ran into trouble, the stock tumbled; it closed at $198 yesterday.","B-WRB-When O-the O-deal O-ran O-into O-trouble O-, O-the O-stock O-tumbled O-; O-it O-closed O-at O-$ O-198 O-yesterday O-."
Some people tend to ignore that a 50-point move is less in percentage terms than it was when the stock market was lower.,O-Some O-people O-tend O-to O-ignore O-that O-a O-50 X-- X-point O-move O-is O-less O-in O-percentage O-terms O-than O-it O-was B-WRB-when O-the O-stock O-market O-was O-lower O-.
"That's how the stock-picking game is shaping up for the months ahead, according to money managers and a few brokers.","O-That O-' X-s B-WRB-how O-the O-stock X-- X-picking O-game O-is O-shaping O-up O-for O-the O-months O-ahead O-, O-according O-to O-money O-managers O-and O-a O-few O-broker X-##s O-."
"According to Institutional Brokers Estimate System, Wall Street market strategists see only a 2.4% jump in company profits in 1990 -- unlike in 1987, when profits a year out looked good (they did soar 36% in 1988).","O-According O-to O-Institution X-##al O-B X-##roke X-##rs O-E X-##st X-##imate O-System O-, O-Wall O-Street O-market O-s X-##trate X-##gis X-##ts O-see O-only O-a O-2 X-. X-4 O-% O-jump O-in O-company O-profits O-in O-1990 O-- X-- O-unlike O-in O-1987 O-, B-WRB-when O-profits O-a O-year O-out O-looked O-good O-( O-they O-did O-so X-##ar O-36 O-% O-in O-1988 O-) O-."
"As the narrator Stevens, the solitary butler of Darlington Hall, mulls over such hallowed terms as ""greatness,"" ""dignity,"" ""service"" and ""loyalty,"" we see how pious cant subverts the soul.","O-As O-the O-narrator O-Stevens O-, O-the O-solitary O-butler O-of O-Darlington O-Hall O-, O-m X-##ull X-##s O-over O-such O-hall X-##owed O-terms O-as O-"" O-great X-##ness O-, X-"" O-"" O-dignity O-, X-"" O-"" O-service O-"" O-and O-"" O-loyalty O-, X-"" O-we O-see B-WRB-how O-p X-##ious O-can X-##t O-sub X-##vert X-##s O-the O-soul O-."
"As he stands on a hill at the beginning of a six-day motor expedition from Oxfordshire to Cornwall, where a former housekeeper resides, perhaps the victim of an unhappy 20-year marriage, perhaps (he hopes with more fervor than he will ever acknowledge) not disinclined to return to domestic service, Stevens surveys the view and thereby provides a self-portrait, a credo and the author's metaphor for the aesthetic of the novel we're reading:","O-As O-he O-stands O-on O-a O-hill O-at O-the O-beginning O-of O-a O-six X-- X-day O-motor O-expedition O-from O-Oxfordshire O-to O-Cornwall O-, B-WRB-where O-a O-former O-housekeeper O-resides O-, O-perhaps O-the O-victim O-of O-an O-unhappy O-20 X-- X-year O-marriage O-, O-perhaps O-( O-he O-hopes O-with O-more O-f X-##er X-##vor O-than O-he O-will O-ever O-acknowledge O-) O-not O-di X-##sin X-##cline X-##d O-to O-return O-to O-domestic O-service O-, O-Stevens O-surveys O-the O-view O-and O-thereby O-provides O-a O-self X-- X-portrait O-, O-a O-c X-##redo O-and O-the O-author O-' X-s O-metaphor O-for O-the O-aesthetic O-of O-the O-novel O-we O-' X-re O-reading O-:"
"It is this kind of dignity and restraint that allows Stevens to declare: ""For all its sad associations, whenever I recall that evening today, I find I do so with a large sense of triumph.""","O-It O-is O-this O-kind O-of O-dignity O-and O-restraint O-that O-allows O-Stevens O-to O-declare O-: O-"" O-For O-all O-its O-sad O-associations O-, B-WRB-whenever O-I O-recall O-that O-evening O-today O-, O-I O-find O-I O-do O-so O-with O-a O-large O-sense O-of O-triumph O-. O-"""
The judge also suggested that Mr. Wallach tried to influence the jury in August when the verdict was being read.,O-The O-judge O-also O-suggested O-that O-Mr X-. O-Wall X-##ach O-tried O-to O-influence O-the O-jury O-in O-August B-WRB-when O-the O-verdict O-was O-being O-read O-.
"The judge said he didn't understand why Mr. Wallach, an experienced trial lawyer, would commit such an outburst, but he said Mr. Wallach may have hoped the jury would be unable to continue with its verdict.","O-The O-judge O-said O-he O-did O-n X-' X-t O-understand B-WRB-why O-Mr X-. O-Wall X-##ach O-, O-an O-experienced O-trial O-lawyer O-, O-would O-commit O-such O-an O-out X-##burst O-, O-but O-he O-said O-Mr X-. O-Wall X-##ach O-may O-have O-hoped O-the O-jury O-would O-be O-unable O-to O-continue O-with O-its O-verdict O-."
"""The place where a judge can comment and explain his rationale {for sentencing} is from the bench .","O-"" O-The O-place B-WRB-where O-a O-judge O-can O-comment O-and O-explain O-his O-rational X-##e O-{ O-for O-sent X-##encing O-} O-is O-from O-the O-bench O-."
"When Chief Justice Rehnquist sent the report to Congress, a majority of federal judges on the policy-making Judicial Conference complained they hadn't been given a chance to consider the recommendations.","B-WRB-When O-Chief O-Justice O-Re X-##hn X-##quist O-sent O-the O-report O-to O-Congress O-, O-a O-majority O-of O-federal O-judges O-on O-the O-policy X-- X-making O-Judicial O-Conference O-complained O-they O-had O-n X-' X-t O-been O-given O-a O-chance O-to O-consider O-the O-recommendations O-."
"Mutual-fund czar John M. Templeton has put his money where his moniker is, pouring $1.4 million into one of his own funds, the Templeton Value Fund.","O-Mutual X-- X-fund O-c X-##zar O-John O-M X-. O-Temple X-##ton O-has O-put O-his O-money B-WRB-where O-his O-moniker O-is O-, O-pouring O-$ O-1 X-. X-4 O-million O-into O-one O-of O-his O-own O-funds O-, O-the O-Temple X-##ton O-Value O-Fund O-."
Why did he add the Value Fund to the list?,B-WRB-Why O-did O-he O-add O-the O-Value O-Fund O-to O-the O-list O-?
Mr. Sherry declined to comment when asked about the sales.,O-Mr X-. O-She X-##rry O-declined O-to O-comment B-WRB-when O-asked O-about O-the O-sales O-.
"The most striking example yesterday may have been in community development funds, where the two houses had separately approved a total of 27 projects valued at $20 million, and the conference added 15 more valued at $8 million to ostensibly preserve ""balance"" between the House and Senate.","O-The O-most O-striking O-example O-yesterday O-may O-have O-been O-in O-community O-development O-funds O-, B-WRB-where O-the O-two O-houses O-had O-separately O-approved O-a O-total O-of O-27 O-projects O-valued O-at O-$ O-20 O-million O-, O-and O-the O-conference O-added O-15 O-more O-valued O-at O-$ O-8 O-million O-to O-ostensibly O-preserve O-"" O-balance O-"" O-between O-the O-House O-and O-Senate O-."
"Amcast previously had said it planned to repurchase shares, but didn't disclose when or how many shares it intended to buy back.","O-Am X-##cast O-previously O-had O-said O-it O-planned O-to O-re X-##pur X-##chase O-shares O-, O-but O-did O-n X-' X-t O-disc X-##lose B-WRB-when O-or B-WRB-how O-many O-shares O-it O-intended O-to O-buy O-back O-."
"The company also cited the stronger dollar, which cuts the value of overseas profit when it is translated into dollars.","O-The O-company O-also O-cited O-the O-stronger O-dollar O-, O-which O-cuts O-the O-value O-of O-overseas O-profit B-WRB-when O-it O-is O-translated O-into O-dollars O-."
Traders are likely to oppose such restrictions because dual trading provides a way to make money in slower markets where there is a shortage of customer orders.,O-Trade X-##rs O-are O-likely O-to O-oppose O-such O-restrictions O-because O-dual O-trading O-provides O-a O-way O-to O-make O-money O-in O-slower O-markets B-WRB-where O-there O-is O-a O-shortage O-of O-customer O-orders O-.
The exchanges contend that dual trading improves liquidity in the markets because traders can buy or sell even when they don't have a customer order in hand.,O-The O-exchanges O-con X-##tend O-that O-dual O-trading O-improve X-##s O-liquid X-##ity O-in O-the O-markets O-because O-traders O-can O-buy O-or O-sell O-even B-WRB-when O-they O-do O-n X-' X-t O-have O-a O-customer O-order O-in O-hand O-.
"The agency didn't cite specific situations where dual trading might be allowed, but smaller exchanges or contracts that need additional liquidity are expected to be among them.","O-The O-agency O-did O-n X-' X-t O-c X-##ite O-specific O-situations B-WRB-where O-dual O-trading O-might O-be O-allowed O-, O-but O-smaller O-exchanges O-or O-contracts O-that O-need O-additional O-liquid X-##ity O-are O-expected O-to O-be O-among O-them O-."
"Traders who stand on the pit's top step, where most customer orders are executed, can't trade for themselves.","O-Trade X-##rs O-who O-stand O-on O-the O-pit O-' X-s O-top O-step O-, B-WRB-where O-most O-customer O-orders O-are O-executed O-, O-ca O-n X-' X-t O-trade O-for O-themselves O-."
"""He still hasn't proven his mettle as a big-league take-out artist,"" said airline analyst Kevin Murphy of Morgan Stanley & Co. ""He's done this thing where he'll buy a little bit of a company and then trade out of it.","O-"" O-He O-still O-has O-n X-' X-t O-proven O-his O-met X-##tle O-as O-a O-big X-- X-league O-take X-- X-out O-artist O-, X-"" O-said O-airline O-analyst O-Kevin O-Murphy O-of O-Morgan O-Stanley O-& O-Co O-. O-"" O-He O-' X-s O-done O-this O-thing B-WRB-where O-he O-' X-ll O-buy O-a O-little O-bit O-of O-a O-company O-and O-then O-trade O-out O-of O-it O-."
"Why doesn't he just follow through on one of these things?""","B-WRB-Why O-does O-n X-' X-t O-he O-just O-follow O-through O-on O-one O-of O-these O-things O-? O-"""
"Mr. Trump never said how much AMR stock he had bought, only that his holdings were ""substantial.""","O-Mr X-. O-Trump O-never O-said B-WRB-how O-much O-AM X-##R O-stock O-he O-had O-bought O-, O-only O-that O-his O-holdings O-were O-"" O-substantial O-. O-"""
"However, he only received federal clearance to buy more than $15 million of the stock on Sept. 20, when the price rose $2 a share to $78.50.","O-However O-, O-he O-only O-received O-federal O-clearance O-to O-buy O-more O-than O-$ O-15 O-million O-of O-the O-stock O-on O-Sept X-. O-20 O-, B-WRB-when O-the O-price O-rose O-$ O-2 O-a O-share O-to O-$ O-78 X-. X-50 O-."
