"Early yesterday, strategists at several investment firms, including Merrill Lynch and Dean Witter Reynolds, urged customers to buy stocks and cut back on bonds.","O-Early O-yesterday O-, O-s X-##trate X-##gis X-##ts O-at O-several O-investment O-firms O-, O-including O-Merrill O-Lynch O-and O-Dean O-W X-##itte X-##r O-Reynolds O-, O-urged O-customers O-to O-buy O-stocks O-and O-cut B-RP-back O-on O-bonds O-."
The dollar bounced back in the currency markets.,O-The O-dollar O-bounced B-RP-back O-in O-the O-currency O-markets O-.
"The Federal National Mortgage Association set up a three-member office of the chairman and elected James A. Johnson as vice chairman, effective Jan. 1.","O-The O-Federal O-National O-Mo X-##rt X-##ga X-##ge O-Association O-set B-RP-up O-a O-three X-- X-member O-office O-of O-the O-chairman O-and O-elected O-James O-A X-. O-Johnson O-as O-vice O-chairman O-, O-effective O-Jan X-. O-1 O-."
"Fannie Mae also said James A. Aliber, chairman of First Federal of Michigan and a director since 1985, moved up the date of his retirement from the board to accommodate Mr. Johnson's election as a director.","O-Fan X-##nie O-Mae O-also O-said O-James O-A X-. O-Ali X-##ber O-, O-chairman O-of O-First O-Federal O-of O-Michigan O-and O-a O-director O-since O-1985 O-, O-moved B-RP-up O-the O-date O-of O-his O-retirement O-from O-the O-board O-to O-accommodate O-Mr X-. O-Johnson O-' X-s O-election O-as O-a O-director O-."
"In his first statement since the recent market gyrations began, Richard Breeden, who was sworn in as SEC chairman last week, said the ""markets' trading and order routing systems generally operated quite smoothly.","O-In O-his O-first O-statement O-since O-the O-recent O-market O-g X-##yra X-##tions O-began O-, O-Richard O-Bree X-##den O-, O-who O-was O-sworn B-RP-in O-as O-SEC O-chairman O-last O-week O-, O-said O-the O-"" O-markets X-' O-trading O-and O-order O-routing O-systems O-generally O-operated O-quite O-smoothly O-."
The move was in part a warning to firms that the SEC will try to crack down on firms if their back offices aren't in order and become a danger in the event of a major market move.,O-The O-move O-was O-in O-part O-a O-warning O-to O-firms O-that O-the O-SEC O-will O-try O-to O-crack B-RP-down O-on O-firms O-if O-their O-back O-offices O-are O-n X-' X-t O-in O-order O-and O-become O-a O-danger O-in O-the O-event O-of O-a O-major O-market O-move O-.
"When the Soviets announced their last soldier had left Afghanistan in February, the voices of skepticism were all but drowned out by an international chorus of euphoria.","O-When O-the O-Soviets O-announced O-their O-last O-soldier O-had O-left O-Afghanistan O-in O-February O-, O-the O-voices O-of O-s X-##ke X-##pticism O-were O-all O-but O-drowned B-RP-out O-by O-an O-international O-chorus O-of O-e X-##up X-##hor X-##ia O-."
The terms of the Geneva accords leave Moscow free to provide its clients in Kabul with assistance of any kind -- including the return of Soviet ground forces -- while requiring the U.S. and Pakistan to cut off aid.,O-The O-terms O-of O-the O-Geneva O-accord X-##s O-leave O-Moscow O-free O-to O-provide O-its O-clients O-in O-Kabul O-with O-assistance O-of O-any O-kind O-- X-- O-including O-the O-return O-of O-Soviet O-ground O-forces O-- X-- O-while O-requiring O-the O-U X-. X-S X-. O-and O-Pakistan O-to O-cut B-RP-off O-aid O-.
"Since the troop withdrawal, Moscow has poured in an additional $200 to $300 million worth per month -- nearly $2 billion since February, equivalent to the total U.S. aid to the resistance in nine years.","O-Since O-the O-troop O-withdrawal O-, O-Moscow O-has O-poured B-RP-in O-an O-additional O-$ O-200 O-to O-$ O-300 O-million O-worth O-per O-month O-- X-- O-nearly O-$ O-2 O-billion O-since O-February O-, O-equivalent O-to O-the O-total O-U X-. X-S X-. O-aid O-to O-the O-resistance O-in O-nine O-years O-."
"At the last minute, however, Pakistani officials sent in Gulbuddin Hekhmatyar, perhaps the most hated and feared of the extremists, with a demand that the surrender be made to his forces.","O-At O-the O-last O-minute O-, O-however O-, O-Pakistani O-officials O-sent B-RP-in O-G X-##ul X-##bu X-##ddin O-He X-##kh X-##mat X-##yar O-, O-perhaps O-the O-most O-hated O-and O-feared O-of O-the O-ex X-##tre X-##mist X-##s O-, O-with O-a O-demand O-that O-the O-surrender O-be O-made O-to O-his O-forces O-."
Experienced resistance commanders wanted to use guerrilla action and siege tactics to wear down the regime.,O-Experience X-##d O-resistance O-commanders O-wanted O-to O-use O-guerrilla O-action O-and O-siege O-tactics O-to O-wear B-RP-down O-the O-regime O-.
No settlement negotiated by others can force the Afghan people to give up their struggle.,O-No O-settlement O-negotiated O-by O-others O-can O-force O-the O-Afghan O-people O-to O-give B-RP-up O-their O-struggle O-.
US Facilities Corp. said Robert J. Percival agreed to step down as vice chairman of the insurance holding company.,O-US O-F X-##ac X-##ilities O-Corp O-. O-said O-Robert O-J X-. O-Per X-##ci X-##val O-agreed O-to O-step B-RP-down O-as O-vice O-chairman O-of O-the O-insurance O-holding O-company O-.
The State Development Board set up a Hugo Hotline to accept business-to-business help.,O-The O-State O-Development O-Board O-set B-RP-up O-a O-Hugo O-Hot X-##line O-to O-accept O-business X-- X-to X-- X-business O-help O-.
Local bankers and accountants help applicants fill out forms.,O-Local O-banker X-##s O-and O-accountant X-##s O-help O-applicants O-fill B-RP-out O-forms O-.
despite his proposal to phase in small business only gradually.,O-despite O-his O-proposal O-to O-phase B-RP-in O-small O-business O-only O-gradually O-.
"Groups representing some independent auto-repair shops join a compromise on the Clean Air legislation worked out between environmentalists and Rep. Henry Waxman (D., Calif.).","O-Groups O-representing O-some O-independent O-auto X-- X-repair O-shops O-join O-a O-compromise O-on O-the O-Clean O-Air O-legislation O-worked B-RP-out O-between O-environmental X-##ists O-and O-Rep O-. O-Henry O-W X-##ax X-##man O-( O-D X-. O-, O-Cal X-##if X-. O-) O-."
"To hear advertisers tell it, the magazine just hasn't kept up with the times.","O-To O-hear O-ad X-##vert X-##isers O-tell O-it O-, O-the O-magazine O-just O-has O-n X-' X-t O-kept B-RP-up O-with O-the O-times O-."
"But now, the magazine is attempting to fight back, with an ambitious plan including a revamped sales strategy and a surprisingly aggressive ad campaign.","O-But O-now O-, O-the O-magazine O-is O-attempting O-to O-fight B-RP-back O-, O-with O-an O-ambitious O-plan O-including O-a O-re X-##va X-##mp X-##ed O-sales O-strategy O-and O-a O-surprisingly O-aggressive O-ad O-campaign O-."
"The magazine had its best year yet in 1988, when it celebrated its centennial and racked up a 17% gain in ad pages, to 283.","O-The O-magazine O-had O-its O-best O-year O-yet O-in O-1988 O-, O-when O-it O-celebrated O-its O-cent X-##ennial O-and O-rack X-##ed B-RP-up O-a O-17 O-% O-gain O-in O-ad O-pages O-, O-to O-28 X-##3 O-."
"But the magazine was slower than its competitors to come up with its regional editions, and until last year offered fewer of them than did competitors.","O-But O-the O-magazine O-was O-slower O-than O-its O-competitors O-to O-come B-RP-up O-with O-its O-regional O-editions O-, O-and O-until O-last O-year O-offered O-fewer O-of O-them O-than O-did O-competitors O-."
"Another sticking point for advertisers was National Geographic's tradition of lumping its ads together, usually at the beginning or end of the magazine, rather than spreading ads out among its articles, as most magazines do.","O-Another O-sticking O-point O-for O-ad X-##vert X-##isers O-was O-National O-Geographic O-' X-s O-tradition O-of O-lump X-##ing O-its O-ads O-together O-, O-usually O-at O-the O-beginning O-or O-end O-of O-the O-magazine O-, O-rather O-than O-spreading O-ads B-RP-out O-among O-its O-articles O-, O-as O-most O-magazines O-do O-."
But Ms. McCraw says the magazine is fighting back.,O-But O-Ms O-. O-M X-##c X-##C X-##raw O-says O-the O-magazine O-is O-fighting B-RP-back O-.
"It now offers 30 regional editions, it very recently began running ads adjacent to articles, and it has been beefing up its sales force.","O-It O-now O-offers O-30 O-regional O-editions O-, O-it O-very O-recently O-began O-running O-ads O-adjacent O-to O-articles O-, O-and O-it O-has O-been O-beef X-##ing B-RP-up O-its O-sales O-force O-."
"However, when negotiations bogged down recently, WCRS's chief executive, Peter Scott, met in Paris with another French firm, Boulet Dru Dupuy Petit, or BDDP.","O-However O-, O-when O-negotiations O-b X-##ogged B-RP-down O-recently O-, O-WC X-##RS O-' X-s O-chief O-executive O-, O-Peter O-Scott O-, O-met O-in O-Paris O-with O-another O-French O-firm O-, O-Bo X-##ulet O-Dr X-##u O-Du X-##pu X-##y O-Petit O-, O-or O-B X-##D X-##DP O-."
"According to the executive, BDDP's involvement prompted renewed vigor in the WCRS-Eurocom talks and the two agencies were hoping to hammer out details by today.","O-According O-to O-the O-executive O-, O-B X-##D X-##DP O-' X-s O-involvement O-prompted O-renewed O-v X-##igor O-in O-the O-WC X-##RS X-- X-Euro X-##com O-talks O-and O-the O-two O-agencies O-were O-hoping O-to O-hammer B-RP-out O-details O-by O-today O-."
"By midnight Oct. 6, all of the paintings were supposed to have been sold off, under orders from Florida's comptroller, whose office regulates the state's S&Ls.","O-By O-midnight O-Oct X-. O-6 O-, O-all O-of O-the O-paintings O-were O-supposed O-to O-have O-been O-sold B-RP-off O-, O-under O-orders O-from O-Florida O-' X-s O-com X-##pt X-##roll X-##er O-, O-whose O-office O-regulate X-##s O-the O-state O-' X-s O-S O-& O-L X-##s O-."
"Besides that, some of the paintings that were to grace the walls of CenTrust actually ended up hanging in the chairman's estate on La Gorce Isle off Miami Beach.","O-Besides O-that O-, O-some O-of O-the O-paintings O-that O-were O-to O-grace O-the O-walls O-of O-Ce X-##n X-##T X-##rust O-actually O-ended B-RP-up O-hanging O-in O-the O-chairman O-' X-s O-estate O-on O-La O-Go X-##rc X-##e O-Isle O-off O-Miami O-Beach O-."
"Mr. Paul has a plan to bring in $150 million by selling off 63 of CenTrust's 71 branches, but it has yet to be approved by regulators.","O-Mr X-. O-Paul O-has O-a O-plan O-to O-bring O-in O-$ O-150 O-million O-by O-selling B-RP-off O-63 O-of O-Ce X-##n X-##T X-##rust O-' X-s O-71 O-branches O-, O-but O-it O-has O-yet O-to O-be O-approved O-by O-regulator X-##s O-."
Embittered shareholders (some of whom are suing) say the chairman and his collection epitomize the excesses of speculation that set off the national S&L crisis.,O-Em X-##bit X-##tered O-shareholders O-( O-some O-of O-whom O-are O-su X-##ing O-) O-say O-the O-chairman O-and O-his O-collection O-e X-##pit X-##omi X-##ze O-the O-excess X-##es O-of O-speculation O-that O-set B-RP-off O-the O-national O-S O-& O-L O-crisis O-.
"Bond has yet to pay up, and until he does, Sotheby's has the painting under lock and key.)","O-Bond O-has O-yet O-to O-pay B-RP-up O-, O-and O-until O-he O-does O-, O-So X-##the X-##by O-' X-s O-has O-the O-painting O-under O-lock O-and O-key O-. O-)"
"There, on one of his first shopping trips, Mr. Paul picked up several paintings at stunning prices.","O-There O-, O-on O-one O-of O-his O-first O-shopping O-trips O-, O-Mr X-. O-Paul O-picked B-RP-up O-several O-paintings O-at O-stunning O-prices O-."
"Sotheby's, the auction house founded in London 1744 and now under the umbrella of Sotheby's Holdings Inc., was hoping to stir up interest in old masters as it strove to build its U.S. business.","O-So X-##the X-##by O-' X-s O-, O-the O-auction O-house O-founded O-in O-London O-174 X-##4 O-and O-now O-under O-the O-umbrella O-of O-So X-##the X-##by O-' X-s O-Holdings O-Inc X-. O-, O-was O-hoping O-to O-stir B-RP-up O-interest O-in O-old O-masters O-as O-it O-s X-##tro X-##ve O-to O-build O-its O-U X-. X-S X-. O-business O-."
"Last October, Mr. Paul paid out $12 million of CenTrust's cash -- plus a $1.2 million commission -- for ""Portrait of a Man as Mars.""","O-Last O-October O-, O-Mr X-. O-Paul O-paid B-RP-out O-$ O-12 O-million O-of O-Ce X-##n X-##T X-##rust O-' X-s O-cash O-- X-- O-plus O-a O-$ O-1 X-. X-2 O-million O-commission O-- X-- O-for O-"" O-Portrait O-of O-a O-Man O-as O-Mars O-. O-"""
But art that has fallen sharply in value is rarely put up for sale.,O-But O-art O-that O-has O-fallen O-sharply O-in O-value O-is O-rarely O-put B-RP-up O-for O-sale O-.
"But quick turnover in artwork is ""like pawning your jewelry -- you end up with 50%.","O-But O-quick O-turnover O-in O-artwork O-is O-"" O-like O-pawn X-##ing O-your O-jewelry O-- X-- O-you O-end B-RP-up O-with O-50 O-% O-."
"People hold out and try to get a bargain.""","O-People O-hold B-RP-out O-and O-try O-to O-get O-a O-bargain O-. O-"""
"""On occasion, he paid a high price,"" Mr. Wachter concedes, but he says those who bid less and dropped out were dealers who would then have marked up the paintings to resell them at a profit to collectors.","O-"" O-On O-occasion O-, O-he O-paid O-a O-high O-price O-, X-"" O-Mr X-. O-W X-##ach X-##ter O-con X-##cede X-##s O-, O-but O-he O-says O-those O-who O-bid O-less O-and O-dropped B-RP-out O-were O-dealers O-who O-would O-then O-have O-marked B-RP-up O-the O-paintings O-to O-re X-##sel X-##l O-them O-at O-a O-profit O-to O-collectors O-."
"Frequently, clients express interest in paintings but don't end up bidding, she adds, ""so we don't know who the potential buyer will be.""","O-Fr X-##e X-##quent X-##ly O-, O-clients O-express O-interest O-in O-paintings O-but O-do O-n X-' X-t O-end B-RP-up O-bidding O-, O-she O-adds O-, O-"" O-so O-we O-do O-n X-' X-t O-know O-who O-the O-potential O-buyer O-will O-be O-. O-"""
"Mr. Paul, in selling off his paintings, is seeking at least a 15% return on the bank's investment, so as to prove that the venture was sound.","O-Mr X-. O-Paul O-, O-in O-selling B-RP-off O-his O-paintings O-, O-is O-seeking O-at O-least O-a O-15 O-% O-return O-on O-the O-bank O-' X-s O-investment O-, O-so O-as O-to O-prove O-that O-the O-venture O-was O-sound O-."
But he implores that the splendor be played down.,O-But O-he O-imp X-##lore X-##s O-that O-the O-s X-##ple X-##ndo X-##r O-be O-played B-RP-down O-.
"The Galileo worm apparently was hatched on a computer in France hooked up to NASA's Space Physics Analysis Network, Mr. Redmond said.","O-The O-Galileo O-worm O-apparently O-was O-hatch X-##ed O-on O-a O-computer O-in O-France O-hooked B-RP-up O-to O-NASA O-' X-s O-Space O-Physics O-Analysis O-Network O-, O-Mr X-. O-Red X-##mond O-said O-."
"If it finds one and gets into the system, it will display a screen when a user logs on that says, ""Worms Against Nuclear Killers. . . . You talk of times of peace for all, and then prepare for war.""","O-If O-it O-finds O-one O-and O-gets O-into O-the O-system O-, O-it O-will O-display O-a O-screen O-when O-a O-user O-logs B-RP-on O-that O-says O-, O-"" O-W X-##orms O-Against O-Nuclear O-Killer X-##s O-. O-. O-. O-. O-You O-talk O-of O-times O-of O-peace O-for O-all O-, O-and O-then O-prepare O-for O-war O-. O-"""
"If it finds one of those passwords, Mr. Alexander said, the worm will do such things as change users' passwords to a series of random numbers, preventing them from signing on to the network.","O-If O-it O-finds O-one O-of O-those O-password X-##s O-, O-Mr X-. O-Alexander O-said O-, O-the O-worm O-will O-do O-such O-things O-as O-change O-users X-' O-password X-##s O-to O-a O-series O-of O-random O-numbers O-, O-preventing O-them O-from O-signing B-RP-on O-to O-the O-network O-."
"He said the Chaos Computer Club, of West Germany, once managed to invade SPAN and do such things as change the value of pi, messing up some calculations.","O-He O-said O-the O-Chaos O-Computer O-Club O-, O-of O-West O-Germany O-, O-once O-managed O-to O-invade O-SP X-##AN O-and O-do O-such O-things O-as O-change O-the O-value O-of O-p X-##i O-, O-messing B-RP-up O-some O-calculations O-."
"He was succeeded by internal-security chief Egon Krenz, 52, a hard-liner who quickly ruled out any sharing of power with pro-democracy groups.","O-He O-was O-succeeded O-by O-internal X-- X-security O-chief O-E X-##gon O-K X-##ren X-##z O-, O-52 O-, O-a O-hard X-- X-liner O-who O-quickly O-ruled B-RP-out O-any O-sharing O-of O-power O-with O-pro X-- X-democracy O-groups O-."
"But whether he single-handedly sparked the crash or had nothing to do with it, one thing is clear in the aftermath of the price slide: Sam Skinner, by his repeated jawboning on the buy-out issue, has irritated some in the Bush administration, so much so that some White House officials want to rein him in.","O-But O-whether O-he O-single X-- X-handed X-##ly O-sparked O-the O-crash O-or O-had O-nothing O-to O-do O-with O-it O-, O-one O-thing O-is O-clear O-in O-the O-aftermath O-of O-the O-price O-slide O-: O-Sam O-Skinner O-, O-by O-his O-repeated O-jaw X-##bon X-##ing O-on O-the O-buy X-- X-out O-issue O-, O-has O-irritated O-some O-in O-the O-Bush O-administration O-, O-so O-much O-so O-that O-some O-White O-House O-officials O-want O-to O-re X-##in O-him B-RP-in O-."
"Yesterday, for example, the administration came out in opposition to legislation to strengthen the Transportation Department's hand in blocking leveraged buy-outs -- despite statements by Mr. Skinner to Congress that suggested he looked favorably on it, without explicitly endorsing it.","O-Yesterday O-, O-for O-example O-, O-the O-administration O-came B-RP-out O-in O-opposition O-to O-legislation O-to O-strengthen O-the O-Transportation O-Department O-' X-s O-hand O-in O-blocking O-leverage X-##d O-buy X-- X-outs O-- X-- O-despite O-statements O-by O-Mr X-. O-Skinner O-to O-Congress O-that O-suggested O-he O-looked O-favor X-##ably O-on O-it O-, O-without O-explicitly O-end X-##ors X-##ing O-it O-."
Mr. Skinner says he hasn't spelled out a policy for leveraged buy-outs because Wall Street bankers and lawyers would simply find ways to circumvent it.,O-Mr X-. O-Skinner O-says O-he O-has O-n X-' X-t O-spelled B-RP-out O-a O-policy O-for O-leverage X-##d O-buy X-- X-outs O-because O-Wall O-Street O-banker X-##s O-and O-lawyers O-would O-simply O-find O-ways O-to O-c X-##ir X-##cum X-##vent O-it O-.
Mr. Skinner plays down any rift in the administration on the foreign-ownership question.,O-Mr X-. O-Skinner O-plays B-RP-down O-any O-rift O-in O-the O-administration O-on O-the O-foreign X-- X-ownership O-question O-.
"Many delegates were willing to craft a compromise, but U.S. delegate Constance Harriman and others thundered that down.","O-Many O-delegates O-were O-willing O-to O-craft O-a O-compromise O-, O-but O-U X-. X-S X-. O-delegate O-Constance O-Ha X-##rri X-##man O-and O-others O-thunder X-##ed O-that B-RP-down O-."
"The prices of the individual stocks that make up the average were correct, Quotron said, but the average was wrong.","O-The O-prices O-of O-the O-individual O-stocks O-that O-make B-RP-up O-the O-average O-were O-correct O-, O-Q X-##uo X-##tron O-said O-, O-but O-the O-average O-was O-wrong O-."
"At about 10:40 a.m. on the over-the-counter trading desk at a major brokerage firm, a veteran trader who buys and sells some of the most active stocks looked at a senior official and asked, ""What's going on?","O-At O-about O-10 X-: X-40 O-a X-. X-m X-. O-on O-the O-over X-- X-the X-- X-counter O-trading O-desk O-at O-a O-major O-broker X-##age O-firm O-, O-a O-veteran O-trader O-who O-buys O-and O-sells O-some O-of O-the O-most O-active O-stocks O-looked O-at O-a O-senior O-official O-and O-asked O-, O-"" O-What O-' X-s O-going B-RP-on O-?"
"Holly Stark, a vice president who heads the trading desk at Dillon Read Capital Corp., said that once she figured out the Quotron numbers were wrong, she called brokers to tell them.","O-Holly O-Stark O-, O-a O-vice O-president O-who O-heads O-the O-trading O-desk O-at O-Dillon O-Read O-Capital O-Corp X-. O-, O-said O-that O-once O-she O-figured B-RP-out O-the O-Q X-##uo X-##tron O-numbers O-were O-wrong O-, O-she O-called O-broker X-##s O-to O-tell O-them O-."
"Since late 1987, for example, it has put off a rule dealing with deferred income taxes because of the continuing controversy over the issue.","O-Since O-late O-1987 O-, O-for O-example O-, O-it O-has O-put B-RP-off O-a O-rule O-dealing O-with O-def X-##er X-##red O-income O-taxes O-because O-of O-the O-continuing O-controversy O-over O-the O-issue O-."
The Wiedemann division was one of three businesses put up for sale in Cross & Trecker's restructuring program announced in July.,O-The O-W X-##ied X-##emann O-division O-was O-one O-of O-three O-businesses O-put B-RP-up O-for O-sale O-in O-Cross O-& O-T X-##reck X-##er O-' X-s O-restructuring O-program O-announced O-in O-July O-.
"House Republicans also are reluctant to pare down the 1,878-page measure -- at least until they are guaranteed that the provisions they care about will get another vote.","O-House O-Republicans O-also O-are O-reluctant O-to O-par X-##e B-RP-down O-the O-1 X-, X-87 X-##8 X-- X-page O-measure O-- X-- O-at O-least O-until O-they O-are O-guaranteed O-that O-the O-provisions O-they O-care O-about O-will O-get O-another O-vote O-."
"Foley and Michel had agreed to streamline the deficit-reduction bill before the House even took it up, but Mr. Darman and White House Chief of Staff John Sununu had torpedoed that plan in order to press their fight for a cut in capital-gains taxes.","O-Foley O-and O-Michel O-had O-agreed O-to O-stream X-##line O-the O-deficit X-- X-reduction O-bill O-before O-the O-House O-even O-took O-it B-RP-up O-, O-but O-Mr X-. O-Dar X-##man O-and O-White O-House O-Chief O-of O-Staff O-John O-Sun X-##un X-##u O-had O-torpedo X-##ed O-that O-plan O-in O-order O-to O-press O-their O-fight O-for O-a O-cut O-in O-capital X-- X-gains O-taxes O-."
"Taking a tough bargaining position, Mr. Darman said he opposes restoring the funds when Congress finally wraps up its work on 1990 spending.","O-Taking O-a O-tough O-bargaining O-position O-, O-Mr X-. O-Dar X-##man O-said O-he O-oppose X-##s O-restoring O-the O-funds O-when O-Congress O-finally O-wraps B-RP-up O-its O-work O-on O-1990 O-spending O-."
"The Gramm-Rudman penalty won't be taken seriously if agencies merely ""figure out how to juggle the accounts, trusting that Congress is going to restore all the money a little bit later,"" he said.","O-The O-Gram X-##m X-- X-R X-##ud X-##man O-penalty O-w X-##o O-n X-' X-t O-be O-taken O-seriously O-if O-agencies O-merely O-"" O-figure B-RP-out O-how O-to O-j X-##ug X-##gle O-the O-accounts O-, O-trusting O-that O-Congress O-is O-going O-to O-restore O-all O-the O-money O-a O-little O-bit O-later O-, X-"" O-he O-said O-."
". . to fudge over things.""","O-. O-. O-to O-f X-##udge B-RP-over O-things O-. O-"""
"This season Lorinda de Roulet (sister of John Whitney Payson, for whom ""Irises"" by Vincent van Gogh was sold for $53.9 million in November of 1987, to the Australian Alan Bond, who still hasn't taken possession because he hasn't yet paid off the loan Sotheby's offered him at the sale) has consigned another biggie to Sotheby's.","O-This O-season O-Lori X-##nda O-de O-R X-##ou X-##let O-( O-sister O-of O-John O-Whitney O-Pay X-##son O-, O-for O-whom O-"" O-Iris X-##es O-"" O-by O-Vincent O-van O-Go X-##gh O-was O-sold O-for O-$ O-53 X-. X-9 O-million O-in O-November O-of O-1987 O-, O-to O-the O-Australian O-Alan O-Bond O-, O-who O-still O-has O-n X-' X-t O-taken O-possession O-because O-he O-has O-n X-' X-t O-yet O-paid B-RP-off O-the O-loan O-So X-##the X-##by O-' X-s O-offered O-him O-at O-the O-sale O-) O-has O-con X-##signed O-another O-big X-##gie O-to O-So X-##the X-##by O-' X-s O-."
"""Au Lapin Agile"" is a 1905 Rose Period Picasso being billed as ""the most important 20th-century picture ever to come up for auction.""","O-"" O-Au O-La X-##pin O-A X-##gi X-##le O-"" O-is O-a O-1905 O-Rose O-Period O-Picasso O-being O-billed O-as O-"" O-the O-most O-important O-20th X-- X-century O-picture O-ever O-to O-come B-RP-up O-for O-auction O-. O-"""
"Sotheby's also weighs in with the John T. Dorrance Jr. collection of impressionists at an estimated $100 million-plus (to be offered tomorrow) and a juicy assortment of paintings from other sources, more than 35 of which are expected to sell in November for at least $1 million each.","O-So X-##the X-##by O-' X-s O-also O-weighs B-RP-in O-with O-the O-John O-T X-. O-Do X-##rra X-##nce O-Jr X-. O-collection O-of O-impression X-##ists O-at O-an O-estimated O-$ O-100 O-million X-- X-plus O-( O-to O-be O-offered O-tomorrow O-) O-and O-a O-j X-##ui X-##cy O-ass X-##ort X-##ment O-of O-paintings O-from O-other O-sources O-, O-more O-than O-35 O-of O-which O-are O-expected O-to O-sell O-in O-November O-for O-at O-least O-$ O-1 O-million O-each O-."
"""A strong art market is bringing out paintings I never expected to see on the market,"" says David Nash, director of Sotheby's Fine Arts Division.","O-"" O-A O-strong O-art O-market O-is O-bringing B-RP-out O-paintings O-I O-never O-expected O-to O-see O-on O-the O-market O-, X-"" O-says O-David O-Nash O-, O-director O-of O-So X-##the X-##by O-' X-s O-Fine O-Arts O-Division O-."
"And given the seductive prices held out by the auction houses, the urge to sell can -- and apparently has -- become irresistible.","O-And O-given O-the O-seductive O-prices O-held B-RP-out O-by O-the O-auction O-houses O-, O-the O-urge O-to O-sell O-can O-- X-- O-and O-apparently O-has O-- X-- O-become O-i X-##rre X-##sist X-##ible O-."
