"The joint venture is being undone, with McCall's magazine being sold last summer to the New York Times Co. 's Magazine Group for about $80 million, and Time Warner agreeing to sell back its 50% interest in Working Woman and Working Mother to Mr. Lang.","O-The O-joint O-venture O-is O-being O-und X-##one O-, O-with O-M X-##c X-##C X-##all O-' X-s O-magazine O-being O-sold O-last O-summer O-to O-the O-New O-York O-Times O-Co O-. O-' O-s O-Magazine O-Group O-for O-about B-$-$ O-80 O-million O-, O-and O-Time O-Warner O-agreeing O-to O-sell O-back O-its O-50 O-% O-interest O-in O-Working O-Woman O-and O-Working O-Mother O-to O-Mr X-. O-Lang O-."
"Last month, Mr. Ruskin proposed, among other things, to buy 3.5 million shares, or 38%, for $4 apiece.","O-Last O-month O-, O-Mr X-. O-R X-##usk X-##in O-proposed O-, O-among O-other O-things O-, O-to O-buy O-3 X-. X-5 O-million O-shares O-, O-or O-38 O-% O-, O-for B-$-$ O-4 O-a X-##piece O-."
"The chemicals and insurance company said net in the latest quarter was $54.8 million, or 45 cents a share.","O-The O-chemicals O-and O-insurance O-company O-said O-net O-in O-the O-latest O-quarter O-was B-$-$ O-54 X-. X-8 O-million O-, O-or O-45 O-cents O-a O-share O-."
"In the year-earlier quarter, net was $62.2 million, or 51 cents a share.","O-In O-the O-year X-- X-earlier O-quarter O-, O-net O-was B-$-$ O-62 X-. X-2 O-million O-, O-or O-51 O-cents O-a O-share O-."
The previous-year quarter included $16.1 million from businesses spun off as Tredegar Industries Inc.,O-The O-previous X-- X-year O-quarter O-included B-$-$ O-16 X-. X-1 O-million O-from O-businesses O-spun O-off O-as O-T X-##red X-##eg X-##ar O-Industries O-Inc O-.
"Revenue was $613.7 million, up 18% from $521.2 million a year ago.","O-Revenue O-was B-$-$ O-61 X-##3 X-. X-7 O-million O-, O-up O-18 O-% O-from B-$-$ O-52 X-##1 X-. X-2 O-million O-a O-year O-ago O-."
"Ethyl said pretax profit from its insurance segment, excluding investment gains, rose 28% in the latest quarter to $28.6 million from $22.4 million.","O-E X-##thy X-##l O-said O-pre X-##ta X-##x O-profit O-from O-its O-insurance O-segment O-, O-excluding O-investment O-gains O-, O-rose O-28 O-% O-in O-the O-latest O-quarter O-to B-$-$ O-28 X-. X-6 O-million O-from B-$-$ O-22 X-. X-4 O-million O-."
"In the chemicals segment, pretax profit rose 7% to $69.2 million from $64.9 million.","O-In O-the O-chemicals O-segment O-, O-pre X-##ta X-##x O-profit O-rose O-7 O-% O-to B-$-$ O-69 X-. X-2 O-million O-from B-$-$ O-64 X-. X-9 O-million O-."
"For the nine months, Ethyl said net fell 2% to $168.7 million, or $1.40 a share, from $172.2 million, $1.42 a share, a year ago.","O-For O-the O-nine O-months O-, O-E X-##thy X-##l O-said O-net O-fell O-2 O-% O-to B-$-$ O-168 X-. X-7 O-million O-, O-or B-$-$ O-1 X-. X-40 O-a O-share O-, O-from B-$-$ O-172 X-. X-2 O-million O-, B-$-$ O-1 X-. X-42 O-a O-share O-, O-a O-year O-ago O-."
Net in the latest period included $11.9 million from discontinued operations and a charge of $6.2 million from a plant closing.,O-Net O-in O-the O-latest O-period O-included B-$-$ O-11 X-. X-9 O-million O-from O-discontinued O-operations O-and O-a O-charge O-of B-$-$ O-6 X-. X-2 O-million O-from O-a O-plant O-closing O-.
"In the year-ago period, net included $32.7 million from discontinued operations.","O-In O-the O-year X-- X-ago O-period O-, O-net O-included B-$-$ O-32 X-. X-7 O-million O-from O-discontinued O-operations O-."
"Revenue was $1.79 billion, up 18% from $1.52 billion a year earlier.","O-Revenue O-was B-$-$ O-1 X-. X-79 O-billion O-, O-up O-18 O-% O-from B-$-$ O-1 X-. X-52 O-billion O-a O-year O-earlier O-."
"In New York Stock Exchange composite trading, Ethyl closed at $25.875 a share, up 12.5 cents.","O-In O-New O-York O-Stock O-Exchange O-composite O-trading O-, O-E X-##thy X-##l O-closed O-at B-$-$ O-25 X-. X-87 X-##5 O-a O-share O-, O-up O-12 X-. X-5 O-cents O-."
"Total value of the contract could be $100 million, Helionetics said, and work on the project would be about evenly divided.","O-Total O-value O-of O-the O-contract O-could O-be B-$-$ O-100 O-million O-, O-He X-##lion X-##etics O-said O-, O-and O-work O-on O-the O-project O-would O-be O-about O-evenly O-divided O-."
"Pretax profit for the year to June 30 rose to #142.5 million ($224.5 million) from #114.7 million ($180.7 million), broadly matching analysts' expectations.","O-Pre X-##ta X-##x O-profit O-for O-the O-year O-to O-June O-30 O-rose O-to B-$-# O-142 X-. X-5 O-million B-$-( X-$ O-224 X-. X-5 O-million O-) O-from B-$-# O-114 X-. X-7 O-million B-$-( X-$ O-180 X-. X-7 O-million O-) O-, O-broadly O-matching O-analysts X-' O-expectations O-."
"Profit after taxes and minority interests but before extraordinary items increased 22% to #92.6 million from #75.6 million a year earlier, while fully diluted earnings per share rose to 29.90 pence (47 cents) from 24.68 pence (39 cents).","O-Prof X-##it O-after O-taxes O-and O-minority O-interests O-but O-before O-extraordinary O-items O-increased O-22 O-% O-to B-$-# O-92 X-. X-6 O-million O-from B-$-# O-75 X-. X-6 O-million O-a O-year O-earlier O-, O-while O-fully O-di X-##lut X-##ed O-earnings O-per O-share O-rose O-to O-29 X-. X-90 O-pen X-##ce O-( O-47 O-cents O-) O-from O-24 X-. X-68 O-pen X-##ce O-( O-39 O-cents O-) O-."
"Also yesterday, Ashok Patel, a former Par official who pleaded guilty to providing an FDA employee an illegal gratuity of $3,000, was sentenced by a federal judge in Baltimore to one year of community service and a $150,000 fine.","O-Also O-yesterday O-, O-Ash X-##ok O-Patel O-, O-a O-former O-Pa X-##r O-official O-who O-pleaded O-guilty O-to O-providing O-an O-FDA O-employee O-an O-illegal O-g X-##rat X-##uity O-of B-$-$ O-3 X-, X-000 O-, O-was O-sentenced O-by O-a O-federal O-judge O-in O-Baltimore O-to O-one O-year O-of O-community O-service O-and O-a B-$-$ O-150 X-, X-000 O-fine O-."
"Net surged to $210.8 million, or $2.68 a share, from $26.7 million, or 33 cents a share, a year earlier.","O-Net O-surged O-to B-$-$ O-210 X-. X-8 O-million O-, O-or B-$-$ O-2 X-. X-68 O-a O-share O-, O-from B-$-$ O-26 X-. X-7 O-million O-, O-or O-33 O-cents O-a O-share O-, O-a O-year O-earlier O-."
"The latest quarter included a gain of $193.3 million, or $2.46 a share, from the sale of New York Times Cable, completed in August.","O-The O-latest O-quarter O-included O-a O-gain O-of B-$-$ O-193 X-. X-3 O-million O-, O-or B-$-$ O-2 X-. X-46 O-a O-share O-, O-from O-the O-sale O-of O-New O-York O-Times O-Cable O-, O-completed O-in O-August O-."
"Exclusive of the gain, operating profit declined 35% to $16.4 million, or 21 cents a share, from $25.2 million, or 31 cents a share.","O-Ex X-##clusive O-of O-the O-gain O-, O-operating O-profit O-declined O-35 O-% O-to B-$-$ O-16 X-. X-4 O-million O-, O-or O-21 O-cents O-a O-share O-, O-from B-$-$ O-25 X-. X-2 O-million O-, O-or O-31 O-cents O-a O-share O-."
Revenue rose 6.4% to $415.3 million from $390.5 million.,O-Revenue O-rose O-6 X-. X-4 O-% O-to B-$-$ O-415 X-. X-3 O-million O-from B-$-$ O-390 X-. X-5 O-million O-.
"While the U.S. share of the increase probably will not reach the $12 billion or more implicit in the IMF's request for a doubling of its $90 billion capital, the administration probably will agree to a multibillion-dollar increase.","O-While O-the O-U X-. X-S X-. O-share O-of O-the O-increase O-probably O-will O-not O-reach O-the B-$-$ O-12 O-billion O-or O-more O-imp X-##licit O-in O-the O-I X-##MF O-' X-s O-request O-for O-a O-doubling O-of O-its B-$-$ O-90 O-billion O-capital O-, O-the O-administration O-probably O-will O-agree O-to O-a O-multi X-##bill X-##ion X-- X-dollar O-increase O-."
"Second, the World Bank's recent $75 billion capital increase -- $14 billion from the U.S. -- has left the IMF feeling less than first fiddle among international financial institutions.","O-Second O-, O-the O-World O-Bank O-' X-s O-recent B-$-$ O-75 O-billion O-capital O-increase O-- X-- B-$-$ O-14 O-billion O-from O-the O-U X-. X-S X-. O-- X-- O-has O-left O-the O-I X-##MF O-feeling O-less O-than O-first O-fiddle O-among O-international O-financial O-institutions O-."
"The last U.S. congressional authorization, in 1983, was a political donnybrook and carried a $6 billion housing program along with it to secure adequate votes.","O-The O-last O-U X-. X-S X-. O-congressional O-authorization O-, O-in O-1983 O-, O-was O-a O-political O-don X-##ny X-##brook O-and O-carried O-a B-$-$ O-6 O-billion O-housing O-program O-along O-with O-it O-to O-secure O-adequate O-votes O-."
Arkla Inc. said that as part of a program to improve profitability it will take a total of $189 million in after-tax charges by year end.,O-Ark X-##la O-Inc O-. O-said O-that O-as O-part O-of O-a O-program O-to O-improve O-profit X-##ability O-it O-will O-take O-a O-total O-of B-$-$ O-189 O-million O-in O-after X-- X-tax O-charges O-by O-year O-end O-.
"Last year, the company had net income of $117.3 million, or $1.30 a share.","O-Last O-year O-, O-the O-company O-had O-net O-income O-of B-$-$ O-117 X-. X-3 O-million O-, O-or B-$-$ O-1 X-. X-30 O-a O-share O-."
"Arkla said it will report $179 milllion in one-time charges against continuing operations for the third quarter, reflecting settlement of certain natural gas contracts.","O-Ark X-##la O-said O-it O-will O-report B-$-$ O-179 O-mill X-##lion O-in O-one X-- X-time O-charges O-against O-continuing O-operations O-for O-the O-third O-quarter O-, O-reflecting O-settlement O-of O-certain O-natural O-gas O-contracts O-."
"It said it will take a $10 million fourth-quarter charge against discontinued operations, reflecting certain write-downs and the planned sale of a unit.","O-It O-said O-it O-will O-take O-a B-$-$ O-10 O-million O-fourth X-- X-quarter O-charge O-against O-discontinued O-operations O-, O-reflecting O-certain O-write X-- X-down X-##s O-and O-the O-planned O-sale O-of O-a O-unit O-."
"Arkla said its initial offering of 18% of Arkla Exploration Co. is expected to result in a net gain of about $90 million, which will be used to pay down Arkla debt.","O-Ark X-##la O-said O-its O-initial O-offering O-of O-18 O-% O-of O-Ark X-##la O-Exploration O-Co X-. O-is O-expected O-to O-result O-in O-a O-net O-gain O-of O-about B-$-$ O-90 O-million O-, O-which O-will O-be O-used O-to O-pay O-down O-Ark X-##la O-debt O-."
"Investors can get slightly higher yields on deposits below $50,000 than they can on deposits of $90,000 and up.","O-In X-##ves X-##tors O-can O-get O-slightly O-higher O-yields O-on O-deposits O-below B-$-$ O-50 X-, X-000 O-than O-they O-can O-on O-deposits O-of B-$-$ O-90 X-, X-000 O-and O-up O-."
Chemical said deposits Monday were about $5 million higher than usual and it expects more activity as investors receive the proceeds from sales of stock.,O-Chemical O-said O-deposits O-Monday O-were O-about B-$-$ O-5 O-million O-higher O-than O-usual O-and O-it O-expects O-more O-activity O-as O-investors O-receive O-the O-proceeds O-from O-sales O-of O-stock O-.
"Six-month CDs of $50,000 and less yielded an average 8.02% in the week ended Tuesday, down from 8.10%, according to Banxquote.","O-Six X-- X-month O-CDs O-of B-$-$ O-50 X-, X-000 O-and O-less O-yielded O-an O-average O-8 X-. X-02 O-% O-in O-the O-week O-ended O-Tuesday O-, O-down O-from O-8 X-. X-10 O-% O-, O-according O-to O-Ban X-##x X-##q X-##uo X-##te O-."
"Meanwhile, the average yield on six-month CDs of more than $90,000 fell to 7.93% in the latest week, according to Banxquote, from 8.10% the week before.","O-Meanwhile O-, O-the O-average O-yield O-on O-six X-- X-month O-CDs O-of O-more O-than B-$-$ O-90 X-, X-000 O-fell O-to O-7 X-. X-93 O-% O-in O-the O-latest O-week O-, O-according O-to O-Ban X-##x X-##q X-##uo X-##te O-, O-from O-8 X-. X-10 O-% O-the O-week O-before O-."
"The Dallas real estate investment trust last paid a dividend on Dec. 31, 1987, when shareholders received $1 a share.","O-The O-Dallas O-real O-estate O-investment O-trust O-last O-paid O-a O-divide X-##nd O-on O-Dec X-. O-31 O-, O-1987 O-, O-when O-shareholders O-received B-$-$ O-1 O-a O-share O-."
"As a result, Canada's trade surplus with the U.S. narrowed to C$656.5 million (US$558 million) in August from C$1.23 billion (US$1.04 billion) in July.","O-As O-a O-result O-, O-Canada O-' X-s O-trade O-surplus O-with O-the O-U X-. X-S X-. O-narrowed O-to B-$-C B-$-$ O-65 X-##6 X-. X-5 O-million O-( O-US B-$-$ O-55 X-##8 O-million O-) O-in O-August O-from B-$-C B-$-$ O-1 X-. X-23 O-billion O-( O-US B-$-$ O-1 X-. X-04 O-billion O-) O-in O-July O-."
"Canada's trade surplus with all countries narrowed to C$203.5 million in August from C$528.3 million in July, Statistics Canada said.","O-Canada O-' X-s O-trade O-surplus O-with O-all O-countries O-narrowed O-to B-$-C B-$-$ O-203 X-. X-5 O-million O-in O-August O-from B-$-C B-$-$ O-52 X-##8 X-. X-3 O-million O-in O-July O-, O-Statistics O-Canada O-said O-."
Sales for the quarter rose to $1.63 billion from $1.47 billion.,O-Sales O-for O-the O-quarter O-rose O-to B-$-$ O-1 X-. X-63 O-billion O-from B-$-$ O-1 X-. X-47 O-billion O-.
"In New York Stock Exchange composite trading yesterday, Merck shares closed at $75.25, up 50 cents.","O-In O-New O-York O-Stock O-Exchange O-composite O-trading O-yesterday O-, O-Me X-##rc X-##k O-shares O-closed O-at B-$-$ O-75 X-. X-25 O-, O-up O-50 O-cents O-."
"Spurred by growth in world-wide sales of the company's prescription drugs, Warner-Lambert said 1989 will be the best year in its history, with per-share earnings expected to increase more than 20% to about $6.10.","O-S X-##pur X-##red O-by O-growth O-in O-world X-- X-wide O-sales O-of O-the O-company O-' X-s O-prescription O-drugs O-, O-Warner X-- X-Lambert O-said O-1989 O-will O-be O-the O-best O-year O-in O-its O-history O-, O-with O-per X-- X-share O-earnings O-expected O-to O-increase O-more O-than O-20 O-% O-to O-about B-$-$ O-6 X-. X-10 O-."
Sales for the quarter rose to $1.11 billion from $1.03 billion.,O-Sales O-for O-the O-quarter O-rose O-to B-$-$ O-1 X-. X-11 O-billion O-from B-$-$ O-1 X-. X-03 O-billion O-.
Prescription-drug world-wide sales rose 9% in the quarter to $340 million; U.S. sales rose 15%.,O-Pre X-##scription X-- X-drug O-world X-- X-wide O-sales O-rose O-9 O-% O-in O-the O-quarter O-to B-$-$ O-340 O-million O-; O-U X-. X-S X-. O-sales O-rose O-15 O-% O-.
"World-wide sales of Warner-Lambert's non-prescription health-care products, such as Halls cough tablets, Rolaids antacid, and Lubriderm skin lotion, increased 3% to $362 million in the third quarter; U.S. sales rose 5%.","O-World X-- X-wide O-sales O-of O-Warner X-- X-Lambert O-' X-s O-non X-- X-prescription O-health X-- X-care O-products O-, O-such O-as O-Hall X-##s O-cough O-tablets O-, O-R X-##ola X-##ids O-ant X-##ac X-##id O-, O-and O-Lu X-##bri X-##der X-##m O-skin O-lot X-##ion O-, O-increased O-3 O-% O-to B-$-$ O-36 X-##2 O-million O-in O-the O-third O-quarter O-; O-U X-. X-S X-. O-sales O-rose O-5 O-% O-."
"World-wide sales of Trident gum, Certs breath mints, and Clorets gum and breath mints, increased 12% to $277 million.","O-World X-- X-wide O-sales O-of O-Tri X-##dent O-gum O-, O-Ce X-##rts O-breath O-mint X-##s O-, O-and O-C X-##lore X-##ts O-gum O-and O-breath O-mint X-##s O-, O-increased O-12 O-% O-to B-$-$ O-27 X-##7 O-million O-."
"Warner-Lambert shares closed at $109.50 a share, up $1.50, in Big Board composite trading yesterday.","O-Warner X-- X-Lambert O-shares O-closed O-at B-$-$ O-109 X-. X-50 O-a O-share O-, O-up B-$-$ O-1 X-. X-50 O-, O-in O-Big O-Board O-composite O-trading O-yesterday O-."
"Third-quarter sales of the Indianapolis, Ind., company rose 11% to $1.045 billion from $940.6 million.","O-Third X-- X-quarter O-sales O-of O-the O-Indianapolis O-, O-In X-##d X-. O-, O-company O-rose O-11 O-% O-to B-$-$ O-1 X-. X-04 X-##5 O-billion O-from B-$-$ O-94 X-##0 X-. X-6 O-million O-."
Nine-month sales grew 12% to $3.39 billion from $3.03 billion a year earlier.,O-Nine X-- X-month O-sales O-grew O-12 O-% O-to B-$-$ O-3 X-. X-39 O-billion O-from B-$-$ O-3 X-. X-03 O-billion O-a O-year O-earlier O-.
"Lilly shares closed yesterday in composite trading on the Big Board at $62.25, down 12.5 cents.","O-Lilly O-shares O-closed O-yesterday O-in O-composite O-trading O-on O-the O-Big O-Board O-at B-$-$ O-62 X-. X-25 O-, O-down O-12 X-. X-5 O-cents O-."
"At the opening of the New York Mercantile Exchange, West Texas Intermediate for November delivery shot up 10 cents a barrel, to $20.85, still on the belief that the refineries were damaged.","O-At O-the O-opening O-of O-the O-New O-York O-Me X-##rca X-##nti X-##le O-Exchange O-, O-West O-Texas O-Intermediate O-for O-November O-delivery O-shot O-up O-10 O-cents O-a O-barrel O-, O-to B-$-$ O-20 X-. X-85 O-, O-still O-on O-the O-belief O-that O-the O-re X-##fine X-##ries O-were O-damaged O-."
"As the news spread that the refineries were intact, crude prices plunged, ending the day at $20.56 a barrel, down 19 cents.","O-As O-the O-news O-spread O-that O-the O-re X-##fine X-##ries O-were O-intact O-, O-crude O-prices O-plunged O-, O-ending O-the O-day O-at B-$-$ O-20 X-. X-56 O-a O-barrel O-, O-down O-19 O-cents O-."
The December contract declined 1.85 cents a pound to $1.2645.,O-The O-December O-contract O-declined O-1 X-. X-85 O-cents O-a O-pound O-to B-$-$ O-1 X-. X-264 X-##5 O-.
"Ethan Bronner's ""Battle for Justice: How the Bork Nomination Shook America"" (Norton, 399 pages, $22.50) is a spirited narrative of the nastiest of these hearings, done with journalistic verve, but with a flawed legal philosophy.","O-Ethan O-B X-##ron X-##ner O-' X-s O-"" O-Battle O-for O-Justice O-: O-How O-the O-Bo X-##rk O-No X-##mination O-S X-##ho X-##ok O-America O-"" O-( O-Norton O-, O-39 X-##9 O-pages O-, B-$-$ O-22 X-. X-50 O-) O-is O-a O-spirit X-##ed O-narrative O-of O-the O-na X-##st X-##iest O-of O-these O-hearings O-, O-done O-with O-journalist X-##ic O-ve X-##rve O-, O-but O-with O-a O-fl X-##awed O-legal O-philosophy O-."
"As the stock market bounced back, withdrawals of money from stock funds amounted to a mere trickle compared with Black Monday, when investors dumped $2.3 billion, or about 2% of stock-fund assets.","O-As O-the O-stock O-market O-bounced O-back O-, O-withdrawal X-##s O-of O-money O-from O-stock O-funds O-amounted O-to O-a O-mere O-trick X-##le O-compared O-with O-Black O-Monday O-, O-when O-investors O-dumped B-$-$ O-2 X-. X-3 O-billion O-, O-or O-about O-2 O-% O-of O-stock X-- X-fund O-assets O-."
"Net outflows from Fidelity's stock funds stood at less than $300 million, or below 15% of the $2 billion cash position of the firm's stock portfolios.","O-Net O-out X-##flow X-##s O-from O-Fi X-##delity O-' X-s O-stock O-funds O-stood O-at O-less O-than B-$-$ O-300 O-million O-, O-or O-below O-15 O-% O-of O-the B-$-$ O-2 O-billion O-cash O-position O-of O-the O-firm O-' X-s O-stock O-portfolio X-##s O-."
Shareholders have been steadily bailing out of several big junk funds the past several weeks as the $200 billion market was jolted by a cash crunch at Campeau Corp. and steadily declining prices.,O-S X-##hare X-##holders O-have O-been O-steadily O-bail X-##ing O-out O-of O-several O-big O-junk O-funds O-the O-past O-several O-weeks O-as O-the B-$-$ O-200 O-billion O-market O-was O-jolt X-##ed O-by O-a O-cash O-c X-##runch O-at O-Camp X-##eau O-Corp X-. O-and O-steadily O-declining O-prices O-.
"The $1.1 billion T. Rowe Price High Yield Fund was among the funds that borrowed during the Campeau crisis, says George J. Collins, president of T. Rowe Price Associates Inc.","O-The B-$-$ O-1 X-. X-1 O-billion O-T O-. O-Rowe O-Price O-High O-Yi X-##eld O-Fund O-was O-among O-the O-funds O-that O-borrowed O-during O-the O-Camp X-##eau O-crisis O-, O-says O-George O-J X-. O-Collins O-, O-president O-of O-T O-. O-Rowe O-Price O-Associates O-Inc O-."
"Most have read the pre-trial documents, however, and estimate Kodak will be ordered to pay $1 billion to $1.5 billion for infringing on seven Polaroid patents.","O-Most O-have O-read O-the O-pre X-- X-trial O-documents O-, O-however O-, O-and O-estimate O-Ko X-##dak O-will O-be O-ordered O-to O-pay B-$-$ O-1 O-billion O-to B-$-$ O-1 X-. X-5 O-billion O-for O-in X-##f X-##ringing O-on O-seven O-Polar X-##oid O-patents O-."
"That may be the largest patent award ever, but it is well below the $12 billion Polaroid seeks.","O-That O-may O-be O-the O-largest O-patent O-award O-ever O-, O-but O-it O-is O-well O-below O-the B-$-$ O-12 O-billion O-Polar X-##oid O-seeks O-."
"The highest patent damage award to date was in 1986, when Smith International Inc. was ordered to pay $205 million to Baker Hughes Inc. for infringing on a patent on an oil drilling bit seal.","O-The O-highest O-patent O-damage O-award O-to O-date O-was O-in O-1986 O-, O-when O-Smith O-International O-Inc X-. O-was O-ordered O-to O-pay B-$-$ O-205 O-million O-to O-Baker O-Hughes O-Inc O-. O-for O-in X-##f X-##ringing O-on O-a O-patent O-on O-an O-oil O-drilling O-bit O-seal O-."
The two companies later agreed to settle for $95 million.,O-The O-two O-companies O-later O-agreed O-to O-settle O-for B-$-$ O-95 O-million O-.
Treasury bonds also were hurt late in the day by a $4 billion offering by the Tennessee Valley Authority and the prospect of a huge amount of new agency debt.,O-Treasury O-bonds O-also O-were O-hurt O-late O-in O-the O-day O-by O-a B-$-$ O-4 O-billion O-offering O-by O-the O-Tennessee O-Valley O-Authority O-and O-the O-prospect O-of O-a O-huge O-amount O-of O-new O-agency O-debt O-.
Fed officials injected more cash into the banking system by arranging $1.5 billion of repurchase agreements during the usual pre-noon intervention period.,O-Fed O-officials O-injected O-more O-cash O-into O-the O-banking O-system O-by O-arranging B-$-$ O-1 X-. X-5 O-billion O-of O-re X-##pur X-##chase O-agreements O-during O-the O-usual O-pre X-- X-noon O-intervention O-period O-.
"The Treasury's benchmark 30-year bond fell more than 1/2 point, or over $5 for each $1,000 face amount, while the yield moved above 8% for the first time since Thursday.","O-The O-Treasury O-' X-s O-bench X-##mark O-30 X-- X-year O-bond O-fell O-more O-than O-1 O-/ O-2 O-point O-, O-or O-over B-$-$ O-5 O-for O-each B-$-$ O-1 X-, X-000 O-face O-amount O-, O-while O-the O-yield O-moved O-above O-8 O-% O-for O-the O-first O-time O-since O-Thursday O-."
Strong investor demand prompted it to boost the size of the issue from $3 billion.,O-Strong O-investor O-demand O-prompted O-it O-to O-boost O-the O-size O-of O-the O-issue O-from B-$-$ O-3 O-billion O-.
"Some traders estimate $9.75 billion of new two-year Treasurys will be sold next week, and they expect Refcorp to offer $4 billion to $6 billion of long-term ""bailout"" bonds.","O-Some O-traders O-estimate B-$-$ O-9 X-. X-75 O-billion O-of O-new O-two X-- X-year O-Treasury X-##s O-will O-be O-sold O-next O-week O-, O-and O-they O-expect O-Re X-##f X-##cor X-##p O-to O-offer B-$-$ O-4 O-billion O-to B-$-$ O-6 O-billion O-of O-long X-- X-term O-"" O-bail X-##out O-"" O-bonds O-."
The Office of Finance of the Federal Home Loan Banks said it priced a four-part $2.27 billion bond offering for the banks to yield from 8.125% to 8.375%.,O-The O-Office O-of O-Finance O-of O-the O-Federal O-Home O-Lo X-##an O-Banks O-said O-it O-priced O-a O-four X-- X-part B-$-$ O-2 X-. X-27 O-billion O-bond O-offering O-for O-the O-banks O-to O-yield O-from O-8 X-. X-125 O-% O-to O-8 X-. X-375 O-% O-.
"The release of several economic reports had little impact on the market, including a report that the U.S. trade deficit expanded to a surprisingly wide $10.77 billion in August, up from a revised $8.24 billion in July.","O-The O-release O-of O-several O-economic O-reports O-had O-little O-impact O-on O-the O-market O-, O-including O-a O-report O-that O-the O-U X-. X-S X-. O-trade O-deficit O-expanded O-to O-a O-surprisingly O-wide B-$-$ O-10 X-. X-77 O-billion O-in O-August O-, O-up O-from O-a O-revised B-$-$ O-8 X-. X-24 O-billion O-in O-July O-."
The August gap was expected to have expanded to $9.1 billion.,O-The O-August O-gap O-was O-expected O-to O-have O-expanded O-to B-$-$ O-9 X-. X-1 O-billion O-.
The TVA's huge $4 billion offering dominated attention in the new-issue market.,O-The O-TV X-##A O-' X-s O-huge B-$-$ O-4 O-billion O-offering O-dominated O-attention O-in O-the O-new X-- X-issue O-market O-.
TVA offered $2 billion of 30-year bonds priced to yield 9.06%; $1 billion in 10-year notes priced to yield 8.42%; and $1 billion in five-year notes priced to yield 8.33%.,O-TV X-##A O-offered B-$-$ O-2 O-billion O-of O-30 X-- X-year O-bonds O-priced O-to O-yield O-9 X-. X-06 O-% O-; B-$-$ O-1 O-billion O-in O-10 X-- X-year O-notes O-priced O-to O-yield O-8 X-. X-42 O-% O-; O-and B-$-$ O-1 O-billion O-in O-five X-- X-year O-notes O-priced O-to O-yield O-8 X-. X-33 O-% O-.
"Yesterday's bond sale was part of a $6.7 billion refinancing plan to pay off high-interest debt the TVA owes the Federal Financing Bank, an arm of the Treasury.","O-Yesterday O-' X-s O-bond O-sale O-was O-part O-of O-a B-$-$ O-6 X-. X-7 O-billion O-re X-##fin X-##an X-##cing O-plan O-to O-pay O-off O-high X-- X-interest O-debt O-the O-TV X-##A O-owes O-the O-Federal O-Fin X-##an X-##cing O-Bank O-, O-an O-arm O-of O-the O-Treasury O-."
"Meanwhile, Lockheed Corp. priced a $300 million note offering to yield 9.39%.","O-Meanwhile O-, O-Lockheed O-Corp O-. O-priced O-a B-$-$ O-300 O-million O-note O-offering O-to O-yield O-9 X-. X-39 O-% O-."
