"""Mad Rush"" began its life as the accompaniment to the Dalai Lama's first public address in the U.S., when Mr. Glass played it on the organ at New York's Cathedral of St. John the Divine.","B-``-"" O-Mad O-Rush O-"" O-began O-its O-life O-as O-the O-accompaniment O-to O-the O-Dal X-##ai O-Lama O-' X-s O-first O-public O-address O-in O-the O-U X-. X-S X-. O-, O-when O-Mr X-. O-Glass O-played O-it O-on O-the O-organ O-at O-New O-York O-' X-s O-Cathedral O-of O-St X-. O-John O-the O-Divine O-."
"The evening ended with Mr. Glass's ""Metamorphosis,"" another multiple work.","O-The O-evening O-ended O-with O-Mr X-. O-Glass O-' X-s B-``-"" O-Met X-##amo X-##rp X-##hos X-##is O-, X-"" O-another O-multiple O-work O-."
"Parts 1, 2, and 5 come from the soundtrack of Errol Morris's acclaimed film, ""The Thin Blue Line,"" and the two other parts from incidental music to two separate dramatizations of the Kafka story of the same name.","O-Parts O-1 O-, O-2 O-, O-and O-5 O-come O-from O-the O-soundtrack O-of O-E X-##rro X-##l O-Morris O-' X-s O-acclaimed O-film O-, B-``-"" O-The O-Thin O-Blue O-Line O-, X-"" O-and O-the O-two O-other O-parts O-from O-incident X-##al O-music O-to O-two O-separate O-drama X-##ti X-##zation X-##s O-of O-the O-Ka X-##f X-##ka O-story O-of O-the O-same O-name O-."
"Admirers of Mr. Glass may agree with the critic Richard Kostelanetz's sense that the 1974 ""Music in Twelve Parts"" is as encyclopedic and weighty as ""The Well-Tempered Clavier.""","O-Ad X-##mir X-##ers O-of O-Mr X-. O-Glass O-may O-agree O-with O-the O-critic O-Richard O-Ko X-##ste X-##lane X-##tz O-' X-s O-sense O-that O-the O-1974 B-``-"" O-Music O-in O-Twelve O-Parts O-"" O-is O-as O-en X-##cy X-##c X-##lop X-##edic O-and O-weight X-##y O-as B-``-"" O-The O-Well X-- X-Te X-##mper X-##ed O-C X-##lav X-##ier O-. O-"""
"""Many members feel there are important features of the House bill that should be enacted,"" Speaker Thomas Foley (D., Wash.) said.","B-``-"" O-Many O-members O-feel O-there O-are O-important O-features O-of O-the O-House O-bill O-that O-should O-be O-enacted O-, X-"" O-Speaker O-Thomas O-Foley O-( O-D X-. O-, O-Was X-##h X-. O-) O-said O-."
"""If there is any support for reducing the bill, it is conditioned on their desire to see them passed in another form.""","B-``-"" O-If O-there O-is O-any O-support O-for O-reducing O-the O-bill O-, O-it O-is O-conditioned O-on O-their O-desire O-to O-see O-them O-passed O-in O-another O-form O-. O-"""
"""You've got to give these chairmen the opportunity to see if they can work things out,"" said House Budget Committee Chairman Leon Panetta (D., Calif.).","B-``-"" O-You O-' X-ve O-got O-to O-give O-these O-chair X-##men O-the O-opportunity O-to O-see O-if O-they O-can O-work O-things O-out O-, X-"" O-said O-House O-Budget O-Committee O-Chairman O-Leon O-Pan X-##etta O-( O-D X-. O-, O-Cal X-##if X-. O-) O-."
"""This is a democratic process -- you can't slam-dunk anything around here.""","B-``-"" O-This O-is O-a O-democratic O-process O-- X-- O-you O-ca O-n X-' X-t O-slam X-- X-du X-##nk O-anything O-around O-here O-. O-"""
"The new magazine, whose name Mr. Kimball won't reveal, will be a service magazine ""at its core,"" covering subjects such as health, clothing, food, travel and gifts for women.","O-The O-new O-magazine O-, O-whose O-name O-Mr X-. O-Kim X-##ball O-w X-##o O-n X-' X-t O-reveal O-, O-will O-be O-a O-service O-magazine B-``-"" O-at O-its O-core O-, X-"" O-covering O-subjects O-such O-as O-health O-, O-clothing O-, O-food O-, O-travel O-and O-gifts O-for O-women O-."
"Mr. Kimball said he will be a partner in the magazine with an ""experienced"" editor, whose name will be revealed later.","O-Mr X-. O-Kim X-##ball O-said O-he O-will O-be O-a O-partner O-in O-the O-magazine O-with O-an B-``-"" O-experienced O-"" O-editor O-, O-whose O-name O-will O-be O-revealed O-later O-."
"""The market must have turned up and down 15 different times,"" commented Lance Zipper, head of OTC trading at Kidder Peabody.","B-``-"" O-The O-market O-must O-have O-turned O-up O-and O-down O-15 O-different O-times O-, X-"" O-commented O-Lance O-Z X-##ip X-##per O-, O-head O-of O-O X-##TC O-trading O-at O-Kid X-##der O-Peabody O-."
"""Every time you thought it was going into a rally it gave up, and every time you thought it would rally it came down.","B-``-"" O-Every O-time O-you O-thought O-it O-was O-going O-into O-a O-rally O-it O-gave O-up O-, O-and O-every O-time O-you O-thought O-it O-would O-rally O-it O-came O-down O-."
"""Everybody's confused and no one has an opinion that lasts longer than 30 seconds,"" said Mr. Zipper.","B-``-"" O-Everybody O-' X-s O-confused O-and O-no O-one O-has O-an O-opinion O-that O-lasts O-longer O-than O-30 O-seconds O-, X-"" O-said O-Mr X-. O-Z X-##ip X-##per O-."
"""A lot of the professional traders are just going back and forth.","B-``-"" O-A O-lot O-of O-the O-professional O-traders O-are O-just O-going O-back O-and O-forth O-."
"He believes that the volatile conditions created by program trading has ""thoroughly confused"" investors about where the market is headed.","O-He O-believes O-that O-the O-volatile O-conditions O-created O-by O-program O-trading O-has B-``-"" O-thoroughly O-confused O-"" O-investors O-about O-where O-the O-market O-is O-headed O-."
"Program trading is ""benefiting a few to the detriment of many and I wish someone would do something about it,"" he complained.","O-Program O-trading O-is B-``-"" O-benefit X-##ing O-a O-few O-to O-the O-de X-##tri X-##ment O-of O-many O-and O-I O-wish O-someone O-would O-do O-something O-about O-it O-, X-"" O-he O-complained O-."
"""Every year we've been waiting for stepped-up expansion from the company.","B-``-"" O-Every O-year O-we O-' X-ve O-been O-waiting O-for O-stepped X-- X-up O-expansion O-from O-the O-company O-."
"ANTHEM ELECTRONICS INC., San Jose, distributor of electronic parts, annual sales of about $300 million, NYSE, sustained very little damage, anticipated being ""in 100% operating condition"" by midday.","O-AN X-##TH X-##EM O-E X-##LE X-##CT X-##RO X-##NI X-##CS O-IN X-##C X-. O-, O-San O-Jose O-, O-distributor O-of O-electronic O-parts O-, O-annual O-sales O-of O-about O-$ O-300 O-million O-, O-NY X-##SE O-, O-sustained O-very O-little O-damage O-, O-anticipated O-being B-``-"" O-in O-100 O-% O-operating O-condition O-"" O-by O-mid X-##day O-."
"HEWLETT-PACKARD Co., Palo Alto, personal computer and electronic equipment maker, annual sales of $9.8 billion, NYSE, said there will be a ""minimal suspension"" of manufacturing for an undefined period.","O-H X-##E X-##W X-##LE X-##TT X-- X-PA X-##C X-##KA X-##RD O-Co X-. O-, O-Pa X-##lo O-Alto O-, O-personal O-computer O-and O-electronic O-equipment O-maker O-, O-annual O-sales O-of O-$ O-9 X-. X-8 O-billion O-, O-NY X-##SE O-, O-said O-there O-will O-be O-a B-``-"" O-minimal O-suspension O-"" O-of O-manufacturing O-for O-an O-und X-##ef X-##ined O-period O-."
"Damage will be ""easily in the millions,"" the company said.","O-Dam X-##age O-will O-be B-``-"" O-easily O-in O-the O-millions O-, X-"" O-the O-company O-said O-."
"WATKINS-JOHNSON CO., defense-oriented electronics manufacturer, annual sales $292 million, NYSE, minor damage to headquarters and plant in Palo Alto, no damage to San Jose plant, ""still assessing"" damage at Scotts Valley plant, where main product is furnaces for semiconductor production.","O-WA X-##T X-##K X-##IN X-##S X-- X-J X-##OH X-##NS X-##ON O-CO X-. O-, O-defense X-- X-oriented O-electronics O-manufacturer O-, O-annual O-sales O-$ O-29 X-##2 O-million O-, O-NY X-##SE O-, O-minor O-damage O-to O-headquarters O-and O-plant O-in O-Pa X-##lo O-Alto O-, O-no O-damage O-to O-San O-Jose O-plant O-, B-``-"" O-still O-assessing O-"" O-damage O-at O-Scott X-##s O-Valley O-plant O-, O-where O-main O-product O-is O-furnace X-##s O-for O-semi X-##conductor O-production O-."
"Called a ""married put,"" the technique is carried out by purchasing a stock and simultaneously buying a put option on that stock.","O-Called O-a B-``-"" O-married O-put O-, X-"" O-the O-technique O-is O-carried O-out O-by O-purchasing O-a O-stock O-and O-simultaneously O-buying O-a O-put O-option O-on O-that O-stock O-."
"It's like ""fire insurance,"" says Harrison Roth, the senior options strategist at Cowen & Co.","O-It O-' X-s O-like B-``-"" O-fire O-insurance O-, X-"" O-says O-Harrison O-Roth O-, O-the O-senior O-options O-s X-##trate X-##gis X-##t O-at O-Co X-##wen O-& O-Co O-."
"""This is the type of fire insurance you only buy when the nearby woods are on fire,"" says Mr. Roth.","B-``-"" O-This O-is O-the O-type O-of O-fire O-insurance O-you O-only O-buy O-when O-the O-nearby O-woods O-are O-on O-fire O-, X-"" O-says O-Mr X-. O-Roth O-."
"""You always want your house insured, but you don't always feel the need for your investments to be insured.""","B-``-"" O-You O-always O-want O-your O-house O-ins X-##ured O-, O-but O-you O-do O-n X-' X-t O-always O-feel O-the O-need O-for O-your O-investments O-to O-be O-ins X-##ured O-. O-"""
"The investor will be out the cost of the put, which is called the ""premium,"" and this loss will reduce the stock-market profit.","O-The O-investor O-will O-be O-out O-the O-cost O-of O-the O-put O-, O-which O-is O-called O-the B-``-"" O-premium O-, X-"" O-and O-this O-loss O-will O-reduce O-the O-stock X-- X-market O-profit O-."
"Once the stock price is less than the exercise price, or ""strike price,"" of the put, the gain will match the loss on the stock dollar for dollar.","O-Once O-the O-stock O-price O-is O-less O-than O-the O-exercise O-price O-, O-or B-``-"" O-strike O-price O-, X-"" O-of O-the O-put O-, O-the O-gain O-will O-match O-the O-loss O-on O-the O-stock O-dollar O-for O-dollar O-."
"They can do this by purchasing ""index puts,"" which are simply put options on indexes that match broad baskets of stocks.","O-They O-can O-do O-this O-by O-purchasing B-``-"" O-index O-puts O-, X-"" O-which O-are O-simply O-put O-options O-on O-index X-##es O-that O-match O-broad O-basket X-##s O-of O-stocks O-."
"""We've had the Russians and Chinese, and people from India visiting us,"" Mr. Iverson beams.","B-``-"" O-We O-' X-ve O-had O-the O-Russians O-and O-Chinese O-, O-and O-people O-from O-India O-visiting O-us O-, X-"" O-Mr X-. O-I X-##vers X-##on O-beams O-."
"""Everyone in the world is watching us very closely.""","B-``-"" O-Everyone O-in O-the O-world O-is O-watching O-us O-very O-closely O-. O-"""
"Says the chief executive officer of a major Midwest steel company: ""It's damn worrisome.""","O-Say X-##s O-the O-chief O-executive O-officer O-of O-a O-major O-Midwest O-steel O-company O-: B-``-"" O-It O-' X-s O-damn O-w X-##or X-##ris X-##ome O-. O-"""
"""There's a revolution ahead of us that will ultimately change the way we market and distribute steel,"" says William Dennis, vice president, manufacturing and technology, for the American Iron Ore and Steel Institute.","B-``-"" O-There O-' X-s O-a O-revolution O-ahead O-of O-us O-that O-will O-ultimately O-change O-the O-way O-we O-market O-and O-distribute O-steel O-, X-"" O-says O-William O-Dennis O-, O-vice O-president O-, O-manufacturing O-and O-technology O-, O-for O-the O-American O-Iron O-Or X-##e O-and O-Steel O-Institute O-."
"""It's no longer enough to beat the guy down the street.","B-``-"" O-It O-' X-s O-no O-longer O-enough O-to O-beat O-the O-guy O-down O-the O-street O-."
"""The technology revolution is going to be very threatening to established producers,"" says Peter Marcus, an analyst with PaineWebber Inc. ""They've got too much invested in the old stuff and they can't get their workers to be flexible.""","B-``-"" O-The O-technology O-revolution O-is O-going O-to O-be O-very O-threatening O-to O-established O-producers O-, X-"" O-says O-Peter O-Marcus O-, O-an O-analyst O-with O-Pain X-##e X-##W X-##eb X-##ber O-Inc O-. B-``-"" O-They O-' X-ve O-got O-too O-much O-invested O-in O-the O-old O-stuff O-and O-they O-ca O-n X-' X-t O-get O-their O-workers O-to O-be O-flexible O-. O-"""
"""At this point, the minimill capacity won't make a great dent in the integrated market, but it does challenge them to develop new markets,"" says James McCall, vice president, materials, at Battelle, a technology and management-research giant based in Columbus, Ohio.","B-``-"" O-At O-this O-point O-, O-the O-mini X-##mill O-capacity O-w X-##o O-n X-' X-t O-make O-a O-great O-den X-##t O-in O-the O-integrated O-market O-, O-but O-it O-does O-challenge O-them O-to O-develop O-new O-markets O-, X-"" O-says O-James O-M X-##c X-##C X-##all O-, O-vice O-president O-, O-materials O-, O-at O-Bat X-##tel X-##le O-, O-a O-technology O-and O-management X-- X-research O-giant O-based O-in O-Columbus O-, O-Ohio O-."
"""We said: `We've got a product: if you want it, you can buy it, '"" he says, adding: ""Now we're figuring out what people need, and are going back to make it.""","B-``-"" O-We O-said O-: B-``-` O-We O-' X-ve O-got O-a O-product O-: O-if O-you O-want O-it O-, O-you O-can O-buy O-it O-, O-' X-"" O-he O-says O-, O-adding O-: B-``-"" O-Now O-we O-' X-re O-figuring O-out O-what O-people O-need O-, O-and O-are O-going O-back O-to O-make O-it O-. O-"""
"""It's like everyone climbing out of the QE II and getting into a lifeboat,"" says John Jacobson, an analyst with AUS Consultants.","B-``-"" O-It O-' X-s O-like O-everyone O-climbing O-out O-of O-the O-Q X-##E O-II O-and O-getting O-into O-a O-life X-##boat O-, X-"" O-says O-John O-Jacobs X-##on O-, O-an O-analyst O-with O-AU X-##S O-Consul X-##tant X-##s O-."
"""After a while, someone has to go over the side.""","B-``-"" O-After O-a O-while O-, O-someone O-has O-to O-go O-over O-the O-side O-. O-"""
"""Unless there is an enormous rate of economic growth or a further drop in the dollar, it's unlikely that consumption of U.S. produced steel will grow sufficiently to offset the growth of minimills.""","B-``-"" O-Unless O-there O-is O-an O-enormous O-rate O-of O-economic O-growth O-or O-a O-further O-drop O-in O-the O-dollar O-, O-it O-' X-s O-unlikely O-that O-consumption O-of O-U X-. X-S X-. O-produced O-steel O-will O-grow O-sufficiently O-to O-offset O-the O-growth O-of O-mini X-##mill X-##s O-. O-"""
"""People think of the steel business as an old and mundane smokestack business,"" says Mr. Iverson.","B-``-"" O-People O-think O-of O-the O-steel O-business O-as O-an O-old O-and O-m X-##unda X-##ne O-smoke X-##sta X-##ck O-business O-, X-"" O-says O-Mr X-. O-I X-##vers X-##on O-."
"""They're dead wrong.""","B-``-"" O-They O-' X-re O-dead O-wrong O-. O-"""
"Dealers noted that the foreign exchange market's initial bearish reaction to the U.S. trade figures was tempered later by a ""calmer reassessment of the data.""","O-Deal X-##ers O-noted O-that O-the O-foreign O-exchange O-market O-' X-s O-initial O-bear X-##ish O-reaction O-to O-the O-U X-. X-S X-. O-trade O-figures O-was O-tempered O-later O-by O-a B-``-"" O-calm X-##er O-re X-##ass X-##ess X-##ment O-of O-the O-data O-. O-"""
"The dollar's near-term path remains foggy, according to currencny analysts, who characterize the market as ""bewildering.""","O-The O-dollar O-' X-s O-near X-- X-term O-path O-remains O-fog X-##gy O-, O-according O-to O-cu X-##rre X-##nc X-##ny O-analysts O-, O-who O-character X-##ize O-the O-market O-as B-``-"" O-be X-##wi X-##lder X-##ing O-. O-"""
"""This is an exceptionally odd takeover battle,"" says London analyst Christopher Will of Shearson Lehman Hutton.","B-``-"" O-This O-is O-an O-exceptionally O-odd O-takeover O-battle O-, X-"" O-says O-London O-analyst O-Christopher O-Will O-of O-Shea X-##rson O-Le X-##hman O-Hutton O-."
"""Sit tight"" through the coming volatility, Mr. Reitman suggests, though he concedes that many small investors will find Jaguar's zigzags ""too hard to swallow.""","B-``-"" O-Sit O-tight O-"" O-through O-the O-coming O-vol X-##ati X-##lity O-, O-Mr X-. O-Re X-##it X-##man O-suggests O-, O-though O-he O-con X-##cede X-##s O-that O-many O-small O-investors O-will O-find O-Jaguar O-' X-s O-z X-##ig X-##za X-##gs B-``-"" O-too O-hard O-to O-swallow O-. O-"""
"""I think Ford is going to come out with full guns blazing,"" Mr. Reitman says.","B-``-"" O-I O-think O-Ford O-is O-going O-to O-come O-out O-with O-full O-guns O-blazing O-, X-"" O-Mr X-. O-Re X-##it X-##man O-says O-."
"""Ford wants {Jaguar} very much.""","B-``-"" O-Ford O-wants B-``-{ O-Jaguar B-``-} O-very O-much O-. O-"""
"Then, Mr. Will says, ""you get a bidding war between two very rich, very determined international companies.""","O-Then O-, O-Mr X-. O-Will O-says O-, B-``-"" O-you O-get O-a O-bidding O-war O-between O-two O-very O-rich O-, O-very O-determined O-international O-companies O-. O-"""
"""There's quite a bit of value left in the {Jaguar} shares here even though they have run up"" lately, says Doug Johnson, a fund manager for Seattle-based Safeco Asset Management.","B-``-"" O-There O-' X-s O-quite O-a O-bit O-of O-value O-left O-in O-the B-``-{ O-Jaguar O-} O-shares O-here O-even O-though O-they O-have O-run O-up O-"" O-lately O-, O-says O-Doug O-Johnson O-, O-a O-fund O-manager O-for O-Seattle X-- X-based O-Safe X-##co O-As X-##set O-Management O-."
"""Ford's appetite to attack {Jaguar} could gradually wane over time, particularly if Saab is a reasonably attractive proposition,"" says John Lawson, an auto analyst at London's Nomura Research Institute.","B-``-"" O-Ford O-' X-s O-appetite O-to O-attack O-{ O-Jaguar O-} O-could O-gradually O-wa X-##ne O-over O-time O-, O-particularly O-if O-Sa X-##ab O-is O-a O-reasonably O-attractive O-proposition O-, X-"" O-says O-John O-Lawson O-, O-an O-auto O-analyst O-at O-London O-' X-s O-No X-##mura O-Research O-Institute O-."
"""I thought the probabilities of {a bidding war} happening were less,"" he says.","B-``-"" O-I O-thought O-the O-pro X-##ba X-##bilities O-of B-``-{ O-a O-bidding O-war O-} O-happening O-were O-less O-, X-"" O-he O-says O-."
"""Investors had expected the worst from the stock market, and so they piled into government bonds last Friday,"" said Steven Einhorn, chairman of the investment policy committee at Goldman, Sachs & Co. ""But when we didn't get the worst, there was some movement out of bonds and back into stocks"" yesterday.","B-``-"" O-In X-##ves X-##tors O-had O-expected O-the O-worst O-from O-the O-stock O-market O-, O-and O-so O-they O-piled O-into O-government O-bonds O-last O-Friday O-, X-"" O-said O-Steven O-Ein X-##horn O-, O-chairman O-of O-the O-investment O-policy O-committee O-at O-Goldman O-, O-Sachs O-& O-Co O-. B-``-"" O-But O-when O-we O-did O-n X-' X-t O-get O-the O-worst O-, O-there O-was O-some O-movement O-out O-of O-bonds O-and O-back O-into O-stocks O-"" O-yesterday O-."
"Cleveland Museum of Art: ""American Cities: The Artist's View"" -- Nearly 50 prints, drawings, paintings and photographs dating from the 1850s to the present explore how different artists have interpreted the urban scene.","O-Cleveland O-Museum O-of O-Art O-: B-``-"" O-American O-Cities O-: O-The O-Artist O-' X-s O-View O-"" O-- X-- O-Nearly O-50 O-prints O-, O-drawings O-, O-paintings O-and O-photographs O-dating O-from O-the O-1850s O-to O-the O-present O-explore O-how O-different O-artists O-have O-interpreted O-the O-urban O-scene O-."
"Pennsylvania Academy of the Fine Arts, Philadelphia: ""Making Their Mark: Women Artists Move Into the Mainstream 1970-85"" -- More than 160 works by painters, sculptors and photographers, as well as tapes and documentation by 33 video and performance artists.","O-Pennsylvania O-Academy O-of O-the O-Fine O-Arts O-, O-Philadelphia O-: B-``-"" O-Making O-Their O-Mark O-: O-Women O-Artists O-Move O-Into O-the O-Main X-##stream O-1970 X-- X-85 O-"" O-- X-- O-More O-than O-160 O-works O-by O-painters O-, O-sculptor X-##s O-and O-photographers O-, O-as O-well O-as O-tapes O-and O-documentation O-by O-33 O-video O-and O-performance O-artists O-."
"Metropolitan Museum, New York: ""Gold of Africa: The Barbier-Mueller Collection"" showcases a king's ransom of West African artifacts culled from a renowned Swiss collection.","O-Metropolitan O-Museum O-, O-New O-York O-: B-``-"" O-Gold O-of O-Africa O-: O-The O-Barbie X-##r X-- X-Mu X-##eller O-Collection O-"" O-showcase X-##s O-a O-king O-' X-s O-ransom O-of O-West O-African O-artifacts O-cu X-##lled O-from O-a O-renowned O-Swiss O-collection O-."
"Cavin-Morris Gallery, New York: ""Gregory Van Maanen"" -- Many of the forceful, heavily symbolic images of this self-taught artist were partly inspired by his service in Vietnam, and carry titles such as ""Death in Flight"" and ""Germans Are Born With Helmet Shaped Skulls.""","O-C X-##avi X-##n X-- X-Morris O-Gallery O-, O-New O-York O-: B-``-"" O-Gregory O-Van O-Ma X-##ane X-##n O-"" O-- X-- O-Many O-of O-the O-force X-##ful O-, O-heavily O-symbolic O-images O-of O-this O-self X-- X-taught O-artist O-were O-partly O-inspired O-by O-his O-service O-in O-Vietnam O-, O-and O-carry O-titles O-such O-as B-``-"" O-Death O-in O-Flight O-"" O-and B-``-"" O-Germans O-Are O-Born O-With O-He X-##lm X-##et O-S X-##ha X-##ped O-Skull X-##s O-. O-"""
"Joffrey Ballet: The company's six-week Manhattan season features a pair of premieres -- ""Les Noces,"" Bronislava Nijinska's celebrated 1923 collaboration with Stravinsky; and ""The Pantages and the Palace Present TWO-A-DAY,"" artistic director Gerald Arpino's salute to vaudeville.","O-Jo X-##ff X-##rey O-Ballet O-: O-The O-company O-' X-s O-six X-- X-week O-Manhattan O-season O-features O-a O-pair O-of O-premiere X-##s O-- X-- B-``-"" O-Les O-No X-##ces O-, X-"" O-B X-##ron X-##islav X-##a O-Ni X-##jin X-##ska O-' X-s O-celebrated O-1923 O-collaboration O-with O-St X-##ra X-##vin X-##sky O-; O-and B-``-"" O-The O-Pan X-##tage X-##s O-and O-the O-Palace O-Present O-T X-##W X-##O X-- X-A X-- X-D X-##A X-##Y O-, X-"" O-artistic O-director O-Gerald O-A X-##rp X-##ino O-' X-s O-salute O-to O-vaudeville O-."
"Other highlights include the revival of ""Trinity,"" Mr. Arpino's rock-scored salute to the Sixties, and, beginning Nov. 24, the late Robert Joffrey's version of ""The Nutcracker.""","O-Other O-highlights O-include O-the O-revival O-of B-``-"" O-Trinity O-, X-"" O-Mr X-. O-A X-##rp X-##ino O-' X-s O-rock X-- X-scored O-salute O-to O-the O-Six X-##ties O-, O-and O-, O-beginning O-Nov X-. O-24 O-, O-the O-late O-Robert O-Jo X-##ff X-##rey O-' X-s O-version O-of B-``-"" O-The O-N X-##ut X-##c X-##racker O-. O-"""
"San Diego Opera opens its 25th season with Mussorgsky's ""Boris Godunov,"" featuring five leading singers and a conductor from the Soviet Union.","O-San O-Diego O-Opera O-opens O-its O-25th O-season O-with O-Mu X-##sso X-##rg X-##sky O-' X-s B-``-"" O-Boris O-God X-##uno X-##v O-, X-"" O-featuring O-five O-leading O-singers O-and O-a O-conductor O-from O-the O-Soviet O-Union O-."
"He then heads for the Lone Star State to make his U.S. opera debut at the Dallas Opera in ""Don Pasquale.""","O-He O-then O-heads O-for O-the O-Lone O-Star O-State O-to O-make O-his O-U X-. X-S X-. O-opera O-debut O-at O-the O-Dallas O-Opera O-in B-``-"" O-Don O-Pa X-##s X-##qua X-##le O-. O-"""
"This is written to correct a misquotation in your Oct. 3 article ""Deaths From Advanced Colon Cancer Can Be Reduced by Using Two Drugs.""","O-This O-is O-written O-to O-correct O-a O-mi X-##s X-##q X-##uo X-##tation O-in O-your O-Oct X-. O-3 O-article B-``-"" O-Death X-##s O-From O-Advanced O-Col X-##on O-Cancer O-Can O-Be O-Red X-##uce X-##d O-by O-Using O-Two O-Drugs O-. O-"""
"In this article, I was alleged to have said, ""Any patient with high-risk colon cancer is really getting short shrift if he's not getting this therapy.""","O-In O-this O-article O-, O-I O-was O-alleged O-to O-have O-said O-, B-``-"" O-Any O-patient O-with O-high X-- X-risk O-co X-##lon O-cancer O-is O-really O-getting O-short O-s X-##hr X-##ift O-if O-he O-' X-s O-not O-getting O-this O-therapy O-. O-"""
"My statement, read verbatim from a printed text available to all reporters attending the National Cancer Institute news conference, was the following: ""New clinical trials are already in operation seeking to improve these results.","O-My O-statement O-, O-read O-verb X-##ati X-##m O-from O-a O-printed O-text O-available O-to O-all O-reporters O-attending O-the O-National O-Cancer O-Institute O-news O-conference O-, O-was O-the O-following O-: B-``-"" O-New O-clinical O-trials O-are O-already O-in O-operation O-seeking O-to O-improve O-these O-results O-."
"""There's no shortage of major things to do,"" he said.","B-``-"" O-There O-' X-s O-no O-shortage O-of O-major O-things O-to O-do O-, X-"" O-he O-said O-."
"As with the previous pact, the new agreement covers the country's debt ""inside the net,"" which applies mainly to repayments due to overseas creditor banks by the private sector.","O-As O-with O-the O-previous O-pact O-, O-the O-new O-agreement O-covers O-the O-country O-' X-s O-debt B-``-"" O-inside O-the O-net O-, X-"" O-which O-applies O-mainly O-to O-repay X-##ments O-due O-to O-overseas O-credit X-##or O-banks O-by O-the O-private O-sector O-."
"""We're very concerned about the financial well-being of the firms,"" said Martin Kuperberg, who runs the SEC's New York broker-dealer unit.","B-``-"" O-We O-' X-re O-very O-concerned O-about O-the O-financial O-well X-- X-being O-of O-the O-firms O-, X-"" O-said O-Martin O-Ku X-##per X-##berg O-, O-who O-runs O-the O-SEC O-' X-s O-New O-York O-broker X-- X-dealer O-unit O-."
"""We've spoken to a number of people both at the {exchanges} and at the firms.""","B-``-"" O-We O-' X-ve O-spoken O-to O-a O-number O-of O-people O-both O-at O-the B-``-{ O-exchanges O-} O-and O-at O-the O-firms O-. O-"""
