The group's resilience gets its first test today when 30 top pilot union leaders convene outside Chicago in a previously scheduled meeting.,O-The O-group O-' X-s O-re X-##si X-##lie X-##nce O-gets O-its O-first O-test O-today B-WRB-when O-30 O-top O-pilot O-union O-leaders O-con X-##ven X-##e O-outside O-Chicago O-in O-a O-previously O-scheduled O-meeting O-.
(Rick) Dubinsky faces the tough task of explaining why banks refused to finance a buy-out the members approved overwhelmingly last week.,O-( O-Rick O-) O-Dub X-##ins X-##ky O-faces O-the O-tough O-task O-of O-explaining B-WRB-why O-banks O-refused O-to O-finance O-a O-buy X-- X-out O-the O-members O-approved O-overwhelming X-##ly O-last O-week O-.
"""But when prices were crazy, it was even harder to do an LBO.","O-"" O-But B-WRB-when O-prices O-were O-crazy O-, O-it O-was O-even O-harder O-to O-do O-an O-L X-##BO O-."
"Still, proponents may be shying away from more drumbeating because they sense political tides have turned against arming the Nicaraguan rebels or boosting spending on SDI -- particularly when the public perceives the Soviet threat is declining under Mikhail Gorbachev.","O-Still O-, O-proponent X-##s O-may O-be O-shy X-##ing O-away O-from O-more O-drum X-##beat X-##ing O-because O-they O-sense O-political O-tide X-##s O-have O-turned O-against O-arm X-##ing O-the O-Nicaragua X-##n O-rebels O-or O-boost X-##ing O-spending O-on O-SD X-##I O-- X-- O-particularly B-WRB-when O-the O-public O-perceive X-##s O-the O-Soviet O-threat O-is O-declining O-under O-Mikhail O-Go X-##rb X-##ache X-##v O-."
Where had all the money come from?,B-WRB-Where O-had O-all O-the O-money O-come O-from O-?
"The young John Gutfreund had been discovered by Billy Salomon of Salomon Bros. when he was still a bearded liberal, and put to work as a trader, and then as a rough-and-tumble syndicator. ""","O-The O-young O-John O-G X-##ut X-##f X-##re X-##und O-had O-been O-discovered O-by O-Billy O-Sal X-##omo X-##n O-of O-Sal X-##omo X-##n O-Bros O-. B-WRB-when O-he O-was O-still O-a O-beard X-##ed O-liberal O-, O-and O-put O-to O-work O-as O-a O-trader O-, O-and O-then O-as O-a O-rough X-- X-and X-- X-t X-##umble O-s X-##yn X-##dic X-##ator O-. O-"""
"Often the genteel, conservative, long-term-oriented investment bankers were displaced by crude traders: ""When angered, he cursed so forcefully that his face reddened and his pale-blue eyes narrowed into tiny slits,"" the authors say of Lehman's Lewis Glucksman.","O-Often O-the O-g X-##ente X-##el O-, O-conservative O-, O-long X-- X-term X-- X-oriented O-investment O-banker X-##s O-were O-displaced O-by O-crude O-traders O-: O-"" B-WRB-When O-angered O-, O-he O-cursed O-so O-forcefully O-that O-his O-face O-red X-##dened O-and O-his O-pale X-- X-blue O-eyes O-narrowed O-into O-tiny O-slit X-##s O-, X-"" O-the O-authors O-say O-of O-Le X-##hman O-' X-s O-Lewis O-G X-##luck X-##sman O-."
"Second, a long-term shareholder of a good company needn't worry too much when the stock price drops temporarily: It will bounce back.","O-Second O-, O-a O-long X-- X-term O-shareholder O-of O-a O-good O-company O-need O-n X-' X-t O-worry O-too O-much B-WRB-when O-the O-stock O-price O-drops O-temporarily O-: O-It O-will O-bounce O-back O-."
"But if a raider takes over when the stock is weak, the shareholder never gets his recovery.","O-But O-if O-a O-raid X-##er O-takes O-over B-WRB-when O-the O-stock O-is O-weak O-, O-the O-shareholder O-never O-gets O-his O-recovery O-."
"Or perhaps Wall Street, when it has suffered enough, will realize that finance is a service industry, and change its ethos.","O-Or O-perhaps O-Wall O-Street O-, B-WRB-when O-it O-has O-suffered O-enough O-, O-will O-realize O-that O-finance O-is O-a O-service O-industry O-, O-and O-change O-its O-et X-##hos O-."
"We have as much nostalgia as anyone for those leafy, breezy days in Washington when honorable men and women dickered over budgets and even log-rolled a bit to see that the bridges got build, roads paved, soldiers paid or that the desperately poor were cared for.","O-We O-have O-as O-much O-no X-##stal X-##gia O-as O-anyone O-for O-those O-leaf X-##y O-, O-br X-##ee X-##zy O-days O-in O-Washington B-WRB-when O-honorable O-men O-and O-women O-dick X-##ered O-over O-budget X-##s O-and O-even O-log X-- X-rolled O-a O-bit O-to O-see O-that O-the O-bridges O-got O-build O-, O-roads O-paved O-, O-soldiers O-paid O-or O-that O-the O-desperately O-poor O-were O-cared O-for O-."
"Yesterday, when similar securities rebounded, it bumped the valuation up again.","O-Yesterday O-, B-WRB-when O-similar O-securities O-re X-##bound X-##ed O-, O-it O-bumped O-the O-v X-##al X-##uation O-up O-again O-."
"This will add to the appeal of small business, he says, where investors often have a degree of influence.","O-This O-will O-add O-to O-the O-appeal O-of O-small O-business O-, O-he O-says O-, B-WRB-where O-investors O-often O-have O-a O-degree O-of O-influence O-."
"""What do we want casinos for when we haven't got anything in the shops?""","O-"" O-What O-do O-we O-want O-casino X-##s O-for B-WRB-when O-we O-have O-n X-' X-t O-got O-anything O-in O-the O-shops O-? O-"""
"An increasing number of banks appear to be considering the option under the deal whereby they can swap their Mexican loans for 30-year bonds with a face value discounted by 35%, Mr. Gurria said.","O-An O-increasing O-number O-of O-banks O-appear O-to O-be O-considering O-the O-option O-under O-the O-deal B-WRB-whereby O-they O-can O-swap O-their O-Mexican O-loans O-for O-30 X-- X-year O-bonds O-with O-a O-face O-value O-discount X-##ed O-by O-35 O-% O-, O-Mr X-. O-G X-##ur X-##ria O-said O-."
"When Poland moves to reform, it can at least lean on its past: However flawed and short-lived Joseph Pilsudski's interwar republic, it was a nonsocialist democracy.","B-WRB-When O-Poland O-moves O-to O-reform O-, O-it O-can O-at O-least O-lean O-on O-its O-past O-: O-However O-fl X-##awed O-and O-short X-- X-lived O-Joseph O-Pi X-##ls X-##uds X-##ki O-' X-s O-inter X-##war O-republic O-, O-it O-was O-a O-non X-##so X-##cial X-##ist O-democracy O-."
Yesterday's edition provided analysts' estimates for the company when actual earnings were available.,O-Yesterday O-' X-s O-edition O-provided O-analysts X-' O-estimates O-for O-the O-company B-WRB-when O-actual O-earnings O-were O-available O-.
"This contrasts with the year-ago quarter, when the company had net income of $11.7 million, or 45 cents a share, on revenue of $75.7 million.","O-This O-contrasts O-with O-the O-year X-- X-ago O-quarter O-, B-WRB-when O-the O-company O-had O-net O-income O-of O-$ O-11 X-. X-7 O-million O-, O-or O-45 O-cents O-a O-share O-, O-on O-revenue O-of O-$ O-75 X-. X-7 O-million O-."
"When the shah died, President Carter was so scared that the shah's ghost would blame him for shoving him out to make way for the ayatollah that he declared the Carter Doctrine.","B-WRB-When O-the O-s X-##ha X-##h O-died O-, O-President O-Carter O-was O-so O-scared O-that O-the O-s X-##ha X-##h O-' X-s O-ghost O-would O-blame O-him O-for O-shoving O-him O-out O-to O-make O-way O-for O-the O-a X-##ya X-##to X-##llah O-that O-he O-declared O-the O-Carter O-Doc X-##trine O-."
"Why, he used to lay in wait for Cap; suddenly he'd leap from behind some statue of Marshall onto Cap's chest and grab him by the throat and choke him till he coughed up an additional $2 billion or so.","B-WRB-Why O-, O-he O-used O-to O-lay O-in O-wait O-for O-Cap O-; O-suddenly O-he O-' X-d O-leap O-from O-behind O-some O-statue O-of O-Marshall O-onto O-Cap O-' X-s O-chest O-and O-grab O-him O-by O-the O-throat O-and O-choke O-him O-till O-he O-coughed O-up O-an O-additional O-$ O-2 O-billion O-or O-so O-."
"And why not save the costs of a thousand bureaucrats by abolishing Central Command and putting responsibility for Gulf naval operations back where it belongs, afloat with the task force commander in the Gulf?","O-And B-WRB-why O-not O-save O-the O-costs O-of O-a O-thousand O-bureau X-##crats O-by O-a X-##bol X-##ishing O-Central O-Command O-and O-putting O-responsibility O-for O-Gulf O-naval O-operations O-back B-WRB-where O-it O-belongs O-, O-a X-##f X-##loat O-with O-the O-task O-force O-commander O-in O-the O-Gulf O-?"
"And where were all our handsomely paid Indian Ocean allies last year when our convoys were being attacked?""","O-And B-WRB-where O-were O-all O-our O-handsome X-##ly O-paid O-Indian O-Ocean O-allies O-last O-year B-WRB-when O-our O-convoys O-were O-being O-attacked O-? O-"""
"Mr. Lang surprised Time soon after joining forces when he said he would negotiate rates individually with advertisers, a practice common in broadcasting but considered taboo by magazine publishers.","O-Mr X-. O-Lang O-surprised O-Time O-soon O-after O-joining O-forces B-WRB-when O-he O-said O-he O-would O-negotiate O-rates O-individually O-with O-ad X-##vert X-##isers O-, O-a O-practice O-common O-in O-broadcasting O-but O-considered O-ta X-##boo O-by O-magazine O-publishers O-."
"It has been waging an all-out campaign to beat back a proposal, pushed by Utah bike groups, to allow the cycles in federally designated wilderness areas, where they are now prohibited.","O-It O-has O-been O-wa X-##ging O-an O-all X-- X-out O-campaign O-to O-beat O-back O-a O-proposal O-, O-pushed O-by O-Utah O-bike O-groups O-, O-to O-allow O-the O-cycles O-in O-federally O-designated O-wilderness O-areas O-, B-WRB-where O-they O-are O-now O-prohibited O-."
"These groups have been trying to improve the mountain biker's image; in the San Francisco-area park district where a ranger was clobbered by a cyclist this summer bikers have formed a volunteer patrol to help rangers enforce regulations, and to school riders in proper trail etiquette.","O-These O-groups O-have O-been O-trying O-to O-improve O-the O-mountain O-bike X-##r O-' X-s O-image O-; O-in O-the O-San O-Francisco X-- X-area O-park O-district B-WRB-where O-a O-range X-##r O-was O-c X-##lo X-##bbe X-##red O-by O-a O-cyclist O-this O-summer O-bike X-##rs O-have O-formed O-a O-volunteer O-patrol O-to O-help O-range X-##rs O-enforce O-regulations O-, O-and O-to O-school O-riders O-in O-proper O-trail O-et X-##ique X-##tte O-."
"Few would have foreseen such a furor when, a decade ago, some Marin County bicycle enthusiasts created a hybrid bike using fat tires, lightweight metallurgy and multi-gear technology.","O-Few O-would O-have O-fore X-##see X-##n O-such O-a O-fur X-##or B-WRB-when O-, O-a O-decade O-ago O-, O-some O-Marin O-County O-bicycle O-enthusiasts O-created O-a O-hybrid O-bike O-using O-fat O-tires O-, O-lightweight O-metal X-##lu X-##rgy O-and O-multi X-- X-gear O-technology O-."
"When the bikes first entered mass production in 1981, they were dismissed as a fad.","B-WRB-When O-the O-bikes O-first O-entered O-mass O-production O-in O-1981 O-, O-they O-were O-dismissed O-as O-a O-f X-##ad O-."
caused an uproar when its title leaked out.,O-caused O-an O-up X-##roa X-##r B-WRB-when O-its O-title O-leaked O-out O-.
He last made waves when he dared to defend an Indian girl who had been adopted by non-Indian parents off her reservation.,O-He O-last O-made O-waves B-WRB-when O-he O-dared O-to O-defend O-an O-Indian O-girl O-who O-had O-been O-adopted O-by O-non X-- X-Indian O-parents O-off O-her O-reservation O-.
"A Par spokesman said he understood the criminal investigation in Maryland relates to matters Par disclosed in July, when Par said it filed false drug information with the FDA.","O-A O-Pa X-##r O-spokesman O-said O-he O-understood O-the O-criminal O-investigation O-in O-Maryland O-relates O-to O-matters O-Pa X-##r O-disclosed O-in O-July O-, B-WRB-when O-Pa X-##r O-said O-it O-filed O-false O-drug O-information O-with O-the O-FDA O-."
"Mr. McKinney, 50 years old, was chairman and chief executive of American Fletcher Corp., Indianapolis, when that bank holding company merged into Banc One in January 1987.","O-Mr X-. O-M X-##c X-##K X-##inn X-##ey O-, O-50 O-years O-old O-, O-was O-chairman O-and O-chief O-executive O-of O-American O-Fletcher O-Corp X-. O-, O-Indianapolis O-, B-WRB-when O-that O-bank O-holding O-company O-merged O-into O-Ban X-##c O-One O-in O-January O-1987 O-."
Each scientist independently concluded society and government are underreacting when it comes to substantive policy change.,O-Each O-scientist O-independently O-concluded O-society O-and O-government O-are O-under X-##rea X-##cting B-WRB-when O-it O-comes O-to O-sub X-##stant X-##ive O-policy O-change O-.
"Friday's market rout came smack in the middle of the heaviest month for CD rollovers, when a number of banks and thrifts already have promotions under way.","O-Friday O-' X-s O-market O-r X-##out O-came O-smack O-in O-the O-middle O-of O-the O-he X-##avi X-##est O-month O-for O-CD O-roll X-##overs O-, B-WRB-when O-a O-number O-of O-banks O-and O-th X-##rift X-##s O-already O-have O-promotions O-under O-way O-."
"In late April, when interest rates were at their recent highs, short-term CDs sold by brokers were offering yields half a percentage point or more higher than banks.","O-In O-late O-April O-, B-WRB-when O-interest O-rates O-were O-at O-their O-recent O-high X-##s O-, O-short X-- X-term O-CDs O-sold O-by O-broker X-##s O-were O-offering O-yields O-half O-a O-percentage O-point O-or O-more O-higher O-than O-banks O-."
"The Dallas real estate investment trust last paid a dividend on Dec. 31, 1987, when shareholders received $1 a share.","O-The O-Dallas O-real O-estate O-investment O-trust O-last O-paid O-a O-divide X-##nd O-on O-Dec X-. O-31 O-, O-1987 O-, B-WRB-when O-shareholders O-received O-$ O-1 O-a O-share O-."
Some tariffs were eliminated when the trade pact took effect Jan. 1.,O-Some O-ta X-##riff X-##s O-were O-eliminated B-WRB-when O-the O-trade O-pact O-took O-effect O-Jan X-. O-1 O-.
"Crude prices spurted upward in brisk trading on the assumption that heavy earthquake damage occurred to San Francisco area refinery complexes, but the rise quickly fizzled when it became apparent that oil operations weren't severely curtailed.","O-C X-##rud X-##e O-prices O-spur X-##ted O-upward O-in O-br X-##isk O-trading O-on O-the O-assumption O-that O-heavy O-earthquake O-damage O-occurred O-to O-San O-Francisco O-area O-re X-##finery O-complexes O-, O-but O-the O-rise O-quickly O-fi X-##zzle X-##d B-WRB-when O-it O-became O-apparent O-that O-oil O-operations O-were O-n X-' X-t O-severely O-cu X-##rta X-##iled O-."
"The rally spread into European markets, where traders were still betting that the earthquake disrupted the San Francisco area's large oil refining plants.","O-The O-rally O-spread O-into O-European O-markets O-, B-WRB-where O-traders O-were O-still O-betting O-that O-the O-earthquake O-disrupted O-the O-San O-Francisco O-area O-' X-s O-large O-oil O-re X-##fining O-plants O-."
"""It's hard to imagine how the markets were speculating, given that nobody could get through to San Francisco,"" said one amazed oil company executive.","O-"" O-It O-' X-s O-hard O-to O-imagine B-WRB-how O-the O-markets O-were O-s X-##pec X-##ulating O-, O-given O-that O-nobody O-could O-get O-through O-to O-San O-Francisco O-, X-"" O-said O-one O-amazed O-oil O-company O-executive O-."
"Whether or not ""great cases make bad-law"" -- as Justice Holmes asserted -- who can doubt that when great confirmation hearings turn on the nominee's response to these great cases they make bad judicial history?","O-Whether O-or O-not O-"" O-great O-cases O-make O-bad X-- X-law O-"" O-- X-- O-as O-Justice O-Holmes O-asserted O-- X-- O-who O-can O-doubt O-that B-WRB-when O-great O-confirmation O-hearings O-turn O-on O-the O-nominee O-' X-s O-response O-to O-these O-great O-cases O-they O-make O-bad O-judicial O-history O-?"
"Ethan Bronner's ""Battle for Justice: How the Bork Nomination Shook America"" (Norton, 399 pages, $22.50) is a spirited narrative of the nastiest of these hearings, done with journalistic verve, but with a flawed legal philosophy.","O-Ethan O-B X-##ron X-##ner O-' X-s O-"" O-Battle O-for O-Justice O-: B-WRB-How O-the O-Bo X-##rk O-No X-##mination O-S X-##ho X-##ok O-America O-"" O-( O-Norton O-, O-39 X-##9 O-pages O-, O-$ O-22 X-. X-50 O-) O-is O-a O-spirit X-##ed O-narrative O-of O-the O-na X-##st X-##iest O-of O-these O-hearings O-, O-done O-with O-journalist X-##ic O-ve X-##rve O-, O-but O-with O-a O-fl X-##awed O-legal O-philosophy O-."
"As the stock market bounced back, withdrawals of money from stock funds amounted to a mere trickle compared with Black Monday, when investors dumped $2.3 billion, or about 2% of stock-fund assets.","O-As O-the O-stock O-market O-bounced O-back O-, O-withdrawal X-##s O-of O-money O-from O-stock O-funds O-amounted O-to O-a O-mere O-trick X-##le O-compared O-with O-Black O-Monday O-, B-WRB-when O-investors O-dumped O-$ O-2 X-. X-3 O-billion O-, O-or O-about O-2 O-% O-of O-stock X-- X-fund O-assets O-."
"When the market stabilized, he added, the firm sold the bonds and quickly paid the loans back.","B-WRB-When O-the O-market O-stab X-##ilized O-, O-he O-added O-, O-the O-firm O-sold O-the O-bonds O-and O-quickly O-paid O-the O-loans O-back O-."
"The highest patent damage award to date was in 1986, when Smith International Inc. was ordered to pay $205 million to Baker Hughes Inc. for infringing on a patent on an oil drilling bit seal.","O-The O-highest O-patent O-damage O-award O-to O-date O-was O-in O-1986 O-, B-WRB-when O-Smith O-International O-Inc X-. O-was O-ordered O-to O-pay O-$ O-205 O-million O-to O-Baker O-Hughes O-Inc O-. O-for O-in X-##f X-##ringing O-on O-a O-patent O-on O-an O-oil O-drilling O-bit O-seal O-."
"The main issues remaining are how to calculate damages and whether the infringement was ""willful and deliberate.""","O-The O-main O-issues O-remaining O-are B-WRB-how O-to O-calculate O-damages O-and O-whether O-the O-infringement O-was O-"" O-will X-##ful O-and O-deliberate O-. O-"""
"""When stocks stabilized, that was a disappointment.""","O-"" B-WRB-When O-stocks O-stab X-##ilized O-, O-that O-was O-a O-disappointment O-. O-"""
Dealers noted that it's difficult to structure new Remics when prices are moving widely.,O-Deal X-##ers O-noted O-that O-it O-' X-s O-difficult O-to O-structure O-new O-Re X-##mic X-##s B-WRB-when O-prices O-are O-moving O-widely O-.
"It was, they said, a factor in why the market didn't rally as strongly as the biggest New York Stock Exchange issues.","O-It O-was O-, O-they O-said O-, O-a O-factor O-in B-WRB-why O-the O-market O-did O-n X-' X-t O-rally O-as O-strongly O-as O-the O-biggest O-New O-York O-Stock O-Exchange O-issues O-."
"On Friday, the market makers, who must be prepared to buy stock when no one else will, were frantically cutting the prices at which they would take stocks off sellers' hands, in reaction to plunging prices on the New York Stock Exchange, according to Mr. Rosenbach.","O-On O-Friday O-, O-the O-market O-makers O-, O-who O-must O-be O-prepared O-to O-buy O-stock B-WRB-when O-no O-one O-else O-will O-, O-were O-frantically O-cutting O-the O-prices O-at O-which O-they O-would O-take O-stocks O-off O-seller X-##s X-' O-hands O-, O-in O-reaction O-to O-p X-##lung X-##ing O-prices O-on O-the O-New O-York O-Stock O-Exchange O-, O-according O-to O-Mr X-. O-Rosen X-##bach O-."
"""Market makers saw sell orders first and that's why they (lowered bids),"" said Brian Finnerty, a Shearson Lehman Hutton market maker.","O-"" O-Market O-makers O-saw O-sell O-orders O-first O-and O-that O-' X-s B-WRB-why O-they O-( O-lowered O-bids O-) X-, X-"" O-said O-Brian O-Finn X-##erty O-, O-a O-Shea X-##rson O-Le X-##hman O-Hutton O-market O-maker O-."
"There was some favorable takeover news, in stark contrast to Friday, when nervousness about the future of leveraged buy-outs hurt takeover-related issues.","O-There O-was O-some O-favorable O-takeover O-news O-, O-in O-stark O-contrast O-to O-Friday O-, B-WRB-when O-nervous X-##ness O-about O-the O-future O-of O-leverage X-##d O-buy X-- X-outs O-hurt O-takeover X-- X-related O-issues O-."
I've learned the hard way that too much booze,O-I O-' X-ve O-learned O-the O-hard O-way B-WRB-that O-too O-much O-b X-##oo X-##ze
"As to negotiations with creditors, Mr. Lorenzo said in remarks after the conference ""we'll have to see how they {talks} come along.""","O-As O-to O-negotiations O-with O-creditors O-, O-Mr X-. O-Lorenzo O-said O-in O-remarks O-after O-the O-conference O-"" O-we O-' X-ll O-have O-to O-see B-WRB-how O-they O-{ O-talks O-} O-come O-along O-. O-"""
"Mr. Roh said a U.S. demand for the removal of South Korean import quotas on beef will be resolved ""satisfactorily"" but gave no hint when that will happen.","O-Mr X-. O-R X-##oh O-said O-a O-U X-. X-S X-. O-demand O-for O-the O-removal O-of O-South O-Korean O-import O-quota X-##s O-on O-beef O-will O-be O-resolved O-"" O-sat X-##is X-##fa X-##ctor X-##ily O-"" O-but O-gave O-no O-hint B-WRB-when O-that O-will O-happen O-."
"""Landfill -- loose and unconsolidated earth -- may feel like rock but it behaves like liquid when you shake it,"" said Douglas Segar, professor of geosciences at San Francisco State University in a televised interview.","O-"" O-Land X-##fill O-- X-- O-loose O-and O-un X-##con X-##solidate X-##d O-earth O-- X-- O-may O-feel O-like O-rock O-but O-it O-behave X-##s O-like O-liquid B-WRB-when O-you O-shake O-it O-, X-"" O-said O-Douglas O-Sega X-##r O-, O-professor O-of O-g X-##eo X-##science X-##s O-at O-San O-Francisco O-State O-University O-in O-a O-televised O-interview O-."
"Our quake behaved much like the Mexico City earthquake, where great damage was miles from the epicenter.""","O-Our O-q X-##ua X-##ke O-behave X-##d O-much O-like O-the O-Mexico O-City O-earthquake O-, B-WRB-where O-great O-damage O-was O-miles O-from O-the O-epic X-##enter O-. O-"""
"He cited the example of San Francisco's financial district, where many new glass towers survived almost unscathed.","O-He O-cited O-the O-example O-of O-San O-Francisco O-' X-s O-financial O-district O-, B-WRB-where O-many O-new O-glass O-towers O-survived O-almost O-un X-##sca X-##the X-##d O-."
"The Chicago office figured prominently in the bank's problems earlier this year, when $65 million in loans to Chicago businessman William Stoecker went sour.","O-The O-Chicago O-office O-figured O-prominently O-in O-the O-bank O-' X-s O-problems O-earlier O-this O-year O-, B-WRB-when O-$ O-65 O-million O-in O-loans O-to O-Chicago O-businessman O-William O-St X-##oe X-##cker O-went O-sour O-."
The percent difference compares actual profit with the 30-day estimate where at least three analysts have issues forecasts in the past 30 days.,O-The O-percent O-difference O-compares O-actual O-profit O-with O-the O-30 X-- X-day O-estimate B-WRB-where O-at O-least O-three O-analysts O-have O-issues O-forecast X-##s O-in O-the O-past O-30 O-days O-.
"When it made the offer, StatesWest declined to disclose details and asked Mesa to do the same.","B-WRB-When O-it O-made O-the O-offer O-, O-States X-##W X-##est O-declined O-to O-disc X-##lose O-details O-and O-asked O-Mesa O-to O-do O-the O-same O-."
"Some of us, who were personal or official participants in the days when the U.S. was able to supply needed material and morale boosts to a destitute nation, now rejoice that the better life we thought possible for Korea has come to fruition.","O-Some O-of O-us O-, O-who O-were O-personal O-or O-official O-participants O-in O-the O-days B-WRB-when O-the O-U X-. X-S X-. O-was O-able O-to O-supply O-needed O-material O-and O-morale O-boost X-##s O-to O-a O-des X-##ti X-##tu X-##te O-nation O-, O-now O-re X-##jo X-##ice O-that O-the O-better O-life O-we O-thought O-possible O-for O-Korea O-has O-come O-to O-fruit X-##ion O-."
"Another factor was that customers were asking, ""Why don't you give us a cheaper system?""","O-Another O-factor O-was O-that O-customers O-were O-asking O-, O-"" B-WRB-Why O-do O-n X-' X-t O-you O-give O-us O-a O-cheaper O-system O-? O-"""
"Next won't comment on when it will do the same, but is believed to have a color model under development.","O-Next O-w X-##o O-n X-' X-t O-comment O-on B-WRB-when O-it O-will O-do O-the O-same O-, O-but O-is O-believed O-to O-have O-a O-color O-model O-under O-development O-."
"Wells Fargo is rebuilding its loan-loss reserve, which increased to $711 million at Sept. 30 from $664 million the previous quarter but was down from $852 million a year ago, when the bank still had some shaky foreign loans.","O-Wells O-Fargo O-is O-rebuilding O-its O-loan X-- X-loss O-reserve O-, O-which O-increased O-to O-$ O-71 X-##1 O-million O-at O-Sept X-. O-30 O-from O-$ O-66 X-##4 O-million O-the O-previous O-quarter O-but O-was O-down O-from O-$ O-85 X-##2 O-million O-a O-year O-ago O-, B-WRB-when O-the O-bank O-still O-had O-some O-shaky O-foreign O-loans O-."
"""Nothing traded on Friday, and people weren't really sure where the market should have opened"" yesterday, said Raymond Minella, co-head of merchant banking at Merrill Lynch & Co. ""But we had a fairly active day yesterday.""","O-"" O-Nothing O-traded O-on O-Friday O-, O-and O-people O-were O-n X-' X-t O-really O-sure B-WRB-where O-the O-market O-should O-have O-opened O-"" O-yesterday O-, O-said O-Raymond O-Mine X-##lla O-, O-co X-- X-head O-of O-merchant O-banking O-at O-Merrill O-Lynch O-& O-Co O-. O-"" O-But O-we O-had O-a O-fairly O-active O-day O-yesterday O-. O-"""
