"The National Affordable Housing Act (Cranston-D'Amato), introduced earlier this year, erases the current mortgage guarantee ceiling of $101,250 and places a ""floating cap"" at 95% of the median home price in higher-cost areas.","O-The O-National O-A X-##ff X-##ord X-##able O-Housing O-Act O-( O-C X-##ran X-##ston X-- X-D X-' X-Am X-##ato O-) O-, O-introduced O-earlier O-this O-year O-, O-erase X-##s O-the O-current O-mortgage O-guarantee O-ceiling O-of B-$-$ O-101 X-, X-250 O-and O-places O-a O-"" O-floating O-cap O-"" O-at O-95 O-% O-of O-the O-median O-home O-price O-in O-higher X-- X-cost O-areas O-."
"This provision would have nearly doubled FHA loan exposure in skyrocketing markets where median home prices can range to $200,000 or more.","O-This O-provision O-would O-have O-nearly O-doubled O-F X-##HA O-loan O-exposure O-in O-sky X-##rock X-##eting O-markets O-where O-median O-home O-prices O-can O-range O-to B-$-$ O-200 X-, X-000 O-or O-more O-."
"After several hours of floor debate and three roll-call votes, we reached a compromise, placing the FHA loan-guarantee ceiling at $124,875.","O-After O-several O-hours O-of O-floor O-debate O-and O-three O-roll X-- X-call O-votes O-, O-we O-reached O-a O-compromise O-, O-placing O-the O-F X-##HA O-loan X-- X-guarantee O-ceiling O-at B-$-$ O-124 X-, X-87 X-##5 O-."
"Although my desire to retain the present ceiling was exceeded by $23,625, a firm limit on loan guarantees did provide some consolation in the face of allowing a haphazard floating cap to remain in the bill.","O-Although O-my O-desire O-to O-retain O-the O-present O-ceiling O-was O-exceeded O-by B-$-$ O-23 X-, X-625 O-, O-a O-firm O-limit O-on O-loan O-guarantees O-did O-provide O-some O-con X-##solation O-in O-the O-face O-of O-allowing O-a O-ha X-##pha X-##zard O-floating O-cap O-to O-remain O-in O-the O-bill O-."
"But people who can afford payments on a $200,000 home should be expected to put more money down.","O-But O-people O-who O-can O-afford O-payments O-on O-a B-$-$ O-200 X-, X-000 O-home O-should O-be O-expected O-to O-put O-more O-money O-down O-."
"It would be difficult to explain to average American workers that their tax dollars were being used to guarantee mortgages on $200,000 homes.","O-It O-would O-be O-difficult O-to O-explain O-to O-average O-American O-workers O-that O-their O-tax O-dollars O-were O-being O-used O-to O-guarantee O-mortgage X-##s O-on B-$-$ O-200 X-, X-000 O-homes O-."
"When Congress increased federal deposit insurance to $100,000 from $40,000, it seemed like a good idea.","O-When O-Congress O-increased O-federal O-deposit O-insurance O-to B-$-$ O-100 X-, X-000 O-from B-$-$ O-40 X-, X-000 O-, O-it O-seemed O-like O-a O-good O-idea O-."
But postponing problems soon gave way to a nightmarish taxpayer bailout to the tune of over $200 billion.,O-But O-post X-##po X-##ning O-problems O-soon O-gave O-way O-to O-a O-night X-##mar X-##ish O-tax X-##pa X-##yer O-bail X-##out O-to O-the O-tune O-of O-over B-$-$ O-200 O-billion O-.
"To confuse matters further, when UAL Corp. stock finally opened on the New York Stock Exchange at 11:08 a.m., the price was listed at $324.75 a share, up about $45 from Friday; in fact, its true price was $224.75, down $55.","O-To O-con X-##fuse O-matters O-further O-, O-when O-U X-##AL O-Corp O-. O-stock O-finally O-opened O-on O-the O-New O-York O-Stock O-Exchange O-at O-11 X-: X-08 O-a X-. X-m X-. O-, O-the O-price O-was O-listed O-at B-$-$ O-32 X-##4 X-. X-75 O-a O-share O-, O-up O-about B-$-$ O-45 O-from O-Friday O-; O-in O-fact O-, O-its O-true O-price O-was B-$-$ O-224 X-. X-75 O-, O-down B-$-$ O-55 O-."
"Net was $24 million, or $1.15 a share, up from $19 million, or 90 cents a share, a year earlier.","O-Net O-was B-$-$ O-24 O-million O-, O-or B-$-$ O-1 X-. X-15 O-a O-share O-, O-up O-from B-$-$ O-19 O-million O-, O-or O-90 O-cents O-a O-share O-, O-a O-year O-earlier O-."
Sales rose 7.4% to $580 million from $540 million.,O-Sales O-rose O-7 X-. X-4 O-% O-to B-$-$ O-580 O-million O-from B-$-$ O-540 O-million O-.
"Olin said its chemical segment had profit of $22 million, up from $15 million a year ago, largely because of gains in electrochemicals such as caustic soda.","O-O X-##lin O-said O-its O-chemical O-segment O-had O-profit O-of B-$-$ O-22 O-million O-, O-up O-from B-$-$ O-15 O-million O-a O-year O-ago O-, O-largely O-because O-of O-gains O-in O-electro X-##chemical X-##s O-such O-as O-ca X-##ustic O-soda O-."
"The chemical segment had a $6 million gain on the sale of ammonia and urea businesses, which was offset by a $6 million charge for future environmental expenditures.","O-The O-chemical O-segment O-had O-a B-$-$ O-6 O-million O-gain O-on O-the O-sale O-of O-am X-##monia O-and O-u X-##rea O-businesses O-, O-which O-was O-offset O-by O-a B-$-$ O-6 O-million O-charge O-for O-future O-environmental O-expenditure X-##s O-."
Profit in Olin's defense and ammunition segment rose to $8 million from $7 million.,O-Prof X-##it O-in O-O X-##lin O-' X-s O-defense O-and O-ammunition O-segment O-rose O-to B-$-$ O-8 O-million O-from B-$-$ O-7 O-million O-.
"The metals segment, hurt by a strike, had break-even results, against $3 million a year ago.","O-The O-metals O-segment O-, O-hurt O-by O-a O-strike O-, O-had O-break X-- X-even O-results O-, O-against B-$-$ O-3 O-million O-a O-year O-ago O-."
"In the first nine months, net rose 21% to $93 million, or $4.52 a share, from $77 million, or $3.62 a share a year ago.","O-In O-the O-first O-nine O-months O-, O-net O-rose O-21 O-% O-to B-$-$ O-93 O-million O-, O-or B-$-$ O-4 X-. X-52 O-a O-share O-, O-from B-$-$ O-77 O-million O-, O-or B-$-$ O-3 X-. X-62 O-a O-share O-a O-year O-ago O-."
Sales rose 13% to $1.91 billion from $1.69 billion.,O-Sales O-rose O-13 O-% O-to B-$-$ O-1 X-. X-91 O-billion O-from B-$-$ O-1 X-. X-69 O-billion O-.
"In New York Stock Exchange composite trading, Olin closed at $58.50 a share, down 25 cents.","O-In O-New O-York O-Stock O-Exchange O-composite O-trading O-, O-O X-##lin O-closed O-at B-$-$ O-58 X-. X-50 O-a O-share O-, O-down O-25 O-cents O-."
"Cross & Trecker, a Bloomfield Hills, Mich., machine-tool maker, said the net sales price of the total transaction is $24 million.","O-Cross O-& O-T X-##reck X-##er O-, O-a O-Bloom X-##field O-Hills O-, O-Mi X-##ch X-. O-, O-machine X-- X-tool O-maker O-, O-said O-the O-net O-sales O-price O-of O-the O-total O-transaction O-is B-$-$ O-24 O-million O-."
The House didn't move quickly enough to meet the Gramm-Rudman deadline for passing legislation to bring the projected fiscal 1990 deficit below the $110 billion target.,O-The O-House O-did O-n X-' X-t O-move O-quickly O-enough O-to O-meet O-the O-Gram X-##m X-- X-R X-##ud X-##man O-deadline O-for O-passing O-legislation O-to O-bring O-the O-projected O-fiscal O-1990 O-deficit O-below O-the B-$-$ O-110 O-billion O-target O-.
"As the law requires, President Bush yesterday signed an order cutting federal spending across the board by $16.1 billion.","O-As O-the O-law O-requires O-, O-President O-Bush O-yesterday O-signed O-an O-order O-cutting O-federal O-spending O-across O-the O-board O-by B-$-$ O-16 X-. X-1 O-billion O-."
"Houston-based Maryland Club Foods, which had sales of about $200 million last year, sells coffee under the Maryland Club and Butter-Nut brands to restaurants, hotels, offices and airlines.","O-Houston X-- X-based O-Maryland O-Club O-Foods O-, O-which O-had O-sales O-of O-about B-$-$ O-200 O-million O-last O-year O-, O-sells O-coffee O-under O-the O-Maryland O-Club O-and O-But X-##ter X-- X-N X-##ut O-brands O-to O-restaurants O-, O-hotels O-, O-offices O-and O-airlines O-."
More than $600 million of impressionist and modern paintings are about to hit the New York auction block -- far outstripping May's four-day $400 million bonanza.,O-More O-than B-$-$ O-600 O-million O-of O-impression X-##ist O-and O-modern O-paintings O-are O-about O-to O-hit O-the O-New O-York O-auction O-block O-- X-- O-far O-outs X-##tri X-##pping O-May O-' X-s O-four X-- X-day B-$-$ O-400 O-million O-b X-##ona X-##nza O-.
"This season Lorinda de Roulet (sister of John Whitney Payson, for whom ""Irises"" by Vincent van Gogh was sold for $53.9 million in November of 1987, to the Australian Alan Bond, who still hasn't taken possession because he hasn't yet paid off the loan Sotheby's offered him at the sale) has consigned another biggie to Sotheby's.","O-This O-season O-Lori X-##nda O-de O-R X-##ou X-##let O-( O-sister O-of O-John O-Whitney O-Pay X-##son O-, O-for O-whom O-"" O-Iris X-##es O-"" O-by O-Vincent O-van O-Go X-##gh O-was O-sold O-for B-$-$ O-53 X-. X-9 O-million O-in O-November O-of O-1987 O-, O-to O-the O-Australian O-Alan O-Bond O-, O-who O-still O-has O-n X-' X-t O-taken O-possession O-because O-he O-has O-n X-' X-t O-yet O-paid O-off O-the O-loan O-So X-##the X-##by O-' X-s O-offered O-him O-at O-the O-sale O-) O-has O-con X-##signed O-another O-big X-##gie O-to O-So X-##the X-##by O-' X-s O-."
"It may sell for more than any previous Picasso -- the record is $47.85 million set in May for ""Self Portrait: Yo Picasso.""","O-It O-may O-sell O-for O-more O-than O-any O-previous O-Picasso O-- X-- O-the O-record O-is B-$-$ O-47 X-. X-85 O-million O-set O-in O-May O-for O-"" O-Self O-Portrait O-: O-Yo O-Picasso O-. O-"""
"Sotheby's also weighs in with the John T. Dorrance Jr. collection of impressionists at an estimated $100 million-plus (to be offered tomorrow) and a juicy assortment of paintings from other sources, more than 35 of which are expected to sell in November for at least $1 million each.","O-So X-##the X-##by O-' X-s O-also O-weighs O-in O-with O-the O-John O-T X-. O-Do X-##rra X-##nce O-Jr X-. O-collection O-of O-impression X-##ists O-at O-an O-estimated B-$-$ O-100 O-million X-- X-plus O-( O-to O-be O-offered O-tomorrow O-) O-and O-a O-j X-##ui X-##cy O-ass X-##ort X-##ment O-of O-paintings O-from O-other O-sources O-, O-more O-than O-35 O-of O-which O-are O-expected O-to O-sell O-in O-November O-for O-at O-least B-$-$ O-1 O-million O-each O-."
"Christie's has snagged the 15 impressionist and modern paintings being pruned from Paul Mellon's vast collection, including the probable $30 million-plus ""Rue Mosnier, Paris, Decorated With Flags on June 30, 1878"" by Edouard Manet (purchased by Mellon at the Jacob Goldschmidt sale in London in 1958 for $316,400) and a van Gogh, ""Trunk of an Old Yew Tree, Arles,"" estimated at $25 million-plus.","O-Christie O-' X-s O-has O-s X-##na X-##gged O-the O-15 O-impression X-##ist O-and O-modern O-paintings O-being O-p X-##run X-##ed O-from O-Paul O-Mellon O-' X-s O-vast O-collection O-, O-including O-the O-probable B-$-$ O-30 O-million X-- X-plus O-"" O-Rue O-Mo X-##s X-##nier O-, O-Paris O-, O-Dec X-##ora X-##ted O-With O-Flags O-on O-June O-30 O-, O-1878 O-"" O-by O-Edo X-##uard O-Man X-##et O-( O-purchased O-by O-Mellon O-at O-the O-Jacob O-Gold X-##sch X-##mi X-##dt O-sale O-in O-London O-in O-1958 O-for B-$-$ O-316 X-, X-400 O-) O-and O-a O-van O-Go X-##gh O-, O-"" O-T X-##runk O-of O-an O-Old O-Ye X-##w O-Tree O-, O-A X-##rle X-##s O-, X-"" O-estimated O-at B-$-$ O-25 O-million X-- X-plus O-."
"Other one-owner collections include Billy Wilder's more modest but choice offerings, and the George N. Richard collection -- piled on top of Christie's estimated $150 million -- $200 million of other impressionist goodies.","O-Other O-one X-- X-owner O-collections O-include O-Billy O-Wilder O-' X-s O-more O-modest O-but O-choice O-offerings O-, O-and O-the O-George O-N X-. O-Richard O-collection O-- X-- O-piled O-on O-top O-of O-Christie O-' X-s O-estimated B-$-$ O-150 O-million O-- X-- B-$-$ O-200 O-million O-of O-other O-impression X-##ist O-good X-##ies O-."
But the stakes are now very high and for your $40 million you can buy only the best of what is available -- which may not be the best there is.,O-But O-the O-stakes O-are O-now O-very O-high O-and O-for O-your B-$-$ O-40 O-million O-you O-can O-buy O-only O-the O-best O-of O-what O-is O-available O-- X-- O-which O-may O-not O-be O-the O-best O-there O-is O-.
"If all goes well, if the Picasso hits $75 million, and Mellon, Dorrance, Wilder and the rest get what they bargained for, the uncomfortable, questioning buzz in the art marketplace will trail off into sighs of relief, only to begin anew slightly louder than before, as the cycle starts over in the spring.","O-If O-all O-goes O-well O-, O-if O-the O-Picasso O-hits B-$-$ O-75 O-million O-, O-and O-Mellon O-, O-Do X-##rra X-##nce O-, O-Wilder O-and O-the O-rest O-get O-what O-they O-bargain X-##ed O-for O-, O-the O-uncomfortable O-, O-questioning O-buzz O-in O-the O-art O-marketplace O-will O-trail O-off O-into O-sighs O-of O-relief O-, O-only O-to O-begin O-an X-##ew O-slightly O-louder O-than O-before O-, O-as O-the O-cycle O-starts O-over O-in O-the O-spring O-."
"Unilab Corp., Norcross, Ga., said it acquired the clinical laboratories of closely held Central Diagnostic Laboratory Inc. in a cash and securities transaction valued at $85 million.","O-Un X-##ila X-##b O-Corp X-. O-, O-Nor X-##cross O-, O-G X-##a X-. O-, O-said O-it O-acquired O-the O-clinical O-laboratories O-of O-closely O-held O-Central O-Di X-##ag X-##nos X-##tic O-Laboratory O-Inc O-. O-in O-a O-cash O-and O-securities O-transaction O-valued O-at B-$-$ O-85 O-million O-."
"Unilab said its wholly owned MetWest Inc. unit paid $25 million in cash, provided $30 million in notes and $30 million in preferred stock to acquire Central's labs in the Western U.S.","O-Un X-##ila X-##b O-said O-its O-wholly O-owned O-Met X-##W X-##est O-Inc O-. O-unit O-paid B-$-$ O-25 O-million O-in O-cash O-, O-provided B-$-$ O-30 O-million O-in O-notes O-and B-$-$ O-30 O-million O-in O-preferred O-stock O-to O-acquire O-Central O-' X-s O-labs O-in O-the O-Western O-U X-. X-S O-."
Consolidated Papers Inc. said it plans to spend $495 million on new paper-manufacturing equipment and facilities.,O-Consolidated O-Papers O-Inc O-. O-said O-it O-plans O-to O-spend B-$-$ O-49 X-##5 O-million O-on O-new O-paper X-- X-manufacturing O-equipment O-and O-facilities O-.
"Ciba-Geigy Ltd. and Chiron Corp. said they extended their offer for Connaught BioSciences Inc., valued at 866 million Canadian dollars (US$736 million) to Oct. 27.","O-C X-##iba X-- X-G X-##ei X-##gy O-Ltd X-. O-and O-Chi X-##ron O-Corp O-. O-said O-they O-extended O-their O-offer O-for O-Con X-##na X-##ught O-B X-##io X-##S X-##cie X-##nces O-Inc X-. O-, O-valued O-at O-86 X-##6 O-million O-Canadian O-dollars O-( O-US B-$-$ O-73 X-##6 O-million O-) O-to O-Oct X-. O-27 O-."
"The companies earlier said they didn't want to raise their offer to match a rival bid by Institut Merieux S.A. of C$37 a share, or C$942 million.","O-The O-companies O-earlier O-said O-they O-did O-n X-' X-t O-want O-to O-raise O-their O-offer O-to O-match O-a O-rival O-bid O-by O-Institut O-Me X-##rie X-##ux O-S X-. X-A X-. O-of B-$-C B-$-$ O-37 O-a O-share O-, O-or O-C B-$-$ O-94 X-##2 O-million O-."
"But they said the C$30-a-share bid, which was due to expire Monday, may still be extended or varied.","O-But O-they O-said O-the O-C B-$-$ O-30 X-- X-a X-- X-share O-bid O-, O-which O-was O-due O-to O-ex X-##pire O-Monday O-, O-may O-still O-be O-extended O-or O-varied O-."
"Prospect, a New York-based leveraged buy-out firm, also agreed to invest $15 million in Recognition, which in turn agreed to repurchase as much as $20 million of its stock.","O-Prospect O-, O-a O-New O-York X-- X-based O-leverage X-##d O-buy X-- X-out O-firm O-, O-also O-agreed O-to O-invest B-$-$ O-15 O-million O-in O-Re X-##cognition O-, O-which O-in O-turn O-agreed O-to O-re X-##pur X-##chase O-as O-much O-as B-$-$ O-20 O-million O-of O-its O-stock O-."
"Beyond that, Prospect said it wouldn't offer to acquire additional shares for less than $11.25 a share during the next year or less than $14.06 a share during the subsequent two years.","O-Beyond O-that O-, O-Prospect O-said O-it O-would O-n X-' X-t O-offer O-to O-acquire O-additional O-shares O-for O-less O-than B-$-$ O-11 X-. X-25 O-a O-share O-during O-the O-next O-year O-or O-less O-than B-$-$ O-14 X-. X-06 O-a O-share O-during O-the O-subsequent O-two O-years O-."
"Recognition also said it obtained a commitment from Chemical Bank and Bank of Boston to convert an estimated $18 million in bank debt to a new, 24-month secured term loan to be repaid through the sale of certain assets.","O-Re X-##cognition O-also O-said O-it O-obtained O-a O-commitment O-from O-Chemical O-Bank O-and O-Bank O-of O-Boston O-to O-convert O-an O-estimated B-$-$ O-18 O-million O-in O-bank O-debt O-to O-a O-new O-, O-24 X-- X-month O-secured O-term O-loan O-to O-be O-re X-##pa X-##id O-through O-the O-sale O-of O-certain O-assets O-."
"In August, Recognition said it was in violation of certain terms of its debt agreements with bank lenders because of a $3.9 million loss for the third quarter ended July 31.","O-In O-August O-, O-Re X-##cognition O-said O-it O-was O-in O-violation O-of O-certain O-terms O-of O-its O-debt O-agreements O-with O-bank O-lend X-##ers O-because O-of O-a B-$-$ O-3 X-. X-9 O-million O-loss O-for O-the O-third O-quarter O-ended O-July O-31 O-."
"The former executives were indicted last October on charges of fraud, theft and conspiracy related to efforts by the company to win $400 million in Postal Service contracts.","O-The O-former O-executives O-were O-indicted O-last O-October O-on O-charges O-of O-fraud O-, O-theft O-and O-conspiracy O-related O-to O-efforts O-by O-the O-company O-to O-win B-$-$ O-400 O-million O-in O-Postal O-Service O-contracts O-."
"In New York Stock Exchange composite trading, Recognition rose 87.5 cents to $6.625.","O-In O-New O-York O-Stock O-Exchange O-composite O-trading O-, O-Re X-##cognition O-rose O-87 X-. X-5 O-cents O-to B-$-$ O-6 X-. X-625 O-."
Prospect slipped 25 cents to $10.50 in national over-the-counter trading.,O-Prospect O-slipped O-25 O-cents O-to B-$-$ O-10 X-. X-50 O-in O-national O-over X-- X-the X-- X-counter O-trading O-.
The British pound declined to $1.5755 from $1.5840 before the weekend.,O-The O-British O-pound O-declined O-to B-$-$ O-1 X-. X-57 X-##55 O-from B-$-$ O-1 X-. X-58 X-##40 O-before O-the O-weekend O-.
"Moreover, forecasters predict that the trade deficit for August, to be released today, will worsen to more than $9 billion from $7.6 billion the previous month.","O-Moreover O-, O-forecast X-##ers O-predict O-that O-the O-trade O-deficit O-for O-August O-, O-to O-be O-released O-today O-, O-will O-worse X-##n O-to O-more O-than B-$-$ O-9 O-billion O-from B-$-$ O-7 X-. X-6 O-billion O-the O-previous O-month O-."
Mr. Bianchi said some big European institutional investors were selling dollars in lots of $100 million to $200 million.,O-Mr X-. O-B X-##ian X-##chi O-said O-some O-big O-European O-institutional O-investors O-were O-selling O-dollars O-in O-lots O-of B-$-$ O-100 O-million O-to B-$-$ O-200 O-million O-.
"On the Commodity Exchange in New York, gold for current delivery rose $4 to $367.30 an ounce in moderate trading.","O-On O-the O-Co X-##mm X-##od X-##ity O-Exchange O-in O-New O-York O-, O-gold O-for O-current O-delivery O-rose B-$-$ O-4 O-to B-$-$ O-36 X-##7 X-. X-30 O-an O-ounce O-in O-moderate O-trading O-."
"In early trading in Hong Kong Tuesday, gold was quoted at about $366.27 an ounce, down $2 an ounce from Monday.","O-In O-early O-trading O-in O-Hong O-Kong O-Tuesday O-, O-gold O-was O-quoted O-at O-about B-$-$ O-36 X-##6 X-. X-27 O-an O-ounce O-, O-down B-$-$ O-2 O-an O-ounce O-from O-Monday O-."
"Moody's Investors Service Inc. said it lowered ratings on about $650 million of Beatrice Co. debt, citing the closely held Chicago food concern's proposed recapitalization.","O-Moody O-' X-s O-In X-##ves X-##tors O-Service O-Inc O-. O-said O-it O-lowered O-ratings O-on O-about B-$-$ O-650 O-million O-of O-Beatrice O-Co X-. O-debt O-, O-citing O-the O-closely O-held O-Chicago O-food O-concern O-' X-s O-proposed O-re X-##cap X-##ital X-##ization O-."
"Beatrice, which went private in an $8.2 billion leveraged buy-out in 1986, said last month that it might borrow again to help pay investors as much as $983 million in preferred stock and debt securities.","O-Beatrice O-, O-which O-went O-private O-in O-an B-$-$ O-8 X-. X-2 O-billion O-leverage X-##d O-buy X-- X-out O-in O-1986 O-, O-said O-last O-month O-that O-it O-might O-borrow O-again O-to O-help O-pay O-investors O-as O-much O-as B-$-$ O-98 X-##3 O-million O-in O-preferred O-stock O-and O-debt O-securities O-."
Reserves traded among commercial banks for overnight use in amounts of $1 million or more.,O-Reserves O-traded O-among O-commercial O-banks O-for O-overnight O-use O-in O-amounts O-of B-$-$ O-1 O-million O-or O-more O-.
"COMMERCIAL PAPER: High-grade unsecured notes sold through dealers by major corporations in multiples of $1,000: 8.50% 30 days; 8.40% 60 days; 8.375% 90 days.","O-CO X-##MM X-##ER X-##CI X-##AL O-PA X-##P X-##ER O-: O-High X-- X-grade O-un X-##se X-##cure X-##d O-notes O-sold O-through O-dealers O-by O-major O-corporations O-in O-multiple X-##s O-of B-$-$ O-1 X-, X-000 O-: O-8 X-. X-50 O-% O-30 O-days O-; O-8 X-. X-40 O-% O-60 O-days O-; O-8 X-. X-375 O-% O-90 O-days O-."
"Average of top rates paid by major New York banks on primary new issues of negotiable C.D.s, usually on amounts of $1 million and more.","O-Average O-of O-top O-rates O-paid O-by O-major O-New O-York O-banks O-on O-primary O-new O-issues O-of O-ne X-##got X-##iable O-C X-. X-D X-. X-s O-, O-usually O-on O-amounts O-of B-$-$ O-1 O-million O-and O-more O-."
"The minimum unit is $100,000.","O-The O-minimum O-unit O-is B-$-$ O-100 X-, X-000 O-."
"TREASURY BILLS: Results of the Monday, October 16, 1989, auction of short-term U.S. government bills, sold at a discount from face value in units of $10,000 to $1 million: 7.37% 13 weeks; 7.42% 26 weeks.","O-T X-##RE X-##AS X-##UR X-##Y O-B X-##IL X-##LS O-: O-Results O-of O-the O-Monday O-, O-October O-16 O-, O-1989 O-, O-auction O-of O-short X-- X-term O-U X-. X-S X-. O-government O-bills O-, O-sold O-at O-a O-discount O-from O-face O-value O-in O-units O-of B-$-$ O-10 X-, X-000 O-to B-$-$ O-1 O-million O-: O-7 X-. X-37 O-% O-13 O-weeks O-; O-7 X-. X-42 O-% O-26 O-weeks O-."
"A year earlier, Flowers had fiscal first-quarter net income of $8 million, or 23 cents a share, on revenue of $170.4 million.","O-A O-year O-earlier O-, O-Flowers O-had O-fiscal O-first X-- X-quarter O-net O-income O-of B-$-$ O-8 O-million O-, O-or O-23 O-cents O-a O-share O-, O-on O-revenue O-of B-$-$ O-170 X-. X-4 O-million O-."
"In August, business inventories totaled $789.87 billion, while sales grew to $526.79 billion, the department said.","O-In O-August O-, O-business O-inventor X-##ies O-totaled B-$-$ O-78 X-##9 X-. X-87 O-billion O-, O-while O-sales O-grew O-to B-$-$ O-52 X-##6 X-. X-79 O-billion O-, O-the O-department O-said O-."
"IRS Commissioner Fred T. Goldberg said the changes are intended to bring ""accountability"" to the agency, which has an annual budget of more than $5 billion and collects about $1 trillion a year.","O-I X-##RS O-Commissioner O-Fred O-T X-. O-Goldberg O-said O-the O-changes O-are O-intended O-to O-bring O-"" O-account X-##ability O-"" O-to O-the O-agency O-, O-which O-has O-an O-annual O-budget O-of O-more O-than B-$-$ O-5 O-billion O-and O-collects O-about B-$-$ O-1 O-trillion O-a O-year O-."
"""And we don't have internal controls and discipline that we need to have to spend $5 billion properly.""","O-"" O-And O-we O-do O-n X-' X-t O-have O-internal O-controls O-and O-discipline O-that O-we O-need O-to O-have O-to O-spend B-$-$ O-5 O-billion O-properly O-. O-"""
"And the agency, which operated throughout fiscal 1989 with a $360 million budget shortfall, has been under a hiring freeze since last fall.","O-And O-the O-agency O-, O-which O-operated O-throughout O-fiscal O-1989 O-with O-a B-$-$ O-360 O-million O-budget O-short X-##fall O-, O-has O-been O-under O-a O-hiring O-freeze O-since O-last O-fall O-."
"Although the jobs will probably pay between $70,000 and $80,000 a year, IRS officials are confident that they can attract top-notch candidates from the private sector.","O-Although O-the O-jobs O-will O-probably O-pay O-between B-$-$ O-70 X-, X-000 O-and B-$-$ O-80 X-, X-000 O-a O-year O-, O-I X-##RS O-officials O-are O-confident O-that O-they O-can O-attract O-top X-- X-notch O-candidates O-from O-the O-private O-sector O-."
"""On the comptroller side, you're developing and making work financial controls governing a $6 billion budget.""","O-"" O-On O-the O-com X-##pt X-##roll X-##er O-side O-, O-you O-' X-re O-developing O-and O-making O-work O-financial O-controls O-governing O-a B-$-$ O-6 O-billion O-budget O-. O-"""
The round-trip fare to Havana is 410 Irish punts ($578).,O-The O-round X-- X-trip O-fare O-to O-Havana O-is O-410 O-Irish O-punt X-##s B-$-( X-$ O-57 X-##8 O-) O-.
"An editorial in the NCI Journal says the report of declining lung-cancer mortality ""among young men and women in the U.S. indicates that we finally may be winning the battle -- this even in a country where the tobacco industry spends over $2 billion a year for promotion of the addictive habit of smoking.""","O-An O-editorial O-in O-the O-NC X-##I O-Journal O-says O-the O-report O-of O-declining O-lung X-- X-cancer O-mortality O-"" O-among O-young O-men O-and O-women O-in O-the O-U X-. X-S X-. O-indicates O-that O-we O-finally O-may O-be O-winning O-the O-battle O-- X-- O-this O-even O-in O-a O-country O-where O-the O-tobacco O-industry O-spends O-over B-$-$ O-2 O-billion O-a O-year O-for O-promotion O-of O-the O-add X-##ict X-##ive O-habit O-of O-smoking O-. O-"""
