"Working Woman and Working Mother have operated as part of Working Woman/McCall's Group, a less-than-successful joint venture between Mr. Lang and Time Warner Inc.","O-Working O-Woman O-and O-Working O-Mother O-have B-VBN-operated O-as O-part O-of O-Working O-Woman O-/ O-M X-##c X-##C X-##all O-' X-s O-Group O-, O-a O-less X-- X-than X-- X-successful O-joint O-venture O-between O-Mr X-. O-Lang O-and O-Time O-Warner O-Inc O-."
"The joint venture is being undone, with McCall's magazine being sold last summer to the New York Times Co. 's Magazine Group for about $80 million, and Time Warner agreeing to sell back its 50% interest in Working Woman and Working Mother to Mr. Lang.","O-The O-joint O-venture O-is O-being B-VBN-und X-##one O-, O-with O-M X-##c X-##C X-##all O-' X-s O-magazine O-being B-VBN-sold O-last O-summer O-to O-the O-New O-York O-Times O-Co O-. O-' O-s O-Magazine O-Group O-for O-about O-$ O-80 O-million O-, O-and O-Time O-Warner O-agreeing O-to O-sell O-back O-its O-50 O-% O-interest O-in O-Working O-Woman O-and O-Working O-Mother O-to O-Mr X-. O-Lang O-."
"The venture, formed in 1986, was supposed to be Time's low-cost, safe entry into women's magazines.","O-The O-venture O-, B-VBN-formed O-in O-1986 O-, O-was B-VBN-supposed O-to O-be O-Time O-' X-s O-low X-- X-cost O-, O-safe O-entry O-into O-women O-' X-s O-magazines O-."
"Mr. Lang surprised Time soon after joining forces when he said he would negotiate rates individually with advertisers, a practice common in broadcasting but considered taboo by magazine publishers.","O-Mr X-. O-Lang O-surprised O-Time O-soon O-after O-joining O-forces O-when O-he O-said O-he O-would O-negotiate O-rates O-individually O-with O-ad X-##vert X-##isers O-, O-a O-practice O-common O-in O-broadcasting O-but B-VBN-considered O-ta X-##boo O-by O-magazine O-publishers O-."
"In addition, McCall's put in a less than stellar performance.","O-In O-addition O-, O-M X-##c X-##C X-##all O-' X-s B-VBN-put O-in O-a O-less O-than O-stellar O-performance O-."
"Time executives complained about the shoddy editorial quality, and in the end, one Time executive who asked not to be identified said, ""Frankly, McCall's and the joint venture were an embarrassment.""","O-Time O-executives O-complained O-about O-the O-s X-##ho X-##ddy O-editorial O-quality O-, O-and O-in O-the O-end O-, O-one O-Time O-executive O-who O-asked O-not O-to O-be B-VBN-identified O-said O-, O-"" O-Frank X-##ly O-, O-M X-##c X-##C X-##all O-' X-s O-and O-the O-joint O-venture O-were O-an O-embarrassment O-. O-"""
"""Their management changed right after {the venture was formed}, and I don't think they were comfortable getting into the competitive wars of women's service magazines.""","O-"" O-Their O-management O-changed O-right O-after O-{ O-the O-venture O-was B-VBN-formed O-} O-, O-and O-I O-do O-n X-' X-t O-think O-they O-were O-comfortable O-getting O-into O-the O-competitive O-wars O-of O-women O-' X-s O-service O-magazines O-. O-"""
"Mr. Lang has named Carol Taber, 43, as group publisher of New York-based Lang Communications.","O-Mr X-. O-Lang O-has B-VBN-named O-Carol O-Ta X-##ber O-, O-43 O-, O-as O-group O-publisher O-of O-New O-York X-- X-based O-Lang O-Communications O-."
"There is plenty of work to be done on what we have.""","O-There O-is O-plenty O-of O-work O-to O-be B-VBN-done O-on O-what O-we O-have O-. O-"""
"Coupled with his current 1.2 million shares and 4% held by an associate, the stake would have given him control of 55% of the concern.","B-VBN-Co X-##up X-##led O-with O-his O-current O-1 X-. X-2 O-million O-shares O-and O-4 O-% B-VBN-held O-by O-an O-associate O-, O-the O-stake O-would O-have B-VBN-given O-him O-control O-of O-55 O-% O-of O-the O-concern O-."
"In a Securities and Exchange Commission filing, Mr. Ruskin had said that holders of the other 45% of United Merchants would receive one-half share of a new preferred stock for each of their shares.","O-In O-a O-Securities O-and O-Exchange O-Commission O-filing O-, O-Mr X-. O-R X-##usk X-##in O-had B-VBN-said O-that O-holders O-of O-the O-other O-45 O-% O-of O-United O-Merchant X-##s O-would O-receive O-one X-- X-half O-share O-of O-a O-new O-preferred O-stock O-for O-each O-of O-their O-shares O-."
Ethyl Corp. reported that third-quarter net income fell 12% from a year-earlier quarter helped by a gain from discontinued operations.,O-E X-##thy X-##l O-Corp O-. O-reported O-that O-third X-- X-quarter O-net O-income O-fell O-12 O-% O-from O-a O-year X-- X-earlier O-quarter B-VBN-helped O-by O-a O-gain O-from B-VBN-discontinued O-operations O-.
"The company's chemicals interests include, among other things, petroleum additives, pharmaceuticals ingredients and polysilicon used by the semiconductor industry.","O-The O-company O-' X-s O-chemicals O-interests O-include O-, O-among O-other O-things O-, O-petroleum O-add X-##itive X-##s O-, O-pharmaceutical X-##s O-ingredients O-and O-p X-##oly X-##si X-##lic X-##on B-VBN-used O-by O-the O-semi X-##conductor O-industry O-."
Net in the latest period included $11.9 million from discontinued operations and a charge of $6.2 million from a plant closing.,O-Net O-in O-the O-latest O-period O-included O-$ O-11 X-. X-9 O-million O-from B-VBN-discontinued O-operations O-and O-a O-charge O-of O-$ O-6 X-. X-2 O-million O-from O-a O-plant O-closing O-.
"In the year-ago period, net included $32.7 million from discontinued operations.","O-In O-the O-year X-- X-ago O-period O-, O-net O-included O-$ O-32 X-. X-7 O-million O-from B-VBN-discontinued O-operations O-."
"After a tortuous climb, she is rewarded by a picture-postcard vista: a glade of golden aspens under an azure Indian-summer sky.","O-After O-a O-to X-##rt X-##uous O-climb O-, O-she O-is B-VBN-rewarded O-by O-a O-picture X-- X-post X-##card O-v X-##ista O-: O-a O-glad X-##e O-of O-golden O-as X-##pen X-##s O-under O-an O-a X-##zure O-Indian X-- X-summer O-sky O-."
"This place is 12 miles into the back country -- a day-long trudge for a hiker, but reached by Ms. Peterson and six others in a mere two hours of pedaling fat-tired mountain bikes.","O-This O-place O-is O-12 O-miles O-into O-the O-back O-country O-- X-- O-a O-day X-- X-long O-t X-##rudge O-for O-a O-hike X-##r O-, O-but B-VBN-reached O-by O-Ms O-. O-Peterson O-and O-six O-others O-in O-a O-mere O-two O-hours O-of O-pedal X-##ing O-fat X-- X-tired O-mountain O-bikes O-."
"This summer, speeding bikers were blamed for an accident in the Napa County park, in which a horse -- spooked on a trail that was closed to bikers -- broke its leg.","O-This O-summer O-, O-speeding O-bike X-##rs O-were B-VBN-blamed O-for O-an O-accident O-in O-the O-Na X-##pa O-County O-park O-, O-in O-which O-a O-horse O-- X-- B-VBN-s X-##po X-##oked O-on O-a O-trail O-that O-was O-closed O-to O-bike X-##rs O-- X-- O-broke O-its O-leg O-."
The animal had to be destroyed; the bikers fled and were never found.,O-The O-animal O-had O-to O-be B-VBN-destroyed O-; O-the O-bike X-##rs O-fled O-and O-were O-never B-VBN-found O-.
"In numerous parks near San Francisco, rangers have been forced to close trails, set up speed traps and use radar guns to curb fast and reckless riding.","O-In O-numerous O-parks O-near O-San O-Francisco O-, O-range X-##rs O-have B-VBN-been B-VBN-forced O-to O-close O-trails O-, O-set O-up O-speed O-traps O-and O-use O-radar O-guns O-to O-curb O-fast O-and O-reckless O-riding O-."
They have even sent helicopters in pursuit of bikers after hikers and equestrians complained they were being driven from trails.,O-They O-have O-even B-VBN-sent O-helicopters O-in O-pursuit O-of O-bike X-##rs O-after O-hike X-##rs O-and O-equestrian X-##s O-complained O-they O-were O-being B-VBN-driven O-from O-trails O-.
"""We were being overrun,"" says Steve Fiala, trails coordinator of the East Bay Regional Park District.","O-"" O-We O-were O-being B-VBN-overrun O-, X-"" O-says O-Steve O-Fi X-##ala O-, O-trails O-coordinator O-of O-the O-East O-Bay O-Regional O-Park O-District O-."
"From about 200,000 six years ago, the number of mountain bikes in the U.S. is expected to grow to 10 million in 1990.","O-From O-about O-200 X-, X-000 O-six O-years O-ago O-, O-the O-number O-of O-mountain O-bikes O-in O-the O-U X-. X-S X-. O-is B-VBN-expected O-to O-grow O-to O-10 O-million O-in O-1990 O-."
At least half that growth will have come in the past three years alone.,O-At O-least O-half O-that O-growth O-will O-have B-VBN-come O-in O-the O-past O-three O-years O-alone O-.
The controversy kicked up by the proliferation of these all-terrain bicycles is one of the most divisive storms to blow through the national conservation movement in recent memory.,O-The O-controversy B-VBN-kicked O-up O-by O-the O-proliferation O-of O-these O-all X-- X-terrain O-bicycles O-is O-one O-of O-the O-most O-di X-##vis X-##ive O-storms O-to O-blow O-through O-the O-national O-conservation O-movement O-in O-recent O-memory O-.
"But the bikes' burgeoning numbers, safety concerns and fear that they damage fragile landscapes have prompted pleas, from the Sierras to the Eastern Seaboard, to ban them from the back country.","O-But O-the O-bikes X-' O-b X-##urge X-##oning O-numbers O-, O-safety O-concerns O-and O-fear O-that O-they O-damage O-fragile O-landscapes O-have B-VBN-prompted O-plea X-##s O-, O-from O-the O-Sierra X-##s O-to O-the O-Eastern O-Sea X-##board O-, O-to O-ban O-them O-from O-the O-back O-country O-."
The move largely consigns them to roads used by motorized vehicles.,O-The O-move O-largely O-con X-##sign X-##s O-them O-to O-roads B-VBN-used O-by O-motor X-##ized O-vehicles O-.
Most other states have enacted similar bans.,O-Most O-other O-states O-have B-VBN-enacted O-similar O-ban X-##s O-.
"Even the U.S. Forest Service, whose lenient ""multiple-use"" philosophy permits motorized vehicles on thousands of miles of its trails across the U.S., has begun to close some lands to the bikes, including major portions of the popular Pacific Crest Trail, which stretches from California to Canada.","O-Even O-the O-U X-. X-S X-. O-Forest O-Service O-, O-whose O-le X-##nie X-##nt O-"" O-multiple X-- X-use O-"" O-philosophy O-permits O-motor X-##ized O-vehicles O-on O-thousands O-of O-miles O-of O-its O-trails O-across O-the O-U X-. X-S X-. O-, O-has B-VBN-begun O-to O-close O-some O-lands O-to O-the O-bikes O-, O-including O-major O-portions O-of O-the O-popular O-Pacific O-C X-##rest O-Trail O-, O-which O-stretches O-from O-California O-to O-Canada O-."
Sierra has been instrumental in securing a number of the California bans.,O-Sierra O-has B-VBN-been O-instrumental O-in O-securing O-a O-number O-of O-the O-California O-ban X-##s O-.
"It has been waging an all-out campaign to beat back a proposal, pushed by Utah bike groups, to allow the cycles in federally designated wilderness areas, where they are now prohibited.","O-It O-has B-VBN-been O-wa X-##ging O-an O-all X-- X-out O-campaign O-to O-beat O-back O-a O-proposal O-, B-VBN-pushed O-by O-Utah O-bike O-groups O-, O-to O-allow O-the O-cycles O-in O-federally B-VBN-designated O-wilderness O-areas O-, O-where O-they O-are O-now B-VBN-prohibited O-."
"Yet Sierra's hard-line stance has created something of a rift in the organization, which estimates that 17% of its 500,000 members own mountain bikes.","O-Yet O-Sierra O-' X-s O-hard X-- X-line O-stance O-has B-VBN-created O-something O-of O-a O-rift O-in O-the O-organization O-, O-which O-estimates O-that O-17 O-% O-of O-its O-500 X-, X-000 O-members O-own O-mountain O-bikes O-."
But the club still insists that public lands ought to be closed to the bikes unless studies indicate the bikes won't injure the environment or other users.,O-But O-the O-club O-still O-insists O-that O-public O-lands O-ought O-to O-be B-VBN-closed O-to O-the O-bikes O-unless O-studies O-indicate O-the O-bikes O-w X-##o O-n X-' X-t O-in X-##jure O-the O-environment O-or O-other O-users O-.
"""I have a mountain bike, yet as a hiker I've been run off the road by kids careening down a fire trail on them,"" says Gene Coan, an official at Sierra's headquarters in San Francisco, echoing the concerns of many members.","O-"" O-I O-have O-a O-mountain O-bike O-, O-yet O-as O-a O-hike X-##r O-I O-' X-ve B-VBN-been B-VBN-run O-off O-the O-road O-by O-kids O-care X-##ening O-down O-a O-fire O-trail O-on O-them O-, X-"" O-says O-Gene O-Co X-##an O-, O-an O-official O-at O-Sierra O-' X-s O-headquarters O-in O-San O-Francisco O-, O-echoing O-the O-concerns O-of O-many O-members O-."
"""People who feel that cyclists should be banned from an area aren't looking at the whole picture,"" complains Mark Langton, associate editor of Mountain and City Biking magazine in Canoga Park, Calif.","O-"" O-People O-who O-feel O-that O-cyclists O-should O-be B-VBN-banned O-from O-an O-area O-are O-n X-' X-t O-looking O-at O-the O-whole O-picture O-, X-"" O-complain X-##s O-Mark O-Lang X-##ton O-, O-associate O-editor O-of O-Mountain O-and O-City O-B X-##iki X-##ng O-magazine O-in O-Can X-##oga O-Park O-, O-Cal X-##if O-."
"Mr. Langton's group, Concerned Off-Road Bicyclists Association, mounted petition drives to help keep open certain Santa Monica Mountain trails designated for closing.","O-Mr X-. O-Lang X-##ton O-' X-s O-group O-, O-Con X-##cer X-##ned O-Off X-- X-Road O-B X-##ic X-##y X-##c X-##lists O-Association O-, O-mounted O-petition O-drives O-to O-help O-keep O-open O-certain O-Santa O-Monica O-Mountain O-trails B-VBN-designated O-for O-closing O-."
"Biking groups in Montana, Idaho, Michigan and Massachusetts have won similar concessions, says Tim Blumenthal, mountain bike editor of Bicycling magazine.","O-B X-##iki X-##ng O-groups O-in O-Montana O-, O-Idaho O-, O-Michigan O-and O-Massachusetts O-have B-VBN-won O-similar O-concessions O-, O-says O-Tim O-Blu X-##ment X-##hal O-, O-mountain O-bike O-editor O-of O-B X-##ic X-##y X-##c X-##ling O-magazine O-."
"These groups have been trying to improve the mountain biker's image; in the San Francisco-area park district where a ranger was clobbered by a cyclist this summer bikers have formed a volunteer patrol to help rangers enforce regulations, and to school riders in proper trail etiquette.","O-These O-groups O-have B-VBN-been O-trying O-to O-improve O-the O-mountain O-bike X-##r O-' X-s O-image O-; O-in O-the O-San O-Francisco X-- X-area O-park O-district O-where O-a O-range X-##r O-was B-VBN-c X-##lo X-##bbe X-##red O-by O-a O-cyclist O-this O-summer O-bike X-##rs O-have B-VBN-formed O-a O-volunteer O-patrol O-to O-help O-range X-##rs O-enforce O-regulations O-, O-and O-to O-school O-riders O-in O-proper O-trail O-et X-##ique X-##tte O-."
"While some are renegade riders who simply scorn regulations, much bad riding simply reflects ignorance that can be corrected through ""education and peer pressure,"" says Jim Hasenauer, a director of the International Mountain Biking Association.","O-While O-some O-are O-re X-##ne X-##gade O-riders O-who O-simply O-s X-##corn O-regulations O-, O-much O-bad O-riding O-simply O-reflects O-ignorance O-that O-can O-be B-VBN-corrected O-through O-"" O-education O-and O-peer O-pressure O-, X-"" O-says O-Jim O-Has X-##ena X-##uer O-, O-a O-director O-of O-the O-International O-Mountain O-B X-##iki X-##ng O-Association O-."
"Few would have foreseen such a furor when, a decade ago, some Marin County bicycle enthusiasts created a hybrid bike using fat tires, lightweight metallurgy and multi-gear technology.","O-Few O-would O-have B-VBN-fore X-##see X-##n O-such O-a O-fur X-##or O-when O-, O-a O-decade O-ago O-, O-some O-Marin O-County O-bicycle O-enthusiasts O-created O-a O-hybrid O-bike O-using O-fat O-tires O-, O-lightweight O-metal X-##lu X-##rgy O-and O-multi X-- X-gear O-technology O-."
"When the bikes first entered mass production in 1981, they were dismissed as a fad.","O-When O-the O-bikes O-first O-entered O-mass O-production O-in O-1981 O-, O-they O-were B-VBN-dismissed O-as O-a O-f X-##ad O-."
"Last year, 25% of the 10 million bicycles sold in the U.S. were mountain bikes.","O-Last O-year O-, O-25 O-% O-of O-the O-10 O-million O-bicycles B-VBN-sold O-in O-the O-U X-. X-S X-. O-were O-mountain O-bikes O-."
"Crested Butte, population 1,200, is a bastion of the sport.","B-VBN-C X-##rest X-##ed O-But X-##te O-, O-population O-1 X-, X-200 O-, O-is O-a O-b X-##ast X-##ion O-of O-the O-sport O-."
"Mr. Allen, appointed by President Reagan, grew understandably tired of dealing with the guerrilla tactics of his enemies.","O-Mr X-. O-Allen O-, B-VBN-appointed O-by O-President O-Reagan O-, O-grew O-understand X-##ably O-tired O-of O-dealing O-with O-the O-guerrilla O-tactics O-of O-his O-enemies O-."
"His recent speech, provocatively titled ""Blacks?","O-His O-recent O-speech O-, O-pro X-##vocative X-##ly B-VBN-titled O-"" O-Blacks O-?"
We've actually read the speech.,O-We O-' X-ve O-actually B-VBN-read O-the O-speech O-.
"He said that other participants in the conference ""do not believe that the rights of Americans should be guaranteed to citizens who are homosexual,"" but that ""I mean to persuade you to the opposite view.""","O-He O-said O-that O-other O-participants O-in O-the O-conference O-"" O-do O-not O-believe O-that O-the O-rights O-of O-Americans O-should O-be B-VBN-guaranteed O-to O-citizens O-who O-are O-homosexual O-, X-"" O-but O-that O-"" O-I O-mean O-to O-persuade O-you O-to O-the O-opposite O-view O-. O-"""
"He recalled to the audience a ""strange, infelicitous"" analogy he once heard arguing ""now that we have finally recognized that American blacks have rights, we need to do the same for animals.""","O-He O-recalled O-to O-the O-audience O-a O-"" O-strange O-, O-in X-##fe X-##licit X-##ous O-"" O-analogy O-he O-once O-heard O-arguing O-"" O-now O-that O-we O-have O-finally B-VBN-recognized O-that O-American O-blacks O-have O-rights O-, O-we O-need O-to O-do O-the O-same O-for O-animals O-. O-"""
"Rights on such a basis, whether for blacks or homosexuals, are ""mere indulgences,"" he said, subject to being taken back.","O-Rights O-on O-such O-a O-basis O-, O-whether O-for O-blacks O-or O-homosexual X-##s O-, O-are O-"" O-mere O-in X-##du X-##lge X-##nces O-, X-"" O-he O-said O-, O-subject O-to O-being B-VBN-taken O-back O-."
"His speech criticized the ""idiocy of notions of protected groups in society"" as opposed to individual equality or, as he put it, in ""a common destiny as Americans.""","O-His O-speech O-criticized O-the O-"" O-id X-##io X-##cy O-of O-notions O-of B-VBN-protected O-groups O-in O-society O-"" O-as B-VBN-opposed O-to O-individual O-equality O-or O-, O-as O-he O-put O-it O-, O-in O-"" O-a O-common O-destiny O-as O-Americans O-. O-"""
"Mr. Allen, who teaches government at prestigious Harvey Mudd College in California and will remain a member of the commission, has spent years arguing that civil rights are individuals' rights.","O-Mr X-. O-Allen O-, O-who O-teaches O-government O-at O-prestigious O-Harvey O-Mu X-##dd O-College O-in O-California O-and O-will O-remain O-a O-member O-of O-the O-commission O-, O-has B-VBN-spent O-years O-arguing O-that O-civil O-rights O-are O-individuals X-' O-rights O-."
He last made waves when he dared to defend an Indian girl who had been adopted by non-Indian parents off her reservation.,O-He O-last O-made O-waves O-when O-he O-dared O-to O-defend O-an O-Indian O-girl O-who O-had B-VBN-been B-VBN-adopted O-by O-non X-- X-Indian O-parents O-off O-her O-reservation O-.
"Efforts by a federal mediator to reignite talks between Boeing Co. and the Machinists union apparently failed, and no further meetings are scheduled.","O-E X-##ff X-##ort X-##s O-by O-a O-federal O-media X-##tor O-to O-reign X-##ite O-talks O-between O-Boeing O-Co X-. O-and O-the O-Mac X-##hin X-##ists O-union O-apparently O-failed O-, O-and O-no O-further O-meetings O-are B-VBN-scheduled O-."
"In a statement issued after the meeting, the aerospace giant said it won't increase its offer although adjustments within the proposed pay-and-benefit mix are possible.","O-In O-a O-statement B-VBN-issued O-after O-the O-meeting O-, O-the O-aerospace O-giant O-said O-it O-w X-##o O-n X-' X-t O-increase O-its O-offer O-although O-adjustments O-within O-the B-VBN-proposed O-pay X-- X-and X-- X-benefit O-mix O-are O-possible O-."
Machinists already have rejected a proposal that called for a 4% pay increase and 8% bonus in the first year.,O-Mac X-##hin X-##ists O-already O-have B-VBN-rejected O-a O-proposal O-that O-called O-for O-a O-4 O-% O-pay O-increase O-and O-8 O-% O-bonus O-in O-the O-first O-year O-.
"In the second year, workers would receive a 3% wage boost and a 3% bonus, followed by a 3% increase without a bonus in the third year.","O-In O-the O-second O-year O-, O-workers O-would O-receive O-a O-3 O-% O-wage O-boost O-and O-a O-3 O-% O-bonus O-, B-VBN-followed O-by O-a O-3 O-% O-increase O-without O-a O-bonus O-in O-the O-third O-year O-."
Helionetics Inc. said it agreed to team with a unit of Minneapolis-based Honeywell Inc. to provide power amplifiers for a new military sonar system being proposed by Honeywell.,O-He X-##lion X-##etics O-Inc O-. O-said O-it O-agreed O-to O-team O-with O-a O-unit O-of O-Minneapolis X-- X-based O-Honey X-##well O-Inc O-. O-to O-provide O-power O-amplifier X-##s O-for O-a O-new O-military O-son X-##ar O-system O-being B-VBN-proposed O-by O-Honey X-##well O-.
"Total value of the contract could be $100 million, Helionetics said, and work on the project would be about evenly divided.","O-Total O-value O-of O-the O-contract O-could O-be O-$ O-100 O-million O-, O-He X-##lion X-##etics O-said O-, O-and O-work O-on O-the O-project O-would O-be O-about O-evenly B-VBN-divided O-."
"As previously reported, Helionetics emerged from Chapter 11 bankruptcy-law protection in February.","O-As O-previously B-VBN-reported O-, O-He X-##lion X-##etics O-emerged O-from O-Chapter O-11 O-bankruptcy X-- X-law O-protection O-in O-February O-."
"Beazer PLC, a major British building materials and construction concern, reported a 24% jump in pretax profit for its latest financial year, helped largely by contributions from its U.S. unit, Koppers Co.","O-Be X-##az X-##er O-P X-##LC O-, O-a O-major O-British O-building O-materials O-and O-construction O-concern O-, O-reported O-a O-24 O-% O-jump O-in O-pre X-##ta X-##x O-profit O-for O-its O-latest O-financial O-year O-, B-VBN-helped O-largely O-by O-contributions O-from O-its O-U X-. X-S X-. O-unit O-, O-Ko X-##pper X-##s O-Co O-."
"Profit after taxes and minority interests but before extraordinary items increased 22% to #92.6 million from #75.6 million a year earlier, while fully diluted earnings per share rose to 29.90 pence (47 cents) from 24.68 pence (39 cents).","O-Prof X-##it O-after O-taxes O-and O-minority O-interests O-but O-before O-extraordinary O-items O-increased O-22 O-% O-to O-# O-92 X-. X-6 O-million O-from O-# O-75 X-. X-6 O-million O-a O-year O-earlier O-, O-while O-fully B-VBN-di X-##lut X-##ed O-earnings O-per O-share O-rose O-to O-29 X-. X-90 O-pen X-##ce O-( O-47 O-cents O-) O-from O-24 X-. X-68 O-pen X-##ce O-( O-39 O-cents O-) O-."
David D. Lung was appointed president and chief operating officer of this maker of building materials for manufactured homes and recreational vehicles.,O-David O-D X-. O-Lu X-##ng O-was B-VBN-appointed O-president O-and O-chief O-operating O-officer O-of O-this O-maker O-of O-building O-materials O-for B-VBN-manufactured O-homes O-and O-recreational O-vehicles O-.
"David Lung has been with Patrick since 1970, and has served as vice president for administration and purchasing since 1987.","O-David O-Lu X-##ng O-has B-VBN-been O-with O-Patrick O-since O-1970 O-, O-and O-has B-VBN-served O-as O-vice O-president O-for O-administration O-and O-purchasing O-since O-1987 O-."
"Par also said it was advised by the U.S. attorney for Maryland that it is one of a number of companies being investigated by a federal grand jury for alleged violations of the federal Food, Drug and Cosmetic Act.","O-Pa X-##r O-also O-said O-it O-was B-VBN-advised O-by O-the O-U X-. X-S X-. O-attorney O-for O-Maryland O-that O-it O-is O-one O-of O-a O-number O-of O-companies O-being B-VBN-investigated O-by O-a O-federal O-grand O-jury O-for O-alleged O-violations O-of O-the O-federal O-Food O-, O-Drug O-and O-Co X-##sm X-##etic O-Act O-."
"Par, a generic-drug maker that has been plagued by management problems, was already the subject of a federal criminal inquiry into the drug-approval process and a Food and Drug Administration investigation.","O-Pa X-##r O-, O-a O-generic X-- X-drug O-maker O-that O-has B-VBN-been B-VBN-plagued O-by O-management O-problems O-, O-was O-already O-the O-subject O-of O-a O-federal O-criminal O-inquiry O-into O-the O-drug X-- X-approval O-process O-and O-a O-Food O-and O-Drug O-Administration O-investigation O-."
"A Par spokesman said he understood the criminal investigation in Maryland relates to matters Par disclosed in July, when Par said it filed false drug information with the FDA.","O-A O-Pa X-##r O-spokesman O-said O-he O-understood O-the O-criminal O-investigation O-in O-Maryland O-relates O-to O-matters O-Pa X-##r B-VBN-disclosed O-in O-July O-, O-when O-Pa X-##r O-said O-it O-filed O-false O-drug O-information O-with O-the O-FDA O-."
"At the time, the company said it was recalling one of its drugs and had stopped selling two others.","O-At O-the O-time O-, O-the O-company O-said O-it O-was O-recalling O-one O-of O-its O-drugs O-and O-had B-VBN-stopped O-selling O-two O-others O-."
"The spokesman said he also understood that the inquiry related to the existence of an ""off-the-record"" production book.","O-The O-spokesman O-said O-he O-also O-understood O-that O-the O-inquiry B-VBN-related O-to O-the O-existence O-of O-an O-"" O-off X-- X-the X-- X-record O-"" O-production O-book O-."
