"Although Sotheby's points out that it is ""an international organization"" not specifically concerned with potential losses to American museums, others are up in arms: ""Donations have always been the main source of increased museum collections,"" says Edward H. Able Jr., executive director of the American Association of Museums.","O-Although O-So X-##the X-##by O-' X-s O-points B-RP-out O-that O-it O-is O-"" O-an O-international O-organization O-"" O-not O-specifically O-concerned O-with O-potential O-losses O-to O-American O-museums O-, O-others O-are O-up O-in O-arms O-: O-"" O-Don X-##ations O-have O-always O-been O-the O-main O-source O-of O-increased O-museum O-collections O-, X-"" O-says O-Edward O-H X-. O-A X-##ble O-Jr X-. O-, O-executive O-director O-of O-the O-American O-Association O-of O-Museums O-."
"(Even Sotheby's PR department couldn't have pulled that one off; Dorrance's executors ""requested"" it.)","O-( O-Even O-So X-##the X-##by O-' X-s O-PR O-department O-could O-n X-' X-t O-have O-pulled O-that O-one B-RP-off O-; O-Do X-##rra X-##nce O-' X-s O-ex X-##ec X-##uto X-##rs O-"" O-requested O-"" O-it O-. O-)"
"""In October of '87 people saw that everything else went down but art went up,"" Desmond Corcoran of London's Alex Reid & Lefevre Ltd. gallery points out.","O-"" O-In O-October O-of O-' O-87 O-people O-saw O-that O-everything O-else O-went O-down O-but O-art O-went O-up O-, X-"" O-Desmond O-Co X-##rc X-##oran O-of O-London O-' X-s O-Alex O-Reid O-& O-Le X-##fe X-##vre O-Ltd O-. O-gallery O-points B-RP-out O-."
"If all goes well, if the Picasso hits $75 million, and Mellon, Dorrance, Wilder and the rest get what they bargained for, the uncomfortable, questioning buzz in the art marketplace will trail off into sighs of relief, only to begin anew slightly louder than before, as the cycle starts over in the spring.","O-If O-all O-goes O-well O-, O-if O-the O-Picasso O-hits O-$ O-75 O-million O-, O-and O-Mellon O-, O-Do X-##rra X-##nce O-, O-Wilder O-and O-the O-rest O-get O-what O-they O-bargain X-##ed O-for O-, O-the O-uncomfortable O-, O-questioning O-buzz O-in O-the O-art O-marketplace O-will O-trail B-RP-off O-into O-sighs O-of O-relief O-, O-only O-to O-begin O-an X-##ew O-slightly O-louder O-than O-before O-, O-as O-the O-cycle O-starts O-over O-in O-the O-spring O-."
"In the past, not only would reputable professionals have rushed to check out such rumors with the company, but companies listed on the major stock exchanges were encouraged by the exchanges to respond openly to such inquiries from securities analysts.","O-In O-the O-past O-, O-not O-only O-would O-re X-##put X-##able O-professionals O-have O-rushed O-to O-check B-RP-out O-such O-rumors O-with O-the O-company O-, O-but O-companies O-listed O-on O-the O-major O-stock O-exchanges O-were O-encouraged O-by O-the O-exchanges O-to O-respond O-openly O-to O-such O-in X-##quiries O-from O-securities O-analysts O-."
"As part of what a Recognition spokeswoman termed an ""amiable agreement,"" Prospect Group will wind up with control of top management posts and an increased stake in the maker of data management equipment.","O-As O-part O-of O-what O-a O-Re X-##cognition O-spoke X-##s X-##woman O-termed O-an O-"" O-am X-##iable O-agreement O-, X-"" O-Prospect O-Group O-will O-wind B-RP-up O-with O-control O-of O-top O-management O-posts O-and O-an O-increased O-stake O-in O-the O-maker O-of O-data O-management O-equipment O-."
"Thomas M. Hurley and Robert A. Vanourek, who had been designated to take over Recognition's top spots had Prospect's tender offer succeeded, were named co-chief executives and directors.","O-Thomas O-M X-. O-Hu X-##rley O-and O-Robert O-A X-. O-Van X-##our X-##ek O-, O-who O-had O-been O-designated O-to O-take B-RP-over O-Re X-##cognition O-' X-s O-top O-spots O-had O-Prospect O-' X-s O-tender O-offer O-succeeded O-, O-were O-named O-co X-- X-chief O-executives O-and O-directors O-."
Some are even coming up with their own novel designs.,O-Some O-are O-even O-coming B-RP-up O-with O-their O-own O-novel O-designs O-.
Yet some dealers have turned down Infiniti or Lexus franchises because they were unwilling or unable to meet the design requirements.,O-Yet O-some O-dealers O-have O-turned B-RP-down O-In X-##fin X-##iti O-or O-Lex X-##us O-franchises O-because O-they O-were O-unwilling O-or O-unable O-to O-meet O-the O-design O-requirements O-.
"Mr. Seidman says he turned down a Lexus franchise in part because ""the building was gorgeous but very expensive.""","O-Mr X-. O-Se X-##id X-##man O-says O-he O-turned B-RP-down O-a O-Lex X-##us O-franchise O-in O-part O-because O-"" O-the O-building O-was O-gorgeous O-but O-very O-expensive O-. O-"""
"To head off arguments, Infiniti offers dealers cash bonuses and low-interest construction loans.","O-To O-head B-RP-off O-arguments O-, O-In X-##fin X-##iti O-offers O-dealers O-cash O-bonus X-##es O-and O-low X-- X-interest O-construction O-loans O-."
Means Branching Out,O-Mean X-##s O-Branch X-##ing B-RP-Out
"ONE DAY Carl Barrett of Mobile, Ala., was raking some sycamore leaves, but the rake kept riding up over the piles.","O-ONE O-D X-##A X-##Y O-Carl O-Barrett O-of O-Mobile O-, O-Al X-##a X-. O-, O-was O-r X-##aking O-some O-s X-##y X-##cam X-##ore O-leaves O-, O-but O-the O-r X-##ake O-kept O-riding B-RP-up O-over O-the O-piles O-."
"Now incorporated into a polypropylene rake, the four-inch prongs, or ""wonderbars,"" also are supposed to aid in picking up leaves.","O-Now O-incorporated O-into O-a O-p X-##oly X-##p X-##rop X-##yle X-##ne O-r X-##ake O-, O-the O-four X-- X-inch O-pro X-##ng X-##s O-, O-or O-"" O-wonder X-##bar X-##s O-, X-"" O-also O-are O-supposed O-to O-aid O-in O-picking B-RP-up O-leaves O-."
"""They either pick it up,"" he says, ""or they start pulling from a fresh direction.""","O-"" O-They O-either O-pick O-it B-RP-up O-, X-"" O-he O-says O-, O-"" O-or O-they O-start O-pulling O-from O-a O-fresh O-direction O-. O-"""
"""Investors who had been in dollars for a long time got out.","O-"" O-In X-##ves X-##tors O-who O-had O-been O-in O-dollars O-for O-a O-long O-time O-got B-RP-out O-."
"If goods on shelves and backlots pile up too high, retailers often cut back on orders and factories on production.","O-If O-goods O-on O-shelves O-and O-back X-##lot X-##s O-pile B-RP-up O-too O-high O-, O-retailers O-often O-cut B-RP-back O-on O-orders O-and O-factories O-on O-production O-."
"Mr. Goldberg, who took over as head of the IRS in July, has been disturbed by what he considers the inefficiency, waste and lack of coordination among the branches of the vast federal agency.","O-Mr X-. O-Goldberg O-, O-who O-took B-RP-over O-as O-head O-of O-the O-I X-##RS O-in O-July O-, O-has O-been O-disturbed O-by O-what O-he O-considers O-the O-in X-##ef X-##ficiency O-, O-waste O-and O-lack O-of O-coordination O-among O-the O-branches O-of O-the O-vast O-federal O-agency O-."
"""You're telling someone they can spend the next three or four or five or six years of their life bringing about the most difficult and costly modernization of an information system on the civil side ever,"" Mr. Goldberg said.","O-"" O-You O-' X-re O-telling O-someone O-they O-can O-spend O-the O-next O-three O-or O-four O-or O-five O-or O-six O-years O-of O-their O-life O-bringing B-RP-about O-the O-most O-difficult O-and O-costly O-modernization O-of O-an O-information O-system O-on O-the O-civil O-side O-ever O-, X-"" O-Mr X-. O-Goldberg O-said O-."
"In his office overlooking the runway of Shannon Airport, Mr. Ovcharenko enthusiastically throws out what he calls ""just ideas"":","O-In O-his O-office O-overlooking O-the O-runway O-of O-Shannon O-Airport O-, O-Mr X-. O-O X-##v X-##cha X-##ren X-##ko O-enthusiastic X-##ally O-throws B-RP-out O-what O-he O-calls O-"" O-just O-ideas O-"" O-:"
"The two groups have been working together since the late 1970s, long before Soviet joint ventures were the rage in the West.","O-The O-two O-groups O-have O-been O-working B-RP-together O-since O-the O-late O-1970s O-, O-long O-before O-Soviet O-joint O-ventures O-were O-the O-rage O-in O-the O-West O-."
"As a result, Ireland didn't spurn the Soviets after they shot down a Korean Air Lines jetliner over the Sea of Japan in 1983, though it suspended direct Moscow-Shannon flights for two months.","O-As O-a O-result O-, O-Ireland O-did O-n X-' X-t O-spur X-##n O-the O-Soviets O-after O-they O-shot B-RP-down O-a O-Korean O-Air O-Lines O-jet X-##liner O-over O-the O-Sea O-of O-Japan O-in O-1983 O-, O-though O-it O-suspended O-direct O-Moscow X-- X-Shannon O-flights O-for O-two O-months O-."
"While nearly equal percentages of black and white women currently smoke, in both sexes more whites have given up smoking than blacks.","O-While O-nearly O-equal O-percentage X-##s O-of O-black O-and O-white O-women O-currently O-smoke O-, O-in O-both O-sexes O-more O-whites O-have O-given B-RP-up O-smoking O-than O-blacks O-."
"Then, it rebounded to finish down only 18.65 points.","O-Then O-, O-it O-re X-##bound X-##ed O-to O-finish B-RP-down O-only O-18 X-. X-65 O-points O-."
"""It's madness -- that in an hour you can whack off so much value,"" says Stanford Calderwood, chairman of Trinity Investment Management Corp., Boston.","O-"" O-It O-' X-s O-madness O-- X-- O-that O-in O-an O-hour O-you O-can O-w X-##hack B-RP-off O-so O-much O-value O-, X-"" O-says O-Stanford O-Calder X-##wood O-, O-chairman O-of O-Trinity O-Investment O-Management O-Corp X-. O-, O-Boston O-."
Prices are moving up and down so fast because investors are employing ways to turn over shares at ever-faster rates and increasingly acting in concert.,O-Price X-##s O-are O-moving O-up O-and O-down O-so O-fast O-because O-investors O-are O-employing O-ways O-to O-turn B-RP-over O-shares O-at O-ever X-- X-faster O-rates O-and O-increasingly O-acting O-in O-concert O-.
"On Monday, for instance, Howard Ward, a principal at Scudder, Stevens & Clark, found that ""you couldn't buy blue-chips at quoted prices without paying up.""","O-On O-Monday O-, O-for O-instance O-, O-Howard O-Ward O-, O-a O-principal O-at O-Sc X-##udder O-, O-Stevens O-& O-Clark O-, O-found O-that O-"" O-you O-could O-n X-' X-t O-buy O-blue X-- X-chips O-at O-quoted O-prices O-without O-paying B-RP-up O-. O-"""
"And when many firms had to ""pay up,"" Monday's sudden rally was sparked.","O-And O-when O-many O-firms O-had O-to O-"" O-pay B-RP-up O-, X-"" O-Monday O-' X-s O-sudden O-rally O-was O-sparked O-."
"These and other modern trading methods ""tend to promote dramatic shifts in assets,"" says George Douglas, first vice president at Drexel Burnham Lambert Inc. ""It's the idea that what goes in easy can come out easy"" -- so that bouts of higher volatility get built into the stock market.","O-These O-and O-other O-modern O-trading O-methods O-"" O-tend O-to O-promote O-dramatic O-shifts O-in O-assets O-, X-"" O-says O-George O-Douglas O-, O-first O-vice O-president O-at O-Dr X-##ex X-##el O-Burn X-##ham O-Lambert O-Inc O-. O-"" O-It O-' X-s O-the O-idea O-that O-what O-goes O-in O-easy O-can O-come B-RP-out O-easy O-"" O-- X-- O-so O-that O-bouts O-of O-higher O-vol X-##ati X-##lity O-get O-built O-into O-the O-stock O-market O-."
"""It was scary to people thinking that they couldn't get their trades off.""","O-"" O-It O-was O-scary O-to O-people O-thinking O-that O-they O-could O-n X-' X-t O-get O-their O-trades B-RP-off O-. O-"""
"Scott Black, a value-oriented money manager who heads Delphi Management Inc., points out that for those who invest on fundamentals, ""the value of a stock from day to day doesn't change all that much.""","O-Scott O-Black O-, O-a O-value X-- X-oriented O-money O-manager O-who O-heads O-Del X-##phi O-Management O-Inc X-. O-, O-points B-RP-out O-that O-for O-those O-who O-invest O-on O-fundamental X-##s O-, O-"" O-the O-value O-of O-a O-stock O-from O-day O-to O-day O-does O-n X-' X-t O-change O-all O-that O-much O-. O-"""
"The trend drove up the aftertax margin -- net income as a percentage of revenues -- to 21.1% in the quarter, compared with 20.7% a year earlier.","O-The O-trend O-drove B-RP-up O-the O-after X-##ta X-##x O-margin O-- X-- O-net O-income O-as O-a O-percentage O-of O-revenues O-- X-- O-to O-21 X-. X-1 O-% O-in O-the O-quarter O-, O-compared O-with O-20 X-. X-7 O-% O-a O-year O-earlier O-."
"That's how the stock-picking game is shaping up for the months ahead, according to money managers and a few brokers.","O-That O-' X-s O-how O-the O-stock X-- X-picking O-game O-is O-shaping B-RP-up O-for O-the O-months O-ahead O-, O-according O-to O-money O-managers O-and O-a O-few O-broker X-##s O-."
"Mr. Neff says the stock market has lost some powerful driving forces, namely earnings growth and the ""LBO sweepstakes"" -- buy-out fever that induced investors to bid up whole groups of stocks, such as media and airlines.","O-Mr X-. O-N X-##ef X-##f O-says O-the O-stock O-market O-has O-lost O-some O-powerful O-driving O-forces O-, O-namely O-earnings O-growth O-and O-the O-"" O-L X-##BO O-sweep X-##sta X-##kes O-"" O-- X-- O-buy X-- X-out O-fever O-that O-induced O-investors O-to O-bid B-RP-up O-whole O-groups O-of O-stocks O-, O-such O-as O-media O-and O-airlines O-."
"With flat corporate profits on the horizon for 1990, money managers say price-earnings multiples that look cheap today might go on being cheap for a long time.","O-With O-flat O-corporate O-profits O-on O-the O-horizon O-for O-1990 O-, O-money O-managers O-say O-price X-- X-earnings O-multiple X-##s O-that O-look O-cheap O-today O-might O-go B-RP-on O-being O-cheap O-for O-a O-long O-time O-."
"The market ""is going to wind down,"" says Gerald W. Perritt, a Chicago money manager.","O-The O-market O-"" O-is O-going O-to O-wind B-RP-down O-, X-"" O-says O-Gerald O-W X-. O-Per X-##rit X-##t O-, O-a O-Chicago O-money O-manager O-."
"He expects stocks to decline an additional 5% to 30%, with the Dow perhaps bottoming out between 2000 and 2100 ""between now and June.""","O-He O-expects O-stocks O-to O-decline O-an O-additional O-5 O-% O-to O-30 O-% O-, O-with O-the O-Dow O-perhaps O-bottom X-##ing B-RP-out O-between O-2000 O-and O-210 X-##0 O-"" O-between O-now O-and O-June O-. O-"""
"""We're doing a little buying"" in some stocks ""that have really been smashed down.""","O-"" O-We O-' X-re O-doing O-a O-little O-buying O-"" O-in O-some O-stocks O-"" O-that O-have O-really O-been O-smashed B-RP-down O-. O-"""
Newspapers are full of headlines about companies defaulting on their debts and banks writing off real estate loans.,O-Newspaper X-##s O-are O-full O-of O-headlines O-about O-companies O-default X-##ing O-on O-their O-debts O-and O-banks O-writing B-RP-off O-real O-estate O-loans O-.
"He ""will not be shaken out by external events, however surprising, alarming or vexing. . . . Continentals are unable to be butlers because they are as a breed incapable of the emotional restraint which only the English race are capable of.""","O-He O-"" O-will O-not O-be O-shaken B-RP-out O-by O-external O-events O-, O-however O-surprising O-, O-alarm X-##ing O-or O-ve X-##xing O-. O-. O-. O-. O-Continental X-##s O-are O-unable O-to O-be O-butler X-##s O-because O-they O-are O-as O-a O-breed O-incapable O-of O-the O-emotional O-restraint O-which O-only O-the O-English O-race O-are O-capable O-of O-. O-"""
"You see, I know my father would have wished me to carry on just now.""","O-You O-see O-, O-I O-know O-my O-father O-would O-have O-wished O-me O-to O-carry B-RP-on O-just O-now O-. O-"""
"Though the play clearly is framed around the events of Iran-Contra, it takes in the wide sweep of scandals over the past 30 years.","O-Though O-the O-play O-clearly O-is O-framed O-around O-the O-events O-of O-Iran X-- X-Con X-##tra O-, O-it O-takes B-RP-in O-the O-wide O-sweep O-of O-scandal X-##s O-over O-the O-past O-30 O-years O-."
"Supposedly the IRS will sell off the assets of MPI, but before it can, a lowly IRS agent is called into the hospital room of Wylie Slaughter, the dying head of the Central Intelligence Agency.","O-Su X-##pp X-##ose X-##dly O-the O-I X-##RS O-will O-sell B-RP-off O-the O-assets O-of O-MP X-##I O-, O-but O-before O-it O-can O-, O-a O-low X-##ly O-I X-##RS O-agent O-is O-called O-into O-the O-hospital O-room O-of O-W X-##yl X-##ie O-S X-##lau X-##ghter O-, O-the O-dying O-head O-of O-the O-Central O-Intelligence O-Agency O-."
"The lowly agent, Abel Lamb, who as you might guess, is being led to the slaughter, is ordered to take over the studio.","O-The O-low X-##ly O-agent O-, O-Abel O-Lamb O-, O-who O-as O-you O-might O-guess O-, O-is O-being O-led O-to O-the O-slaughter O-, O-is O-ordered O-to O-take B-RP-over O-the O-studio O-."
"The picture, to be made in the Central American country of San Elvador, is a cover for sending $800 million of arms to Los Otros, the rebel group attempting to regain neighboring Ambigua, which has been taken over by the leftist dictator Dr. Overtega, a former podiatrist, who leads a revolutionary band of foot soldiers.","O-The O-picture O-, O-to O-be O-made O-in O-the O-Central O-American O-country O-of O-San O-El X-##va X-##dor O-, O-is O-a O-cover O-for O-sending O-$ O-800 O-million O-of O-arms O-to O-Los O-O X-##tro X-##s O-, O-the O-rebel O-group O-attempting O-to O-regain O-neighboring O-Am X-##bi X-##gua O-, O-which O-has O-been O-taken B-RP-over O-by O-the O-left X-##ist O-dictator O-Dr X-. O-Over X-##te X-##ga O-, O-a O-former O-pod X-##ia X-##tri X-##st O-, O-who O-leads O-a O-revolutionary O-band O-of O-foot O-soldiers O-."
"The man handling all this for the now-deceased Slaughter is Major Manley Battle, Mr. Gelbart's stand in for Col. Oliver North.","O-The O-man O-handling O-all O-this O-for O-the O-now X-- X-deceased O-S X-##lau X-##ghter O-is O-Major O-Man X-##ley O-Battle O-, O-Mr X-. O-G X-##el X-##bar X-##t O-' X-s O-stand B-RP-in O-for O-Col X-. O-Oliver O-North O-."
Director Michael Engler has assembled a top-flight cast to carry out the impersonations of well-known political figures and to play the stock characters who invariably show up at congressional hearings.,O-Director O-Michael O-En X-##gler O-has O-assembled O-a O-top X-- X-flight O-cast O-to O-carry B-RP-out O-the O-imp X-##erson X-##ations O-of O-well X-- X-known O-political O-figures O-and O-to O-play O-the O-stock O-characters O-who O-in X-##var X-##iably O-show B-RP-up O-at O-congressional O-hearings O-.
"Major Battle himself speaks in pure Pentagonese: ""Without further monetary-stroke-military aid, scores of Ambiguan freedom lovers, who had gone way out on their life and limbs for us, were literally cut off at the knees without a paddle.""","O-Major O-Battle O-himself O-speaks O-in O-pure O-Pentagon X-##ese O-: O-"" O-Without O-further O-monetary X-- X-stroke X-- X-military O-aid O-, O-scores O-of O-Am X-##bi X-##gua X-##n O-freedom O-lovers O-, O-who O-had O-gone O-way O-out O-on O-their O-life O-and O-limbs O-for O-us O-, O-were O-literally O-cut B-RP-off O-at O-the O-knees O-without O-a O-paddle O-. O-"""
"The evening is short -- 95 minutes without an intermission -- but even so, as the play progresses the thrust of Mr. Gelbart's satire loses its sharpness as his targets pop up ever more predictably.","O-The O-evening O-is O-short O-- X-- O-95 O-minutes O-without O-an O-inter X-##mission O-- X-- O-but O-even O-so O-, O-as O-the O-play O-progresses O-the O-thrust O-of O-Mr X-. O-G X-##el X-##bar X-##t O-' X-s O-satire O-loses O-its O-sharp X-##ness O-as O-his O-targets O-pop B-RP-up O-ever O-more O-predict X-##ably O-."
The judge ordered that the defendants turn over all the money earned through the racketeering enterprise.,O-The O-judge O-ordered O-that O-the O-defendants O-turn B-RP-over O-all O-the O-money O-earned O-through O-the O-rack X-##ete X-##ering O-enterprise O-.
"After the judge's ruling, Mr. Grady said, ""We gave up our right to a trial for the terms of the {agreement}, and we believe that anything that modifies those terms is completely inappropriate.""","O-After O-the O-judge O-' X-s O-ruling O-, O-Mr X-. O-Grady O-said O-, O-"" O-We O-gave B-RP-up O-our O-right O-to O-a O-trial O-for O-the O-terms O-of O-the O-{ O-agreement O-} O-, O-and O-we O-believe O-that O-anything O-that O-m X-##od X-##ifies O-those O-terms O-is O-completely O-inappropriate O-. O-"""
"The judge was then quoted in the Dallas Times Herald as referring to the victims as ""queers"" and saying ""these guys wouldn't have been killed if they hadn't been cruising the streets picking up teen-age boys.""","O-The O-judge O-was O-then O-quoted O-in O-the O-Dallas O-Times O-Herald O-as O-referring O-to O-the O-victims O-as O-"" O-que X-##ers O-"" O-and O-saying O-"" O-these O-guys O-would O-n X-' X-t O-have O-been O-killed O-if O-they O-had O-n X-' X-t O-been O-c X-##ruising O-the O-streets O-picking B-RP-up O-teen X-- X-age O-boys O-. O-"""
The comments touched off a furor in the Dallas gay community and prompted several complaints about Judge Hampton to the State Commission on Judicial Conduct.,O-The O-comments O-touched B-RP-off O-a O-fur X-##or O-in O-the O-Dallas O-gay O-community O-and O-prompted O-several O-complaints O-about O-Judge O-Hampton O-to O-the O-State O-Commission O-on O-Judicial O-Con X-##duct O-.
"), committee chairman, proposed legislation that would carry out the streamlining of death-penalty appeals in federal court that was proposed last month by a special task force appointed by Chief Justice of the U.S. William Rehnquist.","O-) O-, O-committee O-chairman O-, O-proposed O-legislation O-that O-would O-carry B-RP-out O-the O-stream X-##lining O-of O-death X-- X-penalty O-appeals O-in O-federal O-court O-that O-was O-proposed O-last O-month O-by O-a O-special O-task O-force O-appointed O-by O-Chief O-Justice O-of O-the O-U X-. X-S X-. O-William O-Re X-##hn X-##quist O-."
"Even as Citicorp and Chase Manhattan Corp. scrambled to line up bank financing for a revised version of the lapsed labor-management bid, British Airways, a 15% partner in the buying group, indicated it wants to start from scratch.","O-Even O-as O-C X-##itic X-##or X-##p O-and O-Chase O-Manhattan O-Corp O-. O-scrambled O-to O-line B-RP-up O-bank O-financing O-for O-a O-revised O-version O-of O-the O-laps X-##ed O-labor X-- X-management O-bid O-, O-British O-Airways O-, O-a O-15 O-% O-partner O-in O-the O-buying O-group O-, O-indicated O-it O-wants O-to O-start O-from O-scratch O-."
Confusion about the two banks' hurried efforts to round up financing for a new bid that the UAL board hasn't even seen yet helped send UAL stock spiraling downward.,O-Con X-##fusion O-about O-the O-two O-banks X-' O-hurried O-efforts O-to O-round B-RP-up O-financing O-for O-a O-new O-bid O-that O-the O-U X-##AL O-board O-has O-n X-' X-t O-even O-seen O-yet O-helped O-send O-U X-##AL O-stock O-spiral X-##ing O-downward O-.
Several reports as the day progressed gave vague or conflicting indications about whether banks would sign up.,O-Several O-reports O-as O-the O-day O-progressed O-gave O-vague O-or O-conflicting O-indication X-##s O-about O-whether O-banks O-would O-sign B-RP-up O-.
"Observers said it appeared that British Air was angered at the way the bid has degenerated into confusion, as well as by the banks' effort to round up financing for what one called ""a deal that isn't a deal.""","O-Observer X-##s O-said O-it O-appeared O-that O-British O-Air O-was O-angered O-at O-the O-way O-the O-bid O-has O-de X-##generate X-##d O-into O-confusion O-, O-as O-well O-as O-by O-the O-banks X-' O-effort O-to O-round B-RP-up O-financing O-for O-what O-one O-called O-"" O-a O-deal O-that O-is O-n X-' X-t O-a O-deal O-. O-"""
"Because he's very bullish on the emerging growth stocks that make up the fund's portfolio, Mr. Templeton said from his Bahamas hideaway.","O-Because O-he O-' X-s O-very O-bull X-##ish O-on O-the O-emerging O-growth O-stocks O-that O-make B-RP-up O-the O-fund O-' X-s O-portfolio O-, O-Mr X-. O-Temple X-##ton O-said O-from O-his O-Bahamas O-hide X-##away O-."
"The Senate had refused late Friday to invoke cloture and limit debate, but behind the bipartisan leadership, a solid majority took shape yesterday and brushed aside amendments seeking to cut the total package or steer it away from direct aid to political parties.","O-The O-Senate O-had O-refused O-late O-Friday O-to O-in X-##voke O-c X-##lot X-##ure O-and O-limit O-debate O-, O-but O-behind O-the O-bi X-##par X-##tis X-##an O-leadership O-, O-a O-solid O-majority O-took O-shape O-yesterday O-and O-brushed B-RP-aside O-amendments O-seeking O-to O-cut O-the O-total O-package O-or O-steer O-it O-away O-from O-direct O-aid O-to O-political O-parties O-."
"The same issue threatens to spill over to the foreign aid debate, and Mr. Bush also is threatening to veto any agreement that preserves Senate-passed provisions renewing U.S. support for the United Nations Fund for Population Activities.","O-The O-same O-issue O-threatens O-to O-spill B-RP-over O-to O-the O-foreign O-aid O-debate O-, O-and O-Mr X-. O-Bush O-also O-is O-threatening O-to O-veto O-any O-agreement O-that O-preserves O-Senate X-- X-passed O-provisions O-renew X-##ing O-U X-. X-S X-. O-support O-for O-the O-United O-Nations O-Fund O-for O-Population O-Activities O-."
"Although Bausch remains the leader among the six majors, Johnson & Johnson, with its new disposables, is coming on fast.","O-Although O-Ba X-##us X-##ch O-remains O-the O-leader O-among O-the O-six O-majors O-, O-Johnson O-& O-Johnson O-, O-with O-its O-new O-di X-##sp X-##osa X-##bles O-, O-is O-coming B-RP-on O-fast O-."
